Message_id,From,Time_stamp,Text
<16065503.1075852081137.JavaMail.evans@thyme>,-persson@ricemail.ricefinancial.com,2001-08-21 14:44:34,Pension RolloverBarry You probably thought I had forgotten about you I had not I wanted to iron out some areas of concern from my end here As you know I am not supposed to do an investment for you while you are a resident of the US I have discovered that if we put the money into an account and not make moves on it until you move back to Canada then we can do it if I use a Canadian address I was advised to put the money into a balanced fund and leave it there for now My thoughts are to move it to a couple of funds in a self administered account and NOT make any moves with it Please review this note and let me know what you think If all is ok I will mail you the forms to sign which you signed here and we will get this moving Hope all is well with you down there Regards Rob
<4532980.1075852081279.JavaMail.evans@thyme>,-persson@ricemail.ricefinancial.com,2001-08-22 12:28:43,Re Pension RolloverBarry I will send a note to Jacy Also the funds I think we will go into are going to be more heavily weighted towards stocks but will have some bonds as well that what makes them a balanced fund Also do want us to manage the money Jacy has or do you want to leave it with him No problem either way just let me know Rob Reply Separator Subject RE Pension Rollover Author Tycholiz Barry Barry NRONcom at InternetMail Date AM I wasnt worried for a second I would like to have these funds in a portfolio that has a better performance than money markets I already have a decent amount of money K in the Rice portfolio thru andrew agencies in Virden You may want to look at exactly what that is contact Jacy Whyte at Andrew Agencies he will get you the details for Kim and I Was there a particular index fund you had in mind What do you mean by balanced Once we put it there I dont plan on touching or managing this until I return to Canada Thanks talk to you soon BT Original Message From robmcdillatlove mailtorobmcdillatlove Sent Tuesday August PM To Tycholiz Barry Subject Pension Rollover Barry You probably thought I had forgotten about you I had not I wanted to iron out some areas of concern from my end here As you know I am not supposed to do an investment for you while you are a resident of the US I have discovered that if we put the money into an account and not make moves on it until you move back to Canada then we can do it if I use a Canadian address I was advised to put the money into a balanced fund and leave it there for now My thoughts are to move it to a couple of funds in a self administered account and NOT make any moves with it Please review this note and let me know what you think If all is ok I will mail you the forms to sign which you signed here and we will get this moving Hope all is well with you down there Regards Rob This email is the property of Enron Corp andor its relevant affiliate and may contain confidential and privileged material for the sole use of the intended recipient s Any review use distribution or disclosure by others is strictly prohibited If you are not the intended recipient or authorized to receive for the recipient please contact the sender or reply to Enron Corp at and delete all copies of the message This email and any attachments hereto are not intended to be an offer or an acceptance and do not create or evidence a binding and enforceable contract between Enron Corp or any of its affiliates and the intended recipient or any other party and may not be relied on by anyone as the basis of a contract by estoppel or otherwise Thank you 
<17236618.1075852081303.JavaMail.evans@thyme>,-persson@ricemail.ricefinancial.com,2001-08-22 14:56:10,SENT OUT YOUR PACKAGEBarry I just sent out your stuff to get you to sign and return and I just realized I forgot to put a return envelope in there cheap bugger My apologies I am just transferring it to a money market fund until it all gets therethen I will do the direction from there and I will let you know which funds I think will do the job then Regards Rob
<4303625.1075852081408.JavaMail.evans@thyme>,-persson@ricemail.ricefinancial.com,2001-08-23 06:55:50,Re Pension RolloverOK got it Rob Reply Separator Subject RE Re Pension Rollover Author Tycholiz Barry Barry NRONcom at InternetMail Date PM I want to leave those funds with Jacy BT Original Message From robmcdillatlove mailtorobmcdillatlove Sent Wednesday August PM To Tycholiz Barry Subject Re Pension Rollover Barry I will send a note to Jacy Also the funds I think we will go into are going to be more heavily weighted towards stocks but will have some bonds as well that what makes them a balanced fund Also do want us to manage the money Jacy has or do you want to leave it with him No problem either way just let me know Rob Reply Separator Subject RE Pension Rollover Author Tycholiz Barry Barry NRONcom at InternetMail Date AM I wasnt worried for a second I would like to have these funds in a portfolio that has a better performance than money markets I already have a decent amount of money K in the Rice portfolio thru andrew agencies in Virden You may want to look at exactly what that is contact Jacy Whyte at Andrew Agencies he will get you the details for Kim and I Was there a particular index fund you had in mind What do you mean by balanced Once we put it there I dont plan on touching or managing this until I return to Canada Thanks talk to you soon BT Original Message From robmcdillatlove mailtorobmcdillatlove Sent Tuesday August PM To Tycholiz Barry Subject Pension Rollover Barry You probably thought I had forgotten about you I had not I wanted to iron out some areas of concern from my end here As you know I am not supposed to do an investment for you while you are a resident of the US I have discovered that if we put the money into an account and not make moves on it until you move back to Canada then we can do it if I use a Canadian address I was advised to put the money into a balanced fund and leave it there for now My thoughts are to move it to a couple of funds in a self administered account and NOT make any moves with it Please review this note and let me know what you think If all is ok I will mail you the forms to sign which you signed here and we will get this moving Hope all is well with you down there Regards Rob This email is the property of Enron Corp andor its relevant affiliate and may contain confidential and privileged material for the sole use of the intended recipient s Any review use distribution or disclosure by others is strictly prohibited If you are not the intended recipient or authorized to receive for the recipient please contact the sender or reply to Enron Corp at and delete all copies of the message This email and any attachments hereto are not intended to be an offer or an acceptance and do not create or evidence a binding and enforceable contract between Enron Corp or any of its affiliates and the intended recipient or any other party and may not be relied on by anyone as the basis of a contract by estoppel or otherwise Thank you 
<5599869.1075852081458.JavaMail.evans@thyme>,-persson@ricemail.ricefinancial.com,2001-08-23 09:29:45,Re Pension RolloverActually the money that is in Clarica is part pension and part rrsp however the pension money that should cause it to be locked in is actually not locked in I guess that it was not vested As a result of this I am looking to transfer it all the one rrsp Let me know if you or Jacy have questions Rob Reply Separator Subject RE Re Pension Rollover Author Tycholiz Barry Barry NRONcom at InternetMail Date AM Jacy called me last night and I think will get in touch with you today Is the money that I have with you locked in or part of a RRSP or is this just going to be self directed income BT PS more emails in day than in a lifetime wow Original Message From robmcdillatlove mailtorobmcdillatlove Sent Thursday August AM To Tycholiz Barry Subject Re Pension Rollover OK got it Rob Reply Separator Subject RE Re Pension Rollover Author Tycholiz Barry Barry NRONcom at InternetMail Date PM I want to leave those funds with Jacy BT Original Message From robmcdillatlove mailtorobmcdillatlove Sent Wednesday August PM To Tycholiz Barry Subject Re Pension Rollover Barry I will send a note to Jacy Also the funds I think we will go into are going to be more heavily weighted towards stocks but will have some bonds as well that what makes them a balanced fund Also do want us to manage the money Jacy has or do you want to leave it with him No problem either way just let me know Rob Reply Separator Subject RE Pension Rollover Author Tycholiz Barry Barry NRONcom at InternetMail Date AM I wasnt worried for a second I would like to have these funds in a portfolio that has a better performance than money markets I already have a decent amount of money K in the Rice portfolio thru andrew agencies in Virden You may want to look at exactly what that is contact Jacy Whyte at Andrew Agencies he will get you the details for Kim and I Was there a particular index fund you had in mind What do you mean by balanced Once we put it there I dont plan on touching or managing this until I return to Canada Thanks talk to you soon BT Original Message From robmcdillatlove mailtorobmcdillatlove Sent Tuesday August PM To Tycholiz Barry Subject Pension Rollover Barry You probably thought I had forgotten about you I had not I wanted to iron out some areas of concern from my end here As you know I am not supposed to do an investment for you while you are a resident of the US I have discovered that if we put the money into an account and not make moves on it until you move back to Canada then we can do it if I use a Canadian address I was advised to put the money into a balanced fund and leave it there for now My thoughts are to move it to a couple of funds in a self administered account and NOT make any moves with it Please review this note and let me know what you think If all is ok I will mail you the forms to sign which you signed here and we will get this moving Hope all is well with you down there Regards Rob This email is the property of Enron Corp andor its relevant affiliate and may contain confidential and privileged material for the sole use of the intended recipient s Any review use distribution or disclosure by others is strictly prohibited If you are not the intended recipient or authorized to receive for the recipient please contact the sender or reply to Enron Corp at and delete all copies of the message This email and any attachments hereto are not intended to be an offer or an acceptance and do not create or evidence a binding and enforceable contract between Enron Corp or any of its affiliates and the intended recipient or any other party and may not be relied on by anyone as the basis of a contract by estoppel or otherwise Thank you 
