Message_id,From,Time_stamp,Text
<23393515.1075840315406.JavaMail.evans@thyme>,a_la_zing@meals.alazing.com,2002-01-14 08:27:51,Reserve your FREE piece Cutlery Set NowPST cgibinfloyhNyLBpRyjGVzdzDAc wwwalazingcomgifsemailzemailbuyanytwogif wwwalazingcomgifsfillgif A La Zing The complete meal solution to your Whats for Dinner dilemma A La Zing offers complete meals for two that feature Omaha Steaks and other gourmet selections With A La Zing you can serve delicious meals your entire family will love meals that take minutes not hours to prepare This year resolve to make your life easier let A La Zings convenient meal planning take the stress out of Whats for Dinner wwwalazingcomgifsemailzemailbuyanytwogif wwwalazingcomgifsfillgif wwwalazingcomgifsfillgif wwwalazingcomgifsfillgif cgibinfloyhNyLBpRyjGVzdzDAc wwwalazingcomgifsfillgif cgibinfloyhNyLBpRyjGVzdzDAc wwwalazingcomgifsfillgif cgibinfloyhNyLBpRyjGVzdzDAc wwwalazingcomgifsfillgif cgibinfloyhNyLBpRyjGVzdzDAc wwwalazingcomgifsfillgif cgibinfloyhNyLBpRyjGVzdzDAc cgibinfloyhNyLBpRyjGVzdzDAc wwwalazingcomgifsfillgif wwwalazingcomgifsfillgifEnjoy this delicious trio of A La Zing meals Plus youll receive a Tiramisu dessert and piece Cutlery Set FREE Click here for details cgibinfloyhNyLBpRyjGVzdzDAc wwwalazingcomgifsfillgif Hurry Offer ends wwwalazingcomgifsfillgif cgibinfloyhNyLBpRyjGVzdzDAc wwwalazingcomgifsfillgif cgibinfloyhNyLBpRyjGVzdzDAc wwwalazingcomgifsfillgif cgibinfloyhNyLBpRyjGVzdzDAc A La Zing a brand of Omaha Steaks sends special information and offers every days to individuals who have requested them You have received this message because you are on A La Zings mailing list If you feel you have received this message in error or you wish to be removed from this list please go to unsubscribe cgibinprofileyeNyLBpRyjGVz and you will automatically be removed from the list Please allow business days for completion of removal cgibinflosensingyNyLBpRyjGVz
<24088282.1075859134856.JavaMail.evans@thyme>,a_la_zing@meals.alazing.com,2001-12-27 08:05:57,Save up to during our YearEnd EventHTML BODY BGCOLORCCCCCC TABLE CELLPADDING CELLSPACING BORDER WIDTH HEIGHTTRTD BGCOLORCCCCCC TABLE CELLPADDING CELLSPACING BORDER ALIGNCENTER WIDTHTRTD BGCOLOR A HREFcgibinfloyhNclBpRyjGRudQAkIMG SRCwwwalazingcomgifsemailzemailyearendajpg WIDTH HEIGHT BORDERBRIMG SRCwwwalazingcomgifsemailzemailyearendgif WIDTH HEIGHT BORDERBRA TABLE CELLPADDING CELLSPACING BORDER BGCOLORFFFFFF WIDTH TR TD WIDTHA HREFcgibinfloyhNclBpRyjGRudQAkIMG SRCwwwalazingcomgifsemailzemailyearendjpg WIDTH HEIGHT BORDERBRATD TD WIDTH ALIGNCENTER A HREFcgibinfloyhNclBpRyjGRudQAk STYLEfontfamily Arial sansserif fontsizepx colorADBBeef Lovers TrioBABR SPAN STYLEfontfamily Arial sansserif fontsizepx colorAABI Servings for ONLY IBSPANBRIMG SRCwwwalazingcomgifsfillgif WIDTH HEIGHT BORDERBR A HREFcgibinfloyhNclBpRyjGRudQAk STYLEfontfamily Arial sansserif fontsizepx colorADBStuffed Sole SuiteBABR SPAN STYLEfontfamily Arial sansserif fontsizepx colorAABI Servings for ONLY IBSPANBRIMG SRCwwwalazingcomgifsfillgif WIDTH HEIGHT BORDERBR A HREFcgibinfloyhNclBpRyjGRudQAk STYLEfontfamily Arial sansserif fontsizepx colorADBImperial Sesame ChickenBABR SPAN STYLEfontfamily Arial sansserif fontsizepx colorAABI Servings for ONLY IBSPANBRIMG SRCwwwalazingcomgifsfillgif WIDTH HEIGHT BORDERBR SPAN STYLEfontfamily Arial sansserif fontsizepxIBHURRYB Offer expires January th ISPANTD TD WIDTHA HREFcgibinfloyhNclBpRyjGRudQAkIMG SRCwwwalazingcomgifsemailzemailyearendjpg WIDTH HEIGHT BORDERBRATD TR TABLE A HREFcgibinfloyhNclBpRyjGRudQAkIMG SRCwwwalazingcomgifsemailzemailyearendgif WIDTH HEIGHT BORDERBRA TDTRTABLE TABLE CELLPADDING CELLSPACING BORDER WIDTH ALIGNCENTER TRTD table border cellpadding cellspacing stylebordercollapse collapse bordercolor width tr td widthSPAN STYLEfontfamily Arial Helvetica sansserif fontsize px a HREFcgibinfloyhNclBpRyjGRucQAj img SRCwwwalazingcomgifsaffiliategoodStartPromosmallgif BORDER width heightaSPANtd td widthSPAN STYLEfontfamily Arial Helvetica sansserif fontsize px Give your health a jumpstart in with a month of daily ecouragements from a HREFcgibinfloyhNclBpRyjGRudRAAu STYLEcolor FoodFitcoma a HREFcgibinfloyhNclBpRyjGRucQAj STYLEcolor Click herea to get startedSPANtd tr table pSPAN STYLEfontfamily Arial Helvetica sansserif fontsize pxA La Zing a brand of Omaha Steaks sends special information and offers every days to individuals who have requested them You have received this message because you are on NOBRA La ZingsNOBR mailing listBRBRIf you feel you have received this message in error or you wish to be removed from this list please go to A HREFcgibinprofileyeNclBpRyjGRu STYLEcolorunsubscribeA and you will automatically be removed from the list Please allow business days for completion of removalBRSPANTD TRTABLE TDTRTABLE BODY IMG SRCcgibinflosensingyNclBpRyjGRuHTML
<28195661.1075840312404.JavaMail.evans@thyme>,a_la_zing@meals.alazing.com,2002-01-31 08:45:21,Save A Sweetheart of a DealPST cgibinfloyhOMtBpRyjGdZeTcAB wwwalazingcomgifsfillgif wwwalazingcomgifsfillgif Dear Friend wwwalazingcomgifsfillgif Put a little ZING into this Valentines Day with a romantic Dinner for Two cgibinfloyhOMtBpRyjGdZeTcAB wwwalazingcomgifsfillgif In the time it takes you to put flowers on the table light the fireplace and turn on romantic music you can have a gourmet dinner cgibinfloyhOMtBpRyjGdZeTcAB for two that will Light a Fire with that extra special someone A La Zing cgibinfloyhOMtBpRyjGdZeTcAB makes it easy to have an intimate dinner in the privacy of your own home wwwalazingcomgifsfillgif Right now you can save on our gourmet Surf Turf Dinner cgibinfloyhOMtBpRyjGdZeTcAB or you can treat that special someone to any of A La Zings gourmet selections wwwalazingcomgifsfillgif Plus you can SAVE UP TO cgibinfloyhOMtBpRyjGdZeTcAB on these delicious dinners wwwalazingcomgifsfillgif DATE NIGHT DINNER cgibinfloyhOMtBpRyjGdZeTcAB MARINATED SALMON PLATTER cgibinfloyhOMtBpRyjGdZeTcAB CHICKEN KIEV COMBINATION cgibinfloyhOMtBpRyjGdZeTcAB wwwalazingcomgifsfillgif For a grand finale to your Hearts Day Extravaganza why not add a dessert We have a limited supply of David Glass Chocolate Truffle Cakes cgibinfloyhOMtBpRyjGdZeTcAB or David Glass authentic New York Cheesecakes cgibinfloyhOMtBpRyjGdZeTcAB now just While supplies last wwwalazingcomgifsfillgif wwwalazingcomgifsfillgif wwwalazingcomgifszfadetopgif cgibinfloyhOMtBpRyjGdZeTcAB wwwalazingcomgifszfadebottomgif Surf Turf Dinner for cgibinfloyhOMtBpRyjGdZeTcAB Share the incomparable pairing of tender juicy Omaha Steaks Filet Mignons and rich sweet Lobster Tails with your loved one Your complete dinner for two includes Filet Mignons Lobster Tails Twice Baked Potatoes Whole Green Beans and Seasoned Butter Sauce for dipping Save Now Only HURRY Offer expires February th wwwalazingcomgifsfillgif cgibinfloyhOMtBpRyjGdZeTcAB A La Zing a brand of Omaha Steaks sends special information and offers every days to individuals who have requested them You have received this message because you are on A La Zings mailing list If you feel you have received this message in error or you wish to be removed from this list please go to unsubscribe cgibinprofileyeOMtBpRyjGdZk and you will automatically be removed from the list Please allow business days for completion of removal cgibinflosensingyOMtBpRyjGdZk
<21738787.1075840313458.JavaMail.evans@thyme>,a_la_zing@meals.alazing.com,2002-01-24 08:37:51,Save on NEW Family Style MealsPST cgibinfloyhOEmBpRyjGaVeHxAw wwwalazingcomgifsfillgif Introducing our new family style meals cgibinfloyhOEmBpRyjGaVeHxAw theyre fresh theyre delicious and for a limited time theyre OFF when you order through this email With A La Zing cgibinfloyhOEmBpRyjGaVeHxAw its easy to serve your family a hearty home cooked dinner in minutes any night of the week Wow them with Quattro Formaggi Ravioli cgibinfloyhOEmBpRyjGaVeHxAw Four Cheese Ravioli with Basil Marinara Sauce or serve up the ultimate Classic Beef Stroganoff cgibinfloyhOEmBpRyjGaVeHxAw Each of these mouthwatering dinners goes from your freezer to your table in just minutes leaving you the rest of the evening to enjoy wwwalazingcomgifsfillgif cgibinfloyhOEmBpRyjGaVeHxAw cgibinfloyhOEmBpRyjGaVeHxAw wwwalazingcomgifsfillgif wwwalazingcomgifsfillgif Egg and spinach pasta filled with grated Parmesan Romano Ricotta and Fontina cheeses A robust tomato sauce with fresh basil creates a true Italian dinner Just boil pasta and heat sauce Serves in just minutes Click here cgibinfloyhOEmBpRyjGaVeHxAw to order cgibinfloyhOEmBpRyjGaVeHxAw wwwalazingcomgifsemailzemailfamilystylejpg wwwalazingcomgifsfillgif cgibinfloyhOEmBpRyjGaVeHxAw cgibinfloyhOEmBpRyjGaVeHxAw wwwalazingcomgifsfillgif wwwalazingcomgifsfillgif Tender fettuccini noodles are topped with a tantalizing blend of sliced beef strips in a stroganoff sour cream sauce Fully cooked just heat and serve Serves in just minutes Click here cgibinfloyhOEmBpRyjGaVeHxAw to order cgibinfloyhOEmBpRyjGaVeHxAw wwwalazingcomgifsemailzemailfamilystylejpg Hurry this special introductory offer ends January th wwwalazingcomgifsfillgif wwwalazingcomgifsemailzemailfamilystylegif A La Zing a brand of Omaha Steaks sends special information and offers every days to individuals who have requested them You have received this message because you are on A La Zings mailing list If you feel you have received this message in error or you wish to be removed from this list please go to unsubscribe cgibinprofileyeOEmBpRyjGaVO and you will automatically be removed from the list Please allow business days for completion of removal cgibinflosensingyOEmBpRyjGaVO
<13402857.1075859138465.JavaMail.evans@thyme>,a_la_zing@meals.alazing.com,2001-12-19 08:50:13,Save on the perfect New Years Eve DinnerHTML BODY TABLE CELLPADDING CELLSPACING BORDER ALIGNCENTER WIDTHTRTD BGCOLOR A HREFcgibinfloyhNWbBpRyjGQYdDYAFIMG SRCwwwalazingcomgifsemailzemailnewyeardinnergif WIDTH HEIGHT BORDERABR TABLE CELLPADDING CELLSPACING BORDER BGCOLORFFFFFF WIDTH TR TD WIDTH VALIGNTOPIMG SRCwwwalazingcomgifsemailzemailnewyeardinnerjpg WIDTH HEIGHT BORDERTD TD WIDTH BGCOLOR VALIGNTOPIMG SRCwwwalazingcomgifsemailzemailnewyeardinnergif WIDTH HEIGHT BORDERTD TD WIDTH ROWSPAN VALIGNBOTTOM TABLE CELLPADDING CELLSPACING BORDER WIDTH TRTD VALIGNBOTTOMSPAN STYLEfontfamily Arial sansserif fontsizepxBDear Friend of nobrA La ZingnobrBBRBRMake this New Years Eve one to remember with a romantic A HREFcgibinfloyhNWbBpRyjGQYdDYAF STYLEcolorSurf Turf DinnerA for two from nobrA La ZingnobrBRBRIn about minutes thats just enough time to light the candles pour the wine and start the fire you can serve up a gourmet dinner of incredible quality u andu enjoy more of your evening with that special someoneBRBRAnd while supplies last you can top off your holiday celebration with a David Glass A HREFcgibinfloyhNWbBpRyjGQYdDYAF STYLEcolorPumpkin CheesecakeAI Specially priced at just IBRBRPlus right now you can A HREFcgibinfloyhNWbBpRyjGQYdDYAF STYLEcolorBSAVE BA on three nobrA La Zingnobr favoritesBRBRSPAN SPAN STYLEfontfamily Arial sansserif fontsizepx color B A HREFcgibinfloyhNWbBpRyjGQYdDYAF STYLEcolorTOP SIRLOIN MENUABR A HREFcgibinfloyhNWbBpRyjGQYdDYAF STYLEcolorSALMON FILLET SUPPERABR A HREFcgibinfloyhNWbBpRyjGQYdDYAF STYLEcolorTUNA STEAK DINNERABBRSPANTDTR TABLE TABLE CELLPADDING CELLSPACING BORDER WIDTHTR TD ALIGNRIGHT VALIGNBOTTOMIMG SRCwwwalazingcomgifsemailzemailnewyeardinnerajpg WIDTH HEIGHT BORDERTD TRTABLE TD TR TR TD WIDTH VALIGNTOP TABLE CELLPADDING CELLSPACING BORDER WIDTH TRTDSPAN STYLEfontfamily Arial sansserif fontsizepxCENTERA HREFcgibinfloyhNWbBpRyjGQYdDYAF STYLEcolor BSurf Turf Dinner for BACENTERSPANSPAN STYLEfontfamily Arial sansserif fontsizepxTheres nothing more sumptuous than the incomparable duo of tender juicy Omaha Steaks Filet Mignons and rich sweet Lobster Tails especially when paired with delicately seasoned Butter Sauce just perfect for dipping Complemented with zesty twice baked potatoes and whole green beans this complete dinner for two is an unforgettable dining experience SPANBRSPAN STYLEfontfamily Arial sansserif fontsizepxBDinner for two Reg BSPAN STYLEcolorCCCCBNow Only BSPANSPANTDTR TABLE TD TD WIDTH BGCOLOR VALIGNBOTTOMIMG SRCwwwalazingcomgifsemailzemailnewyeardinnergif WIDTH HEIGHT BORDERTDTR TABLE TABLE CELLPADDING CELLSPACING BORDER BGCOLORFFFFFF WIDTHTR TDIMG SRCwwwalazingcomgifsfillgif WIDTH HEIGHT BORDERTD TD ALIGNCENTERSPAN STYLEfontfamily Arial sansserif fontsizepxIBHURRYB Offer expires December th ISPANTD TD ALIGNRIGHTIMG SRCwwwalazingcomgifsemailzemailnewyeardinnerbjpg WIDTH HEIGHT BORDERTD TRTABLE A HREFcgibinfloyhNWbBpRyjGQYdDYAFIMG SRCwwwalazingcomgifsemailzemailnewyeardinnergif WIDTH HEIGHT BORDERABR TDTRTABLE TABLE CELLPADDING CELLSPACING BORDER WIDTH ALIGNCENTER TRTD VALIGNTOP STYLEfontsizepx widthBRA HREFcgibinfloyhNWbBpRyjGQYcQAsIMG SRCwwwalazingcomgifsaffiliategoodStartPromosmallgif WIDTH HEIGHT BORDERAIMG SRCwwwalazingcomgifsfillgif WIDTH HEIGHT BORDERTD TD widthSPAN STYLEfontfamily Arial Helvetica sansserif fontsize pxGive your health a jumpstart in with a month of daily ecouragements from A HREFcgibinfloyhNWbBpRyjGQYcQAs STYLEcolorFoodFitcomA A HREFcgibinfloyhNWbBpRyjGQYcQAs STYLEcolorClick hereA to get startedSPANTDTR TABLE TABLE CELLPADDING CELLSPACING BORDER WIDTH ALIGNCENTER TRTDSPAN STYLEfontfamily Arial Helvetica sansserif fontsize pxBRA La Zing a brand of Omaha Steaks sends special information and offers every days to individuals who have requested them You have received this message because you are on NOBRA La ZingsNOBR mailing listBRBRIf you feel you have received this message in error or you wish to be removed from this list please go to A HREFcgibinprofileyeNWbBpRyjGQYH STYLEcolorunsubscribeA and you will automatically be removed from the list Please allow business days for completion of removalBRSPANTD TRTABLE BODY IMG SRCcgibinflosensingyNWbBpRyjGQYHHTML
<13402014.1075840032718.JavaMail.evans@thyme>,a_la_zing@meals.alazing.com,2002-01-14 12:58:37,Reserve your FREE piece Cutlery Set Nowwwwalazingcomgifsfillgif A La Zing The complete meal solution to your Whats for Dinner dilemma A La Zing offers complete meals for two that feature Omaha Steaks and other gourmet selections With A La Zing you can serve delicious meals your entire family will love meals that take minutes not hours to prepare This year resolve to make your life easier let A La Zings convenient meal planning take the stress out of Whats for Dinner wwwalazingcomgifsemailzemailbuyanytwogif wwwalazingcomgifsfillgif wwwalazingcomgifsfillgif wwwalazingcomgifsfillgif cgibinfloyhNyLBpAnGVzdzDAI wwwalazingcomgifsfillgif cgibinfloyhNyLBpAnGVzdzDAI wwwalazingcomgifsfillgif cgibinfloyhNyLBpAnGVzdzDAI wwwalazingcomgifsfillgif cgibinfloyhNyLBpAnGVzdzDAI wwwalazingcomgifsfillgif cgibinfloyhNyLBpAnGVzdzDAI cgibinfloyhNyLBpAnGVzdzDAI wwwalazingcomgifsfillgif wwwalazingcomgifsfillgifEnjoy this delicious trio of A La Zing meals Plus youll receive a Tiramisu dessert and piece Cutlery Set FREE Click here for details cgibinfloyhNyLBpAnGVzdzDAI wwwalazingcomgifsfillgif Hurry Offer ends wwwalazingcomgifsfillgif cgibinfloyhNyLBpAnGVzdzDAI wwwalazingcomgifsfillgif cgibinfloyhNyLBpAnGVzdzDAI wwwalazingcomgifsfillgif cgibinfloyhNyLBpAnGVzdzDAI A La Zing a brand of Omaha Steaks sends special information and offers every days to individuals who have requested them You have received this message because you are on A La Zings mailing list If you feel you have received this message in error or you wish to be removed from this list please go to unsubscribe cgibinprofileyeNyLBpAnGVzl and you will automatically be removed from the list Please allow business days for completion of removal cgibinflosensingyNyLBpAnGVzl
