Message_id,From,Time_stamp,Text
<24747426.1075851577283.JavaMail.evans@thyme>,amy.quirsfeld@enron.com,2001-09-27 07:50:16,Jedi Cash ScheduleHi Dana Please let me know if you see any Linder money come in the next few days Im wondering if they are going to make a Distribution this month Thanks Amy
<18202257.1075851575016.JavaMail.evans@thyme>,amy.quirsfeld@enron.com,2001-10-22 14:29:46,REThats cool Original Message From Davis Dana Sent Monday October PM To Quirsfeld Amy Subject RE I just used all the recon folders for the companies that Kristi just gave me Im going to have Nicole order more tomorrow Original Message From Quirsfeld Amy Sent Monday October PM To Davis Dana Subject Dana Will you please make me an account recon folder for Co and THANK YOU
<9587764.1075851575039.JavaMail.evans@thyme>,amy.quirsfeld@enron.com,2001-10-22 14:24:30,Dana Will you please make me an account recon folder for Co and THANK YOU
<882785.1075851579901.JavaMail.evans@thyme>,amy.quirsfeld@enron.com,2001-09-04 08:56:54,Trutta account We have new procedures with Treasury concerning our Trutta accounts Stacy and I use to manage these accounts but now are having to go through Treasury to reserve funds They are managing our balances but will need to know about any same day wires If you have a same day wire going out on the account please fax Treasury to reserve the funds This is for same day wires only all other wires that go through AP and Treasury they are already aware of Feel free to ask me if you have any questions Thanks for your help Amy
<6060271.1075851584231.JavaMail.evans@thyme>,amy.quirsfeld@enron.com,2001-10-11 07:01:13,Bonne Terre Funding Cc My Bonne Terre funding for invoices totaling Jedi II Trutta which had been put off for several days now was not approved by the Land Dept Please delete the wires from your cash schedules Thank you Amy Veronica I have already deleted it from our Trutta schedule
