Message_id,From,Time_stamp,Text
<10964004.1075844996239.JavaMail.evans@thyme>,anita.fam@enron.com,1999-07-06 15:17:00,Update on GAll Guess what weve got some updated photos on Gillians website so if youre at a loose end please check them out at homeasesgohbabyhtm Gillians now and a half months old and weighs in at a hefty pounds kg she was weighed weeks ago so I guess that shes little heavier than that by now not bad for someone who was weeks early Shes a little chatterbox who cant stop yabbering and talks incessantly in her sleep as well Shes just started to suffer from stranger anxiety as well Rather embarrassing really cos she now bursts into tears whenever she sees Men her papa excluded The driver the gardener and the grandfather have all been her victims so far were wondering who will be next Regards Anita
<22946400.1075844313982.JavaMail.evans@thyme>,anita.fam@enron.com,1999-07-19 02:46:00,Re Update on Petron Hedging Program Cc Ill be happy to do the legal due dliligence and ISDA documentation from here BillCynthia Please let me know who in Credit will be handling this so that I can coordinate with them when the need arises Sara When Janice mentioned the legal due diligence with regard to commodity derivatives in the Philippines did she mean the legal survey done by Allen Overy If so Ive got copies of all that and can take it from here If that isnt the case and youve done more ISDA work in the Phillipines since then Id be forever grateful if you could send over whatever copies of the stuff which you have for me to suss out the situation there Mark T Janice Is there any particular law firm whom we should work with this time round Thanks all Rgds Anita Alan B Aronowitz PM To Janice CT cc Anita CT William S CT Mark ECT Legal CT Cynthia L CT Sara CT Subject Re Update on Petron Hedging Program AnitaSara I would suggest that Anita handle while coordinating with Sara on the background of the previous work product Alan Janice Moore AM To Anita CT William S CT cc Mark ECT Legal CT Alan B CT Cynthia L CT Subject Re Update on Petron Hedging Program Well it looks like we might have a shot at an ISDA w a PHilippines company One issue that discussed w Manuel but he does not mention in his note is that we would probably require an enforceability opinion from Petron a compnay jointly owned by the PHilippines govt and Saudi Aramco Im not sure which credit dept would handle this deal but Cynthia Schnedier has some familiarity w Petron Ill leave it to Mark Alan and Anita to determine whether Anita will handle the ISDA or whether it will be someone from Houston Sara S did the original legal due diligence on the enforceability of commodities derivatives contracts in the PHilippines Forwarded by Janice MooreHOUECT on Wang Moi Eng To Manuel GallegoENRONDEVELOPMENT AT ENRON CMAIL ENRON cc John ChismarSINECT Hans CT Mike NRON Janice CT Angel M CT David A Terlip AT ENRON NRON Victor Santos AT ENRON NRON Bruce Lundstrom AT ENRON NRON Heather J Mitchell AT ENRON NRON Alberto J Carreno AT ENRON NRON Subject Re Update on Petron Hedging Program Manuel Thanks for the update and we look forward to meet Petron tradersrisk management team during our next visit to Manila probably during our first cargo of gasoil to FGH currently planned for end August early September Kindly let us know on new developments For your information John is away on home leave and will be back in office only after mid August Best regards Eng From Manuel GallegoENRONDEVELOPMENT AT ENRON CMAIL on CDT To John CT Hans CT Wang Moi CT Mike Brown Janice CT Angel M CT David A Terlip AT ENRON CMAIL Victor Santos AT ENRON CMAIL Bruce Lundstrom AT ENRON CMAIL Heather J Mitchell AT ENRON CMAIL Alberto J Carreno AT ENRON CMAIL cc Subject Update on Petron Hedging Program Dear John Yayette Ventigan of Petron informed me yesterday that the energy derivatives course conducted by Paradigm in Manila from July to was wellreceived I sensed that the course was not deemed easy by the Petron participants Further Yayette indicated that they could have easily used up more time for the same amount of material Given the Paradigm course and the Citibank course which Yayette attended in Australia Yayette indicated that the Petron Board will most likely give the marching orders to Petron management on July to develop an initial basic and conservative hedging program for Petrons fuel oil and gasoil supplied to the National Power Corporation and go out to the market most likely through a bid process and execute a financial risk management contract ISDA Yayette indicated that Petron looks forward to the working meeting with Enrons Singapore traders I indicated to Yayette that end of August to early September would probably be convenient for us Yayette could not yet determine an appropriate time for Petron With respect to legal expectations Petron appears to be at ease with the following In general the concept of disassociating the financial risk management contract from the Philippines with the exception of Petron Corporation a Philippine corporation being a party to the contract Petron executing a financial risk management contract with an offshore counterparty like Citibank Australia or ECT Singapore Petron physically executing the contract outside the Philippines The contract to be governed by the laws of the State of New York I did point out to Yayette the need for offshore collateral in the form of a Letter of Credit which is consistent with the risk of nonenforcement for collateral in the Philippines Yayette indicated that she would raise this issue in her discussions with Petron treasury More later as I receive more feedback from Petron Best regards Manuel
<25361888.1075844515430.JavaMail.evans@thyme>,anita.fam@enron.com,1999-07-19 02:46:00,Re Update on Petron Hedging Program Cc Ill be happy to do the legal due dliligence and ISDA documentation from here BillCynthia Please let me know who in Credit will be handling this so that I can coordinate with them when the need arises Sara When Janice mentioned the legal due diligence with regard to commodity derivatives in the Philippines did she mean the legal survey done by Allen Overy If so Ive got copies of all that and can take it from here If that isnt the case and youve done more ISDA work in the Phillipines since then Id be forever grateful if you could send over whatever copies of the stuff which you have for me to suss out the situation there Mark T Janice Is there any particular law firm whom we should work with this time round Thanks all Rgds Anita Alan B Aronowitz PM To Janice CT cc Anita CT William S CT Mark ECT Legal CT Cynthia L CT Sara CT Subject Re Update on Petron Hedging Program AnitaSara I would suggest that Anita handle while coordinating with Sara on the background of the previous work product Alan Janice Moore AM To Anita CT William S CT cc Mark ECT Legal CT Alan B CT Cynthia L CT Subject Re Update on Petron Hedging Program Well it looks like we might have a shot at an ISDA w a PHilippines company One issue that discussed w Manuel but he does not mention in his note is that we would probably require an enforceability opinion from Petron a compnay jointly owned by the PHilippines govt and Saudi Aramco Im not sure which credit dept would handle this deal but Cynthia Schnedier has some familiarity w Petron Ill leave it to Mark Alan and Anita to determine whether Anita will handle the ISDA or whether it will be someone from Houston Sara S did the original legal due diligence on the enforceability of commodities derivatives contracts in the PHilippines Forwarded by Janice MooreHOUECT on Wang Moi Eng To Manuel GallegoENRONDEVELOPMENT AT ENRON CMAIL ENRON cc John ChismarSINECT Hans CT Mike NRON Janice CT Angel M CT David A Terlip AT ENRON NRON Victor Santos AT ENRON NRON Bruce Lundstrom AT ENRON NRON Heather J Mitchell AT ENRON NRON Alberto J Carreno AT ENRON NRON Subject Re Update on Petron Hedging Program Manuel Thanks for the update and we look forward to meet Petron tradersrisk management team during our next visit to Manila probably during our first cargo of gasoil to FGH currently planned for end August early September Kindly let us know on new developments For your information John is away on home leave and will be back in office only after mid August Best regards Eng From Manuel GallegoENRONDEVELOPMENT AT ENRON CMAIL on CDT To John CT Hans CT Wang Moi CT Mike Brown Janice CT Angel M CT David A Terlip AT ENRON CMAIL Victor Santos AT ENRON CMAIL Bruce Lundstrom AT ENRON CMAIL Heather J Mitchell AT ENRON CMAIL Alberto J Carreno AT ENRON CMAIL cc Subject Update on Petron Hedging Program Dear John Yayette Ventigan of Petron informed me yesterday that the energy derivatives course conducted by Paradigm in Manila from July to was wellreceived I sensed that the course was not deemed easy by the Petron participants Further Yayette indicated that they could have easily used up more time for the same amount of material Given the Paradigm course and the Citibank course which Yayette attended in Australia Yayette indicated that the Petron Board will most likely give the marching orders to Petron management on July to develop an initial basic and conservative hedging program for Petrons fuel oil and gasoil supplied to the National Power Corporation and go out to the market most likely through a bid process and execute a financial risk management contract ISDA Yayette indicated that Petron looks forward to the working meeting with Enrons Singapore traders I indicated to Yayette that end of August to early September would probably be convenient for us Yayette could not yet determine an appropriate time for Petron With respect to legal expectations Petron appears to be at ease with the following In general the concept of disassociating the financial risk management contract from the Philippines with the exception of Petron Corporation a Philippine corporation being a party to the contract Petron executing a financial risk management contract with an offshore counterparty like Citibank Australia or ECT Singapore Petron physically executing the contract outside the Philippines The contract to be governed by the laws of the State of New York I did point out to Yayette the need for offshore collateral in the form of a Letter of Credit which is consistent with the risk of nonenforcement for collateral in the Philippines Yayette indicated that she would raise this issue in her discussions with Petron treasury More later as I receive more feedback from Petron Best regards Manuel
<28181184.1075859875411.JavaMail.evans@thyme>,anita.fam@enron.com,1998-11-20 02:09:00,Re LNG hedging for ChinaMark Youre right Only types of institutions have the capacity and authority to enter into derivatives transactions in the PRC They are a banks b nonbank financial institutions NBFI and c foreign invested enterprises FIE Banks and NBFIs require banking licences and may only enter into derivative transactions for hedging purposes FIEs comprise i wholly foreign owned enterprises WFOE and ii sinoforeign owned joint ventures SFJV and include foreign banks foreign finance companies and bank branches There are no specific restrictions for WFOEs but SFJVs may only enter into derivative transactions for hedging purposes as well Stateowned enterprises and collectivelyowned enterprises can therefore only transact through a duly authorised bank or NBFI So it looks as if China National Oil Company Corp and China State Power Corp do not have the capacity nor the authority to enter into derivative transactions themselves in the PRC I believe that Nony has our Legal Survey on PRC on file so you might wish to pass to Cynthia a copy of the PRC Derivatives Transctions Guide for her to look at Its a good snapshot of the issues which are encountered in the PRC Regards Anita
<21621081.1075860085068.JavaMail.evans@thyme>,anita.fam@enron.com,1998-11-20 02:09:00,Re LNG hedging for ChinaMark Youre right Only types of institutions have the capacity and authority to enter into derivatives transactions in the PRC They are a banks b nonbank financial institutions NBFI and c foreign invested enterprises FIE Banks and NBFIs require banking licences and may only enter into derivative transactions for hedging purposes FIEs comprise i wholly foreign owned enterprises WFOE and ii sinoforeign owned joint ventures SFJV and include foreign banks foreign finance companies and bank branches There are no specific restrictions for WFOEs but SFJVs may only enter into derivative transactions for hedging purposes as well Stateowned enterprises and collectivelyowned enterprises can therefore only transact through a duly authorised bank or NBFI So it looks as if China National Oil Company Corp and China State Power Corp do not have the capacity nor the authority to enter into derivative transactions themselves in the PRC I believe that Nony has our Legal Survey on PRC on file so you might wish to pass to Cynthia a copy of the PRC Derivatives Transctions Guide for her to look at Its a good snapshot of the issues which are encountered in the PRC Regards Anita
