Message_id,From,Time_stamp,Text
<3489668.1075849644205.JavaMail.evans@thyme>,balletstar315@msn.com,2001-05-01 15:17:00,HIwanted to wish you a good day Hope it goes or went well Keran
<32517258.1075840576934.JavaMail.evans@thyme>,balletstar315@msn.com,2001-08-20 08:39:14,PST I just wanted to say that I love you and hope you have a good day Keran
<20869514.1075849663010.JavaMail.evans@thyme>,balletstar315@msn.com,2001-05-01 15:17:00,HIwanted to wish you a good day Hope it goes or went well Keran
<5354627.1075849678136.JavaMail.evans@thyme>,balletstar315@msn.com,2001-05-01 15:17:00,HIwanted to wish you a good day Hope it goes or went well Keran
<21664824.1075852415582.JavaMail.evans@thyme>,balletstar315@msn.com,2001-08-20 08:39:14,I just wanted to say that I love you and hope you have a good day Keran
