Message_id,From,Time_stamp,Text
<21354608.1075860950456.JavaMail.evans@thyme>,bruno@firstconf.com,2002-03-14 07:22:17,th Eyeforenergy UpdateWelcome to this weeks Eyeforenergy Update Just to refresh your memories this update is sent to you alternating each week with the main Eyeforenergy Briefing to let you know of any developments on the Eyeforenergycom website including publication of new stories whitepapers and special features as well as the latest news on our upcoming conferences If you visit our homepage wwweyeforenergycom you will see that our newest Featured Content is a special report commissioned by Norsk Hydro ASA and produced by the Center for International Climate and Environmental Research Oslo This takes a look at the current status of climate negotiations and the Kyoto agreement particularly after COP towards the end of last year Its most interesting aspect for Eyeforenergy readers is how it takes a look at implications for business in terms of compliance mechanisms and funding even for countries which have chosen not to ratify Kyoto such as the USA Scroll down the page to read the full report On the same subject early discounted registration is now available for our CO Trading The North American Market conference June in Chicago which already has companies such as DuPont Entergy TransAlta Natsource Entergy and Cinergy on board Look out for the full program for this event which will be published on our website tomorrow We can also announce that the number of industries who will be talking about their energy management strategies for the first time at Strategy Energy Management USA is growing including the likes of International Paper North Star Steel Nestl and more Keep an Eye on future Eyeforenergy Updates for more information as it becomes available Lastly we are now taking early noobligation applications for our forthcoming members only Premium Content subscription area which will entitle you to a discount off the already very low price See down for further details Bruno Russell mailto CONTENTS NEW ARTICLE An evaluation of business implications of the Kyoto Protocol APPLY EARLY FOR EYEFORENERGY PREMIUM CONTENT AND RECEIVE A DISCOUNT EVENTS UPDATE New case studies for Strategic Energy Management RECENT HEADLINES NEW WHITEPAPER An evaluation of business implications of the Kyoto Protocol This report was originally commissioned by Norsk Hydro ASA and its aim is to present and analyze the newest developments in the climate negotiations particularly the seventh Conference of the Parties to the Climate Convention in Marrakech Morocco in OctoberNovember and to provide an evaluation of what the finalized Kyoto Protocol means for business Eyeforenergy thanks and acknowledges the author Dr Asbjrn Torvanger and CICERO Center for International Climate and Environmental Research Oslo on whose website it was originally presented Click here to read the full article contentaspnews APPLY EARLY FOR EYEFORENERGY PREMIUM CONTENT AND RECEIVE A DISCOUNT We will very shortly be launching our first ever members only Premium Content area on the website This subscriptionbased service is aimed at those who wish to have access to the wealth of the exclusive and uptodate information case studies company strategies and knowledge which are presented at Eyeforenergy conferences As well as having access a community for subscribers to easily find and contact each other you will have full and unrestricted access to full conference proceedings including speaker presentations and transcriptions of speeches and panel discussions Furthermore any paying subscriber will get a full REFUND on their fee if they purchase an Eyeforenergy conference pass within their annual subscription period Alternatively subscription is FREE for a year to all our paying conference delegates A years subscription will be worth US per annum but if you are thinking of subscribing and let us know before the launch at the end of March we can offer you a discount off this low price Simply complete this form to be kept informed of the launch details premiumshtml EVENTS UPDATE Energy Exchanges Online III Sheraton Hotel New Orleans September Now in its rd Year Energy trading has never been more important or more important than today New systems and software continue come onto the market market leaders find themselves out of business trading portfolios continue to expand into new energy types and new derivatives Where can you go to network with the important players in the field Where can you get expert appraisal of your risk strategies Where can you find out about the latest trading tools that can make your operations more efficient and more secure The answer is New Orleans this September at the Energy Exchanges Online conference and exhibition For more information go to eeo CO Trading The North American Market The Radisson Hotel Chicago June Thank you to everyone who has already registered an interest in the forthcoming CO Trading The North American Market June Radisson Hotel Chicago The program is just one week away from being finalized and the brochure with full details will be mailed out midMarch If you havent yet requested a copy please do so now by completing the form at wwweyeforenergycomco Interest is also mounting in the attached Exhibition Space is strictly limited to stands continuing Eyeforenergys tradition of offering a high quality industry led conference with a focused relevant exhibition creating an ideal environment for networking in coffee breaks Applications to exhibit should be made to Robert Wolstenholme Sales Manager on mailto Please send any programspeaker enquiries to Sarah Robinson Conference Director on mailto Strategic Energy Management USA Park Hyatt Hotel Philadelphia June Energy Management has never been more important than today As the energy sector continues to deregulate energy managers are finding themselves increasingly faced with new players new tools and new choices A solid strategy which can navigate the challenges of intense competition online developments and a volatile market supply is crucial to your business This June in Philadelphia and for the first time ever all the major industries will be discussing their energy management strategies International Paper North Star Steel the Childrens Hospital of Philadelphia and Nestl are just some of the companies who will outline how they purchase and manage their energy supplies If you are involved in energy procurement make sure youre in Philadelphia this June at the Strategic Energy Management USA conference and exhibition To find out more or get involved simply register your interest at sem email Meabh Quoirin at mailto or call LATEST HEADLINES Shareholders Bless ConocoPhillips Merger contentaspnews Energy Virtual Partners Open for Business Offer Asset Management Solution contentaspnews Hyprotech Sulphur Experts Announce Breakthrough in Gas Processing Technology contentaspnews Environmental Report One Third of US Plants Given a Free Ride on Pollution contentaspnews Dark Cloud Covers Florida Solar Initiatives contentaspnews BofA Taps Former Enron Power Traders Enters Volatile Market contentaspnews SEC Snares PricewaterhouseCoopers Sets Sights on Hanover Compressor contentaspnews BP Pushing the Envelope on Global Warming contentaspnews This update is provided as part of the free Eyeforenergy Briefing service In addition to these updates you will receive a comprehensive newsletter every other week with fresh indepth analysis reports and insights into the issues currently affecting different areas of the energy industry To subscribe email mailto or alternatively send a message to mailtoSubjectBriefingSubscribe To unsubscribe email mailto or alternatively send a message to mailtoSubjectBriefingUnSubscribe
<22126422.1075852192826.JavaMail.evans@thyme>,bruno@firstconf.com,2001-10-25 10:13:54,th Eyeforenergy UpdateThis week we present a series of fact sheets on Renewable Energy published by the United Nations Environment Programme UNEP These provide a concise synopsis of the benefits and issues surrounding some of the different types of renewable and alternative energies Scroll down to find the link to the complete page Also we are privileged to have added the final speaker to the Green Convention representing Enron Wind as well as the EWEA find out more below As always please send any comments or enquiries to mailto CONTENTS RENEWABLE ENERGY FACT SHEETS from UNEP United Nations Environment Programme Energy EVENTS UPDATE Final Speaker from Enron Wind and the EWEA announced to complete the Green Convention lineup RECENT HEADLINES RENEWABLE ENERGY FACT SHEETS UNEPs Energy Programme addresses the environmental consequences of energy production and use such as global climate change and local air pollution It assists decisionmakers in government and the private sector to make better more informed energy choices which fully integrate environmental and social costs One of the areas UNEP Energy wwwuneptieorg is concerned with is renewable energy issues and has published a series of Renewable Energy Technology fact sheets on various types of renewable energies You can download a selection of them here contentaspnews EVENTS UPDATE Eyeforenergy Green Convention Brussels November Eyeforenergy has just secured our final speaker for the Eyeforenergy Green Convention Mr Andreas Wagner of Enron Wind Andreas as well as being the Director of Government and Regularory Affairs for Enron Wind is also VicePresident of the European Wind Energy Association On behalf of both he will bring his insight to the green debate as Chairman of the first day of the Convention He joins a host of toplevel speakers set to bring you their expertise in green commercial markets at this exclusive forum BP Nuon Essent Erga the EC Scottish Power Birka Energi RWE Power to name just a few will all be there Can you really afford to miss out Remember that as an Eyeforenergy reader you qualify for a discount with just over a week before the conference make sure you secure your place today Visit wwweyeforenergycomgreen for full details or contact Meabh Quoirin at mailto EEO Europe Energy Trading in the New Economy Amsterdam February Following up for our sellout conference in Phoenix December that was attended by over CEOs senior executives and press and Energy Exchanges Online II Energy Trading in the New Economy USA September Eyeforenergy brings you the premier networking and discussion conference for the energy trading community Meet do business and discuss the big issues over days with the leaders in energy trading in Amsterdam To find out more information including discounts for preregistration speaking sponsoring and exhibiting opportunities click here eurotrading Emissions Trading Okura Hotel Amsterdam February Emissions trading options are ripe for the picking so how can you make sure youre ready to profit from GHG Lets face it you cant really afford not to be especially as the World Bank has estimated demand in the international GHG trading system to be in the order of US billion per annum by Eyeforenergy is delighted to bring you this event which will focus on how you can best seize this exciting nwe market opportunity As ever the conference will be driven by the industry leaders in this arena backed up by expert advice from those helping the indsutry make the right moves in emissions Click here for further information emissions Weather Trading Okura Hotel Amsterdam February Todays business is all about risk and how to mitigate it Weather derivatives has become one of the key tools industries as wide ranging at utilities airlines and agriculture have at hand to offset risks associated with temperature and precipitation With over of Europes companies facing weatherrelated risk knowing about the latest advances in weather trading is a necessity Eyeforenergys latest event will be run in conjunction with our European online trading conference Energy Trading in the New Economy and Eyeforenergys Emissions Trading event so you can learn about the latest developments in energy and emissions trading all under one roof Click here for further information weather LATEST HEADLINES Germanys EEX and LPX Plan Merger contentaspnews Dynegy and Enron Square Off vie for Market Dominance contentaspnews Pennsylvanias Two Newest Wind Farms Begin Supplying Clean Energy contentaspnews Kiodex Launches Groundbreaking WebBased Risk Application contentaspnews EU Set to Begin Emissions Trading in contentaspnews Europe Attractive Market for US Power Companies contentaspnews This update is provided as part of the Eyeforenergy Briefing service In addition to these updates you will receive a comprehensive newsletter every other week with fresh indepth analysis reports and insights into the issues currently affecting different areas of the energy industry To subscribe email mailto or alternatively send a message to mailtoSubjectBriefingSubscribe To unsubscribe email mailto or alternatively send a message to mailtoSubjectBriefingUnSubscribe
<3946377.1075861270989.JavaMail.evans@thyme>,bruno@firstconf.com,2001-11-22 10:50:50,th Eyeforenergy UpdateJust a brief Update for you this week including the latest major news in the Energy industry and a complete rundown of our upcoming conferences for anyone who is thinking of attending including our latest addition of The Business of Fuel Cells for Transportation in Michigan next Spring Over the next few days keep a particularly close eye on our coverage of the unfolding Enron saga as we will be bringing you some of the very latest breaking news as it happens All that remains is to wish everyone in North America a very Happy Thanksgiving from all of us at Eyeforenergy If you have any comments or enquiries about this Update drop us a line at mailto CONTENTS EVENTS UPDATE New EyeforFuelCells event announced for Detroit RECENT HEADLINES EVENTS UPDATE The Business of Fuel Cells for Stationary Applications Le Plaza Hotel Brussels November Our sister company EyeforFuelCells is giving away a FREE ticket each week for this groundbreaking European conference in Brussels later this month Organisations who will be represented at this event include Gaz de France DuPont Johnson Matthey Global Thermoelectric Alstom Ballard Cogen Europe the World Fuel Cell Council the European Commission ZeTek Power Products Honda Europe Power Equipment the Royal Military Academy of Belgium Chevron Texaco Metasource Nuvera Fuel Cells Europe SiemensWestinghouse Power Corp and many more To enter the draw and for more information please visit EEO Europe Energy Trading in the New Economy Amsterdam February Following up for our sellout conference in Phoenix December that was attended by over CEOs senior executives and press and Energy Exchanges Online II Energy Trading in the New Economy USA September Eyeforenergy brings you the premier networking and discussion conference for the energy trading community Meet do business and discuss the big issues over days with the leaders in energy trading in Amsterdam To find out more information including discounts for preregistration speaking sponsoring and exhibiting opportunities click here eurotrading Emissions Trading Okura Hotel Amsterdam February Emissions trading options are ripe for the picking so how can you make sure youre ready to profit from GHG Lets face it you cant really afford not to be especially as the World Bank has estimated demand in the international GHG trading system to be in the order of US billion per annum by Eyeforenergy is delighted to bring you this event which will focus on how you can best seize this exciting nwe market opportunity As ever the conference will be driven by the industry leaders in this arena backed up by expert advice from those helping the indsutry make the right moves in emissions Click here for further information emissions Weather Trading Okura Hotel Amsterdam February Todays business is all about risk and how to mitigate it Weather derivatives has become one of the key tools industries as wide ranging at utilities airlines and agriculture have at hand to offset risks associated with temperature and precipitation With over of Europes companies facing weatherrelated risk knowing about the latest advances in weather trading is a necessity Eyeforenergys latest event will be run in conjunction with our European online trading conference Energy Trading in the New Economy and Eyeforenergys Emissions Trading event so you can learn about the latest developments in energy and emissions trading all under one roof Click here for further information weather The Business of Fuel Cells for Transportation Dearborn Hotel Detroit Michigan April May As manufacturers are increasingly developing technologies with the energy industry the auto industry is globalising at an unprecedented rate and both OEMs and suppliers are renegotiating their alternative vehicle programs This event will examine all possible applications in teh transport industry including synergies with hybrid automobiles and the potentially lucrative APU market Fueling infrastructure will also be covered and with BP recently launching Hydrogen fueling stations in Singapore this issure could not be more timely or pertinent If you have a story to tell a product to promote or would simply like to get the full lowdown on the movers and shakers in the industry then if youre not already in Detroit youll certainly want to be there in April For more information please visit LATEST HEADLINES Enron Deal on the Brink Dynegy to Renegotiate Deal contentaspnews AEP Ventures Into Renewable Energy contentaspnews Shell Renewables Takes stake in US Wind Power Market contentaspnews General Motors Says Fuel Cells To Power Homes In Addition To Vehicles contentaspnews NYMEX on a Roll Sets Overnight Trading Record contentaspnews Nuon Taps Sakonnet Technologys Trading and Risk Management Solution contentaspnews This update is provided as part of the Eyeforenergy Briefing service In addition to these updates you will receive a comprehensive newsletter every other week with fresh indepth analysis reports and insights into the issues currently affecting different areas of the energy industry To subscribe email mailto or alternatively send a message to mailtoSubjectBriefingSubscribe To unsubscribe email mailto or alternatively send a message to mailtoSubjectBriefingUnSubscribe
<12486357.1075852110245.JavaMail.evans@thyme>,bruno@firstconf.com,2001-10-25 10:13:54,th Eyeforenergy UpdateThis week we present a series of fact sheets on Renewable Energy published by the United Nations Environment Programme UNEP These provide a concise synopsis of the benefits and issues surrounding some of the different types of renewable and alternative energies Scroll down to find the link to the complete page Also we are privileged to have added the final speaker to the Green Convention representing Enron Wind as well as the EWEA find out more below As always please send any comments or enquiries to mailto CONTENTS RENEWABLE ENERGY FACT SHEETS from UNEP United Nations Environment Programme Energy EVENTS UPDATE Final Speaker from Enron Wind and the EWEA announced to complete the Green Convention lineup RECENT HEADLINES RENEWABLE ENERGY FACT SHEETS UNEPs Energy Programme addresses the environmental consequences of energy production and use such as global climate change and local air pollution It assists decisionmakers in government and the private sector to make better more informed energy choices which fully integrate environmental and social costs One of the areas UNEP Energy wwwuneptieorg is concerned with is renewable energy issues and has published a series of Renewable Energy Technology fact sheets on various types of renewable energies You can download a selection of them here contentaspnews EVENTS UPDATE Eyeforenergy Green Convention Brussels November Eyeforenergy has just secured our final speaker for the Eyeforenergy Green Convention Mr Andreas Wagner of Enron Wind Andreas as well as being the Director of Government and Regularory Affairs for Enron Wind is also VicePresident of the European Wind Energy Association On behalf of both he will bring his insight to the green debate as Chairman of the first day of the Convention He joins a host of toplevel speakers set to bring you their expertise in green commercial markets at this exclusive forum BP Nuon Essent Erga the EC Scottish Power Birka Energi RWE Power to name just a few will all be there Can you really afford to miss out Remember that as an Eyeforenergy reader you qualify for a discount with just over a week before the conference make sure you secure your place today Visit wwweyeforenergycomgreen for full details or contact Meabh Quoirin at mailto EEO Europe Energy Trading in the New Economy Amsterdam February Following up for our sellout conference in Phoenix December that was attended by over CEOs senior executives and press and Energy Exchanges Online II Energy Trading in the New Economy USA September Eyeforenergy brings you the premier networking and discussion conference for the energy trading community Meet do business and discuss the big issues over days with the leaders in energy trading in Amsterdam To find out more information including discounts for preregistration speaking sponsoring and exhibiting opportunities click here eurotrading Emissions Trading Okura Hotel Amsterdam February Emissions trading options are ripe for the picking so how can you make sure youre ready to profit from GHG Lets face it you cant really afford not to be especially as the World Bank has estimated demand in the international GHG trading system to be in the order of US billion per annum by Eyeforenergy is delighted to bring you this event which will focus on how you can best seize this exciting nwe market opportunity As ever the conference will be driven by the industry leaders in this arena backed up by expert advice from those helping the indsutry make the right moves in emissions Click here for further information emissions Weather Trading Okura Hotel Amsterdam February Todays business is all about risk and how to mitigate it Weather derivatives has become one of the key tools industries as wide ranging at utilities airlines and agriculture have at hand to offset risks associated with temperature and precipitation With over of Europes companies facing weatherrelated risk knowing about the latest advances in weather trading is a necessity Eyeforenergys latest event will be run in conjunction with our European online trading conference Energy Trading in the New Economy and Eyeforenergys Emissions Trading event so you can learn about the latest developments in energy and emissions trading all under one roof Click here for further information weather LATEST HEADLINES Germanys EEX and LPX Plan Merger contentaspnews Dynegy and Enron Square Off vie for Market Dominance contentaspnews Pennsylvanias Two Newest Wind Farms Begin Supplying Clean Energy contentaspnews Kiodex Launches Groundbreaking WebBased Risk Application contentaspnews EU Set to Begin Emissions Trading in contentaspnews Europe Attractive Market for US Power Companies contentaspnews This update is provided as part of the Eyeforenergy Briefing service In addition to these updates you will receive a comprehensive newsletter every other week with fresh indepth analysis reports and insights into the issues currently affecting different areas of the energy industry To subscribe email mailto or alternatively send a message to mailtoSubjectBriefingSubscribe To unsubscribe email mailto or alternatively send a message to mailtoSubjectBriefingUnSubscribe
