Message_id,From,Time_stamp,Text
<26571460.1075852655696.JavaMail.evans@thyme>,bruno@firstconf.com,2001-06-14 02:38:45,h Eyeforenergy Briefing IMAGEIMAGEIMAGE IMAGE IMAGEHOME EVENTS ADVERTISE INDUSTRY DIRECTORY IMAGEI MAGE Thursday June Issue EDITORIAL Putting the brakes on Re gulations The past few weeks have brought home the reality of just what sort of environment energy companies are working in For all the talk abou t deregulation across the globe its become increasingly apparent that go vernments arent quite willing to give up their control over energy supply and distribution In Europe EDFs expansion plans have been put on th e hot seat by various governments not too thrilled about the idea of the French company becoming a major player in their backyards Enrons recent problems in India only serve to highlight that while Asia remains an impor tant place for investment governmental red tape remains a major impedimen t The Brazilian energy crisis has brought the Brazilian government back into the mix with a vengeance And in the US California is having a fine time going after a number of energy companies on charges of price fixing It would seem that the energy companies cant catch a break wherever they term even mother nature seems to be having fun at their expense with the recent flooding in Houston with my namesake Tropical Storm Allison It s not all doom and gloom however Record profits and investment in the en ergy stocks only go to show that the energy industry is a resilient lot Allison Robertshaw Editor CASE STUDY Latin America and the Energ y Economy The dawn of the st Century signals a shift in Latin America to an Energy Economy However the pathway to the new economy is plagued with potholes in the form of political unrest decades of poor planning hydroelectric projects on the verge of drying up on againoff again dere gulation efforts and impending gloom in some power sectors In spite of many headlines pronouncing doom and gloom there are many bright spots on Latin Americas energy horizon As the old saying goes there are many ros es among the thorns Not the least of those roses is the sectors abundan t oil and gas reserves estimated at some billion bbl Click here fo r Full Story FOCUS The Sun Rises On Alternative Energy The winds o f change are blowing in the energy sector particularly in the field of r enewable energy Renewables especially solar are set to grow dramatically over the near term as the industry comes to grips with the depletion of f ossil fuels and the power shortages plaguing much of the globe The renew able energy sector is expected to grow as much as per year over the next five years according to reliable sources It should be noted however that renewables are not expected to be a major threat to conventional oi l and gas as most of the world and virtually all of the industrialized Click here for Full Story INSIGHT Preparing for the Uncertain Fu ture Technological advances along with increased merger activity clearl y have increased the complexity of the energy industry dramatically during the past decade Complicating the scenario is the fact that energy manag ers are more accountable to shareholders and shareholder value than ever The change has been tremendous In upstream EP for example the concept of the customer much less shareholder value didnt exist five years ago Toward this end a companys ability to present itself in a good light is paramount to do so requires a reasonable ability to predict company per formance in the near future Headquartered in London Celerant Consultin g formerly Cambridge Management Consulting helps oil and gas companies manage these and other challenges they face Among the fourteenyearold c ompanys clientele are Click here for Full Story ADVERTISEMENT IMAGE Landmark Graphics and Petroleum Place Accelerating Business Ef ficiency Landmark Graphics and Petroleum Place Delivers Enormous Efficie ncies within Acquisition and Divestiture How Through online delivery of data and evaluation tools within an APS environment to afford dramatic eff iciencies for both sellers and buyers Visit wwwpetroleumplacecom IMAGE NEW GLOBAL ENERGY REPORTS Emerging Markets Online specializes in global energy reports Dozens of new reports are now available includ ing Latin American Oil and Gas Report Power Generation in Latin America Iraq Oil and Gas Report European Energy Liberalization Gas and Power in India and more The site includes news and a Global Energy Projects Data base Register now to view FREE executive summaries at marketscomloginenergyreportsasp IMAGE NEWS ROUND UP WEEK IN R EVIEW Smart Meters Lower Reduce Operating Cost Satisfy Increased Demand for Electricity Internet based metering technologies make it easier and m ore affordable for power companies to satisfy the rising demand for electr icity Independent System Operators ISOs and Regional Transmission Orga nizations RTOs can now deploy Webenabled meters and software to suppor t their ancillary services and can choose demand response programs as ine xpensive alternatives to spinning reserve requirements Webenabled tool s such as Click here for Full Story DTE Samsung Techwin Form Korea n Energy Venture A new venture energynow will be launched by Koreaba sed Samsung Techwin and DTE Energy DTE will provide its distributed gene ration technologies mini and micro grid expertise and its energynow br and while Samsung will offer access to customers sales offices and marke ting infrastructure and logistical services Click here for Full Story Russia Proclaims Solar a Top Priority Dimitry Strebkov The director o f the AllRussia Institute of Agriculture Energy has said that Russia has breakthrough technologies in all major areas of solar power engineering and that the country can compete with foreign achievements in the field The Ministry of Industry and Science will provide funding in for t he construction of a solar power plant using solar concentrators at the Gr ibanovo testing range also known as the design bureau SOLTO This is one of the five Russian projects in the field of untraditional renewable sourc es Click here for Full Story Enron Considers Shuttering Of Second Ph ase of Dabhol Plant Enron in cooperation with lenders to its Indian uti lity is strongly considering shutting down the billion second phase of its giant Dabhol Power plant Enron spokesman John Ambler said Thursda y that the entire billion project is in jeopardy with the second phase being more percent complete The second phase of the plant is critical a nd would almost triple Dabhols powergeneration capacity to about megawatts or enough power to Click here for Full Story Wireless Web Network Monitors Million Miles of Pipelines San Jose Calif An Austi n Tx June Aerisnet and American Innovations are teaming up t o help protect the environmentally sensitive areas and local communities f rom hazardous pipeline leaks and explosions by using Aerisnets wireless telemetry network services and American Innovations Bullhorn Remote Moni toring System to remotely monitor over million miles of pipelines throug hout North America More than million miles of pipeline weave across the US transporting all sorts of hazardous Click here for Full Story President Bush vs Renewable Energy Truth stranger than Fiction Rece nt statements by US Vice President Dick Cheney regarding the Administra tions Energy Policy appear to show the administrations bias toward big oi l Some claim the vice president showed a decided lack of vision when he said recently Conservation may be a sign of personal virtue but it is n ot a sufficient basis for a sound comprehensive energy policy Renewabl e advocates claim it is time to move forward to renewable energy sources a nd leave Click here for Full Story Oil Giants Clash Over US Bill ion Merger The merger of giants Chevron and Texaco as beset with delays as Texaco and Shell squabble over the sale of assets The dispute is rais ing concerns of the US Federal Trade Commissions about Texaco and Chevron s combined refining and marketing operations in California where they ow n five refineries and control more than per cent of the retail petrol m arket Texaco has been in talks with its partners Click here for Full Story Latest News Now IMAGE EDITORIAL IMAGE Putting t he brakes on Regulations ARTICLES IMAGE Latin America and the Energy Economy IMAGE The Sun Rises On Alternative Energy IMAGE Dealing with Ch ange NEWS ROUND UP IMAGE Smart Meters Lower Reduce Operating Cost Sat isfy Increased Demand for Electricity IMAGE DTE Samsung Techwin Form K orean Energy Venture IMAGE Russia Proclaims Solar a Top Priority IMA GE Enron Considers Shuttering Of Second Phase of Dabhol Plant IMAGE Wi reless Web Network Monitors Million Miles of Pipelines IMAGE Presiden t Bush vs Renewable Energy Truth stranger than Fiction IMAGE Oil Giant s Clash Over US Billion Merger SUBSCRIBE Please enter your em ail address below to subscribe to the EyeForEnergy newsletter Thank you UNSUBSCRIBE To unsubscribe from the EyeForEnergy newsletter please enter your email below Thank you If you have any comments about th is newsletter or you would like to suggest future topics or industry rela ted news please email IMAGE
<32727695.1075852645797.JavaMail.evans@thyme>,bruno@firstconf.com,2001-08-29 11:12:52,th Eyeforenergy UpdateThis is a reminder that the Energy Exchanges Online II show is less than two weeks away and tickets have nearly sold out Further to our recent announcement that we will be hosting a Cocktail Party at the famous Pat OBriens on the River at the end of the first day sponsored by Bloomberg we confirmed yesterday that Enron will also be chairing the conference find out more here contentaspnews REMEMBER As an Eyeforenergy Briefing subscriber you are entitled to a discount off the regular conference fee You can view the topics and speakers at usaprogramshtml if you would like to see interviews with any of the speakers prior to the show please contact us at mailto Contents EVENTS UPDATE ENRON to chair Energy Exchanges Online II and BLOOMBERG to sponsor the Cocktail Party at Pat OBriens on the River The EWEAs President to chair the Green Convention RECENT HEADLINES EVENTS UPDATE Energy Exchanges Online II Energy Trading in the New Economy New Orleans September Eyeforenergy is pleased to announce that Enron will be chairing the upcoming conference on energy trading in New Orleans Energy Exchanges Online II Energy Trading in the New Economy From September energy traders will be meeting in New Orleans to discuss the latest developments in online trading Speakers include Bill Lawson Director of Strategic Development Williams Jeff Shorter VP of Energy Trading TXU Richard Schaeffer Director Global Energy Futures ABN AMRO Kevin Fox SVP and GM Commodities at Aquila Other companies speaking at the event include the Intercontinental Exchange Powerex NetThruPut AES FSD International Southern EEI Watt Exchange the American Petroleum Exchange GlobalCoal Ameren Amerex Penterra Enermetrix Nexclear TrueQuote TradeCapture the Chicago Merchantile Exchange Altra APX and Duke Weve been astounded by the success of this show remarked Allison Robertshaw Director of Eyeforenergy Its a key time for the industry Weve had a bit of time to take stock of the fall out from deregulation in places like California and New York In addition it looks like the shake down among the online exchanges is about to go through another round I think its an ideal time for energy traders to take a good hard look at who theyre working with and make sure that theyve got the right partners The event is taking place at the Sheraton New Orleans from September For full information please see wwweyeforenergycomusa DISCOUNT Remember as a newsletter subscriber you get off the registration fee when you book using the reference code newsletter Eyeforenergy Asia Shangri La Hotel Singapore October Eyeforenergy returns to Singapore October for its rd Asian conference with a packed program featuring presentations on eprocurement and online trading as well as eretail and everything you need to know about all the latest ebusiness developments in Asia Companies speaking include world heavyweights such as TotalFinaElf Shell Enron TradeRanger Foster Wheeler Kvaerner Pantellos Intercontinental Exchange Automated Power Exchange Petroleum Authority of Thailand Unocal Indian Oil Premier Oil GE GXS and Asean Centre for Energy Eyeforenergy is delighted to announce that global technology leader Sun Microsystems and energy trading and risk management specialist FSD International sponsor the event this year The conference is produced in association with our media partners EnergyAsia PetroMin and Hydrocarbon Asia and Emerging Markets Online the premier online resource for global energy and utilities intelligence For more information on this cuttingedge industry event please visit our regional website wwweyeforenergycomasia or contact Hilton Mundy on mailto For press inquiries please contact Sarah Robinson on mailto Eyeforenergy Green Convention Brussels November The president of the European Wind Energy Association will be the Chairman on the first day of the Eyeforenergy Green Convention to take place in Brussels th November The EWEA are the latest major assocation to join the impressive line up of senior level speakers all experts from the Green Energy Community that will be sharing their expertise at the conference Sponsored by BP the day conference and exhibition in the heart of Brussels at the Hotel le Plaza will provide you the knowledge and contacts that will be key to cracking this emerging market The speakers include the European Commission G Renewable Energy Task Force BP ICF Consulting REGS Group Enron JP Morgan Essent BG Group Scottish Power Nuon Erga Edison COecom RWE Power MVV Energie Green Electricity Marketplace Esmap EcoSecurities Greenpricescom World Bank Norddeutsche Landesbank Birka Energi and Green Energy Marketplace Key issues to be discussed include Renewable regulations EU certification and labels Alternative energy investment and risk management Green technologies and product development Green power marketing and consumer sales Green energy and emissions trading Visit wwweyeforenergycomgreen for full details or contact Meabh Quoirin at mailto EEO Europe Energy Trading in the New Economy Amsterdam February Following up for our sellout conference in Phoenix December that was attended by over CEOs senior executives and press and Energy Exchanges Online II Energy Trading in the New Economy USA September Eyeforenergy brings you the premier networking and discussion conference for the energy trading community Meet do business and discuss the big issues over days with the leaders in energy trading in Amsterdam To find out more information including discounts for preregistration speaking sponsoring and exhibiting opportunities click here eurotrading Financial Public Relations for the Energy Industry Amsterdam February Deregulation rising profits consolidation and spinoffs have all created a new environment for the energy industry Energy companies and their financial strategies are coming under increasing scrutiny from a number of sources Are you ready to answer them Eyeforenergy is issuing a call for papers for this event Click to get more information or submit a speaking request financial LATEST HEADLINES SPL WorldGroup Launches TransFormance Group to Focus on Innovation contentaspnewsnlienergy California Energy Commission Awards Million Contract to ICF Consulting contentaspnewsnlienergy Swedens Renewable Energy Teams With Swiss World Wind contentaspnewsnlienergy Nigerian Private sector Set to Tap Solar Energy contentaspnewsnlienergy Online Power Trading On the Rise Threatens Traditional Brokers contentaspnewsnlienergy This update is provided as part of the Eyeforenergy Briefing service In addition to these updates you will receive a comprehensive newsletter every other week with fresh indepth analysis reports and insights into the issues currently affecting different areas of the energy industry To subscribe email mailto or alternatively send a message to mailtoSubjectBriefingSubscribe To unsubscribe email mailto or alternatively send a message to mailtoSubjectBriefingUnSubscribe
<25646649.1075852677307.JavaMail.evans@thyme>,bruno@firstconf.com,2001-09-05 18:05:11,h Eyeforenergy Briefingnewsletternewsletterhtm IMAGEIMAGEIMAGEIMAGE IMAGEHOME EVENTS ADVERTISE INDUSTRY DIRECTORY IMAGEI MAGE Thursday September Issue EDITORIAL Consumers Consolida tion and Cocktails Its been an interesting week for the energy industry A number of recent announcements hint at some long term changes in the way t he energy industry will look years from now International Fuel Cells have announced that Woking UK will be the home of the first commercial fue l cell in the UK for more information on this story see the article below and Puget Sound Energy is extending their conservation program that take s advantage of realtime pricing for consumers It would seem that the lon gpromised benefits of fuel cells are turning the corner and are beginning to offer a viable commercial alternative Consumers are soon to be faced w ith even more options on where they get their power from and with the incr easingly ability of utilities to pass on the real costs and benefits of the ir power choices their choice will be an important one It opens up a wor ld where consumers will develop a relationship with their power supplier as theyre forced to look at where they get their power from and when they us e it Its been a while in the making and it seems that the recent power crises in the States have given it the push it needed to turn the corner As dramatically as the downstream and retail side of the energy industry i s set to change in the next months the wholesale energy market continue s to face almost daily changes One of the articles in this weeks briefin g is an interview with Canadas WattEx It would seem that while cross U SCanadian energy trading is developing apace there are still a number of hurdles on both sides of the fence to be overcome Recent announcements at Enron in the past week or two suggest that Energys golden boy is having a few teething problems is this the opportunity for rivals like the ICE TradeSpark and Dynegy to consolidate their recent gains And what does i t mean for exchanges like HoustonStreet and RedMeteor that have been strugg ling of late Theres a lot of talk about consolidation and it seems to be picking up steam On a final note you probably know that the Eyeforen ergy team is going to be down in New Orleans next week for our Energy Excha nges Online II event We look forward to seeing some familiar faces and me eting some new ones down there as well as getting all the latest news over a hurricane or two See you in the Big Easy Allison Robertshaw Editor QA Ene rgy Without Borders The web revolution is in full swing and it has hi t the energy sector full force Despite an economic slowdown in the United States and other areas of the globe energy companies continue to flock hea dfirst to the Internet Recently Forrester Research published a wellread r eport Net Energy Hits Hypergrowth that predicts online energy trading w ill exceed trillion by While the online energy trading world is dominated by the likes of EnronOnline with a reported average daily trad ing volume of billion TradeSpark IntercontinentialExchange Click here for Full Story FOCUS Online Energy Exchanges A Moving Ta rget As deregulation and competition sweep the globe there is an eve rincreasing demand being placed on utilities and energy providers to gathe r manage analyze and distribute data in creative ways Widespread merger s consolidation sell offs and closings have marked the past year as the online energy marketplace has evolved In the midst of this energy market u pheaval a crop of new Webbased businesses products and services has emer ged to reduce the complexity of deregulation and help manage the pain of sk yrocketing energy prices Exchanges that started life with one product lin e aimed at a small group of users traders and marketers have evolved to th e point where they give new meaning to the word power Todays exchanges serve up a wide range of products from electricity natural gas crude oil refined products Click here for Full Story ADVERTISEMENT I MAGE Energy Exchanges Online II Energy Trading in the New Economy New Orl eans September There are now very few spaces left at the prem ier energy trading event of the year New Orleans has proved to be an irres istible draw to energy traders from across the country Were also pleased to announce that Bloomberg will be hosting our first night cocktail party a t the famous Pat OBriens Make sure that you dont miss out on the chanc e to network with the key players in the energy trading community CLICK HERE to register for your place or to find out prices and further informa tion go here DISCOUNT Remember as a newsletter subscriber you get off the registration fee when you book using reference code newsletter IMAGE Landmark Graphics and Petroleum Place Accelerating Business Efficiency Landmark Graphics and Petroleum Place Delivers Enormous Effic iencies within Acquisition and Divestiture How Through online delivery of data and evaluation tools within an APS environment to afford dramatic eff iciencies for both sellers and buyers Visit wwwpetroleumplacecom IM AGE NEWS ROUND UP WEEK IN REVIEW UK gets its first commercial fuel ce ll system A recreational center in Woking England will become the site of the first commercial fuel cell operating in the United Kingdom All an Jones MBE a featured speaker at the upcoming Business of Fuel Cells for Stationary Applications conference in Brussels says Installing a fuel ce ll is a logical part of our ongoing efforts to promote and use sustainable energy sources We are proud to be the first site in the UK to employ fuel cell technology in everyday use Click here for Full Story Japa n Joint Venture Deploys Power Line Telecommunications A new joint ven ture formed by Kansai Electric Power Company Inc and ITRAN Communications Ltd A new joint venture formed by Kansai Electric Power Company Inc a nd ITRAN Communications Ltd ITRAN announce the formation of Linecom Inc will develop and deploy power line telecommunications systems in Japa n Linecom will leverage Kansai EPs knowledge of power distribution Click here for Full Story CAN Energy Calls on Excelergy to Help Mul tiply Customer Base ACN Energy is teaming with Excelergy Corp to im plement the companys open coaction products ACN Energy is teaming with E xcelergy Corp to implement the companys open coaction products in order to expand their offerings of electricity natural gas and related products in the rapidly growing mass market residential and small business area Excelergy Corporation will provide ACN Click here for Full Story Enron Broadband Downsizes Two Top Execs Out Enrons Broadband busi ness took another hit last week Enrons Broadband business took another hi t last week with the announcement that Ken Rice chairman and chief exe cutive of Enron Broadband services and Kevin Hannon chief executive of Enron Global Assets and Services have left the company Hannon had been p resident and chief operating Click here for Full Story TradeSpa rk Tops Billion Since Launch in October New York August The online marketplace TradeSpark reports that it has transacted billion notational value in energy products since its launch in Octo ber TradeSpark a manytomany electronic trading platform powere d by eSpeed technology brings multiple buyers and multiple sellers to one neutral anonymous marketplace to trade natural gas electricity coal nit rogen oxide and sulfur dioxide emission credits TradeSpark offers three modes of access to its electronic trading platform through a highly secu re dedicated private network that guarantees response times for all trades through TradeSparks experienced voice brokers and via the Internet M idway Click here for Full Story Puget Sound Energy Alliance Da ta Form Alliance Strengthen Utility Marketplace August P uget Sound Energy and Alliance Data Systems have formed a strategic allianc e that will leaverage Alliances ConsumerLinX software and PSEs customeri nformation software developed by its ConneXtsubsidiary Alliance Data has acquired the assets of ConneXt including use of the ConsumerLinX software Alliance Data will offer ConsumerLinX as part of its integrated singles ource customer relationship management solution for largescale regulated utility clients Puget Sound Energy is the utility subsidiary of Puget En ergy We feel this new relationship is beneficial for both Alliance Data a nd Puget Sound Energy said Mike Beltz president of Alliance Cli ck here for Full Story Latest News Now IMAGE EDITORIAL I MAGE Consumers Consolidation and Cocktails ARTICLES IMAGE Energy Wi thout Borders IMAGE Online Energy Exchanges A Moving Target NEWS ROUN D UP IMAGE ICE on the Fast Track Growing Rapidly IMAGE Japan Joint V enture Deploys Power Line Telecommunications IMAGE CAN Energy Calls on Excelergy to Help Multiply Customer Base IMAGE Enron Broadband Downsize s Two Top Execs Out IMAGE TradeSpark Tops Billion Since Launch in October IMAGE Puget Sound Energy Alliance Data Form Alliance St rengthen Utility Marketplace EVENTS IMAGE Energy Exchanges Online I I IMAGE Eyeforenergy Asia IMAGE Green Convention IMA GE EEO Europe Energy Trading in the New Economy IMAGE Financial Pu blic Relations for the Energy Industry SUBSCRIBE Please enter your email address below to subscribe to the EyeForEnergy newsletter Thank you UNSUBSCRIBE To unsubscribe from the EyeForEnergy newsletter ple ase enter your email below Thank you If you have any comments about this newsletter or you would like to suggest future topics or industry re lated news please email IMAGE 
