Message_id,From,Time_stamp,Text
<8762663.1075861575471.JavaMail.evans@thyme>,bruno@firstconf.com,2001-11-01 09:33:08,h Eyeforenergy Briefingnewsletternewsletterhtml IMAGEIMAGEIMAGEIMAGEIMAGE HOME EVENTS ADVERTISE INDUSTRY DIRECTORY IMAGEIMAGE Thursday November Issue EDITORIAL In this edition we take a closer look at the state of play in the green energy market an d also at technologies not planned or anticipated but with us right now t hat can bring alternative energy strategies to fruition There are just a few remaining places on the delegate register for the Eyeforenergy Green C onvention in Brussels next week so if you are intending to go and havent yet registered please do so today In Going Green The Bottom Line t he first of our two articles on green energy Abyd Karmali VP of ICF Consu lting points to the increasing importance of emissions trading as a key en vironmental issue We also examine the relative market share currently enj oyed or lamented by the main renewable energy initiatives wind solar biomass and fuel cells Speakers are lining up rapidly for our three col ocated events in Amsterdam February Energy Trading Online Wea ther Trading and Emissions Trading Recently confirmed include Enron LIFF E TXU and NatSource The programmes for all three are likely to be filled over the next couple of weeks so if you are interested in speaking please contact Allison Robertshaw for Energy and Weather Trading and Meabh Quoirin for Emission s Trading as soon as possible I hope you enjoy this edition of the Eyefo renergy Briefing your feedback as always is welcome and can be directed to Sarah Robinson Marketing PR Director FOCUS Technology Driving Green Energy Recent events have served to hig hlight the need to reduce our dependence on Middle Eastern oil reserves and strengthen our resolve to bring alternative forms of energy into mainstrea m use Most of the energy used today comes from fossil fuel resulting in g reen house gas GHG emissions being released into the atmosphere at ever i ncreasing rates Indeed the environment is as much a player in developing the coming hydrogen economy as reducing our dependence on foreign oil rese rves Carbon and sulphur dioxides are having a decided impact on our enviro nment contributing to climate change and acid rain As any school boy can attest energy Click here for Full Story INSIGHT Going Green The Bottom Line Deregulation of the European gas and electric markets is a b lessing to some and a stone around the neck of others With most of the Eur opean Union particularly France Italy Greece and Portugal dominated by tired old state monopolies the opening of markets to competition is moving technology to the front burner as power companies jockey for position in t he race to keep pace with new opportunities Green power initiatives move front and center as concerns over the impact climate change will have on r ate structures when most EU markets become fully deregulated by Renew able sustainable and alternative energy sources once seen as marginal and advocated by tree huggers and back to nature Click here for Full Story ADVERTISEMENT IMAGE Eyeforenergy Green Convention Hotel Le Pl aza Brussels November With just a few days to go the Eyeforener gy team are looking forward to the Green Convention in Brussels Andreas Wa gner VP of the European Wind Energy Association and also of Enron Wind wil l open and chair the first day of the conference He heads an all star cast of the leading figures in the renewable energy industry The European Comm ission BP Nuon Edison RWE Power Birka Energi Scottish Power Essent the RECS Group Erga MVV Energie Green electricity marketplace COecom EcoSecurities Natsource Enron The Italian Ministry of Environment NDLB the World Bank and ICF Consulting will all be sharing their expertise and showing you how you can profit from green energy A very limited number of places are available To register click here IMAGE Landmark Graphic s and Petroleum Place Accelerating Business Efficiency Landmark Graphic s and Petroleum Place Delivers Enormous Efficiencies within Acquisition and Divestiture How Through online delivery of data and evaluation tools wit hin an APS environment to afford dramatic efficiencies for both sellers and buyers Visit wwwpetroleumplacecom IMAGE NEWS ROUND UP WEEK IN R EVIEW SPL Build Further Market Dominance In Australias Deregulating Util ities Sector Morristown NJ October st SPL WorldGroup BV t he leading provider of customer management solutions to the global energy water and waste management industries is set to expand its already dominan t position as the leading provider of billing and customer management solut ions in the Australian utilities marketplace with full retail contestabilit y imminent for the countrys two most populous states SPL client implemen tations currently support billing for approximately million customers o ut of a potential market of eight million By comparison its nearest com petitor bills less than million clients Additionally when the two la rgest states in terms of customer numbers New South Click here for Full Story Pantellos Named A Top Net Market by Aberdeen Press Release Source Pantellos In just a week after announcing that its live operations have exceeded million in deal flow Pantellos today announced that it was the only vertically focused utility and energy services company highl ighted for its best practices as a Process Net by Aberdeen Group a lea ding IT market analysis and positioning service firm Aberdeen defines Pro cess Nets as entities that support business processes in a connected enviro nment such as a net market an exchange or a private trading network From day one Pantellos has dedicated significant resources to building a t rading community that would offer our members Click here for Full Story Atlantic Renewable Boosts New Yorks Wind Power by MW October Atlantic Renewable Resources Corp of Richmond Va is teaming with MA Mortenson Construction of Minneapolis to develop a MW wind farm fo r CHI Energy near Fenner NY The facility will employ twenty MW Enron wind turbinegenerator sets when completed in November of this year Octob er Atlantic Renewable Resources Corp of Richmond Va is teami ng with MA Mortenson Construction of Minneapolis to develop a MW wind farm for CHI Energy near Fenner NY The facility will employ twenty M W Enron wind turbinegenerator sets when completed in November of Click here for Full Story UK Will Meet Green Targets Without Nuclear Power October A recently released government backed report reached t he conclusion that ministers will meet ambitious targets to reduce greenhou se gas emissions without having to build any more nuclear power stations The Carbon Trust charged by the prime minister to persuade business to red uce carbon dioxide emissions has told the governments energy review that the targets can be met if power is generated through other means such as hy drogen wind and waves Ian McAllister who chairs the trust Click her e for Full Story San Francisco Voters Asked to Approve SolarPower Init iative October When San Francisco voters enter the voting boot h on November they will be asked to approve an initiative that offers to turn the foggy city on the bay into solar city USA At first blush solar p ower in a city noted for its fog appears doubtful at best but supporters an d solar experts say the citys sunny eastern side generates nearly as much solar energy as Sacramento and that solar power is produced even in the f og If Propositions B and H pass the Click here for Full Story Pe nnsylvanias Two Newest Wind Farms Begin Supplying Clean Energy October Pennsylvania has brought two new wind farms online tripling the a mount of windgenerated energy in the state and reducing carbon dioxide emi ssions in the process The megawatts of windproduced electricity will supply enough power annually for more than homes The new turbines in the southwest part of the state stand feet tall and have three blad es Three universities Carnegie Mellon Penn State and the University of Pennsylvania Click here for Full Story Latest News Now I MAGE EDITORIAL IMAGE In this edition ARTICLES IMAGE Technolo gy Driving Green Energy IMAGE Going Green The Bottom Line NEWS ROUND UP IMAGE SPL Build Further Market Dominance In Australias Deregulating U tilities Sector IMAGE Pantellos Named A Top Net Market by Aberdeen IMA GE Atlantic Renewable Boosts New Yorks Wind Power by MW IMAGE UK Wil l Meet Green Targets Without Nuclear Power IMAGE San Francisco Voters Asked to Approve SolarPower Initiative IMAGE Pennsylvanias Two Newest Wind Farms Begin Supplying Clean Energy EVENTS IMAGE Green Conventio n IMAGE The Business of Fuel Cells for Stationary Applications IMAGE EEO Europe Energy Trading in the New Economy IMAGE Emission s Trading IMAGE Weather Trading SUBSCRIBE Please ente r your email address below to subscribe to the EyeForEnergy newsletter Tha nk you UNSUBSCRIBE To unsubscribe from the EyeForEnergy newsletter please enter your email below Thank you If you have any comments abo ut this newsletter or you would like to suggest future topics or industry r elated news please email IMAGE 
<5179751.1075861576866.JavaMail.evans@thyme>,bruno@firstconf.com,2001-11-08 10:16:53,th Eyeforenergy UpdateThis Update follows this weeks resoundingly successful Green Convention in Brussels which saw many of Europes most influential players and policymakers get together for two days and nights of informationsharing meeting and networking Most of the speakers presentations from the event are already available on our website unlimited access to these downloads is available for only at greenloginasp We also present a white paper courtesy of Kiodex a technology and services company providing technology products to facilitate trading and risk management in commodity markets Scroll down for more details As always please send any comments or enquiries to mailto CONTENTS WHITE PAPER The Effective Energy Risk Management Program Design and Implementation EVENTS UPDATE Free draw for The Business of Fuel Cells for Stationary Applications Brussels Nov RECENT HEADLINES WHITE PAPER The Effective Energy Risk Management Program Design and Implementation CONTENTS Foreword by Leslie Haines Editor Oil and Gas Investor and Joe Fisher Senior Editor Energy Markets Why To Hedging Softens the Blow of Skyrocketing Energy Costs By Jodi Wetsuki In the first half of the year it was next to impossible to pick up an earnings statement that didnt list rising energy costs as a major detriment to the business in question When To Designing an Effective Energy Hedging Program By R Martin Chavez As the derivatives markets have matured an old debate continues to rage should corporations that are exposed to the price of energy hedge their exposure How To Putting Your Plan Into Action By Raj Mahajan and Brett Holleman This article provides guidance to those companies looking to implement an energy risk management program Overview of the Kiodex Risk Workbenchtm You can download this white paper here contentaspnews EVENTS UPDATE The Business of Fuel Cells for Stationary Applications Le Plaza Hotel Brussels November Our sister company EyeforFuelCells is giving away a FREE ticket each week for this groundbreaking European conference in Brussels later this month Organisations who will be represented at this event include Gaz de France DuPont Johnson Matthey Global Thermoelectric Alstom Ballard Cogen Europe the World Fuel Cell Council the European Commission ZeTek Power Products Honda Europe Power Equipment the Royal Military Academy of Belgium Chevron Texaco Metasource Nuvera Fuel Cells Europe SiemensWestinghouse Power Corp and many more To enter the draw and for more information please visit EEO Europe Energy Trading in the New Economy Amsterdam February Following up for our sellout conference in Phoenix December that was attended by over CEOs senior executives and press and Energy Exchanges Online II Energy Trading in the New Economy USA September Eyeforenergy brings you the premier networking and discussion conference for the energy trading community Meet do business and discuss the big issues over days with the leaders in energy trading in Amsterdam To find out more information including discounts for preregistration speaking sponsoring and exhibiting opportunities click here eurotrading Emissions Trading Okura Hotel Amsterdam February Emissions trading options are ripe for the picking so how can you make sure youre ready to profit from GHG Lets face it you cant really afford not to be especially as the World Bank has estimated demand in the international GHG trading system to be in the order of US billion per annum by Eyeforenergy is delighted to bring you this event which will focus on how you can best seize this exciting nwe market opportunity As ever the conference will be driven by the industry leaders in this arena backed up by expert advice from those helping the indsutry make the right moves in emissions Click here for further information emissions Weather Trading Okura Hotel Amsterdam February Todays business is all about risk and how to mitigate it Weather derivatives has become one of the key tools industries as wide ranging at utilities airlines and agriculture have at hand to offset risks associated with temperature and precipitation With over of Europes companies facing weatherrelated risk knowing about the latest advances in weather trading is a necessity Eyeforenergys latest event will be run in conjunction with our European online trading conference Energy Trading in the New Economy and Eyeforenergys Emissions Trading event so you can learn about the latest developments in energy and emissions trading all under one roof Click here for further information weather LATEST HEADLINES DynegyEnron Merger Imminent contentaspnews Ecuador Taking Steps to Privatize Power Generators contentaspnews Renewables Get Boost From Minneapolis Based Xcel contentaspnews Regulators Eyeing Enrons Impact on Energy Markets contentaspnews In Wake of NYMEX Plans Emergency Trading Floor contentaspnews Sun Shines Brightly as San Francisco Goes Solar contentaspnews This update is provided as part of the Eyeforenergy Briefing service In addition to these updates you will receive a comprehensive newsletter every other week with fresh indepth analysis reports and insights into the issues currently affecting different areas of the energy industry To subscribe email mailto or alternatively send a message to mailtoSubjectBriefingSubscribe To unsubscribe email mailto or alternatively send a message to mailtoSubjectBriefingUnSubscribe
<2351773.1075861577797.JavaMail.evans@thyme>,bruno@firstconf.com,2001-11-15 08:12:35,h Eyeforenergy Briefingnewsletternewsletterhtml IMAGE IMAGE IMAGE IMAGE IMAGE HOME
<22595615.1075852663418.JavaMail.evans@thyme>,bruno@firstconf.com,2001-10-25 10:13:54,th Eyeforenergy UpdateThis week we present a series of fact sheets on Renewable Energy published by the United Nations Environment Programme UNEP These provide a concise synopsis of the benefits and issues surrounding some of the different types of renewable and alternative energies Scroll down to find the link to the complete page Also we are privileged to have added the final speaker to the Green Convention representing Enron Wind as well as the EWEA find out more below As always please send any comments or enquiries to mailto CONTENTS RENEWABLE ENERGY FACT SHEETS from UNEP United Nations Environment Programme Energy EVENTS UPDATE Final Speaker from Enron Wind and the EWEA announced to complete the Green Convention lineup RECENT HEADLINES RENEWABLE ENERGY FACT SHEETS UNEPs Energy Programme addresses the environmental consequences of energy production and use such as global climate change and local air pollution It assists decisionmakers in government and the private sector to make better more informed energy choices which fully integrate environmental and social costs One of the areas UNEP Energy wwwuneptieorg is concerned with is renewable energy issues and has published a series of Renewable Energy Technology fact sheets on various types of renewable energies You can download a selection of them here contentaspnews EVENTS UPDATE Eyeforenergy Green Convention Brussels November Eyeforenergy has just secured our final speaker for the Eyeforenergy Green Convention Mr Andreas Wagner of Enron Wind Andreas as well as being the Director of Government and Regularory Affairs for Enron Wind is also VicePresident of the European Wind Energy Association On behalf of both he will bring his insight to the green debate as Chairman of the first day of the Convention He joins a host of toplevel speakers set to bring you their expertise in green commercial markets at this exclusive forum BP Nuon Essent Erga the EC Scottish Power Birka Energi RWE Power to name just a few will all be there Can you really afford to miss out Remember that as an Eyeforenergy reader you qualify for a discount with just over a week before the conference make sure you secure your place today Visit wwweyeforenergycomgreen for full details or contact Meabh Quoirin at mailto EEO Europe Energy Trading in the New Economy Amsterdam February Following up for our sellout conference in Phoenix December that was attended by over CEOs senior executives and press and Energy Exchanges Online II Energy Trading in the New Economy USA September Eyeforenergy brings you the premier networking and discussion conference for the energy trading community Meet do business and discuss the big issues over days with the leaders in energy trading in Amsterdam To find out more information including discounts for preregistration speaking sponsoring and exhibiting opportunities click here eurotrading Emissions Trading Okura Hotel Amsterdam February Emissions trading options are ripe for the picking so how can you make sure youre ready to profit from GHG Lets face it you cant really afford not to be especially as the World Bank has estimated demand in the international GHG trading system to be in the order of US billion per annum by Eyeforenergy is delighted to bring you this event which will focus on how you can best seize this exciting nwe market opportunity As ever the conference will be driven by the industry leaders in this arena backed up by expert advice from those helping the indsutry make the right moves in emissions Click here for further information emissions Weather Trading Okura Hotel Amsterdam February Todays business is all about risk and how to mitigate it Weather derivatives has become one of the key tools industries as wide ranging at utilities airlines and agriculture have at hand to offset risks associated with temperature and precipitation With over of Europes companies facing weatherrelated risk knowing about the latest advances in weather trading is a necessity Eyeforenergys latest event will be run in conjunction with our European online trading conference Energy Trading in the New Economy and Eyeforenergys Emissions Trading event so you can learn about the latest developments in energy and emissions trading all under one roof Click here for further information weather LATEST HEADLINES Germanys EEX and LPX Plan Merger contentaspnews Dynegy and Enron Square Off vie for Market Dominance contentaspnews Pennsylvanias Two Newest Wind Farms Begin Supplying Clean Energy contentaspnews Kiodex Launches Groundbreaking WebBased Risk Application contentaspnews EU Set to Begin Emissions Trading in contentaspnews Europe Attractive Market for US Power Companies contentaspnews This update is provided as part of the Eyeforenergy Briefing service In addition to these updates you will receive a comprehensive newsletter every other week with fresh indepth analysis reports and insights into the issues currently affecting different areas of the energy industry To subscribe email mailto or alternatively send a message to mailtoSubjectBriefingSubscribe To unsubscribe email mailto or alternatively send a message to mailtoSubjectBriefingUnSubscribe
