Message_id,From,Time_stamp,Text
<2001130.1075841079513.JavaMail.evans@thyme>,d..winfree@enron.com,2002-01-28 08:46:28,FW Monday Status report of integration testing remaining outstanding issues going forward Cc PST Just an update on the testing front O Original Message From Smith Regan M Sent Monday January AM To Allen Thresa A Anderson Bridgette Anderson Diane Aucoin Evelyn Baker Natalie Baxter Bryce Bentley Corry Bowen Bob Brackett Debbi e R Campos Anthony Campos Sylvia A Dahlke Andrea Dawes Cheryl De nny Jennifer Denton Rhonda L Dupuy Mark Elledge Susan Engel Tom Evans Casey Garcia Clarissa Gillis Brian Hare Bill D Hayden Frank Heal Kevin Hunter Larry Joe Huntley Kelley Jaquet Tammy Kenne Da wn C Lozano Melba Mcginnis Stephanie McLaughlin Jr Errol Meredith Kevin Murphy Melissa Price Wade R Reeves Kathy Robinson Rhonda R odriguez Bernice Schield Elaine Schrab Mark L Seib Dianne Severson Russ Spears Christopher Stevens Mechelle Sullivan Patti Sweitzer Tara Theriot Kim S Vander velde Nikole Wallumrod Ellen Winfree ON eal D Wynne Rita Bharathi Jaikishore Boudreaux Lori Brewer Charles Chitradurga Sundar Cinelli Steve Clark Cynthia Fortney Bill Frank s Shawn Greig Iain Henry Jane Hilburn Hunter Wade Johnson Jeff Kr ishnaswamy Jayant Lim Francis S Martinez Bob McKeel Richard Nolte Ron Pena Matt Poston David Powell John D Ramesh Ganapathy Rao R amesh Saleem Aftab Sanvido Terry Schmidt Mark Schomer Chris Smith Regan M Stock Steve Brockhan Richard Blaylock Jr Samuel Subject Monday Status report of integration testing remaining ou tstanding issues going forward Everyone updates from testing last week and communication of information going forward Thanks to all involved in last weeks testing Much has been accomplished We did encounter a legal mandated test freeze on Friday given a legal co mmunication came down to halt all data entry code changes but as of Frida y evening it was eventually lifted Any unfinished testing can continue Weve completed Integration testing of transaction type scenarios from EOL entry Si tara TDS Tagg This includes the sample testing of scripts and the end to end testing to SAP EOL has sent gas and financial transactions through downstream syste ms Over integration issues identified and resolved Majority were data s etup issues but code changes were identified incorrect hardware being use d reports not running startup scripting issues resolved replication iss ues resolved Whats remaining to test and status EDI testing Tammy Jaquet Robert Virnau are expected to complete the E DI test by end of day today Financial Settlements EOL deals Mechelle Stevens is completing her ve rification of EOL deals into Unify Testing is expected to complete the ED I test by end of day today SAP testing SAP is still in requirements analysis with regards to GL a ccount setup profit centers A meeting is scheduled for Wednesday afterno on with the UBS SAP Netco leads SAP testing can be conducted between Un ify and within SAP once decisions are determined Any other issues we are not aware of please advise Outstanding known issues Unify custom reports SQR not working This was not part of integratio n test but testing by Kelley Huntley on Friday resulted in failure Infra structure expected to resolve by Monday noon There is some data setup that is being completed Monday morning and shou ld be complete by now Any other issues we are not aware of please advise Going forward The Netco EOL or new OLT team will be testing all week deals into Net co environments You may see these in downstream systems Analysis of what estate data still resides in Netco and what needs to b e there to go forward Namely curve data for EnPower We will perform regression testing to determine if there are any cross d ependency of hardware Testing scenarios include a Application messaging that use Tibco port multicast addresses b Estate execution with Netco hardware inactive c Netco execution with Estate hardware inactive Notice FYI All Netco UBS employees LAN NT userids will be changed t o a new file server anticipated Friday The impacts are mainly the O drive W drive will be split between Estat e and Netco All authorized legal data is being copied now to the new fi le servers For example if Netco employees need specific files on the O drive if th ey are missing they would have remained with estate If you have files in progress they may missing the batch file copy which is occurring this week Updates to follow later this week Regan Smith Energy Operations Systems Enron Net Works wk cell Original Message From Smith Regan M Sent Wednesday January PM To Allen Thresa A Anderson Bridgette Anderson Diane Aucoin Evelyn Baker Natalie Baxter Bryce Bentley Corry Bowen Bob Brackett Debbi e R Campos Anthony Campos Sylvia A Dahlke Andrea Dawes Cheryl De nny Jennifer Denton Rhonda L Dupuy Mark Elledge Susan Engel Tom Evans Casey Garcia Clarissa Gillis Brian Hare Bill D Hayden Frank Heal Kevin Hunter Larry Joe Huntley Kelley Jaquet Tammy Kenne Da wn C Lozano Melba Mcginnis Stephanie McLaughlin Jr Errol Meredith Kevin Murphy Melissa Price Wade R Reeves Kathy Robinson Rhonda R odriguez Bernice Schield Elaine Schrab Mark L Seib Dianne Severson Russ Spears Christopher Stevens Mechelle Sullivan Patti Sweitzer Tara Theriot Kim S Vander velde Nikole Wallumrod Ellen Winfree ON eal D Wynne Rita Bharathi Jaikishore Brewer Charles Chitradurga Su ndar Cinelli Steve Elwood Richard Fortney Bill Franks Shawn Greig Iain Henry Jane Hilburn Hunter Wade Johnson Jeff Lim Francis S M artinez Bob McKeel Richard Nolte Ron Pena Matt Poston David Powel l John D Ramesh Ganapathy Rao Ramesh Saleem Aftab Sanvido Terry Schmidt Mark Schomer Chris Smith Regan M Stock Steve Clark Cynthi a Boudreaux Lori Subject Status report of integration testing from Wednesday Jan rd a nd Thursdays continuation Status report of integration testing from Wednesday Jan rd gas power types of transactions to test Overall there were no infrastructure or major application issues Unlike the prior testing weve included many more gas transaction types and testi ng with all nonessential Netco data removed aka baseline for Netco goliv e In todays test we had numerous data setup related issues that resulted i n downtime ie EOL Dynegy information TGP address information bad credit counterparty contracts or database issues with data sync replication These were mainly attributed to the massive cleanup removal of data not needed The remaining issues open are being addressed Wednesday night Given the deferred pm to pm start time and data setup sync issues we were unable to complete downstream processes mainly Settlements conf irmations SAP Continuation of testing into Thursday We are requesting the testers with tasks remaining to complete the script e xecution Thursday morning shift and afternoon shifts given UBS offsite mee tings We will try to balance the testing activities given some will be out in the morning and some in the afternoon The bridgeline will be active from for communication status RECAP of where testing left off for Netco and EOL entry NETCO Deal types with Netco external gaspower good bad credit Financial All financial testing completed Power Wednesday Completed tasks Deal Entry settlement statement group setup notif ication EnPower deal load Awaiting settlements drafting issue Thursday remaining status DCAF testing ready Kelley Huntley to draft invoices after draft issue resolved Gas Wednesday Completed tasks Deal Entry in TDS TAGG ERMS Sitara Port Calc Thursday Chris Spears Transport The TGP payment methods are now setup Clarissa Hanks Transport usage ticket for generic contract is se tup Deal Wade Price To draft invoices after confirmation of activity upst ream pm DCAF testing after confirmation of activity upstream Need to conduct the EDI test Tammy Jaquet Robert Virnau EOL Deals Dawn Kenne has confirmed EOL deals were setup Gas Power Thursdays plans are to confirm the flow of these deals into Sitara Tagg EnPower Followed by eventual confirmations settlement through Unify and SAP These are ready now for validation by Sitara Tagg EnPower Thanks to your continued involvement Regan Smith Energy Operations Systems Enron Net Works wk cell
<16203746.1075841185351.JavaMail.evans@thyme>,d..winfree@enron.com,2002-01-11 07:14:26,EOL Product to Book ListPST Hey Gang Could you guys review the attached list of products as I attempted to match EOL product to Risk Book and Trader The sheet current is a list of all products the sheet Texas is my attempt to carve out Texas related products only Risk Books will be as follows Tom FBTexas Jim FBTexas Eric FBTexas Charlie FBTexas Dave FBTexas ONeal
<15946144.1075841185942.JavaMail.evans@thyme>,d..winfree@enron.com,2002-01-07 10:55:23,Physical Curve MappingsSitara Cc PST Hey Gang Attached are the physical curve mappings as provided by Russ Severson Please take a peek and let us know if we need to change adddelete update any pointsmappings going forward in a Netco environment For instance I would like to change Texoma to Carthage on the curve mappings Also I would like to delete all derived curves leaving only Carthage KatyTailgate and Agua Dulce The other physical locations would be ShipChannel Waha and Katy nontailgate Let me know your thoughts ONeal 
<1108851.1075841186547.JavaMail.evans@thyme>,d..winfree@enron.com,2002-01-02 08:18:06,Texas CustomersPST Latest file
<16443671.1075841187400.JavaMail.evans@thyme>,d..winfree@enron.com,2001-12-19 10:19:07,FW Customer listPST This one includes more financial counterparties noneol Original Message From Winfree ONeal D Sent Wednesday December AM To Martin Thomas A Subject Customer list Tom Attached are EOL customers between July and Nov broken out by Physical and Financial The only physical customers I remember non EOL are Imperial Sugar and Texas Energy Im also checking this list against other nonEOL deals Eric or Joe might have done but for now take a look at this O
<14489804.1075841187425.JavaMail.evans@thyme>,d..winfree@enron.com,2001-12-19 09:12:50,Customer listPST Tom Attached are EOL customers between July and Nov broken out by Physical and Financial The only physical customers I remember non EOL are Imperial Sugar and Texas Energy Im also checking this list against other nonEOL deals Eric or Joe might have done but for now take a look at this O
<7638038.1075862411048.JavaMail.evans@thyme>,d..winfree@enron.com,2001-11-20 09:02:41,Physical Index Positions Dec Tom Physical index positions are Carthage contracts mmbtuper day ONeal 
<26817557.1075862411071.JavaMail.evans@thyme>,d..winfree@enron.com,2001-11-20 11:21:24,FW Physical Index Positions Dec Tom Total desk physical index positions are Carthage contracts mmbtuday Tail Gate contracts mmbtuday Waha contracts mmbtuday Total desk financial positions are Elpo Perm contracts FTTexas Ship Channel contracts FTTexas Intra and FTKaty Waha contracts FTTexas Net Positions Elpo Ship Waha Tailgate Carthage All December Original Message From Winfree ONeal D Sent Tuesday November AM To Martin Thomas A Subject Physical Index Positions Dec Tom Physical index positions are Carthage contracts mmbtuper day ONeal 
<17429194.1075841228644.JavaMail.evans@thyme>,d..winfree@enron.com,2002-01-30 12:32:11,RE Heads upPST dont make me come over there Original Message From McLaughlin Jr Errol Sent Wednesday January PM To Keiser Kam Winfree ONeal D Love Phillip M Giron Darron C Palmer B Scott Subject RE Heads up fysicalll sp weapon y what are yall talking about stop confusing me Original Message From Keiser Kam Sent Wednesday January PM To Winfree ONeal D Love Phillip M Giron Darron C Palmer B Scott McLaughlin Jr Errol Subject RE Heads up Also all physical weaponX tabs are linking to an old east book I didnt touch that tab yet we dont know if were using weaponX or sasqwatch KK Original Message From Winfree ONeal D Sent Wednesday January AM To Keiser Kam Love Phillip M Giron Darron C Palmer B Scott McLaughlin Jr Errol Subject Heads up Hey Gang Just a heads up but you may need to edit your Copy Physical Macro in your PLs that are saved in the NetcoRegions folder The changes were simply renaming sheets in the Macro O
<16805612.1075841228751.JavaMail.evans@thyme>,d..winfree@enron.com,2002-01-30 09:52:36,Heads upPST Hey Gang Just a heads up but you may need to edit your Copy Physical Macro in your PLs that are saved in the NetcoRegions folder The changes were simply renaming sheets in the Macro O
<27698572.1075862643445.JavaMail.evans@thyme>,d..winfree@enron.com,2001-11-19 07:22:08,RE Missing books Cc Im not familiar with any O Original Message From Lobusch Christy Sent Monday November AM To Evans Casey Reeves Kathy Gillis Brian Loibl Kori Love Phillip M Keiser Kam McLaughlin Jr Errol Postlethwaite John Palmer B Scott Winfree ONeal D Cc Considine Keith Subject Missing books Dear all Could you all please review the attached list and see if these are any of your books or if you know anything about them If they are could you please let me know if they should be included in the new RisktRAC hierarchy We ran a comparison from the active book list that I received from you all to what is currently shown as active in RisktRAC and came up with these differences Please let me know either way if any of these are your books so that I wont harass you anymore I need a response ASAP I appreciate your help Thanks Christy File Missing books in Testxls 
<6043019.1075841229247.JavaMail.evans@thyme>,d..winfree@enron.com,2002-01-24 15:47:17,FW EOL test tradesPST The name police O Original Message From Cheung Cecilia Sent Thu PM To Engel Tom Winfree ONeal D Kenne Dawn C Severson Russ Brackett Debbie R Wallumrod Ellen Spears Christopher Price Wade R Hayden Frank Dahlke Andrea Saleem Aftab Swaim Michael Lim Christine Krishnaswamy Jayant Hunter Larry Joe Stevens Mechelle Smith Regan M Bowen Bob Cc Denny Jennifer Sweitzer Tara Meredith Kevin Lozano Melba Subject RE EOL test trades Dawn already notified us the other day about this but nobody confirmed me what to use at that time Ill change the Tagg bridge program to read OLT instead of EOL today Cecilia Original Message From Engel Tom Sent Thursday January PM To Winfree ONeal D Kenne Dawn C Severson Russ Brackett Debbie R Wallumrod Ellen Spears Christopher Price Wade R Hayden Frank Dahlke Andrea Saleem Aftab Swaim Michael Cheung Cecilia Lim Christine Krishnaswamy Jayant Hunter Larry Joe Stevens Mechelle Smith Regan M Bowen Bob Cc Denny Jennifer Sweitzer Tara Meredith Kevin Lozano Melba Subject RE EOL test trades We need to stop calling the UBS online trades EOL We also need to change the downstream systems especially the auto confirms to something other than EOL for the transaction ID or anything else I spoke to Dave Forster about this and he suggested we use OLT onlinetrade and OLT transaction number Unfortunately the new website for trading does not have an exciting name wwwubswenergycom so unlike EnronOnline it does not stand out I realize it may take some time to change everywhere in all the systems it says Enron but as you know we definitely need to do it wherever the customers are involved
<2005007.1075841239657.JavaMail.evans@thyme>,d..winfree@enron.com,2002-02-06 09:14:07,FWPST code for runM Original Message From Winfree ONeal D Sent Wednesday February AM To Cheung Cecilia Cc Winfree ONeal D Keiser Kam Subject usropenwinbinxterm ls sb display d n host T host r sl 
<2992259.1075841244202.JavaMail.evans@thyme>,d..winfree@enron.com,2002-01-02 09:26:47,RE new books Cc PST Are we going to begin with a Trader Matrix or master list of traders and what responsibilities will include Original Message From Keiser Kam Sent Wednesday January AM To Love Phillip M Palmer B Scott Winfree ONeal D McLaughlin Jr Errol Cc Gossett Jeffrey C Subject new books Have you started to set up any new books for NetCo yet Do you guys think we should all use the same book and portfolio codes this time to make minibooks easier Also I think we should have some consistency in book names make them more descriptive any other suggestions KK
<22120589.1075841246246.JavaMail.evans@thyme>,d..winfree@enron.com,2001-11-27 12:39:15,FW DKR monetizationPST and this Original Message From Dawson Sherry Sent Tuesday November AM To Winfree ONeal D Subject FW DKR monetization Oneal pls call me at Thanks Sherry Original Message From Dyk Russell Sent Wednesday November AM To Dawson Sherry Cc Zivic Robyn Subject DKR monetization Sherry As you can see from the attached all but of AIGs combined position is natural gas related Give me a call if you have any other questions Have a great Thanksgiving Rgds Russ
<31194458.1075841246273.JavaMail.evans@thyme>,d..winfree@enron.com,2001-11-27 12:38:35,FW AIG Deal NumbersPST Do we need to do anything with this Original Message From Dawson Sherry Sent Tuesday November AM To Winfree ONeal D Subject FW AIG Deal Numbers Oneal below is a list of trades that have been unwound pRussel Dyk Russells ph is Thanks Original Message From Dyk Russell Sent Wednesday November AM To Dawson Sherry Cc Zivic Robyn Subject AIG Deal Numbers Deal Numbers by trade are on the individual tabs
<5262695.1075841240765.JavaMail.evans@thyme>,d..winfree@enron.com,2002-02-04 06:52:35,FW UPDATE FW Key PointsPST The messages below can better explain whats going on IT wise O Original Message From Qavi Faheem SentMonday February AM ToWinfree ONeal D SubjectFW UPDATE FW Key Points ImportanceHigh Oneal Looks like they did not migrate the accounts over the weekend We can t ry again tomorrow to migrate the Netco directory over to the Netco environm ent Thanks Faheem A Qavi Enron Net Works IT Security Controls Faheem nronCom Original Message From Martinez Bob SentSaturday February PM ToAdamik Darren Andrews Stephen Ballmer Charles Barber Michael Behney Chris Beyer Troy Bode Gary Brennan Ryan Burgess Simon Cast rejana Pete Cheng John Coles Frank Cox Paige Croucher Jr Mike De leon Roberto Dietrich Dan Harrelson Mike James Matthew Jameson Lan ce Kachinski Joe Larkin Brian Le Rick Link Kathy Marcinkowski Dan ielle Matson Randy McNair Darren Qavi Faheem Ray Edward Setliff J ohn Shishido Scott Smith Bruce Staggs Micah Stevens Wilford Thelen Todd Van Arsdall Leah CcCochinwala Mustafa Bucknell Martin Dopson LaMetrice Dziadek Ke ith Gubser Marlin McAuliffe Bob SubjectFW UPDATE FW Key Points ImportanceHigh fyi Just in case you are not on the distribution list Bob Original Message From Henry Jane Hilburn SentFriday February PM ToStock Steve Johnson Jeff Schomer Chris Smith Regan M Ballmer Charles Larkin Brian Newland William Patel Piyush Ward Bob Brewe r Charles Tang Mable Charbonnet Clement Matson Randy Nat Steve No mmensen Dave Merrell Brad Ogden Arlene Chitradurga Sundar Jia Wins ton Luu Duong Poston David Powell John D Ramesh Ganapathy Rao Ra mesh Warner John Wei Zhiyong Dolan Michael Barber Michael Gubser Marlin Dziadek Keith Sanborn Brandee Sanvido Terry Constantine Chri s Pua Cornelio Wang N Jessie Simpson Stephen Hall Rich Cheng Joh n Shishido Scott Saleem Aftab Krishnaswamy Jayant Brennan Ryan Pul licino Marcus Schmidt Mark Renaud Todd McNair Darren Qavi Faheem Deleon Roberto Beyer Troy James Matthew Martinez Bob Yanowski Tomm y J Conley Tom Cinelli Steve McKeel Richard Harmon Kenneth M Ste vens Wilford Smith Bruce Fortney Bill Wong Jeremy Lim Francis S Yang Sean Dronet David Bharathi Jaikishore Sugrue Jim Setliff John Pena Matt Clark Cynthia DSouza Romeo Ray Edward Burchfield Rich ard McAuliffe Bob Forster David Webb Jay Rub Jenny Cc Meinel UBS Matt SubjectUPDATE FW Key Points ImportanceHigh Legal was unable to produce the document needed for the data moves today Looks like they are pushing for Monday therefore IT Infrastructure will n ot be converting the NetCo accounts over the weekend The new estimated delivery for logins will be Monday night sometime We ca n discuss this issue in further detail at Mondays Jane Original Message From Henry Jane Hilburn SentFriday February PM ToStock Steve Johnson Jeff Schomer Chris Smith Regan M Ballmer Charles Larkin Brian Newland William Patel Piyush Ward Bob Brewe r Charles Tang Mable Charbonnet Clement Matson Randy Nat Steve No mmensen Dave Merrell Brad Ogden Arlene Chitradurga Sundar Jia Wins ton Luu Duong Poston David Powell John D Ramesh Ganapathy Rao Ra mesh Warner John Wei Zhiyong Dolan Michael Barber Michael Gubser Marlin Dziadek Keith Sanborn Brandee Sanvido Terry Constantine Chri s Pua Cornelio Wang N Jessie Simpson Stephen Hall Rich Cheng Joh n Shishido Scott Saleem Aftab Krishnaswamy Jayant Brennan Ryan Pul licino Marcus Schmidt Mark Renaud Todd McNair Darren Qavi Faheem Deleon Roberto Beyer Troy James Matthew Martinez Bob Yanowski Tomm y J Conley Tom Cinelli Steve McKeel Richard Harmon Kenneth M Ste vens Wilford Smith Bruce Fortney Bill Wong Jeremy Lim Francis S Yang Sean Dronet David Bharathi Jaikishore Sugrue Jim Setliff John Pena Matt Clark Cynthia DSouza Romeo Ray Edward Burchfield Rich ard McAuliffe Bob Forster David Webb Jay Rub Jenny Cc Meinel UBS Matt Subject Key Points Reminders Status are due at under OInfoTechDevelopment SupportUBS Integration TeamYOUR TEAMS WORKING FOLDERStatus Reports Review open issues under OInfoTechDevelopment SupportUBS Integration TeamIT Integration Man agementUBSIntegrationPMWorkingDocVxls Announcements EOL identifier will be changed to ETX HR and Security working on Dual Access issue with Legal A posting to how you will be handling your mail common drives etc to be posted today NetCo employees to be churning to ECS today and through next week The ir phones will be inactive in ECN this coming Monday New Issues Database refreshes for Curves Meeting to be handled by Mable Tang 
<25261171.1075841241203.JavaMail.evans@thyme>,d..winfree@enron.com,2002-01-31 07:16:01,FW Policy on migration of data to Netco Cc PST Original Message From Smith Regan M Sent Thursday January AM To Winfree ONeal D Subject FW Policy on migration of data to Netco The following guidelines should be followed in determining the kind of application data and databases that should be migrated to UBS As a general rule all Enron data relating to or used in connection with the trading of North American Gas and Power Netcos commodities should be copied and the copy transferred to Netco This includes forward curves created in the past and data on commodities that are relevant to the pricing of Netcos commodities ie coal and oil Data on other commodities should not be copied or transferred for Netco In all cases a complete copy of the data transferred to Netco must be retained by Enron There are three important exceptions to the general rule a With respect to trading counterparties only contact information and Enron created trading profiles may be transferred to Netco All other information concerning a trading counterparty including credit information historical trading data and terms of trading contracts with Enron may not be transferred without the express written consent of the trading counterparty and the approval of the legal department b With respect to other third parties that have entered into written agreements with Enron such as brokers software vendors and market data vendors only contact information may be transferred to Netco All other information including pricing concerning the contractual relationship between Enron and the third party may not be transferred without the approval of the legal department In many cases there are confidentiality provisions in these agreements requiring the consent of the third party prior to the disclosure of confidential information c Historical data provided to Enron by a third party data source may not be transferred to Netco without the approval of the legal department In many cases the contracts governing the data preclude its copying and transfer If you have any questions concerning these guidelines please contact Regan Smith at x
<3869465.1075841241298.JavaMail.evans@thyme>,d..winfree@enron.com,2002-01-30 16:23:26,New Corp LoginPST Question for NetCo employees The new corp ids xfer to UBS is being considered for this Sunday Hence no start menu access to estate You will still have access to NT estate drive data to copy Does anyone have the need to retain a estate id for support estate application during the last week Exceptions have to be authorized Wanted to get a preliminary need analysis This was sent by an IT manager let me know your thoughts O
