Message_id,From,Time_stamp,Text
<25941638.1075840427753.JavaMail.evans@thyme>,d..winfree@enron.com,2001-12-19 10:19:07,FW Customer listpst This one includes more financial counterparties noneol Original Message From Winfree ONeal D Sent Wednesday December AM To Martin Thomas A Subject Customer list Tom Attached are EOL customers between July and Nov broken out by Physical and Financial The only physical customers I remember non EOL are Imperial Sugar and Texas Energy Im also checking this list against other nonEOL deals Eric or Joe might have done but for now take a look at this O
<18419798.1075840427384.JavaMail.evans@thyme>,d..winfree@enron.com,2002-01-07 13:39:12,RE Physical Curve MappingsSitarapst I would much rather add the Thompsonville now O Original Message From Farmer Daren J Sent Monday January PM To Winfree ONeal D Subject RE Physical Curve MappingsSitara OW I went through the list on the sort by pipe and highlighted the curvesmapping we can delete yellow and those we can change orange The only curves we will have left are Katy Waha HSC Agua Dulce and Thompsonville I expect to be using Thompsonville in months to a year If it easier or cleaner to delete that curve and add it when we need it that will be fine Let me know if you have any questions File CurveMappingTexasdfxls D Original Message From Winfree ONeal D Sent Monday January PM To Farmer Daren J Baumbach David Olsen Michael Cc Martin Thomas A Subject Physical Curve MappingsSitara Hey Gang Attached are the physical curve mappings as provided by Russ Severson Please take a peek and let us know if we need to change adddelete update any pointsmappings going forward in a Netco environment For instance I would like to change Texoma to Carthage on the curve mappings Also I would like to delete all derived curves leaving only Carthage KatyTailgate and Agua Dulce The other physical locations would be ShipChannel Waha and Katy nontailgate Let me know your thoughts ONeal File CurveMappingTexasxls 
<3752202.1075840427432.JavaMail.evans@thyme>,d..winfree@enron.com,2002-01-07 10:55:23,Physical Curve MappingsSitara Cc Hey Gang Attached are the physical curve mappings as provided by Russ Severson Please take a peek and let us know if we need to change adddelete update any pointsmappings going forward in a Netco environment For instance I would like to change Texoma to Carthage on the curve mappings Also I would like to delete all derived curves leaving only Carthage KatyTailgate and Agua Dulce The other physical locations would be ShipChannel Waha and Katy nontailgate Let me know your thoughts ONeal 
<2041959.1075840430945.JavaMail.evans@thyme>,d..winfree@enron.com,2001-05-15 06:38:40,RE New Carthage Phys Product for EOL Cc For the EOL location Carthage Hub the information is as follows pipe ETXG East Texas Gas Systems zone East Texas Gas Systems facility Easttrans Carthage Hub ONeal Original Message From Dawn C Kenne Sent Monday May PM To ONeal D Winfree Cc Tara Sweitzer Melba Lozano Subject FW New Carthage Phys Product for EOL ONeal Any word on this yet Dawn Original Message From Kenne Dawn C Sent Friday May PM To Winfree ONeal Cc Sweitzer Tara Subject FW New Carthage Phys Product for EOL Can you please provide the pipe zone and facility for the EOL location listed below requested by Eric Bass Thanks Dawn Original Message From Lozano Melba Sent Thursday May PM To Sweitzer Tara Kenne Dawn C Cc Cass Robert B Walker Chris Meredith Kevin Subject FW New Carthage Phys Product for EOL Please map the following Location in TEST Carthage The transaction is for delivery at the tailgate of the Carthage Hub Trader Eric Bass Thanks Melba Original Message From Bass Eric Sent Thursday May AM To Lozano Melba Subject RE New Carthage Phys Product for EOL Carthage Thanks Eric Original Message From Lozano Melba Sent Thursday May AM To Bass Eric Subject FW New Carthage Phys Product for EOL what do you want to call this product Let me know Thanks Melba Original Message From Cass Robert B Sent Thursday May AM To Lozano Melba Subject FW New Carthage Phys Product for EOL Original Message From Bass Eric Sent Wednesday May PM To Cass Robert B Cc Farmer Daren J Subject New Carthage Phys Product for EOL Hey Rob The Texas desk needs to create a new product that is similar to the Exxon Katy Phys product The product will be identical to the Exxon Katy product except for the location This product should be for delivery at the tailgate of the Carthage Hub Please call with questions Thanks Eric x
<27590157.1075845125571.JavaMail.evans@thyme>,d..winfree@enron.com,2001-06-04 11:16:10,FTWaha CurveshiftJpst Daren Brain fart on my part You were long contracts index during bidweek so your index trueup should be contracts by You are now buying less expensive index gas index gas now worth vs prior which gives you the benefit Add to that the weekend trueup of which gives you another Take away your physical new deals of K and you are left with the K pl ONeal
<418796.1075840434581.JavaMail.evans@thyme>,d..winfree@enron.com,2001-06-28 08:34:09,RE TXU Fuel deals Imbalancespst Im not sure this request is coming from Settlements O Original Message From Farmer Daren J Sent Thursday June AM To Winfree ONeal D Subject RE TXU Fuel deals Imbalances OW Was this passed through Janet Wallis D Original Message From Winfree ONeal D Sent Thursday June AM To Farmer Daren J Subject FW TXU Fuel deals Imbalances Daren The deals listed below are related to TUFCO imbalances Let me know if you have any objections to me entering the deals ONeal Original Message From Griffin Rebecca Sent Thursday June AM To Winfree ONeal D Subject TXU Fuel deals As my voice mail said could you add deals for the following Date Location PGEVFor Tufco Volume mmbtu Price This should be entered as a purchase with Enron as buyer Date Location PGEVFor Tufco Volume mmbtu Price This should be entered as a sale with Enron as seller Date Location PGEVFor Tufco Volume mmbtu Price This should be entered as a purchase with Enron as buyer This is related to the TXU Fuel Wagner Brown contract Please let me know if you have any questions Thanks Rebecca 
<5974496.1075840432549.JavaMail.evans@thyme>,d..winfree@enron.com,2001-10-31 12:50:34,RE TGLO Statuspst Sorry bout the first comment did not totally understand We will handle this via the OA process where Im working with the OA group that will allow us a bucket of income or loss and we will run this through Toms PL This will be a pass through for Toms book O Original Message From Farmer Daren J Sent Wednesday October PM To Winfree ONeal D Subject FW TGLO Status OW What do you think about the orig deduct How do we usually handle orig on something like this D Original Message From East Laynie Sent Tuesday October AM To Coffey Jr Jim Parker Megan Boyt Eric Farmer Daren J Cc Bryan Gary Pond Jim Helton Susan Roberts Linda Subject RE TGLO Status Cost centers and are rolling to Texas Gas Trading Original Message From Coffey Jr Jim Sent Tuesday October AM To Parker Megan Boyt Eric Farmer Daren J Cc Bryan Gary Pond Jim Helton Susan East Laynie Roberts Linda Subject RE TGLO Status Megan As I mentioned to you yesterday it still looks like the volumes for gas delivered to TX GLO do not have Linda Roberts origination fee deducted Do we need to execute a PMA with TXGLO to deduct those volumes from the next delievery Also isnt there an entry that is missing in your file to capture the cost of gas for the gas delivered to TXGLO Is that being captured in Unify or is it being manually entered by Gas Accounting Darren Do we need to execute a seperate deal ticket for the origination deduct SusanLaynie What busines unit are these cost centers rolling up to File TGLO GL Account Detailxls Original Message From Parker Megan Sent Tuesday October AM To Boyt Eric Cc Newman Frank G Coffey Jr Jim Subject TGLO Status Eric I reviewed the gas deals on Franks spreadsheet and they agree with what is in Sitara As soon as I have the October gas numbers I will forward them to you Attached is a spreadsheet of the TGLO deals booked to the GL to help you with our current settlement position It is divided by debitcredit entries When the sales are booked a debit hits the customer account to create the open sale to apply the cash to and a credit hits the revenue account third party intercompany for the profit center Below is a summary of where we are on the sale dollars to EGM I have already sent an email to risk to update the demand fees for the prior months and to book Aug and Sept crude I will wait for the go ahead from Frank before I final them to the GL Let me know if you have any questions Megan Status of Sales to EGM Cleared invoices Open Invoices To be booked File TGLO GL Account Detailxls 
<539209.1075852215007.JavaMail.evans@thyme>,d..winfree@enron.com,2001-06-28 08:18:26,FW TXU Fuel deals ImbalancesDaren The deals listed below are related to TUFCO imbalances Let me know if you have any objections to me entering the deals ONeal Original Message From Griffin Rebecca Sent Thursday June AM To Winfree ONeal D Subject TXU Fuel deals As my voice mail said could you add deals for the following Date Location PGEVFor Tufco Volume mmbtu Price This should be entered as a purchase with Enron as buyer Date Location PGEVFor Tufco Volume mmbtu Price This should be entered as a sale with Enron as seller Date Location PGEVFor Tufco Volume mmbtu Price This should be entered as a purchase with Enron as buyer This is related to the TXU Fuel Wagner Brown contract Please let me know if you have any questions Thanks Rebecca 
<28120894.1075840441019.JavaMail.evans@thyme>,d..winfree@enron.com,2001-06-21 14:27:52,TRV Notification WAHA pst The report named WAHA linkFromExcelaspreportcdreportnameWAHAcategorycdcategorynameTEXAStochidesTVTVExpYcurrentefctdate published as of is now available for viewing on the website
<7696990.1075840549565.JavaMail.evans@thyme>,d..winfree@enron.com,2002-02-01 11:09:03,RE UBS SAP LoginPST Dont think I need O Original Message From Valdes John Sent Friday February PM To Keiser Kam Giron Darron C Gossett Jeffrey C Love Phillip M Winfree ONeal D Palmer B Scott Subject UBS SAP Login We are setting up SAP for the new UBS signon Do any of you guys need to have SAP Let me know by the end of the day so we can set up If there is anyone in your group please let me know about them as well Thanks John
<23435461.1075840550183.JavaMail.evans@thyme>,d..winfree@enron.com,2002-01-30 12:32:11,RE Heads upPST dont make me come over there Original Message From McLaughlin Jr Errol Sent Wednesday January PM To Keiser Kam Winfree ONeal D Love Phillip M Giron Darron C Palmer B Scott Subject RE Heads up fysicalll sp weapon y what are yall talking about stop confusing me Original Message From Keiser Kam Sent Wednesday January PM To Winfree ONeal D Love Phillip M Giron Darron C Palmer B Scott McLaughlin Jr Errol Subject RE Heads up Also all physical weaponX tabs are linking to an old east book I didnt touch that tab yet we dont know if were using weaponX or sasqwatch KK Original Message From Winfree ONeal D Sent Wednesday January AM To Keiser Kam Love Phillip M Giron Darron C Palmer B Scott McLaughlin Jr Errol Subject Heads up Hey Gang Just a heads up but you may need to edit your Copy Physical Macro in your PLs that are saved in the NetcoRegions folder The changes were simply renaming sheets in the Macro O
<22153734.1075840551321.JavaMail.evans@thyme>,d..winfree@enron.com,2002-01-17 10:48:24,Directions revisitedPST Original Message From Winfree ONeal D Sent Friday January PM To Love Phillip M Subject Phil Let me know if this is ok Gentlemen What Lets play poker Where The land of Pears When Thursday January th between pm Directions No key map so here goes South please find from Downtown Exit McHardShadow Creek hint its the first exit after the Beltway Take a left onto McHard and proceed to the end of McHard There will be a Conoco at the first Stop sign the next stop sign will say Country Place Proceed to the third stop Sign and take a left to The Lakes of Country Place Go to the Gurards gate You will visit Starleaf Go thru the gate and Take a left on River Birch drive Starleaf will be the rd street on the right My house is the th house on the left in the cul de sac address Starleaf Pearland Tx phone cell O
<23551344.1075840554498.JavaMail.evans@thyme>,d..winfree@enron.com,2002-02-04 06:52:35,FW UPDATE FW Key PointsPST The messages below can better explain whats going on IT wise O Original Message From Qavi Faheem SentMonday February AM ToWinfree ONeal D SubjectFW UPDATE FW Key Points ImportanceHigh Oneal Looks like they did not migrate the accounts over the weekend We can t ry again tomorrow to migrate the Netco directory over to the Netco environm ent Thanks Faheem A Qavi Enron Net Works IT Security Controls Faheem nronCom Original Message From Martinez Bob SentSaturday February PM ToAdamik Darren Andrews Stephen Ballmer Charles Barber Michael Behney Chris Beyer Troy Bode Gary Brennan Ryan Burgess Simon Cast rejana Pete Cheng John Coles Frank Cox Paige Croucher Jr Mike De leon Roberto Dietrich Dan Harrelson Mike James Matthew Jameson Lan ce Kachinski Joe Larkin Brian Le Rick Link Kathy Marcinkowski Dan ielle Matson Randy McNair Darren Qavi Faheem Ray Edward Setliff J ohn Shishido Scott Smith Bruce Staggs Micah Stevens Wilford Thelen Todd Van Arsdall Leah CcCochinwala Mustafa Bucknell Martin Dopson LaMetrice Dziadek Ke ith Gubser Marlin McAuliffe Bob SubjectFW UPDATE FW Key Points ImportanceHigh fyi Just in case you are not on the distribution list Bob Original Message From Henry Jane Hilburn SentFriday February PM ToStock Steve Johnson Jeff Schomer Chris Smith Regan M Ballmer Charles Larkin Brian Newland William Patel Piyush Ward Bob Brewe r Charles Tang Mable Charbonnet Clement Matson Randy Nat Steve No mmensen Dave Merrell Brad Ogden Arlene Chitradurga Sundar Jia Wins ton Luu Duong Poston David Powell John D Ramesh Ganapathy Rao Ra mesh Warner John Wei Zhiyong Dolan Michael Barber Michael Gubser Marlin Dziadek Keith Sanborn Brandee Sanvido Terry Constantine Chri s Pua Cornelio Wang N Jessie Simpson Stephen Hall Rich Cheng Joh n Shishido Scott Saleem Aftab Krishnaswamy Jayant Brennan Ryan Pul licino Marcus Schmidt Mark Renaud Todd McNair Darren Qavi Faheem Deleon Roberto Beyer Troy James Matthew Martinez Bob Yanowski Tomm y J Conley Tom Cinelli Steve McKeel Richard Harmon Kenneth M Ste vens Wilford Smith Bruce Fortney Bill Wong Jeremy Lim Francis S Yang Sean Dronet David Bharathi Jaikishore Sugrue Jim Setliff John Pena Matt Clark Cynthia DSouza Romeo Ray Edward Burchfield Rich ard McAuliffe Bob Forster David Webb Jay Rub Jenny Cc Meinel UBS Matt SubjectUPDATE FW Key Points ImportanceHigh Legal was unable to produce the document needed for the data moves today Looks like they are pushing for Monday therefore IT Infrastructure will n ot be converting the NetCo accounts over the weekend The new estimated delivery for logins will be Monday night sometime We ca n discuss this issue in further detail at Mondays Jane Original Message From Henry Jane Hilburn SentFriday February PM ToStock Steve Johnson Jeff Schomer Chris Smith Regan M Ballmer Charles Larkin Brian Newland William Patel Piyush Ward Bob Brewe r Charles Tang Mable Charbonnet Clement Matson Randy Nat Steve No mmensen Dave Merrell Brad Ogden Arlene Chitradurga Sundar Jia Wins ton Luu Duong Poston David Powell John D Ramesh Ganapathy Rao Ra mesh Warner John Wei Zhiyong Dolan Michael Barber Michael Gubser Marlin Dziadek Keith Sanborn Brandee Sanvido Terry Constantine Chri s Pua Cornelio Wang N Jessie Simpson Stephen Hall Rich Cheng Joh n Shishido Scott Saleem Aftab Krishnaswamy Jayant Brennan Ryan Pul licino Marcus Schmidt Mark Renaud Todd McNair Darren Qavi Faheem Deleon Roberto Beyer Troy James Matthew Martinez Bob Yanowski Tomm y J Conley Tom Cinelli Steve McKeel Richard Harmon Kenneth M Ste vens Wilford Smith Bruce Fortney Bill Wong Jeremy Lim Francis S Yang Sean Dronet David Bharathi Jaikishore Sugrue Jim Setliff John Pena Matt Clark Cynthia DSouza Romeo Ray Edward Burchfield Rich ard McAuliffe Bob Forster David Webb Jay Rub Jenny Cc Meinel UBS Matt Subject Key Points Reminders Status are due at under OInfoTechDevelopment SupportUBS Integration TeamYOUR TEAMS WORKING FOLDERStatus Reports Review open issues under OInfoTechDevelopment SupportUBS Integration TeamIT Integration Man agementUBSIntegrationPMWorkingDocVxls Announcements EOL identifier will be changed to ETX HR and Security working on Dual Access issue with Legal A posting to how you will be handling your mail common drives etc to be posted today NetCo employees to be churning to ECS today and through next week The ir phones will be inactive in ECN this coming Monday New Issues Database refreshes for Curves Meeting to be handled by Mable Tang 
<17671143.1075840554875.JavaMail.evans@thyme>,d..winfree@enron.com,2002-01-31 07:16:01,FW Policy on migration of data to Netco Cc PST Original Message From Smith Regan M Sent Thursday January AM To Winfree ONeal D Subject FW Policy on migration of data to Netco The following guidelines should be followed in determining the kind of application data and databases that should be migrated to UBS As a general rule all Enron data relating to or used in connection with the trading of North American Gas and Power Netcos commodities should be copied and the copy transferred to Netco This includes forward curves created in the past and data on commodities that are relevant to the pricing of Netcos commodities ie coal and oil Data on other commodities should not be copied or transferred for Netco In all cases a complete copy of the data transferred to Netco must be retained by Enron There are three important exceptions to the general rule a With respect to trading counterparties only contact information and Enron created trading profiles may be transferred to Netco All other information concerning a trading counterparty including credit information historical trading data and terms of trading contracts with Enron may not be transferred without the express written consent of the trading counterparty and the approval of the legal department b With respect to other third parties that have entered into written agreements with Enron such as brokers software vendors and market data vendors only contact information may be transferred to Netco All other information including pricing concerning the contractual relationship between Enron and the third party may not be transferred without the approval of the legal department In many cases there are confidentiality provisions in these agreements requiring the consent of the third party prior to the disclosure of confidential information c Historical data provided to Enron by a third party data source may not be transferred to Netco without the approval of the legal department In many cases the contracts governing the data preclude its copying and transfer If you have any questions concerning these guidelines please contact Regan Smith at x
<24829984.1075840554971.JavaMail.evans@thyme>,d..winfree@enron.com,2002-01-30 16:23:26,New Corp LoginPST Question for NetCo employees The new corp ids xfer to UBS is being considered for this Sunday Hence no start menu access to estate You will still have access to NT estate drive data to copy Does anyone have the need to retain a estate id for support estate application during the last week Exceptions have to be authorized Wanted to get a preliminary need analysis This was sent by an IT manager let me know your thoughts O
<12115732.1075840555091.JavaMail.evans@thyme>,d..winfree@enron.com,2002-01-30 09:52:36,Heads upPST Hey Gang Just a heads up but you may need to edit your Copy Physical Macro in your PLs that are saved in the NetcoRegions folder The changes were simply renaming sheets in the Macro O
<32927169.1075840555420.JavaMail.evans@thyme>,d..winfree@enron.com,2002-01-28 11:54:22,RE EOL productsPST Texas is good O Original Message From Keiser Kam Sent Monday January PM To Love Phillip M Winfree ONeal D Palmer B Scott Giron Darron C Subject EOL products Now that we know which traders will be moving over or we should we need to make a second pass at the EOL product list Can you confirm with your desk heads that the list of names we have is correct and then update the product mappings by tomorrow afternoon OermsermsadmnetcocontrolsTraderBook template US GasEOL new booksxls Thanks KK
