Message_id,From,Time_stamp,Text
<9739709.1075862364990.JavaMail.evans@thyme>,david.shine@ubspainewebber.com,2001-11-21 06:20:14,Enron Benefits StatementSteve please have your admin make x copies of the various sections of your benefits statement and fax it to me I will look through it for possible scenarios Regards David Original Message From Kean Steven J mailto Sent Tuesday November PM To Subject Thanks for the information It looks like I have a sizable additional tax bill Am I missing something Do I have Enron stock I can sell to offset these gains eg in my savings plan matching Other ideas This email is the property of Enron Corp andor its relevant affiliate and may contain confidential and privileged material for the sole use of the intended recipient s Any review use distribution or disclosure by others is strictly prohibited If you are not the intended recipient or authorized to receive for the recipient please contact the sender or reply to Enron Corp at and delete all copies of the message This email and any attachments hereto are not intended to be an offer or an acceptance and do not create or evidence a binding and enforceable contract between Enron Corp or any of its affiliates and the intended recipient or any other party and may not be relied on by anyone as the basis of a contract by estoppel or otherwise Thank you 
<24530958.1075862323069.JavaMail.evans@thyme>,david.shine@ubspainewebber.com,2001-11-19 14:29:51,Short Term BondsNeal Short Bonds Exexls David L Shine Vice PresidentInvestments UBS PaineWebber Bagby Suite Houston Texas Direct Toll Free Fax OLEObj Notice Regarding Entry of Orders and Instructions Please do not transmit orders andor instructions regarding your UBSPaineWebber accounts by email Orders andor instructions transmitted by email will not be accepted by UBSPaineWebber and UBSPaineWebber will not be responsible for carrying out such orders andor instructions Notice Regarding Privacy and Confidentiality UBSPaineWebber reserves the right to monitor and review the content of all email communications sent andor received by its employees Neal Short Bonds Exexls
<6896295.1075858828842.JavaMail.evans@thyme>,david.shine@ubspainewebber.com,2001-10-19 10:11:15,Order ExecutionsBot Puts ENE Jan closing order Bot Puts ENE Jan closing order Sold Calls ENE April opening order Have a great weekend David L Shine Vice PresidentInvestments UBS PaineWebber Bagby Suite Houston Texas Direct Toll Free Fax OLEObj Notice Regarding Entry of Orders and Instructions Please do not transmit orders andor instructions regarding your UBSPaineWebber accounts by email Orders andor instructions transmitted by email will not be accepted by UBSPaineWebber and UBSPaineWebber will not be responsible for carrying out such orders andor instructions Notice Regarding Privacy and Confidentiality UBSPaineWebber reserves the right to monitor and review the content of all email communications sent andor received by its employees
<22118860.1075862194308.JavaMail.evans@thyme>,david.shine@ubspainewebber.com,2001-11-27 16:47:50,Equity Rebalancing Cc If we sell all of the following mutual funds in HME Munder Money Market Munder Net Net MFS Emerging Growth Pimco Growth Putman Voyager That should bring available cash for equities to We can open a new managed account with a Large Cap Value manager NWQ and fund it with We can add to HME bringing the account balance to appx and replace the manager with Newbridge a different large cap growth We can add the remaining to HME bringing the account balance to appx and replace the manager with Fayez a different core manager After all the dust settles the accounts should look like Fayez Core SP Newbridge Large Cap Growth NWQ Large Cap Value We will drop the documents of at the front desk on Wednesday Regards David L Shine Vice PresidentInvestments UBS PaineWebber Bagby Suite Houston Texas Direct Toll Free Fax OLEObj Notice Regarding Entry of Orders and Instructions Please do not transmit orders andor instructions regarding your UBSPaineWebber accounts by email Orders andor instructions transmitted by email will not be accepted by UBSPaineWebber and UBSPaineWebber will not be responsible for carrying out such orders andor instructions Notice Regarding Privacy and Confidentiality UBSPaineWebber reserves the right to monitor and review the content of all email communications sent andor received by its employees
<16167596.1075863366790.JavaMail.evans@thyme>,david.shine@ubspainewebber.com,2001-08-15 18:23:31,ENRON Comments on Skilling Departure Lowering month Target to ShareThe enclosed research report is being sent to you from UBS PaineWebber Inc by David Shine or Please contact your Financial Advisor directly if you have any questions or would like to discuss this material The information contained in the attached research report is believed to be reliable but its accuracy is not guaranteed UBS PaineWebber Inc affiliated companies andor their officers directors employees or stockholders may at times have a position including an arbitrage position in the securities described herein and may sell or buy them to or from customers These companies may from time to time act as a consultant to a company being reported upon You will need the Adobe Acrobat Reader to view this document If you dont already have it just click on this link prodindexacrobatreadstephtml and follow the onscreen instructions The Acrobat Reader is free of charge
<16052543.1075858701090.JavaMail.evans@thyme>,david.shine@ubspainewebber.com,2001-07-30 13:16:39, PlansReminder Child Name Date of Birth Social Security Thanks David L Shine Vice PresidentInvestments UBS PaineWebber Bagby Suite Houston Texas Direct Toll Free Fax Notice Regarding Entry of Orders and Instructions Please do not transmit orders andor instructions regarding your UBS PaineWebber accounts by email Orders andor instructions transmitted by email will not be accepted by UBS PaineWebber and UBS PaineWebber will not be responsible for carrying out such orders andor instructions Notice Regarding Privacy and Confidentiality UBS PaineWebber reserves the right to monitor and review the content of all email communications sent andor received by its employees
