Message_id,From,Time_stamp,Text
<19143766.1075845228339.JavaMail.evans@thyme>,dtencellent@prebon.com,2001-05-23 10:19:26,FW prebonene dinnerHpst From Donald Tencellent Jr Sent Wednesday May PM To Cc Donald Tencellent Jr Subject prebonene dinner hi guysi know that over the past few weeks i have been asking you guys if you could come out to a prebonene dinner on next thursday may st at a site tbdthe day is about a week away now and i hope that we can all still hang outim emailing you guys to see who is still in or if there are any flakes as the date grows closeradditionallywhere would you guys like to goany place new in houston that we need to check out just let me know so i can make the plans and if i left anybody out who wants to go sneal griggs martin huntman frank the more the better as far as im concernedthanks donny 
<30026781.1075845286111.JavaMail.evans@thyme>,dtencellent@prebon.com,2001-05-23 10:12:16,RE prebonene dinneri hate stuffyi guarantee fletch will want trulucks or papas or something like thatwell figure it out im looking frwd to meeting youthanks for the timely response From SMTP Sent Wednesday May PM To Donald Tencellent Jr Subject RE prebonene dinner Im in and as far as im concerned the more laid back of a place the betterive been to a lot of stuffy restaurants as of latebut seriously i am flexible if we go stuffy just let me know when and where Original Message From Donald Tencellent Jr ENRON mailtoIMCEANOTESDonaldTencellentJrECDTencellentpr ebonEcomE NRONcom Sent Wednesday May AM To Holst Keith Cc Donald Tencellent Jr Subject prebonene dinner hi guysi know that over the past few weeks i have been asking you guys if you could come out to a prebonene dinner on next thursday may st at a site tbdthe day is about a week away now and i hope that we can all still hang outim emailing you guys to see who is still in or if there are any flakes as the date grows closeradditionallywhere would you guys like to goany place new in houston that we need to check out just let me know so i can make the plans and if i left anybody out who wants to go sneal griggs martin huntman frank the more the better as far as im concernedthanks donny 
<1452009.1075845286135.JavaMail.evans@thyme>,dtencellent@prebon.com,2001-05-23 09:43:56,prebonene dinner Cc guysi know that over the past few weeks i have been asking you guys if you could come out to a prebonene dinner on next thursday may st at a site tbdthe day is about a week away now and i hope that we can all still hang outim emailing you guys to see who is still in or if there are any flakes as the date grows closeradditionallywhere would you guys like to goany place new in houston that we need to check out just let me know so i can make the plans and if i left anybody out who wants to go sneal griggs martin huntman frank the more the better as far as im concernedthanks donny
<22111163.1075845345203.JavaMail.evans@thyme>,dtencellent@prebon.com,2001-05-23 10:22:59,FW prebonene dinner From Donald Tencellent Jr Sent Wednesday May PM To Cc Donald Tencellent Jr Subject prebonene dinner hi guysi know that over the past few weeks i have been asking you guys if you could come out to a prebonene dinner on next thursday may st at a site tbdthe day is about a week away now and i hope that we can all still hang outim emailing you guys to see who is still in or if there are any flakes as the date grows closeradditionallywhere would you guys like to goany place new in houston that we need to check out just let me know so i can make the plans and if i left anybody out who wants to go sneal griggs martin huntman frank the more the better as far as im concernedthanks donny 
<32507030.1075852317071.JavaMail.evans@thyme>,dtencellent@prebon.com,2001-10-23 10:05:24,stori have tried to call you numerous times on the out but have been unsuccessfulmy comms dept tells me our direct has been fixed just need to coordinate w you putting her back onlineany love left for your long lost broker armaniill wait o here from youthxdonny
