Message_id,From,Time_stamp,Text
<10181741.1075844138548.JavaMail.evans@thyme>,ets.announcement@enron.com,2001-01-12 04:47:00,Omaha IT Announcement Cc you were missed yesterday in the distrubution list for this announcement message I have made the adjustments to my email lists Thanks Jean From Jean McFarland on PM Sent by ETS General Announcement To Omaha Office All Employees Sue NevilleET NRON Morgan GottsponerET NRON Theresa BranneyET nron Kay ThreetET NRON Reyna CabreraET nron Martha JanousekET NRON Kimberly WatsonET NRON Sean BolksET NRON Jim WiltfongET NRON Vernon MercaldoET NRON Pilar RamirezET NRON Craig BuehlerET NRON Stephen HerberET NRON Bob BurlesonET NRON Steve WellerET NRON Penny McCarranET NRON Linda WehringET NRON Frank SeminET NRON Bob StevensET NRON Lisa ValleyET NRON Lee FerrellET nron Michael G StageET NRON cc Steve NRON Bob nronXGate Tony MayerET NRON Lisa SawyerET NRON Nick nronXGate Michael NRON m Jim nron Mark nronXGate Subject Omaha IT Announcement To Omaha Office From Bill Cordes Dave Neubauer and Steve Hotte Subject Omaha Helpdesk Consolidation We are pleased to announce that effective immediately we are consolidating the two Omaha Infrastructure teams into one team that supports Enrons T wo Pacific Place office building in Omaha We believe this consolidation will provide all Enron employees in Omaha better support in a more efficient manner This new team will continue to work with the Houston ETS Infrastructure team to implement the ETS standard across companies and citi es Joe Palik will lead the new team Joe and the team will be responsible for all the daytoday operations relating to help desk calls desktop support and Infrastructure support Joe will have a dual reporting role to both To ny Mayer and Bob Martinez Jean McFarland is moving into fulltime project management reporting to Bo b Martinez In the nearterm in addition to her project work Jean will remain accessible to her current customers and Joe and his team to help in this transition Until the completion of the Omaha Windows and Exchange implementation Mike Guzman and Tommy Sellers will be spending the majority of their time o n this project reporting to Jean Jean will continue to have responsibility for this and other key ETS projects currently in progress or planned for Diane Becker will continue to work on the Windows Security item s along with her help desk responsibilities Once the Windows project is complete reporting to Joe will be Infrastructure Platform HelpdeskDesktop Mike Guzman WK Karen Melton Mike Rasmussen Diane Becker Tyler Theobald Randy Lukken Dan Bunch Ed Wojcik Tommy Sellers WK The first step in this merger will be to combine the help desks and move to a common help desk call system Once this is complete well initiate crosstraining activities in the desktop support area allowing these suppo rt functions to be shared Please congratulate Jean and Joe on their new responsibilities and work wit h them to ensure a smooth transition to one support team for Omaha If you have any questions or concerns please contact one of us Bob Martinez or Tony Mayer Thank you for your cooperation
<15398324.1075844140304.JavaMail.evans@thyme>,ets.announcement@enron.com,2001-01-21 04:09:00,Pulse Survey Resultsyou for your participation in the Pulse survey this past October We achieved our highest response rate ever with more than ETS employees participating in this important feedback process The survey results too are very encouraging Most elements improved and ETS strengths continue to be in the area of our employees just as Enro n as a whole has been recognized by Fortune magazine for our employees and management ETS received high marks from employees for the following areas People are treated with respect and dignity Information from management is believable Supervisors deal fairly with everyone Teamwork is encouraged Employee benefits are satisfying ETS is wellmanaged I am pleased with these results because I believe they exhibit a strong belief in Enrons core values Respect Integrity Communication and Excellence These results are indicative of the quality of ETS employees a t all levels In this recent survey just as in workload was a concern with percent of survey participants saying they believed they did not have enoug h time to complete all of the work required of them While we have made some strides at alleviating this concern as compared to the December and June surveys I believe that we can do better still by shifting resources as business needs change eliminating unnecessary work and more effectively using technology I would also encourage you to consider the variety of training and development offerings available in the areas of workload planning and management You also voiced concerns with communication across departments I take you r concerns very seriously and will ensure that ETS focuses on further improvements in this area A summary of what we heard from ETS employees has been added to our intrane t site Click on the following URL to view our survey results etcPulseSurveyhtm Even beyond this survey I continue to be interested in your thoughts on improving the ETS organization Please feel free to send me your ideas vi a email or interoffice mail You can also send your ideas to Gary Smith Vi ce President of Human Resources or to any of the ETS management team The Pulse enables us to focus on real issues affecting each employee so yo ur continued participation is critical to its success I hope you will choose to be a part of future surveys the next of which is scheduled for the fall of Your input is essential in creating and shaping ETS to be the best it can be Thank you again for participating in the Pulse survey Stan Horton
<31701717.1075844142512.JavaMail.evans@thyme>,ets.announcement@enron.com,2001-01-29 16:58:00,SDWT Task ForceSDWT task force would like you to know that the web site is now up and running Information pertaining to the task force will be updated on a continual basis The web site address is servicesSDWTdefaulthtm and hopefully the site will be available to meet your questions Included in the web site is a listing of the current task force membership along with contact information The site also includes the minutes of past meetings as well as links for performance management and the latest resources available to employees The task force members would like to encourage you to utilize this resource and please feel free to contact the members for assistance and comments The task force is currently working on several objectives related to SelfDirected Work Teams We are also continuing to assist in the EOTT transition The task force is looking forward to serving ETS for the upcoming year and please continue to communicate your concerns and comments to the members Sincerely The SDWT Communication Committee
<24425146.1075844142923.JavaMail.evans@thyme>,ets.announcement@enron.com,2001-01-31 07:47:00,Greg Whalley Floor Meeting on to a scheduling conflict Mark Frevert will not be able to speak at the ETS floor meeting on the st floor tomorrow Greg Whalley President and COO of Enron Wholesale Services will be our guest speaker Greg will be informing us of what is currently happening within EWS as well as answer any questions you have Please join us tomorrow Thursday February at pm by the Fax Center on I look forward to seeing you there Danny J McCarty
<8485936.1075844143268.JavaMail.evans@thyme>,ets.announcement@enron.com,2001-02-01 15:52:00,XMS Expense Management System AvailabilityTechnologies Expense Management System XMS is now available to all ETS employees You can prepare your expense report send it for approval and transmit it for payment using the intranet It is more userfriendly than the previous Excelbased form and efficiently integrates with the SAP accounting system We request and encourage you to start using it System access on the Enron intranet To access the system go to the Enron Transportation Services Home Page and type in the Location field This will access XMS software Using the system once accessed LOGON ID Enter your personnel number P number If you dont know your P number your HR rep has it PASSWORD The first time you log in the password is upper case ENRON The system wi ll guide you through confirming your personal information and changing your password The Enron Code of Ethics prohibits the sharing of passwords and logging on as another person Please observe Enrons policy If you cant log in to the system go to the IT Central web page from the Enron intranet home page and select Services click Security Requests click eRequest or call OTHER Once in the XMS system will help you get set up including designating those who will be approving your expense report and if applicable those who have been designated to prepare your expense report Additionally ther e is a tour that you can take to get acquainted with system features User Guide Hard copy stepbystep documentation is also available from IT Central we b page on the Enron intranet After getting to IT Central on the Enron intranet click through the following and you should be there Services Training Documentation XMS Users Guide which will com e up through Adobe Acrobat Application Support Services Call the ISC help desk at SAP Accounting Coding No changes in coding are being implemented as a result of the transition fr om the Excel template to XMS in fact much of the coding will be suggested b y the XMS software You will need a FAR cost center or WBS elements as applicable GOOD LUCK
<1319250.1075844144964.JavaMail.evans@thyme>,ets.announcement@enron.com,2001-02-09 10:50:00,Safety BulletinTeam concept has given us numerous opportunities for improvements over the past several years with Team members continuing to be recognized and rewarded for their positive efforts and accomplishments As accomplishments are made trust and responsibilities increase and the Team experiences growth maturity and the associated rewards A part of this growth and maturity must include the realization and acceptance of the Teams responsibility to monitor and enforce Company policies and procedures As you heard from me in I will protect those who are complying with and enforcing our requirements but I have zero tolerance for those who choose not to do so Along with the rewards for positive efforts there are also consequences for those who fail to act when circumstances call for action During the year several ETS employees received disciplinary action as a result of their failure to act andor ignoring safe work practices These cases were distributed to all employees in the form of a Safety Bulletin It has been my intention that we all learn from these instances to make our work place even safer As we publish this first and hopefully only Safety Bulletin in I would like to share with you two instances from last year After repeatedly counseling a fellow team member observed violating several safety requirements including hard hat safety glasses FRC one Team took action which ultimately resulted in this person being discharged While this may seem to be a harsh outcome it is much better than the person injuring themselves or even worse a fellow team member This person had others expressing concern over his wellbeing and chose to ignore the warnings Individual team members acted on their responsibility and the team as a whole accepted their accountability In the second case a team member chose to drive a Company vehicle without using a seatbelt The employee was involved in an accident ejecting him from the vehicle causing injuries that could have been prevented if the seat belt would have been properly used This employee is lucky to be alive Use of seat belts by all occupants of Company vehicles is one of the most basic elements of our program and has been a requirement for over years As the use of seat belts is habit forming could this have been the first time the employee failed to use them Is it possible that other Team members had observed this failure in the past and not acted Could this have been prevented through positive interaction Had positive interaction been taken but ignored When the Declaration of Interdependence was introduced in we made the commitment to each other that we would be our Brothers and Sisters Keeper and to remind each other of the need to comply with safety requirements at all times While some employees may feel uncomfortable enforcing our requirements that does not relieve the person from their responsibility Likewise a Team is responsible and accountable for the actions or lack of a required action of each Team member Each individual team member and the team as a whole are responsible for the outcome and any disciplinary action that management may be required to take Please assist us in creating the safest work environment possible Our most important personal goal should be to do whatever it takes to arrive home safely each and every night and should expect nothing less from peers or members of your leadership to hold you accountable for doing just that
<26710428.1075844144989.JavaMail.evans@thyme>,ets.announcement@enron.com,2001-02-09 10:51:00,iBuyit projectwanted to share some great news with you about a major corporate initiati ve within ETS called the iBuyit project that you should know about and be looking forward to iBuyit is a tool that will make it easier for you to purchase the things you need to get your job done andor to operate our business Some key points related to iBuyit are Employees at all levels across ETS will be able to access iBuyit on their computers much like the Enron Intranet iBuyit provides an upgrade to the existing BB WebBased Procurement tool iBuyit will utilize a new catalog system REQUISITE that will make it easier for you to identify material items and incorporate them into the requisition iBuyit will not only make it simple for you to buy online but it can al so serve as your single convenient source to access other tools and informati on you use everyday at Enron Stan Horton Rod Hayslett and Phil Lowry decided back in December that ETS would take the lead by being the first business unit to begin working with Global Strategic Sourcing GSS who is developing iBuyit Both field and Houstonbased ETS employees have been involved with iBuyit efforts todate to help determine how iBuyit can best be used to support our employees and our business More of you will be involved as the iBuyit project progresses iBuyit will be deployed to ETS Corporate EBS EES and EWS in a phased approach during the first three quarters of Starting in April iBuyi t will be available to certain groups of ETS employees for the purchase of office supplies and travel iBuyit will be implemented on a full scale across ETS in July Those of you in Engineering may be aware of the ongoing MLRP efforts and ma y be wondering about the impact of iBuyit Because of the unique nature of i ts business Engineering has decided to continue moving forward with MLRP Bu t we will also continue to explore ways for iBuyit to complement MLRP and benefit Engineerings business As the person ultimately responsible for iBuyits success within ETS I wanted to share my enthusiasm with you as early as possible about iBuyit In addition to what I already mentioned iBuyit strongly supports ETSs exi sting Procurement and Supply Management strategy will allow the company to save money by taking advantage of its relationships with preferred suppliers an d will help us to achieve a greater return on our investments in cuttingedge technology As you can tell there are many strong reasons for all of us within ETS to be excited about iBuyit So stay tuned You may be asked to actively participate in iBuyit efforts but I guarantee that you will have many opportunities to hear and learn mor e about iBuyit in the coming months You will also have many opportunities t o have your questions answered and opinions heard starting here If you ha ve any questions or comments simply reply to this email I will appreciate hearing from you Morris Brassfield Senior Director Operations Support Services 
<18111707.1075844145670.JavaMail.evans@thyme>,ets.announcement@enron.com,2001-02-14 14:32:00,ETS Salutesyou know the Enron Chairmans Award program recognizes employees who make a difference one day at a time by living Enrons Vision and Values in everything they do The program which is percent employeedriven enables all of us to nominate those of our fellow employees who we believe exemplify the Enron values of Respect Integrity Communication and Excellence This past October the Employee Selection Committee reviewed all of the nominations of them from across Enron and from around the world and selected the finalists who comprise the Chairmans Roundtable The wi nner of the Chairmans Award EES employee Mark Harada then was selected fro m this group and announced at the Enron Management Conference in November During the next couple of months ETS is going to honor its nominees including our two finalists for the award by sharing the details of their nominations with each of you Our employees like the nominees from the oth er Enron companies are everyday heroes who apply Enrons values to their w ork their relationships and their communities This week I salute the two Chairmans Award finalists from ETS Amelia Alder Craig Buehler Amelia an executive secretary in Houston has taken excellence to new heights In Amelia led an member cycling team for the Multiple Sclerosis Society collecting in pledges Today she has led this tea m to be the nationally recognized event leader with over riders and a top fundraiser with an amazing in pledges Thanks to Amelias involvement out of every dollars raised for MS is connected to Enrons name Amelias ability to communicate through cooperation and persuasion ha s resulted in unprecedented recognition for Enron Craig a senior analyst in Houston has been identified as a trendsetter regarding communication Today we take for granted the technology our videoconference rooms provide us But in the early days of Enron in an effort to bridge the gap between Omaha and Houston he would videotape individuals within groups and forward the film to the other location He wa s the human link that spanned two cities and helped two cultures become one As a tribute to his efforts a large number of bonds exist today as a result o f his efforts to promote a sense of esprit de corps and friendship Craig was also responsible for creating Enron Kids now a favorite employee volunteer activity during the holidays that gives students a complete outfit of clothes a pair of shoes a jacket a toy and a book Please join me in congratulating Amelia and Craig Stan
<31583655.1075863626483.JavaMail.evans@thyme>,ets.announcement@enron.com,2000-10-30 14:00:00,YearEnd Performance Feedback Lets Do It RightPerformance Evaluation Process PEP system is now open through Friday Nov for all employees to solicit and provide performance feedback Th is process is powerful if we provide meaningful feedback Management when determining performance ratings participating in PRC meetings and providing feedback to employees depends on the comments received via PEP For the users of PEP information to fully understand the employees performance and the ratings identified specific comments are needed to explain each rating including the overall rating Its most beneficial to describe specifically what the employee did and why their action was productive or why it needs improvement Comments on areas of strength as well as suggesting areas needing improveme nt are both important Just as each of us needs feedback and coaching to improve our skills in sports or other pursuits we also need to know what a nd how we can improve our work skills and behaviors We all benefit from constructive feedback Please actively participate in the yearend PEP process and make your input meaningful PEP Feedback Tips Provide feedback when requested Rate only those skills and behaviors you have observed this year Provide specific comments with specific examples Indicate performance needs improvement when appropriate Some Feedback Examples SkillBehaviorIneffective FeedbackImproved Feedback CommunicationJack communicates wellJack was called on to provide written updates for the Ajax project and he clearly conveyed pertinent information that was easy to read timely and suited for his audience The Accounting Finance management team commented on how his reports saved them time TeamworkSues a poor team playerWhen we got to crunch time sending out yearend reports Sue chose to spend a day preparing her goals for next year instea d of pitching in and helping check figures and box up reports with everyone else We missed the shipping deadline and our reports were received a day late This impacted our customers and caused our team to miss an important goal InnovationJennifer comes up with great new ideasFrom reading an a rticle on data transmitting devices Jennifer identified a tool she thought could be utilized in our remote gas measurement applications Now implemented the remote measurement device has saved us significant monies and time LeadershipTom often displays inappropriate leadership skillsAltho ugh Tom closes big deals and contributes significantly to the success of ETS he lacks the ability to gain the support and commitment of others when dealing with support groups across departmental lines For greater success he should listen more and provide rationale for his ideas and directives TechnicalBills technical skills are weakOn three occasions B ill misaligned columns or overlaid critical data when updating departmental electronic spreadsheets These errors caused more than hours of rework and approximately hours of overtime to fix the mistakes For additional information or assistance on providing performance feedback please contact your HR Rep or Roger Sumlin at Thanks in advance for your participation in this very important feedback process
<3622828.1075844036093.JavaMail.evans@thyme>,ets.announcement@enron.com,2000-10-12 11:52:00,We want to check your pulseagain its time to find out what you think about your work experience at Enron and Enron Transportation Services Company and what we can do to help make it better Thats why we want to check your pulse In fact we ve changed the name of last years Excellence Through Communication employee survey to The Pulse We believe The Pulse more accurately captures the purpose of the survey Your diagnosis will help us correct problem areas s o we can continue to make Enron a great place to work Is available Monday Oct Friday Oct Is located at surveyenroncom There are a few things we want you to remember about The Pulse Your survey responses will be confidential You can complete your surve y from special computer kiosks that will be set up in some of our larger offices Several group computer terminals also will be available in smalle r field offices We want to provide you with the most comfortable environment possible as your participation is of vital importance to us Alternatively you can key in your responses from your desktop computer The responses key ed from your desktop will be confidential as well We will respond actively to your comments We are going to do our best to cure some of the current problems that exist and put into action preventati ve processes that will help identify smaller problems before they become major ones We may ask for your help in resolving some of the issues that are collected in the survey your active role will help us identify the best solutions In last years survey you identified several problem areas regarding internal communications workload and performance management Weve already acted on many of your recommendations These are a few of the things weve accomplished in direct response to your input ETS strengthened management focus on intellectual capital and employee through the initiation of Table Talk sessions with ETS Office of the Chairman which give employ ees the opportunity to have frontline discussions The Innovation Series which invites employees to share their ideas openly and ensures management commitment to evaluating ideas ESpeak sessions with ETS leaders to exchange ideas and Our name change to Enron Transportation Services to recognize our most strategic asset you We made workload planning and management trainingdevelopment availabl e to ETS employees to address workload issues the greatest ETS concern in the survey We improved the consistency of performance management the survey topi c that received the most employee comments by extending the use of the Performance Evaluation Process PEP system and the Performance Review Committee PRC process to all levels in ETS at midyear in Please take a few minutes to check your pulse and tell us what you think an d how you feel about your job and about Enron We look forward to hearing from you
<11387203.1075844036455.JavaMail.evans@thyme>,ets.announcement@enron.com,2000-10-13 13:57:00,ETS eSpeak with Dan McCartyjoin Dan McCarty on Wednesday October at am Houston time for an ETS eSpeak Dan Managing Director and Chief Commercial Officer of Enron Transportation Services will host an open discussion on the direction of ETS If you are unable to join Dan live please submit your questions ahead of the event by logging on to wwwethinkenroncom and click eSpeak
