Message_id,From,Time_stamp,Text
<24431531.1075844036683.JavaMail.evans@thyme>,ets.announcement@enron.com,2000-10-16 14:48:00,ETS Retiree Planning Workshop SurveyEnron Transportation Services Human Resources ETS Human Resources department is determining the feasibility of providing a retirement planning workshops for ETS employees By completing the following survey you will provide us the information we need to determine the level of interest for this type of training If there is sufficient interest we will schedule these workshops around midDecember Please complete the survey and return to Merlyn Fance by fax or e mail at by Monday October The training will be conducted by an outside Financial Planner This is not about an Enron Retirement package Name LocationRegion TeamDepartment I am interested in attending a Retirement Planning workshop along with my spouse q Yes q No I would be interested in learning more about the following topics in a Retirement Planning Workshop q Retiree Medical Insurance q Survivor Benefits q Savings Plan q Employee Stock Ownership Plan ESOP q All Employee Stock Option Program q Cash Balance Plan q Social Security q Medicare q Other The best time for both me and my spouse to attend a hour Retirement Planning Workshop is q On weekdays Monday through Thursday from pmpm q Saturday morning from am noon
<18073447.1075844036937.JavaMail.evans@thyme>,ets.announcement@enron.com,2000-10-17 14:31:00,Mechanical Services Advisory Bulletinpart of Mechanical Services ongoing efforts to ensure equipment reliability and employee safety the following Mechanical Advisory is being distributed to all ETS Operations Teams Please review the attached failure investigation to determine if there is similar equipment andor operating conditions that may exist within your Teams area of responsibility This incident could have been catastrophic to both life and equipment if the excaping gas had ignited
<25713547.1075844036960.JavaMail.evans@thyme>,ets.announcement@enron.com,2000-10-18 16:25:00,ETS Toy Food Drivethe Holidays quickly approaching Enron Transportation Services will b e having a Food and Toy Drive Monday Oct through Friday Nov to benefit the children and families of the Head Start Program The Head Start Program ETS adopted United Way agency serves lowincom e residents of Houston and surrounding counties with many services including child care youth and family assistance help for senior citizens energy assistance and life skills Please bring nonperishable food items andor NEW toys for children ages three and above The toys must be unwrapped and in their original packaging We are not allowed to accept used toys Decorated boxes will be stationed by the desks of the following people Rita Houser EB Ruth Mann EB Amelia Alder AC Emily Sellers EB Janice Hogan AC Alma Martinez EB Julie Armstrong EB Kathy Campos EB Tammy Kovalcik EB Ricki Winters EB Food and toys will be picked up Monday Nov and Friday Nov We need volunteers to deliver the food and toys to the Head Start downtown location on the afternoon of Nov Please contact Kimberly Nelson ext or Gina Taylor ext if you have questions or would like to volunteer on Nov Thanks in advance for participating in the drive to make this Holiday Season a little brighter for many Houstonarea families
<3031574.1075844037221.JavaMail.evans@thyme>,ets.announcement@enron.com,2000-10-19 13:32:00,Hear Ken Lay and Don Jordan Speakreceived tickets for the Oct Downtown Arena Referendum panel discussion including Ken Lay and Don Jordan formerly of Reliant Energy Please come by eb to get your ticket for admission Hurry tickets are going fast In a unique meeting of the minds the employees of Enron and Reliant Energy are invited to an Arena Open Forum This event has been arranged to ensure you have the opportunity to have your questions answered regarding the upcoming downtown arena referendum Distinguished Panel Monday October Noon pm Hyatt Regency Imperial Ballroom Tickets are required for attendance Please note lunch will not be provided Get the facts Jack
<14390922.1075844037510.JavaMail.evans@thyme>,ets.announcement@enron.com,2000-10-21 15:54:00,Theres still time to Check your Pulsenot too late to tell us what you think about your work experience a t Enron and Enron Transportation Services and what we can do to help make it better To date nearly of all ETS employees have completed The Pulse survey For those of you who have completed the survey thank you for taking the ti me to tell us whats on your mind Wed still like to hear from those employees who have not completed the survey Between now and Friday Oct please access The Pulse survey via surveyenroncom to share your Enron work experiences It would be great to get participation from ETS employees Your survey responses are confidential and your comments can bring improvements to ETS Thanks in advance for your participation in The Pulse
<24877645.1075844037648.JavaMail.evans@thyme>,ets.announcement@enron.com,2000-10-23 17:10:00,eSpeak Reminderjoin Dan McCarty ETS Chief Commercial Officer for an eSpeak to discuss the future of ETS on Wednesday October at am Houston time If you are unable to join Dan live please submit your questions ahead of the event by logging on to wwwethinkenroncom and click eSpeak
<8489014.1075844038211.JavaMail.evans@thyme>,ets.announcement@enron.com,2000-10-25 17:04:00,The Pulse is Pounding for your ResponseOct is the last day to tell us whats on your mind via The Pulse survey To make improvements throughout Enron and ETS we need your input on your Enron work experiences If you havent completed the survey its fast and its easy Ple ase log on to surveyenroncom now to let us know whats on your mind Hurry tim e is running out No matter what the feedback wed like to hear from everyone Remember that all survey responses are confidential and your comments can bring improvements to ETS If youve completed The Pulse survey thank you
<1421378.1075844038241.JavaMail.evans@thyme>,ets.announcement@enron.com,2000-10-25 17:09:00,IdeaBank Websiteread the attached document for information about an exciting new website for ETS employees
<28333967.1075844038452.JavaMail.evans@thyme>,ets.announcement@enron.com,2000-10-26 15:58:00,ETS Operations Realignmentthe recent announcement of Enron Engineering and Construction Company EECC becoming a part of Enron Transportation Services Company Operations is making the following realignments effective Nov Jerry Martin will become vice president ETS engineering and construction reporting to Phil Lowry managing director ETS operations Reporting to Jerry includes Jordan Hunter Jim Alexander and Paul Fuhrer project directors Dave Sinclair director right of way Frank Osburn director design and records Arnold Eisenstein director compression Greg Mathews director project controls and Norm Spalding director regional projects John Keller senior director ETS will continue to report to Phil Lowry Reporting to John includes Ben Asante director optimization Terri Galassini director planning and Gary Maestas Houston Mike Bonstetter Omaha directors mechanical services Rick Craig vice president operations technical services will have responsibility for Enron Machine and Mechanical Services Inc including the Clifton and Beaver machine shop teams and will continue to report to Phil Lowry Reporting to Rick includes Ken Crowl director controls and electrical services Kenneth Cessac director measurement services and Max Brown director corrosion and pipeline risk management services In addition ETS operations supply management will become part of ETS finance accounting and administration under the leadership of Rod Hayslett managing director Please join me in wishing these individuals success in their assigned responsibilities
<2162565.1075844039243.JavaMail.evans@thyme>,ets.announcement@enron.com,2000-10-31 10:30:00,Reminder ETS Food Toy DriveFood and Toy Drive has begun It will run through Friday Nov and benefits the children and families of the Head Start Program Please bring nonperishable food items andor NE W toys for children ages three and above The toys must be unwrapped and in their original packaging We are not allowed to accept used toys Decorated boxes are stationed by the desks of the following people Rita Houser EB Ruth Mann EB Amelia Alder AC Emily Sellers EB Janice Hogan AC Alma Martinez EB Julie Armstrong EB Kathy Campos EB Tammy Kovalcik EB Ricki Winters EB Food and toys will be picked up Monday Nov and Friday Nov Please contact Kimberly Nelson ext or Gina Taylor ext if you have questions Thank you in advance for your donations
<25686851.1075844039945.JavaMail.evans@thyme>,ets.announcement@enron.com,2000-11-03 08:23:00,ETS QuickPlaceIdeaBank OutageFriday November at we will be migrating the ETS QuickPlace server The maintenance is expected to last approximately minutes What does this mean to you Users who access the IdeaBank or any QuickPlace discussion sites ie ETS Infrastructure Program Office ETS Standards will not be able to access them until the server has been brought back up The IdeaBank will automatically be rerouted to the new server However any references to GTHOUWWPQuickPlace will need to be changed to NAHOULNWWQuickPlace If you have any concerns about this maintenance please contact the Customer Assistance Center at Customer Assistance Center
<21675271.1075844040038.JavaMail.evans@thyme>,ets.announcement@enron.com,2000-11-03 13:11:00,Organizational Announcementam very pleased to announce that LD Stephens has accepted the position of Account Director in the Business and Power Development group of the Northern Natural Gas Marketing Division LD has been with Enron for years and has held many positions from Field Technician to Field OM Supervisor to Regional Team Advisor Most recently LD was a Sr Facility Planner and had primary accountability to provide planning support to the commercial activities of the Business and Power Development team LD has a BS in Industrial Technology from Southwest Oklahoma State He will be located in Omaha and will manage a number of projects primarily in the area of on system power development and ethanol market development Please join me in welcoming LD to our group Thank You John Dushinske
<25178587.1075844040334.JavaMail.evans@thyme>,ets.announcement@enron.com,2000-11-07 13:49:00,ETS Organizational Announcementsam pleased to announce that effective immediately Gary Smith has accept ed the position of Vice President Human Resources for Enron Transportation Services Gary assumes the human resources responsibilities from Dave Schafer who has accepted the position of Vice President Human Resources fo r Enron Corporate Staff Gary most recently was Vice President Human Resources for Enron Wind Prior to that Gary was Vice President of Procurement Supply Management f or Enrons Gas Pipeline Group Gary has years of experience in Enron s pipeline business and has held management positions in Human Resources Operations and Procurement Also effective immediately the ETS Communications group will join the Government Affairs group This will help coordinate communications with employees media and government officials Shelley Corman will assume responsibility for ETS communications as Vice President Government Affairs and Public Relations Gina Taylor Director of Communications will join Shelleys group as well as Kimberly Nelson and Alma Martinez Please join me in congratulating Dave Gary and Shelley on their new assignments
<20489883.1075844040937.JavaMail.evans@thyme>,ets.announcement@enron.com,2000-11-08 13:05:00,Your last chanceis the last day of the ETS Food Toy Drive If you havent alread y done so please consider bringing nonperishable food or a new toy to help those less fortunate in the Head Start Program ETS adopted United Way agency Decorated boxes are located at the following locations Rita Houser EB Ruth Mann EB Amelia Alder AC Emily Sellers EB Janice Hogan AC Alma Martinez EB Julie Armstrong EB Kathy Campos EB Tammy Kovalcik EB Ricki Winters EB Thanks again for your donations
<16718720.1075844041350.JavaMail.evans@thyme>,ets.announcement@enron.com,2000-11-10 09:41:00,ETS and Enron KidsHyatt Director for the TW Commercial Team is a member of the Enron Kids Committee He has again volunteered to be the GPG coordinator for those of you interested in adopting or contributing to the Enron Kids Christmas campaign This year the Committee has adopted HISDs Burrus Elementary If youre not familiar with Enron Kids this is the program where Enron adopts all the kids in a local school where a majority of the families are living near or below the poverty line The adoption consists of groups of employees selecting one or more children and buying a full set of clothes including socks underwear shoes and an overcoat plus a toy and book The approximate cost is per child adopted All the gifts are distributed by the Committee during a party at the school several weeks before Christmas In a lot of cases our gifts are the only things the kids will get this year If youre interested in participating Heres what you do Reply via email to Kevin Hyatt with your anticipated donation Kevin will be in charge of collecting funds and coordinating the buying of presents If you or your spouse or significant other want to volunteer to assist with the shopping please let him know Kevin will provide a daily update of the donations total Please let Kevin know your donation by Tuesday November We will adopt the maximum number of kids on Wednesday November Thanks for your assistance
<6720168.1075844041373.JavaMail.evans@thyme>,ets.announcement@enron.com,2000-11-10 09:42:00,ETS Operations Technical Services Organizationmission of ETS Operations Technical Services OTS remains unchanged Our goal is to be an integral part of field operations provide the highest level of technical support possible and assist the field operations teams in achieving their objectives To that end and as a part of ETSs ongoing transition of merging ETSs and EOTTs Operations I am pleased to announce a realignment of ETS Operations Technical Services The purpose of these changes is to better align our technical resources with the new Operations Areas and teams and better serve their needs Therefore we will form Area Technical Support Teams for each of the Technical disciplines Corrosion Measurement and Controls Electrical Max Brown Director of Corrosion Services will lead the Corrosion teams Kenneth Cessac Director of Measurement Services will have responsibility for the Measurement Support teams Ken Crowl Director of Controls and Electrical Services will provide leadership to the CE teams Steve Klimesh Business Consultant will provide ongoing support to ETS on UAF and other continuous improvement initiatives The Clifton and Beaver machines shops will remain a part of OTS as we continue to grow the Enron Machine and Mechanical Services business The attached organizational charts show the new Tech Services The vacancies reflected on the charts are an effort to shore up our technical support staff for operating the EOTT assets In the coming weeks our Technical Support Teams will be further defining their support roles to the Region and team level and working diligently to fill these vacancies Any thoughts or comments that you might have regarding these changes are certainly appreciated Please feel free to call me or any of the OTS Directors with your feedback or for assistance Our goal is to continue to provide the best service possible to you our customers
<1646829.1075844041396.JavaMail.evans@thyme>,ets.announcement@enron.com,2000-11-10 09:42:00,Floor Meeting with John Sherriffjoin me for a floor meeting on Nov at am for an open discussion with John Sherriff President and CEO of Enron Europe John will share the direction of Enron Europe and the power industry as well as answer questions The meeting will take place on the st floor by the Fax Center If you prefer to presubmit questions please forward them via email to Kimberly Nelson before Nov I look forward to seeing you on Nov Dan
<29413814.1075844041421.JavaMail.evans@thyme>,ets.announcement@enron.com,2000-11-10 09:43:00,Thank youthis one is going to Enron Transportation Services Houston I want to take a moment to say thank you to all the employees who participated in the ETS Food Toy Drive We delivered over boxes of food and toys on Friday to the Downtown location of the Head Start program There are many people in the Houston community who need our help and support especially during the Holiday Season Through your kindness the Head Start Program ETS adopted United Way agency will be able to help those less fortunate The pictures below capture some of our employees displaying the donations that were collected in the Enron building The collections in Three Allen Center were significant as well Thank you again for your overwhelming generosity
<10243264.1075844043154.JavaMail.evans@thyme>,ets.announcement@enron.com,2000-11-21 04:57:00,EnronETS Code of Ethicsofficers of the company we would like to reiterate that we are all responsible for conducting the business affairs of the Company in accordanc e with all applicable laws and in a moral and honest manner At this particular point in time we would like to revisit our Business Ethics policy Employees of the Company are charged with conducting their business af fairs in accordance with the highest ethical standards An employee shall not conduct himself or herself in a manner which directly or indirectly would be detrimental to the best interests of the Company or in a manner which woul d bring to the employee financial gain separately derived as a direct consequence of his or her employment with the Company Please realize conducting our business affairs in accordance with the highest ethical standards should be reflected in all communications T his applies to communication via person to person telephone correspondence f ax and email We particularly want to address the importance of absolute integrity in your communications via email and any attached documents or graphics If further clarification is needed please contact your AdvisorDirector for any questions or concerns We are available to discus s these issues as well The Code of Ethics was revised in July of this year and every employee was asked to sign a new Certificate of Compliance statement This signed statement serves as your personal agreement to comply with the policies set forth during the term of your employment with the Company The Code of Ethics booklet and the Certificate of Compliance are avaliable to all employees on the Enron Home Page at You may access them by clicking on Code of Ethics We are proud of Enron and we want it to continue to enjoy a reputation for fairness and honesty that is respected Lets keep that reputation high 
<13830958.1075844045638.JavaMail.evans@thyme>,ets.announcement@enron.com,2000-12-05 09:06:00,ETS on the Moveimmediately Joe Jeffers Manager of Technical Training and Skill Based Pay Administration and his team of Dick Heitman Cliff McPherson Andrea Woody and Lupi Trevino will move from ETS Human Resources to ETS Operations Technical Services Joe will report to Steve Klimesh This move will better align Technical Training and SBP Administration with Operations and enhance the interfaces that take place between this group and ETS Operations management and the field teams Joe and his team have provided outstanding support to Operations in the past and it is expected that this high standard of customer service will continue We will be sending more information in the very near future with regard to the individual support accountabilities of the team members Please join me in welcoming this team and helping to make their transition a smooth one
<12247840.1075844050371.JavaMail.evans@thyme>,ets.announcement@enron.com,2000-11-10 09:43:00,Thank youthis one is going to Enron Transportation Services Houston I want to take a moment to say thank you to all the employees who participated in the ETS Food Toy Drive We delivered over boxes of food and toys on Friday to the Downtown location of the Head Start program There are many people in the Houston community who need our help and support especially during the Holiday Season Through your kindness the Head Start Program ETS adopted United Way agency will be able to help those less fortunate The pictures below capture some of our employees displaying the donations that were collected in the Enron building The collections in Three Allen Center were significant as well Thank you again for your overwhelming generosity
<1321585.1075844055663.JavaMail.evans@thyme>,ets.announcement@enron.com,2000-10-16 14:48:00,ETS Retiree Planning Workshop SurveyEnron Transportation Services Human Resources ETS Human Resources department is determining the feasibility of providing a retirement planning workshops for ETS employees By completing the following survey you will provide us the information we need to determine the level of interest for this type of training If there is sufficient interest we will schedule these workshops around midDecember Please complete the survey and return to Merlyn Fance by fax or e mail at by Monday October The training will be conducted by an outside Financial Planner This is not about an Enron Retirement package Name LocationRegion TeamDepartment I am interested in attending a Retirement Planning workshop along with my spouse q Yes q No I would be interested in learning more about the following topics in a Retirement Planning Workshop q Retiree Medical Insurance q Survivor Benefits q Savings Plan q Employee Stock Ownership Plan ESOP q All Employee Stock Option Program q Cash Balance Plan q Social Security q Medicare q Other The best time for both me and my spouse to attend a hour Retirement Planning Workshop is q On weekdays Monday through Thursday from pmpm q Saturday morning from am noon
<30657507.1075844055928.JavaMail.evans@thyme>,ets.announcement@enron.com,2000-10-23 17:10:00,eSpeak Reminderjoin Dan McCarty ETS Chief Commercial Officer for an eSpeak to discuss the future of ETS on Wednesday October at am Houston time If you are unable to join Dan live please submit your questions ahead of the event by logging on to wwwethinkenroncom and click eSpeak
<32163400.1075844057269.JavaMail.evans@thyme>,ets.announcement@enron.com,2000-11-21 04:57:00,EnronETS Code of Ethicsofficers of the company we would like to reiterate that we are all responsible for conducting the business affairs of the Company in accordanc e with all applicable laws and in a moral and honest manner At this particular point in time we would like to revisit our Business Ethics policy Employees of the Company are charged with conducting their business af fairs in accordance with the highest ethical standards An employee shall not conduct himself or herself in a manner which directly or indirectly would be detrimental to the best interests of the Company or in a manner which woul d bring to the employee financial gain separately derived as a direct consequence of his or her employment with the Company Please realize conducting our business affairs in accordance with the highest ethical standards should be reflected in all communications T his applies to communication via person to person telephone correspondence f ax and email We particularly want to address the importance of absolute integrity in your communications via email and any attached documents or graphics If further clarification is needed please contact your AdvisorDirector for any questions or concerns We are available to discus s these issues as well The Code of Ethics was revised in July of this year and every employee was asked to sign a new Certificate of Compliance statement This signed statement serves as your personal agreement to comply with the policies set forth during the term of your employment with the Company The Code of Ethics booklet and the Certificate of Compliance are avaliable to all employees on the Enron Home Page at You may access them by clicking on Code of Ethics We are proud of Enron and we want it to continue to enjoy a reputation for fairness and honesty that is respected Lets keep that reputation high 
<819857.1075844162191.JavaMail.evans@thyme>,ets.announcement@enron.com,2001-01-29 16:58:00,SDWT Task ForceSDWT task force would like you to know that the web site is now up and running Information pertaining to the task force will be updated on a continual basis The web site address is servicesSDWTdefaulthtm and hopefully the site will be available to meet your questions Included in the web site is a listing of the current task force membership along with contact information The site also includes the minutes of past meetings as well as links for performance management and the latest resources available to employees The task force members would like to encourage you to utilize this resource and please feel free to contact the members for assistance and comments The task force is currently working on several objectives related to SelfDirected Work Teams We are also continuing to assist in the EOTT transition The task force is looking forward to serving ETS for the upcoming year and please continue to communicate your concerns and comments to the members Sincerely The SDWT Communication Committee
