Message_id,From,Time_stamp,Text
<16058762.1075844162920.JavaMail.evans@thyme>,ets.announcement@enron.com,2001-02-09 10:51:00,iBuyit projectwanted to share some great news with you about a major corporate initiati ve within ETS called the iBuyit project that you should know about and be looking forward to iBuyit is a tool that will make it easier for you to purchase the things you need to get your job done andor to operate our business Some key points related to iBuyit are Employees at all levels across ETS will be able to access iBuyit on their computers much like the Enron Intranet iBuyit provides an upgrade to the existing BB WebBased Procurement tool iBuyit will utilize a new catalog system REQUISITE that will make it easier for you to identify material items and incorporate them into the requisition iBuyit will not only make it simple for you to buy online but it can al so serve as your single convenient source to access other tools and informati on you use everyday at Enron Stan Horton Rod Hayslett and Phil Lowry decided back in December that ETS would take the lead by being the first business unit to begin working with Global Strategic Sourcing GSS who is developing iBuyit Both field and Houstonbased ETS employees have been involved with iBuyit efforts todate to help determine how iBuyit can best be used to support our employees and our business More of you will be involved as the iBuyit project progresses iBuyit will be deployed to ETS Corporate EBS EES and EWS in a phased approach during the first three quarters of Starting in April iBuyi t will be available to certain groups of ETS employees for the purchase of office supplies and travel iBuyit will be implemented on a full scale across ETS in July Those of you in Engineering may be aware of the ongoing MLRP efforts and ma y be wondering about the impact of iBuyit Because of the unique nature of i ts business Engineering has decided to continue moving forward with MLRP Bu t we will also continue to explore ways for iBuyit to complement MLRP and benefit Engineerings business As the person ultimately responsible for iBuyits success within ETS I wanted to share my enthusiasm with you as early as possible about iBuyit In addition to what I already mentioned iBuyit strongly supports ETSs exi sting Procurement and Supply Management strategy will allow the company to save money by taking advantage of its relationships with preferred suppliers an d will help us to achieve a greater return on our investments in cuttingedge technology As you can tell there are many strong reasons for all of us within ETS to be excited about iBuyit So stay tuned You may be asked to actively participate in iBuyit efforts but I guarantee that you will have many opportunities to hear and learn mor e about iBuyit in the coming months You will also have many opportunities t o have your questions answered and opinions heard starting here If you ha ve any questions or comments simply reply to this email I will appreciate hearing from you Morris Brassfield Senior Director Operations Support Services 
<33512518.1075844076118.JavaMail.evans@thyme>,ets.announcement@enron.com,2000-10-12 11:52:00,We want to check your pulseagain its time to find out what you think about your work experience at Enron and Enron Transportation Services Company and what we can do to help make it better Thats why we want to check your pulse In fact we ve changed the name of last years Excellence Through Communication employee survey to The Pulse We believe The Pulse more accurately captures the purpose of the survey Your diagnosis will help us correct problem areas s o we can continue to make Enron a great place to work Is available Monday Oct Friday Oct Is located at surveyenroncom There are a few things we want you to remember about The Pulse Your survey responses will be confidential You can complete your surve y from special computer kiosks that will be set up in some of our larger offices Several group computer terminals also will be available in smalle r field offices We want to provide you with the most comfortable environment possible as your participation is of vital importance to us Alternatively you can key in your responses from your desktop computer The responses key ed from your desktop will be confidential as well We will respond actively to your comments We are going to do our best to cure some of the current problems that exist and put into action preventati ve processes that will help identify smaller problems before they become major ones We may ask for your help in resolving some of the issues that are collected in the survey your active role will help us identify the best solutions In last years survey you identified several problem areas regarding internal communications workload and performance management Weve already acted on many of your recommendations These are a few of the things weve accomplished in direct response to your input ETS strengthened management focus on intellectual capital and employee through the initiation of Table Talk sessions with ETS Office of the Chairman which give employ ees the opportunity to have frontline discussions The Innovation Series which invites employees to share their ideas openly and ensures management commitment to evaluating ideas ESpeak sessions with ETS leaders to exchange ideas and Our name change to Enron Transportation Services to recognize our most strategic asset you We made workload planning and management trainingdevelopment availabl e to ETS employees to address workload issues the greatest ETS concern in the survey We improved the consistency of performance management the survey topi c that received the most employee comments by extending the use of the Performance Evaluation Process PEP system and the Performance Review Committee PRC process to all levels in ETS at midyear in Please take a few minutes to check your pulse and tell us what you think an d how you feel about your job and about Enron We look forward to hearing from you
<28647328.1075844076461.JavaMail.evans@thyme>,ets.announcement@enron.com,2000-10-13 13:57:00,ETS eSpeak with Dan McCartyjoin Dan McCarty on Wednesday October at am Houston time for an ETS eSpeak Dan Managing Director and Chief Commercial Officer of Enron Transportation Services will host an open discussion on the direction of ETS If you are unable to join Dan live please submit your questions ahead of the event by logging on to wwwethinkenroncom and click eSpeak
<21261691.1075844076688.JavaMail.evans@thyme>,ets.announcement@enron.com,2000-10-16 14:48:00,ETS Retiree Planning Workshop SurveyEnron Transportation Services Human Resources ETS Human Resources department is determining the feasibility of providing a retirement planning workshops for ETS employees By completing the following survey you will provide us the information we need to determine the level of interest for this type of training If there is sufficient interest we will schedule these workshops around midDecember Please complete the survey and return to Merlyn Fance by fax or e mail at by Monday October The training will be conducted by an outside Financial Planner This is not about an Enron Retirement package Name LocationRegion TeamDepartment I am interested in attending a Retirement Planning workshop along with my spouse q Yes q No I would be interested in learning more about the following topics in a Retirement Planning Workshop q Retiree Medical Insurance q Survivor Benefits q Savings Plan q Employee Stock Ownership Plan ESOP q All Employee Stock Option Program q Cash Balance Plan q Social Security q Medicare q Other The best time for both me and my spouse to attend a hour Retirement Planning Workshop is q On weekdays Monday through Thursday from pmpm q Saturday morning from am noon
<5454179.1075844076939.JavaMail.evans@thyme>,ets.announcement@enron.com,2000-10-17 14:31:00,Mechanical Services Advisory Bulletinpart of Mechanical Services ongoing efforts to ensure equipment reliability and employee safety the following Mechanical Advisory is being distributed to all ETS Operations Teams Please review the attached failure investigation to determine if there is similar equipment andor operating conditions that may exist within your Teams area of responsibility This incident could have been catastrophic to both life and equipment if the excaping gas had ignited
<31243470.1075844076963.JavaMail.evans@thyme>,ets.announcement@enron.com,2000-10-18 16:25:00,ETS Toy Food Drivethe Holidays quickly approaching Enron Transportation Services will b e having a Food and Toy Drive Monday Oct through Friday Nov to benefit the children and families of the Head Start Program The Head Start Program ETS adopted United Way agency serves lowincom e residents of Houston and surrounding counties with many services including child care youth and family assistance help for senior citizens energy assistance and life skills Please bring nonperishable food items andor NEW toys for children ages three and above The toys must be unwrapped and in their original packaging We are not allowed to accept used toys Decorated boxes will be stationed by the desks of the following people Rita Houser EB Ruth Mann EB Amelia Alder AC Emily Sellers EB Janice Hogan AC Alma Martinez EB Julie Armstrong EB Kathy Campos EB Tammy Kovalcik EB Ricki Winters EB Food and toys will be picked up Monday Nov and Friday Nov We need volunteers to deliver the food and toys to the Head Start downtown location on the afternoon of Nov Please contact Kimberly Nelson ext or Gina Taylor ext if you have questions or would like to volunteer on Nov Thanks in advance for participating in the drive to make this Holiday Season a little brighter for many Houstonarea families
<9518898.1075844077222.JavaMail.evans@thyme>,ets.announcement@enron.com,2000-10-19 13:32:00,Hear Ken Lay and Don Jordan Speakreceived tickets for the Oct Downtown Arena Referendum panel discussion including Ken Lay and Don Jordan formerly of Reliant Energy Please come by eb to get your ticket for admission Hurry tickets are going fast In a unique meeting of the minds the employees of Enron and Reliant Energy are invited to an Arena Open Forum This event has been arranged to ensure you have the opportunity to have your questions answered regarding the upcoming downtown arena referendum Distinguished Panel Monday October Noon pm Hyatt Regency Imperial Ballroom Tickets are required for attendance Please note lunch will not be provided Get the facts Jack
<4583286.1075844077511.JavaMail.evans@thyme>,ets.announcement@enron.com,2000-10-21 15:54:00,Theres still time to Check your Pulsenot too late to tell us what you think about your work experience a t Enron and Enron Transportation Services and what we can do to help make it better To date nearly of all ETS employees have completed The Pulse survey For those of you who have completed the survey thank you for taking the ti me to tell us whats on your mind Wed still like to hear from those employees who have not completed the survey Between now and Friday Oct please access The Pulse survey via surveyenroncom to share your Enron work experiences It would be great to get participation from ETS employees Your survey responses are confidential and your comments can bring improvements to ETS Thanks in advance for your participation in The Pulse
<16417312.1075844077649.JavaMail.evans@thyme>,ets.announcement@enron.com,2000-10-23 17:10:00,eSpeak Reminderjoin Dan McCarty ETS Chief Commercial Officer for an eSpeak to discuss the future of ETS on Wednesday October at am Houston time If you are unable to join Dan live please submit your questions ahead of the event by logging on to wwwethinkenroncom and click eSpeak
<4638222.1075844078178.JavaMail.evans@thyme>,ets.announcement@enron.com,2000-10-25 17:04:00,The Pulse is Pounding for your ResponseOct is the last day to tell us whats on your mind via The Pulse survey To make improvements throughout Enron and ETS we need your input on your Enron work experiences If you havent completed the survey its fast and its easy Ple ase log on to surveyenroncom now to let us know whats on your mind Hurry tim e is running out No matter what the feedback wed like to hear from everyone Remember that all survey responses are confidential and your comments can bring improvements to ETS If youve completed The Pulse survey thank you
<7654543.1075844078207.JavaMail.evans@thyme>,ets.announcement@enron.com,2000-10-25 17:09:00,IdeaBank Websiteread the attached document for information about an exciting new website for ETS employees
<13920593.1075844078419.JavaMail.evans@thyme>,ets.announcement@enron.com,2000-10-26 15:58:00,ETS Operations Realignmentthe recent announcement of Enron Engineering and Construction Company EECC becoming a part of Enron Transportation Services Company Operations is making the following realignments effective Nov Jerry Martin will become vice president ETS engineering and construction reporting to Phil Lowry managing director ETS operations Reporting to Jerry includes Jordan Hunter Jim Alexander and Paul Fuhrer project directors Dave Sinclair director right of way Frank Osburn director design and records Arnold Eisenstein director compression Greg Mathews director project controls and Norm Spalding director regional projects John Keller senior director ETS will continue to report to Phil Lowry Reporting to John includes Ben Asante director optimization Terri Galassini director planning and Gary Maestas Houston Mike Bonstetter Omaha directors mechanical services Rick Craig vice president operations technical services will have responsibility for Enron Machine and Mechanical Services Inc including the Clifton and Beaver machine shop teams and will continue to report to Phil Lowry Reporting to Rick includes Ken Crowl director controls and electrical services Kenneth Cessac director measurement services and Max Brown director corrosion and pipeline risk management services In addition ETS operations supply management will become part of ETS finance accounting and administration under the leadership of Rod Hayslett managing director Please join me in wishing these individuals success in their assigned responsibilities
<7041168.1075844079111.JavaMail.evans@thyme>,ets.announcement@enron.com,2000-10-31 10:30:00,Reminder ETS Food Toy DriveFood and Toy Drive has begun It will run through Friday Nov and benefits the children and families of the Head Start Program Please bring nonperishable food items andor NE W toys for children ages three and above The toys must be unwrapped and in their original packaging We are not allowed to accept used toys Decorated boxes are stationed by the desks of the following people Rita Houser EB Ruth Mann EB Amelia Alder AC Emily Sellers EB Janice Hogan AC Alma Martinez EB Julie Armstrong EB Kathy Campos EB Tammy Kovalcik EB Ricki Winters EB Food and toys will be picked up Monday Nov and Friday Nov Please contact Kimberly Nelson ext or Gina Taylor ext if you have questions Thank you in advance for your donations
<20970022.1075844079761.JavaMail.evans@thyme>,ets.announcement@enron.com,2000-11-03 08:23:00,ETS QuickPlaceIdeaBank OutageFriday November at we will be migrating the ETS QuickPlace server The maintenance is expected to last approximately minutes What does this mean to you Users who access the IdeaBank or any QuickPlace discussion sites ie ETS Infrastructure Program Office ETS Standards will not be able to access them until the server has been brought back up The IdeaBank will automatically be rerouted to the new server However any references to GTHOUWWPQuickPlace will need to be changed to NAHOULNWWQuickPlace If you have any concerns about this maintenance please contact the Customer Assistance Center at Customer Assistance Center
<32435825.1075844079859.JavaMail.evans@thyme>,ets.announcement@enron.com,2000-11-03 13:11:00,Organizational Announcementam very pleased to announce that LD Stephens has accepted the position of Account Director in the Business and Power Development group of the Northern Natural Gas Marketing Division LD has been with Enron for years and has held many positions from Field Technician to Field OM Supervisor to Regional Team Advisor Most recently LD was a Sr Facility Planner and had primary accountability to provide planning support to the commercial activities of the Business and Power Development team LD has a BS in Industrial Technology from Southwest Oklahoma State He will be located in Omaha and will manage a number of projects primarily in the area of on system power development and ethanol market development Please join me in welcoming LD to our group Thank You John Dushinske
<25811195.1075844080154.JavaMail.evans@thyme>,ets.announcement@enron.com,2000-11-07 13:49:00,ETS Organizational Announcementsam pleased to announce that effective immediately Gary Smith has accept ed the position of Vice President Human Resources for Enron Transportation Services Gary assumes the human resources responsibilities from Dave Schafer who has accepted the position of Vice President Human Resources fo r Enron Corporate Staff Gary most recently was Vice President Human Resources for Enron Wind Prior to that Gary was Vice President of Procurement Supply Management f or Enrons Gas Pipeline Group Gary has years of experience in Enron s pipeline business and has held management positions in Human Resources Operations and Procurement Also effective immediately the ETS Communications group will join the Government Affairs group This will help coordinate communications with employees media and government officials Shelley Corman will assume responsibility for ETS communications as Vice President Government Affairs and Public Relations Gina Taylor Director of Communications will join Shelleys group as well as Kimberly Nelson and Alma Martinez Please join me in congratulating Dave Gary and Shelley on their new assignments
<14376341.1075844080684.JavaMail.evans@thyme>,ets.announcement@enron.com,2000-11-08 13:05:00,Your last chanceis the last day of the ETS Food Toy Drive If you havent alread y done so please consider bringing nonperishable food or a new toy to help those less fortunate in the Head Start Program ETS adopted United Way agency Decorated boxes are located at the following locations Rita Houser EB Ruth Mann EB Amelia Alder AC Emily Sellers EB Janice Hogan AC Alma Martinez EB Julie Armstrong EB Kathy Campos EB Tammy Kovalcik EB Ricki Winters EB Thanks again for your donations
<21978944.1075844081074.JavaMail.evans@thyme>,ets.announcement@enron.com,2000-11-10 09:41:00,ETS and Enron KidsHyatt Director for the TW Commercial Team is a member of the Enron Kids Committee He has again volunteered to be the GPG coordinator for those of you interested in adopting or contributing to the Enron Kids Christmas campaign This year the Committee has adopted HISDs Burrus Elementary If youre not familiar with Enron Kids this is the program where Enron adopts all the kids in a local school where a majority of the families are living near or below the poverty line The adoption consists of groups of employees selecting one or more children and buying a full set of clothes including socks underwear shoes and an overcoat plus a toy and book The approximate cost is per child adopted All the gifts are distributed by the Committee during a party at the school several weeks before Christmas In a lot of cases our gifts are the only things the kids will get this year If youre interested in participating Heres what you do Reply via email to Kevin Hyatt with your anticipated donation Kevin will be in charge of collecting funds and coordinating the buying of presents If you or your spouse or significant other want to volunteer to assist with the shopping please let him know Kevin will provide a daily update of the donations total Please let Kevin know your donation by Tuesday November We will adopt the maximum number of kids on Wednesday November Thanks for your assistance
<32931877.1075844081097.JavaMail.evans@thyme>,ets.announcement@enron.com,2000-11-10 09:42:00,ETS Operations Technical Services Organizationmission of ETS Operations Technical Services OTS remains unchanged Our goal is to be an integral part of field operations provide the highest level of technical support possible and assist the field operations teams in achieving their objectives To that end and as a part of ETSs ongoing transition of merging ETSs and EOTTs Operations I am pleased to announce a realignment of ETS Operations Technical Services The purpose of these changes is to better align our technical resources with the new Operations Areas and teams and better serve their needs Therefore we will form Area Technical Support Teams for each of the Technical disciplines Corrosion Measurement and Controls Electrical Max Brown Director of Corrosion Services will lead the Corrosion teams Kenneth Cessac Director of Measurement Services will have responsibility for the Measurement Support teams Ken Crowl Director of Controls and Electrical Services will provide leadership to the CE teams Steve Klimesh Business Consultant will provide ongoing support to ETS on UAF and other continuous improvement initiatives The Clifton and Beaver machines shops will remain a part of OTS as we continue to grow the Enron Machine and Mechanical Services business The attached organizational charts show the new Tech Services The vacancies reflected on the charts are an effort to shore up our technical support staff for operating the EOTT assets In the coming weeks our Technical Support Teams will be further defining their support roles to the Region and team level and working diligently to fill these vacancies Any thoughts or comments that you might have regarding these changes are certainly appreciated Please feel free to call me or any of the OTS Directors with your feedback or for assistance Our goal is to continue to provide the best service possible to you our customers
<5702207.1075844081119.JavaMail.evans@thyme>,ets.announcement@enron.com,2000-11-10 09:42:00,Floor Meeting with John Sherriffjoin me for a floor meeting on Nov at am for an open discussion with John Sherriff President and CEO of Enron Europe John will share the direction of Enron Europe and the power industry as well as answer questions The meeting will take place on the st floor by the Fax Center If you prefer to presubmit questions please forward them via email to Kimberly Nelson before Nov I look forward to seeing you on Nov Dan
<5538190.1075844081142.JavaMail.evans@thyme>,ets.announcement@enron.com,2000-11-10 09:43:00,Thank youthis one is going to Enron Transportation Services Houston I want to take a moment to say thank you to all the employees who participated in the ETS Food Toy Drive We delivered over boxes of food and toys on Friday to the Downtown location of the Head Start program There are many people in the Houston community who need our help and support especially during the Holiday Season Through your kindness the Head Start Program ETS adopted United Way agency will be able to help those less fortunate The pictures below capture some of our employees displaying the donations that were collected in the Enron building The collections in Three Allen Center were significant as well Thank you again for your overwhelming generosity
<13691419.1075844082730.JavaMail.evans@thyme>,ets.announcement@enron.com,2000-11-21 04:57:00,EnronETS Code of Ethicsofficers of the company we would like to reiterate that we are all responsible for conducting the business affairs of the Company in accordanc e with all applicable laws and in a moral and honest manner At this particular point in time we would like to revisit our Business Ethics policy Employees of the Company are charged with conducting their business af fairs in accordance with the highest ethical standards An employee shall not conduct himself or herself in a manner which directly or indirectly would be detrimental to the best interests of the Company or in a manner which woul d bring to the employee financial gain separately derived as a direct consequence of his or her employment with the Company Please realize conducting our business affairs in accordance with the highest ethical standards should be reflected in all communications T his applies to communication via person to person telephone correspondence f ax and email We particularly want to address the importance of absolute integrity in your communications via email and any attached documents or graphics If further clarification is needed please contact your AdvisorDirector for any questions or concerns We are available to discus s these issues as well The Code of Ethics was revised in July of this year and every employee was asked to sign a new Certificate of Compliance statement This signed statement serves as your personal agreement to comply with the policies set forth during the term of your employment with the Company The Code of Ethics booklet and the Certificate of Compliance are avaliable to all employees on the Enron Home Page at You may access them by clicking on Code of Ethics We are proud of Enron and we want it to continue to enjoy a reputation for fairness and honesty that is respected Lets keep that reputation high 
