Message_id,From,Time_stamp,Text
<641668.1075846741573.JavaMail.evans@thyme>,flycheap@promos.flycheap.com,2000-12-12 13:16:00,Fun in the Sun Fares from Roundtrip Dear Flycheapcom Member You are receiving this email because you are a registered user of flycheapcom and have indicated that you would like to receive travel specials from us Heres what youll find in todays newsletter START OFF THE NEW YEAR WITH FUN IN THE SUN FARES fcasp Now that Holiday Stress is in full swing you need to start planning that quick getaway break There is no better way to relax and rejuvenate yourself than catching a flight to one of our Fun in the Sun destinations New York to Ft Lauderdale Chicago to Honolulu Philadelphia to Tampa RaleighDurham to Orlando Just click below for even more cities and rates fcasp Remember Fly Smart Fly Cheap at FLYCHEAPCOM SEARCH FOR HOTELS ONLINE lodging Now that youve booked your flights search for hotels on Flycheapcoms sister site mytravelcocom On the mytravelcocom Hotel Search Engine you can reserve online at one of our hotels resorts and inns It is safe and secure and youll find some of the best Hotel Rates in the industry Click Below to Begin Your Hotel Search lodging HOT CRUISE DEALS Discover everything cruising was meant to be and see why the Norwegian Way is a better way Prepare yourself for sumptuous meals in grand restaurants candlelight dinners in cozy bistros a soothing massage or a soak in the Hot Tub Norwegian Cruise Line has something for everyone First Time Cruisers and Experienced Cruise Veterans will want to take advantage of these outstanding last minute deals Click the links below for detailed itineraries For reservations please call SEASAVER Norwegian Sea Night Key West Bahamas from Miami pp cruiseshotdealsdealpageaspidseass Inside Cabins per person Oceanview Cabins per person January or The Norway Night Eastern Caribbean from Miami pp cruiseshotdealsdealpageaspidseass Inside Cabins Upper Lowers per person Inside Cabins lowers per person Oceanview Cabins per person January and January All of these cruise rates are without airfare However you can find the best air rates on Flycheapcom When planning your air travel to catch a cruise plan to arrive no later than pm on day of cruise departure and no earlier than noon when your cruise returns A quick check on Flycheapcom gave the following rates to Miami or Ft Lauderdale for the January departure of the Norwegian Sea listed above Please visit flycheapcom for your air gateway Newark to Ft Lauderdale Atlanta to Miami Dallas to Ft Lauderdale Please visit Flycheapcom to check the lowest airfares to catch your next cruise vacation This email is free service of Flycheapcom and Travel Services International For more information please visit To unsubscribe from flycheapcom please click here removeasp DISCLAIMER All fares require a day roundtrip advance purchase a Saturday night stay and travel must take place on Tues Wed or Thurs only Fares quoted are valid for the period to and must be ticketed by Domestic fares include Federal Excise Tax fuel surcharge and delivery fees Fares do not include airport PFC charges where applicable and segment fees of per takeofflanding and service charge Fares are nonrefundable and may not be available on all flights Cruise Fares All rates are per person double occupancy cruise only and include port charges unless otherwise indicated above All rates are based on availability and may go up sell out or be withdrawn at any time Copyright Travel Services International CST 
<5738404.1075861117105.JavaMail.evans@thyme>,flycheap@promos.flycheap.com,2002-02-14 13:08:28,Visit ParadiseHonolulu Hawaii from February Dear Flycheapcom Member You a re receiving this email because you are a registered user of Flycheapcom a nd have indicated that you would like to receive travel specials from us Heres what youll find in todays Flycheap newsletter Honolu lu Airfares from Roundtrip Honolulu Vacation Packages from Top Cruise Deals as low as Vacation Rentals Nt Las Ve gas from per person Reserve your Hotel Room online and Save For more information please visit wwwflycheapcom VISIT PARADISEHONOLULU HAWAII FROM Have you ever wondered if there was such a thing as parad ise Well there is and you dont even have to leave the country to experie nce it Paradise is a place where the average annual temperature is a perf ect degrees thanks to a moderate tropical climate influenced by the warm Pacific Ocean Paradise otherwise known as Hawaii is just a few hours w est of the California coast If you have never been to the Hawaiian Island s dont miss out on this opportunity to see one of the most beautiful plac es in the world These roundtrip airfares to Honolulu Hawaii found on Fl yCheapcom include all taxes and surcharges Los Angeles San Francisco Phoenix Seattle Denver Dallas Chicago New O rleans Detroit New York Fares available from where you live to everywhere you wan t to go Visit wwwflycheapcom for even more great fares Remember to Fly Smart Fly Cheap at FLYCHEAPCOM HONOLULU HAWAII VACATION PACKAGES FROM Call FLY CHEAP or visit wwwflycheapcom The H awaiian islands offer lush tropical foliage impressive volcanic mountain p eaks world class beaches and the beautiful blue waters of the Pacific Oce an FlyCheap Vacations offers packages to Oahu Maui Kauai and the islan d of Hawaii which is also called the Big Island Book now to take advanta ge of these great deals Honolulu Hawaii vacation packages include night s accommodation at the listed resort airfare via American Airlines and a compact rental car from Alamo Ohana Maile Sky Court Aston Waikiki Grand New York Boston Chicago Dallas Denver Los Angeles Miami New York Boston Chicago Dallas Denver Los Angeles Miami Outrigger Islander Waikiki Pacific Beach Hotel New York Boston Chicago Dallas Denver Los Angeles Miami New York Boston Chicago Dallas Denver Los Angeles Miami Package rates are available from over cities to over resorts in Hawaii Call FLY CHEAP or visit wwwflycheapcom ADDITIONAL GREAT PROMOTIONS NOW AVAILABLE th Night Free at all Ohana hotels in Waikiki Hawaii fr om through th Night Free at the Kauai Coconut Beach Res ort in Kauai Hawaii through th Night Free at select Outrigge r and Ohana hotels in Hawaii from through th Night Free at the Royal Lahaina Resort in Maui Hawaii through th Night Free at King Kamehamehas Kona Beach Hotel in KailuaKona Hawaii through th Night Free at the Radisson Kauai Beach Resort in Kauai Haw aii through th Night Free at the Comfort Suites Maingate East in Orlando Florida through th Night Free at the Days Suites Maingate East in Orlando Florida through th Night Free at S heratons Vistana Resort and Sheratons Vistana Villages in Orlando Florid a through th Night Free at the Comfort Suites in the Turks Caicos through Remember to Fly Smart Fly Cheap at FLYCHEAPCO M TOP CRUISE DEALS Mexican Baja Nights sailing from Los Angeles fr om Caribbean Nights on Royal Caribbean from only Transatlantic Aboard the QE from including airfare For ot her hot cruise deals visit wwwmytravelcom VACATION RENTAL SPECIAL Las Vegas NV night stay for just per person Relax in highroller style at the Fairfield Grand Desert This brand new l uxury resort is just two blocks from the Las Vegas Strip total cost including taxes for a bedroom condo Per person pricing based upon quad occupancy Click here for more details RESERVE YOUR HOTEL ROOM ONLINE Now that youve booked your flights search for hotels on Flycheapcoms sister site MyTravelcom On the MyTravelcom Hotel Search Engine you can reserve online at one of our hotels resorts and inn s It is safe and secure and youll find some of the best Hotel Rates in th e industry Click here to reserve your room online This email is free service of Flycheapcom and MyTravel U SA For more information please visit wwwflycheapcom You rec eived this mailing at this address To automatically u nsubscribe from Flycheapcom mailings please click here Flycheapcom is part of the MyTravel Group Click here for details Disclaimer Roundtrip fares require day advance purcha se Saturday night stay and Tuesday Wednesday or Thursday travel only Quoted fares valid and must be ticketed by Domes tic fares include all taxes and fees Fares nonrefundable and may not be available on all flights Package rates are per person double occupancy based on select midweek travel and include all air taxes and fees hotel taxes and car rental taxes and fees if applicable Packag e rates are limited do not include transfers and must be booked by Package rates that include car are based on a compact size car Top Cruise Disclaimer All rates are per person double occupancy cruise only do not include airfare and include port charges unless otherwise indicate d above Government fees and taxes are additional All rates are subject to availability and may go up sell out or be withdrawn by the cruise line a t any time Disclaimer for Vacation Rentals Rates shown are per unit for the specific time period listed and include applicable taxes Guests may n ot exceed maximum occupancy for specific unit purchased Rates may sell out at any time Additional dates and unit sizes are listed on the website FL Seller of Travel Reg No ST CST IA SOT Copyrig ht MyTravel USA
<33339419.1075861117679.JavaMail.evans@thyme>,flycheap@promos.flycheap.com,2002-02-19 13:48:18,Cruise the South of France with Free AirfareDear Flycheapcom Subscriber You are receiving this email because you are a registered user of Flycheapcom and have indicated that you would like to receive travel specials from us On occasion we are very pleased to offer fantastic travel specials from our sister companies AHI Travel is the premier operator of deluxe travel programs all over the world NT SOUTH OF FRANCE CRUISE WITH FREE AIR FROM ONLY ahitourintroprovcruia a hrefahitourintroprovcruiaClick Herea Embark on a most magnifique adventure through the romantic south of France land of inspiration to master artists van Gogh and Gauguin In Lyon board the deluxe MS Cezanne an intimate river cruise ship designed especially for navigating Frances provincial Rhone and Saone waterways Cruise for nights enjoying superb comfort delectable French cuisine and the highest quality of service as you leisurely sail through scenic ports such as Avignon Arles Lyon Tournon and Viviers PACKAGE AND PRICING Priced from per person package includes INCLUDES FREE TRANSATLANTIC AIR from the following gateways Atlanta Boston Chicago Newark New York Washington Dulles Add for departures from Los Angeles or San Francisco Ports of call include Lyon Trvoux Tournon Viviers Arles and Avignon with Optional Excursions available for further exploration All Meals onboard ship including wine with dinner Outside Cabin with private facilities television and airconditioning Roundtrip AirportShip Transfers TRAVEL DATES AND AVAILABILITY Vacation Dates are from April to April and space is very limited Click here for details ahitourintroprovcruia a hrefahitourintroprovcruiaClick Herea For more information and reservations read and click the link below or call AHI Travel directly at Click here for details ahitourintroprovcruia a hrefahitourintroprovcruiaClick Herea This email is a free service of Flycheapcom and MyTravel USA Flycheapcom and AHI Travel are part of the MyTravel Group aboutusmytravelasp a hrefaboutusmytravelaspClick herea You received this mailing at this address To automatically unsubscribe from Flycheapcom mailings please click here airdelphpemailaddress a hrefairdelphpemailaddressClick here to unsubscribea Terms and Conditions Prices are per person based on double occupancy Airport security taxes are at an additional cost Additional departure cities are available upon request FL Seller of Travel Reg No ST CST IA SOT Copyright MyTravel USA
<10171182.1075861117704.JavaMail.evans@thyme>,flycheap@promos.flycheap.com,2002-02-06 17:29:10,Escape the ColdFlorida Beaches from February Dear Flycheapcom Member You ar e receiving this email because you are a registered user of Flycheapcom an d have indicated that you would like to receive travel specials from us Heres what youll find in todays Flycheap newsletter Florida Beach Airfares from Roundtrip Florida Beach Vacation Packages fr om Top Cruise Deals from only Vacation Rentals Nights from per person Reserve your Hotel Room online and Save For more information please visit wwwflycheapcom FLORIDA BEACH AIRFARES FROM ROUNDTRIP Now is the perfect time to visit the Florida beaches Be the envy of all your neighbors Get a tropical tan without having to leav e the states From the panhandle to Key West from St Pete Beach to Miami Beach from Daytona to Naples the Sunshine State has some of the most bea utiful and wellknown beaches in the entire world These roundtrip airfar es to the Florida Beaches found on FlyCheapcom include all taxes and surch arges Fort Lauderdale New York Boston Denver Fort Myers New York Atlanta Dallas Miami Baltimore Chicago Philadelphia Palm Beach Houston New York Charlotte Ta mpa Raleigh Durham Minneapolis Pittsburgh Fares available from where you live to everywhere you wan t to go Visit wwwflycheapcom for even more great fares Remember to Fly Smart Fly Cheap at FLYCHEAPCOM FLORIDA BEACH VACATION PACKAGES FROM Call FLY CHEAP or visit wwwflycheapcom The F lorida beaches are more than just sand and sun You can enjoy fine dining visit beautiful museums or shop like never before Visit Busch Gardens in Tampa Metrozoo in Miami Sawgrass Mills Outlet Mall in Fort Lauderdale or the spring training home of your favorite baseball team Family vacation o r romantic getaway East coast or west coast Its your choice Book now to take advantage of these great deals and the fantastic Florida weather Fl orida beach vacation packages include nights accommodation at the listed resort airfare via American Airlines and a compact rental car from Alamo Fort Lauderdale Days Inn Bahia Cabana Fort Myers Beach Outr igger Beach Resort New York Boston Chicago Dallas Denver Los Angeles New York Boston Chicago Dallas Denver Los Angeles Jensen Beach Holiday Inn Oceanside Miami Beach RIU Florida Beach New York Boston Chicago Dallas Denver Los Angeles New York Boston Chicago Dallas Denver Los Angeles St Pete Beach TradeWinds Sandpiper New York Boston Chicago Dallas Denver Los Angeles Package rates are available from over cities to over resorts in Florida Call FLY CHEAP or visit wwwflycheapcom ADDITIONAL GREAT PROMOTIONS NOW AVAILABLE th Night Free at all Ohana hotels in Waikiki Hawaii fr om through th Night Free at the Kauai Coconut Beach Resor t in Kauai Hawaii through th Night Free at select Outrigger an d Ohana hotels in Hawaii from through th Night Free at t he Royal Lahaina Resort in Maui Hawaii through th Night Free at the Days Suites Maingate East in Orlando Florida through th N ight Free at Sheratons Vistana Resort and Sheratons Vistana Villages in O rlando Florida through Double Upgrades at the Kauai Coconut Bea ch Royal Lahaina and Royal Kona Resorts in Hawaii through R emember to Fly Smart Fly Cheap at FLYCHEAPCOM TOP CRUISE DEALS Caribbean Nights Aboard Royal Caribbean from Alaska Night Princess Glacier Cruise from only B ahamas Nights from Port Canaveral from For other hot cruise deals visit wwwmytravelcom VACATION RENTAL SPECIAL Cocoa Beach FL Night Stay for just Per Person Featuring luxurious bedroom bathroom condominiums and large private balconies The Resort on Cocoa Beach boasts a spectacular square foot pool and spa and a fabulous water playgrounda perfect playground for the entire family total cost including taxes for a bedroom condo P er person pricing based upon person occupancy Click here for more detail s RESERVE YOUR HOTEL ROOM ONLINE Now that youve booked your flights search for hotels on Flycheapcoms sister site MyTravelcom On the MyTravelcom Hotel Search Engine you can reserve online at one of our hotels resorts and inn s It is safe and secure and youll find some of the best Hotel Rates in th e industry Click here to reserve your room online This email is free service of Flycheapcom and MyTravel U SA For more information please visit wwwflycheapcom You rec eived this mailing at this address To automatically u nsubscribe from Flycheapcom mailings please click here Flycheapcom is part of the MyTravel Group Click here for details Disclaimer Roundtrip fares require day advance purcha se Saturday night stay and Tuesday Wednesday or Thursday travel only Quoted fares valid and must be ticketed by Dome stic fares include all taxes and fees Fares nonrefundable and may not be available on all flights Package rates are per person double occupancy based on select midweek travel and include all air taxes and fees hotel taxes and car rental taxes and fees if applicable Packag e rates are limited do not include transfers and must be booked by Package rates that include car are based on a compact size car Top Cruise Disclaimer All rates are per person double occupancy cruise only do not include airfare and include port charges unless otherwise indicate d above Government fees and taxes are additional All rates are subject to availability and may go up sell out or be withdrawn by the cruise line a t any time Disclaimer for Vacation Rentals Rates shown are per unit for the specific time period listed and include applicable taxes Guests may n ot exceed maximum occupancy for specific unit purchased Rates may sell out at any time Additional dates and unit sizes are listed on the website FL Seller of Travel Reg No ST CST IA SOT Copyrig ht MyTravel USA
<20787486.1075861117815.JavaMail.evans@thyme>,flycheap@promos.flycheap.com,2002-01-23 12:40:41,Springtime in Orlando from January Dear Flycheapcom Member You are receiving this email because you are a registered user of Flycheapcom and have indicated that you would like to receive travel specials from us Heres what youll find in todays Flycheap newsletter Orlando Airfares from Roundtrip Orlando Vacation Packages from Top Cruise Deals Resort Condominiums Nights from for up to guests Reserve your Hotel Room online and Save For more information please visit a hrefClick herea ORLANDO AIRFARES FROM ROUNDTRIP Get away from the cold The weather is beautiful in Florida during the springtime Enjoy sunny days and cool nights using these airfares found on FlyCheapcom These domestic airfares to Orlando are roundtrip and include all taxes and surcharges Raleigh Durham Boston New Orleans New York Philadelphia Washington DC Chicago Houston St Louis Seattle Las Vegas Los Angeles Phoenix Denver San Francisco Visit for even more great fares a hrefClick herea Remember Fly Smart Fly Cheap at FLYCHEAPCOM EXPERIENCE THE MAGIC OF AN ORLANDO VACATION FROM CALL FLY CHEAP or visit Dont put off that vacation Kids of all ages from to will enjoy Orlando and all it has to offer Book now to experience more action packed adventure thrilling rides and nonstop entertainment than ever before Orlando vacation packages include nights accommodation at the listed resort airfare via American Airlines and a compact rental car from Alamo Comfort Inn Lake Buena Vista Kids Eat Free Free Shuttle to Disney Theme Parks New York Boston Chicago Dallas Denver Los Angeles Miami Marriott Residence Inn Complimentary Buffet Breakfast New York Boston Chicago Dallas Denver Los Angeles Miami Hard Rock Hotel Located Onsite at Universal Studios Express Ride Access Early Theme Park Admission Priority Theme Park Restaurant Seating New York Boston Chicago Dallas Denver Los Angeles Miami Walt Disney World Dolphin Resort Complimentary Disney Transportation to all Disney Parks Located Onsite just a short walk from Epcot New York Boston Chicago Dallas Denver Los Angeles Miami Package rates are available from over cities to over resorts in Orlando CALL FLY CHEAP or visit WE ALSO HAVE THE FOLLOWING PROMOTIONS TO GREAT DESTINATIONS th Night Free at all Ohana hotels in Waikiki Hawaii from through th Night Free at the Kauai Coconut Beach Resort in Kauai Hawaii through th Night Free at the Pueblo Bonito Rose in Los Cabos Mexico through th Night Free at the Royal Lahaina Resort in Maui Hawaii through th Night Free at the Bolongo Bay Beach Club in St Thomas through th Night Free at La Cabana All Suite Beach Resort in Aruba through Double Upgrades at the Kauai Coconut Beach Royal Lahaina and Royal Kona Resorts in Hawaii through Visit for even more great fares a hrefClick herea Remember Fly Smart Fly Cheap at FLYCHEAPCOM TOP CRUISE DEALS Bahamas Night Cruise aboard Carnival from pp ssaspidtype a hrefssaspidtypeClick herea Caribbean Night Cruise from only pp WOW ssaspidtype a hrefssaspidtypeClick herea Mexican Riviera Nts from LA on Princess from ssaspidtype a hrefssaspidtypeClick herea For other hot cruise deals visit cruisesindexasptype a hrefcruisesindexasptypeClick herea RESORT CONDOMINIUM SPECIAL Orlando FL Nts in a Bedroom home just Total Price Just minutes from Walt Disney World Lake Berkley Resort is a collection of beautiful homes in an idyllic setting each with their own private heated swimming pool Perfect for the entire family a bedroom home accommodates up to guests total price including tax and nt stays and and bedroom homes also available Click here for more details mrasppropertydatesubregion a hrefmrasppropertydatesubregionClick herea This special resort offer is available through ResortEscapescom Click the link or call for details RESERVE YOUR HOTEL ROOM ONLINE lodging Now that youve booked your flights search for hotels on Flycheapcoms sister site MyTravelcom On the MyTravelcom Hotel Search Engine you can reserve online at one of our hotels resorts and inns It is safe and secure and youll find some of the best Hotel Rates in the industry lodging a hreflodgingClick herea This email is free service of Flycheapcom and MyTravel USA For more information please visit You received this mailing at this address To automatically unsubscribe from Flycheapcom mailings please click here airdelphpemailaddress a hrefairdelphpemailaddressClick here to unsubscribea Flycheapcom is part of the MyTravel Group MyTravelcocom is now MyTravel click here for details aboutusmytravelasp a hrefaboutusmytravelaspClick herea Disclaimer Roundtrip fares require day advance purchase Saturday night stay and Tuesday Wednesday or Thursday travel only Quoted fares valid and must be ticketed by Domestic fares include all taxes and fees International fares do not include taxes and fees of up to Fares nonrefundable and may not be available on all flights Package rates per person double occupancy based on select midweek travel and do not include air taxes and fees hotel taxes or transfers but do include car rental taxes and fees if applicable Package rates are limited and must be booked by Package rates including car are based on a compact size car Top Cruise Disclaimer All rates are per person double occupancy cruise only and include port charges unless otherwise indicated above Government fees and taxes are additional All rates are subject to availability and may go up sell out or be withdrawn by the cruise line at any time Disclaimer for Resort Condominium Rates shown are per unit for the specific time period listed and include applicable taxes Guests may not exceed maximum occupancy for specific unit purchased Rates may sell out at any time Additional dates and unit sizes are listed on the ResortEscapescom website FL Seller of Travel Reg No ST CST IA SOT Copyright MyTravel USA
