Message_id,From,Time_stamp,Text
<1283851.1075846788133.JavaMail.evans@thyme>,flycheap@promos.flycheap.com,2000-12-12 13:16:00,Fun in the Sun Fares from Roundtrip Dear Flycheapcom Member You are receiving this email because you are a registered user of flycheapcom and have indicated that you would like to receive travel specials from us Heres what youll find in todays newsletter START OFF THE NEW YEAR WITH FUN IN THE SUN FARES fcasp Now that Holiday Stress is in full swing you need to start planning that quick getaway break There is no better way to relax and rejuvenate yourself than catching a flight to one of our Fun in the Sun destinations New York to Ft Lauderdale Chicago to Honolulu Philadelphia to Tampa RaleighDurham to Orlando Just click below for even more cities and rates fcasp Remember Fly Smart Fly Cheap at FLYCHEAPCOM SEARCH FOR HOTELS ONLINE lodging Now that youve booked your flights search for hotels on Flycheapcoms sister site mytravelcocom On the mytravelcocom Hotel Search Engine you can reserve online at one of our hotels resorts and inns It is safe and secure and youll find some of the best Hotel Rates in the industry Click Below to Begin Your Hotel Search lodging HOT CRUISE DEALS Discover everything cruising was meant to be and see why the Norwegian Way is a better way Prepare yourself for sumptuous meals in grand restaurants candlelight dinners in cozy bistros a soothing massage or a soak in the Hot Tub Norwegian Cruise Line has something for everyone First Time Cruisers and Experienced Cruise Veterans will want to take advantage of these outstanding last minute deals Click the links below for detailed itineraries For reservations please call SEASAVER Norwegian Sea Night Key West Bahamas from Miami pp cruiseshotdealsdealpageaspidseass Inside Cabins per person Oceanview Cabins per person January or The Norway Night Eastern Caribbean from Miami pp cruiseshotdealsdealpageaspidseass Inside Cabins Upper Lowers per person Inside Cabins lowers per person Oceanview Cabins per person January and January All of these cruise rates are without airfare However you can find the best air rates on Flycheapcom When planning your air travel to catch a cruise plan to arrive no later than pm on day of cruise departure and no earlier than noon when your cruise returns A quick check on Flycheapcom gave the following rates to Miami or Ft Lauderdale for the January departure of the Norwegian Sea listed above Please visit flycheapcom for your air gateway Newark to Ft Lauderdale Atlanta to Miami Dallas to Ft Lauderdale Please visit Flycheapcom to check the lowest airfares to catch your next cruise vacation This email is free service of Flycheapcom and Travel Services International For more information please visit To unsubscribe from flycheapcom please click here removeasp DISCLAIMER All fares require a day roundtrip advance purchase a Saturday night stay and travel must take place on Tues Wed or Thurs only Fares quoted are valid for the period to and must be ticketed by Domestic fares include Federal Excise Tax fuel surcharge and delivery fees Fares do not include airport PFC charges where applicable and segment fees of per takeofflanding and service charge Fares are nonrefundable and may not be available on all flights Cruise Fares All rates are per person double occupancy cruise only and include port charges unless otherwise indicated above All rates are based on availability and may go up sell out or be withdrawn at any time Copyright Travel Services International CST 
<13159137.1075858936107.JavaMail.evans@thyme>,flycheap@promos.flycheap.com,2001-10-19 12:47:02,FlyCheapcom Every Airfare DiscountedOctober Dear Flycheapcom Member You are receiving this email because you are a registered user of flycheapcom and have indicated that you would like to receive travel specials from us Heres what youll find in todays Flycheap newsletter FlyCheapcom is discounting every airfare on our web site Lay Back on the Beach for Top Cruise Deals Hilton Grand Vacations Club in Las Vegas total price Reserve your Hotel Room online and Save For more information please visit FLYCHEAPCOM IS DISCOUNTING EVERY AIRFARE ON OUR WEB SITE To encourage air travel and to keep our country moving we are discounting every airfare on our web site for travel through Not only do you get the lowest airfare available but now you get something extra Every airfare is discounted an additional You can only get this discount by booking on FlyCheapcom Take advantage and visit your friends and family during this holiday season These domestic fares are roundtrip and include all taxes and surcharges Take an additional off these already low airfares New York Los Angeles Seattle Ft Lauderdale Chicago Orlando Boston Dallas New York San Juan Tampa San Diego Miami Atlanta Denver Baltimore Los Angeles San Francisco New York Las Vegas Phoenix Philadelphia St Louis Orlando Visit for even more great fares Remember Fly Smart Fly Cheap at FLYCHEAPCOM LAY BACK ON THE BEACH FOR Call FLYCHEAP or visit The beach is callingand there are no better beaches than in Florida Chose from the carnival atmosphere of Miamis South Beach to the relaxing tranquil atmosphere of St Petersburg Beach Package Includes Nights Accommodation at the listed resort airfare via USAirways and an Alamo compact car Package rates are available from over cities to Resorts in Ft Lauderdale Miami Tampa Daytona Ft Myers and West Palm Beach Ft Lauderdale Best Western Oceanside New York Boston Chicago Dallas Denver Los Angeles Miami Holiday Inn Southbeach Resort New York Boston Chicago Dallas Denver Los Angeles Tampa Tradewinds Sandpiper on St Pete Beach Resort New York Boston Chicago Dallas Denver Los Angeles Visit for even more great fares Remember Fly Smart Fly Cheap at FLYCHEAPCOM TOP CRUISE DEALS Royal Caribbean Nt Bahamas Cruise from pp ssaspidtype Norwegian Nt Southern Caribbean Cruise from pp ssaspidtype Carnival Nt Bahamas Cruise from Pt Canaveral from pp ssaspidtype For other hot cruise deals visit cruisesindexasptype HILTON GRAND VACATIONS CLUB AT LAS VEGAS HILTON TOTAL PRICE nights in a studio suite Total price for guests including tax Reminiscent of an upscale private club setting with an atmosphere of comfortable elegance Click below for more details mrasppropertydatesubregion This special Florida resort offer is available through MyResortscom Click the link or call for details RESERVE YOUR HOTEL ROOM ONLINE lodging Now that youve booked your flights search for hotels on Flycheapcoms sister site mytravelcocom On the mytravelcocom Hotel Search Engine you can reserve online at one of our hotels resorts and inns It is safe and secure and youll find some of the best Hotel Rates in the industry lodging This email is free service of Flycheapcom and Travel Services International For more information please visit To unsubscribe from flycheapcom please click here removeasp Disclaimer Roundtrip fares require day advance purchase Saturday night stay and Tuesday Wednesday or Thursday travel only Quoted fares valid and must be ticketed by Domestic fares include all taxes and fees International fares do not include taxes and fees of up to Fares nonrefundable and may not be available on all flights discount applies to base airfare and is not applied to taxes or surcharges Package rates per person double occupancy based on select midweek travel and do not include air taxes and fees hotel taxes or transfers but do include car rental taxes and fees if applicable Package rates are limited and rates including car are based on a compact size car Top Cruise Disclaimer All rates are per person double occupancy cruise only and include port charges unless otherwise indicated above Government fees and taxes are additional All rates are subject to availability and may go up sell out or be withdrawn by the cruise line at any time Rates are for new reservations only Disclaimer for Hilton Las Vegas Resort Rates shown are per unit for the specific time period listed and include applicable taxes Guests may not exceed maximum occupancy for specific unit purchased Rates may sell out at any time Additional dates and unit sizes are listed on the myresortscom website FL Seller of Travel Reg No ST CST IA SOT Copyright Travel Services International Inc
<11426758.1075861134253.JavaMail.evans@thyme>,flycheap@promos.flycheap.com,2002-03-01 14:13:33,Airfares as low as on Flycheapcom March Dear Flycheapcom Member You are receiving thi s email because you are a registered user of Flycheapcom and have indicate d that you would like to receive travel specials from us Heres what yo ull find in todays Flycheap newsletter Airfares from Rou ndtrip Top Cruise Deals Caribbean as low as Vacation Ren tals Nights from Per Person Reserve your Hotel Room online an d Save For more information please visit wwwflycheapcom CHECK OUT THESE GREAT AIRFARES STARTING AT These roundtrip airfares found on FlyCheapcom include all taxes and surcharges San Diego to Las Vegas Raleigh Durham to Orlando Los Angeles to San F rancisco Pittsburgh to Chicago San Francisco to Portland Cincinnati to W ashington DC New York to Ft Lauderdale New York to Orlando Houston to Tampa Seattle to Salt Lake City Charlotte to Miami Chicago to New Orle ans Atlanta to New York Detroit to Dallas Fares available from where you live to everywhere you want to go C all FLY CHEAP or visit wwwflycheapcom Remember to Fly Smart Fly Cheap at FLYCHEAPCOM TOP CRUISE DEALS Royal Caribbean Nt Western Caribbean from Carni val Nt Caribbean from Princess Nt Alaska Cruise from o nly For other hot cruise deals visit wwwmytravelcom VACATION RENTAL SPECIAL Naples FL Nights from Per Person In the heart of Naples and off the beaten path Park Shore Resort features colorful foliage vibra nt blooms and two picturesque waterfallsthe perfect place to make vacation memories From total price including tax for a bedroom condo for guests Per person pricing based upon quad occupancy Click here for mor e details RESERVE YOUR HOTEL ROOM ONLINE Now that youve booked your flights search for hotels on Flycheapco ms sister site MyTravelcom On the MyTravelcom Hotel Search Engine you can reserve online at one of our hotels resorts and inns It is saf e and secure and youll find some of the best Hotel Rates in the industry Click here to reserve your room online This email is free service of Flycheapcom and MyTravel USA For mo re information please visit wwwflycheapcom You received this m ailing at this address To automatically unsubscribe f rom Flycheapcom mailings please click here Flycheapcom is part of the MyTravel Group Click here for details Disclaimer Roundtrip fares require day advance purchase Saturday night stay and Tuesday Wednesday or Thursday travel only Quoted fares valid and must be ticketed by Domestic fares in clude all taxes and fees Fares nonrefundable and may not be available on all flights Top Cruise Disclaimer All rates are per person double occupancy cruise only do not include airfare and include port charges un less otherwise indicated above Government fees and taxes are additional A ll rates are subject to availability and may go up sell out or be withdra wn by the cruise line at any time Disclaimer for Vacation Rentals Rates shown are per unit for the specific time period listed and include applica ble taxes Guests may not exceed maximum occupancy for specific unit purcha sed Rates may sell out at any time Additional dates and unit sizes are li sted on the website FL Seller of Travel Reg No ST CST IA SOT Copyright MyTravel USA
<14503406.1075861134489.JavaMail.evans@thyme>,flycheap@promos.flycheap.com,2002-03-06 15:37:31,Great Airfares from Flycheapcom March Dear Susan You are receiving this email because you are a registered user of Flycheapcom and have indicated that you would like to receive travel specials from us Heres what youll find in tod ays Flycheap newsletter Great AirfaresIncluding NYC to Orla ndo for Top Cruise Deals as low as Vacation Rentals Nights at Sanibel Island FL Reserve your Hotel Room online and S ave For more information please visit wwwflycheapcom GREAT AIRFARESINCLUDING NYC TO ORLANDO FOR These roundtrip airfares found on FlyCheapcom include all taxes and surcharges Boston to Raleigh Durham New York to Orlando Boston to Atlanta Balti more to San Diego New York to Chicago Chicago to Orlando Philadelphia to Miami Philadelphia to Houston Baltimore to Dallas Seattle to Fort Laud erdale New York to Denver Los Angeles to Dallas Denver to Atlanta Phila delphia to Los Angeles Seattle to Denver Fares available from where you live to everywhere you want to go C all FLY CHEAP or visit wwwflycheapcom Remember to Fly Smart Fly Cheap at FLYCHEAPCOM TOP CRUISE DEALS Royal Caribbean Nt Bahamas Cruise from Carnival Nt Caribbean from Princess Nt Alaska Cruise on a NEW sh ip from For other hot cruise deals visit wwwmytravelcom VACATION RENTAL SPECIAL Sanibel Island FL night stay from just per person A lux urious homelike setting in a prime gulffront location Sundial Beach Reso rt provides plenty of activities and fun for the entire family From just total cost for a bedroom condo Per person pricing based upon qua d occupancy Click here for more details RESERVE YOUR HOTEL ROOM ONLINE Now that youve booked your flights search for hotels on Flycheapco ms sister site MyTravelcom On the MyTravelcom Hotel Search Engine you can reserve online at one of our hotels resorts and inns It is saf e and secure and youll find some of the best Hotel Rates in the industry Click here to reserve your room online This email is free service of Flycheapcom and MyTravel USA For mo re information please visit wwwflycheapcom You received this m ailing at this address To unsubscribe from Flycheapc om mailings or change your mailing preferences please click here Flyc heapcom is part of the MyTravel Group Click here for details Airfare Terms and Conditions Roundtrip fares require day advance purchase Saturday night stay and Tuesday Wednesday or Thursday travel o nly Quoted fares valid and must be ticketed by Domestic fares include all taxes and fees Fares nonrefundable and may not be available on all flights Cruise Terms and Conditions All rates a re per person double occupancy cruise only do not include airfare and i nclude port charges unless otherwise indicated above Government fees and t axes are additional All rates are subject to availability and may go up s ell out or be withdrawn by the cruise line at any time Vacation Rentals Terms and Conditions Rates shown are per unit for the specific time perio d listed and include applicable taxes Guests may not exceed maximum occupa ncy for specific unit purchased Rates may sell out at any time Additional dates and unit sizes are listed on the website FL Seller of Travel Re g No ST CST IA SOT Copyright MyTravel USA 
<27629751.1075846790951.JavaMail.evans@thyme>,flycheap@promos.flycheap.com,2000-12-12 13:16:00,Fun in the Sun Fares from Roundtrip Dear Flycheapcom Member You are receiving this email because you are a registered user of flycheapcom and have indicated that you would like to receive travel specials from us Heres what youll find in todays newsletter START OFF THE NEW YEAR WITH FUN IN THE SUN FARES fcasp Now that Holiday Stress is in full swing you need to start planning that quick getaway break There is no better way to relax and rejuvenate yourself than catching a flight to one of our Fun in the Sun destinations New York to Ft Lauderdale Chicago to Honolulu Philadelphia to Tampa RaleighDurham to Orlando Just click below for even more cities and rates fcasp Remember Fly Smart Fly Cheap at FLYCHEAPCOM SEARCH FOR HOTELS ONLINE lodging Now that youve booked your flights search for hotels on Flycheapcoms sister site mytravelcocom On the mytravelcocom Hotel Search Engine you can reserve online at one of our hotels resorts and inns It is safe and secure and youll find some of the best Hotel Rates in the industry Click Below to Begin Your Hotel Search lodging HOT CRUISE DEALS Discover everything cruising was meant to be and see why the Norwegian Way is a better way Prepare yourself for sumptuous meals in grand restaurants candlelight dinners in cozy bistros a soothing massage or a soak in the Hot Tub Norwegian Cruise Line has something for everyone First Time Cruisers and Experienced Cruise Veterans will want to take advantage of these outstanding last minute deals Click the links below for detailed itineraries For reservations please call SEASAVER Norwegian Sea Night Key West Bahamas from Miami pp cruiseshotdealsdealpageaspidseass Inside Cabins per person Oceanview Cabins per person January or The Norway Night Eastern Caribbean from Miami pp cruiseshotdealsdealpageaspidseass Inside Cabins Upper Lowers per person Inside Cabins lowers per person Oceanview Cabins per person January and January All of these cruise rates are without airfare However you can find the best air rates on Flycheapcom When planning your air travel to catch a cruise plan to arrive no later than pm on day of cruise departure and no earlier than noon when your cruise returns A quick check on Flycheapcom gave the following rates to Miami or Ft Lauderdale for the January departure of the Norwegian Sea listed above Please visit flycheapcom for your air gateway Newark to Ft Lauderdale Atlanta to Miami Dallas to Ft Lauderdale Please visit Flycheapcom to check the lowest airfares to catch your next cruise vacation This email is free service of Flycheapcom and Travel Services International For more information please visit To unsubscribe from flycheapcom please click here removeasp DISCLAIMER All fares require a day roundtrip advance purchase a Saturday night stay and travel must take place on Tues Wed or Thurs only Fares quoted are valid for the period to and must be ticketed by Domestic fares include Federal Excise Tax fuel surcharge and delivery fees Fares do not include airport PFC charges where applicable and segment fees of per takeofflanding and service charge Fares are nonrefundable and may not be available on all flights Cruise Fares All rates are per person double occupancy cruise only and include port charges unless otherwise indicated above All rates are based on availability and may go up sell out or be withdrawn at any time Copyright Travel Services International CST 
