Message_id,From,Time_stamp,Text
<31569992.1075861118362.JavaMail.evans@thyme>,flycheap@promos.flycheap.com,2002-02-22 13:45:20,Great Airfares on Flycheapcom from February Dear Flycheapcom Member You are receiving this email because you are a registered user of Flycheapcom and have indi cated that you would like to receive travel specials from us Heres wha t youll find in todays Flycheap newsletter Great Airfares fro m Roundtrip Top Cruise Deals as low as Vacation Ren tals Nt Key Largo from per person Reserve your Hotel Room onl ine and Save For more information please visit wwwflycheapcom CHECK OUT THESE GREAT AIRFARES These roundtrip airfares found on FlyCheapcom include all taxes and surcharges Phoenix to Las Vegas San Francisco to Los Angeles Raleigh Durham to F t Lauderdale Kansas City to New Orleans Pittsburgh to Atlanta Detroit to Omaha Hartford to Orlando New York to West Palm Beach San Diego to Albu querque Salt Lake City to Seattle Washington DC to Dallas Charlotte to T ampa Chicago to Las Vegas Cincinnati to Houston Fares available from where you live to everywhere you want to go C all FLY CHEAP or visit wwwflycheapcom Remember to Fly Smart Fly Cheap at FLYCHEAPCOM TOP CRUISE DEALS Caribbean Nt Grand Princess from with upgrades Bahamas Nights on Carnival from only Alaska Cruisetou r Nights on the Ocean Princess from For other hot cruise d eals visit wwwmytravelcom VACATION RENTAL SPECIAL Key Largo FL night stay from just per person Everything you could want for a perfect Florida vacationtropical elegance luxurious suites and a myriad of activities await you at Ocean Pointe Suites From just total cost including taxes for a bedroom condo Per person pr icing based upon quad occupancy Click here for more details RESERVE YOUR HOTEL ROOM ONLINE Now that youve booked your flights search for hotels on Flycheapco ms sister site MyTravelcom On the MyTravelcom Hotel Search Engine you can reserve online at one of our hotels resorts and inns It is saf e and secure and youll find some of the best Hotel Rates in the industry Click here to reserve your room online This email is free service of Flycheapcom and MyTravel USA For mo re information please visit wwwflycheapcom You received this m ailing at this address To automatically unsubscribe f rom Flycheapcom mailings please click here Flycheapcom is part of the MyTravel Group Click here for details Disclaimer Roundtrip fares require day advance purchase Saturday night stay and Tuesday Wednesday or Thursday travel only Quoted fares valid and must be ticketed by Domestic fares in clude all taxes and fees Fares nonrefundable and may not be available on all flights Top Cruise Disclaimer All rates are per person double occupancy cruise only do not include airfare and include port charges un less otherwise indicated above Government fees and taxes are additional A ll rates are subject to availability and may go up sell out or be withdra wn by the cruise line at any time Disclaimer for Vacation Rentals Rates shown are per unit for the specific time period listed and include applica ble taxes Guests may not exceed maximum occupancy for specific unit purcha sed Rates may sell out at any time Additional dates and unit sizes are li sted on the website FL Seller of Travel Reg No ST CST IA SOT Copyright MyTravel USA
<4527581.1075861110989.JavaMail.evans@thyme>,flycheap@promos.flycheap.com,2002-01-15 18:13:16,Airline Sale Fares from RoundtripJanuary Dear Flycheapcom Member You are receiving this email because you are a registered user of Flycheapcom and have indicated that you would like to receive travel specials from us Heres what youll find in todays Flycheap newsletter Airline Sale Fares from Roundtrip off of Airfare on Hawaii Vacations Top Cruise Deals Nights from only pp Resort Condominiums Nights from per person Reserve your Hotel Room online and Save For more information please visit a hrefClick herea AIRLINE SALE FARES FROM ROUNDTRIP These domestic fares are roundtrip and include all taxes and surcharges Pittsburgh Chicago Kansas City New Orleans New York City Ft Lauderdale Philadelphia Chicago Raleigh Durham Tampa Ft Lauderdale San Juan Washington Tucson Baltimore San Diego Seattle Houston Orlando Reno New York Los Angeles Los Angeles San Francisco Boston Las Vegas Atlanta Salt Lake City Portland OR Dallas Fares available from where you live to everywhere you want to go Visit for even more great fares a hrefClick herea Remember Fly Smart Fly Cheap at FLYCHEAPCOM OFF of AIRFARE ON HAWAII VACATIONS CALL FLY CHEAP or visit American Airlines reduced their rates to Hawaii by for travel through This is a great time to book a Hawaiian Vacation of a Lifetime You have to book by January to get the reduced airfare Package Includes Nights Accommodation at the listed resort and airfare via American Airlines Package rates are available from over cities to Resorts in Hawaii Aston Waikiki Grand Overlooking Waikiki Beach and Kapiolani Park New York Boston Chicago Dallas Denver Los Angeles Miami Ohana Waikiki Surf Blocks from the Beach in the middle of shops and restaurants New York Boston Chicago Dallas Denver Los Angeles Miami Outrigger Reef Right on Waikiki Beach New York Boston Chicago Dallas Denver Los Angeles Miami Sheraton Princess Kaiulani In the heart of Waikiki located across the street from the beach Offering a th night Free promotion New York Boston Chicago Dallas Denver Los Angeles Miami CALL FLY CHEAP or visit WE ALSO HAVE THE FOLLOWING PROMOTIONS TO GREAT DESTINATIONS Reduced Rates at the Monte Carlo Casino in Las Vegas through Reduced Rates at the Sheratons in Honolulu Maui and Kauai through th Night Free at the Bolongo in St Thomas through Reduced Rates at the Comfort Inn Lake Buena Vista in Orlando through Reduced Rates at the Courtyard Little Lake Bryan in Orlando through th night free at La Cabana All Suite Resort in Aruba through Reduced Rates at the Ritz Carlton in Cancun through Visit for even more great fares a hrefClick herea Remember Fly Smart Fly Cheap at FLYCHEAPCOM TOP CRUISE DEALS Caribbean Nts on the SmokeFree Paradise from pp ssaspidtype a hrefssaspidtypeClick herea Bahamas Weekend Nights on Carnival from only pp This Last Minute Deal will Sell Quickly ssaspidtype a hrefssaspidtypeClick herea Europe Night TransAtlantic and Rome Cruisetour Includes nights hotel and sightseeing in Rome from pp ssaspidtype a hrefssaspidtypeClick herea For other hot cruise deals visit cruisesindexasptype a hrefcruisesindexasptypeClick herea RESORT CONDOMINIUM SPECIAL Maui HI Nights from per person A acre tropical paradise awaits you at Kamaole Sands Resort Enjoy a relaxed vacation setting filled with fish ponds flower blossoms gardens waterfalls and one of Mauis finest beaches total price including tax Per person price based upon quad occupancy Click here for more details mrasppropertydatesubregion a hrefmrasppropertydatesubregionClick herea This special resort offer is available through ResortEscapescom Click the link or call for details RESERVE YOUR HOTEL ROOM ONLINE lodging Now that youve booked your flights search for hotels on Flycheapcoms sister site MyTravelcom On the MyTravelcom Hotel Search Engine you can reserve online at one of our hotels resorts and inns It is safe and secure and youll find some of the best Hotel Rates in the industry lodging a hreflodgingClick herea This email is free service of Flycheapcom and MyTravel USA For more information please visit You received this mailing at this address To automatically unsubscribe from Flycheapcom mailings please click here airdelphpemailaddress a hrefairdelphpemailaddressAOL Users Click here to unsubscribea Flycheapcom is part of the MyTravel Group MyTravelcocom is now MyTravel click here for details aboutusmytravelasp a hrefaboutusmytravelaspClick herea Disclaimer Roundtrip fares require day advance purchase Saturday night stay and Tuesday Wednesday or Thursday travel only Domestic fares valid and must be ticketed by Domestic fares include all taxes and fees International fares do not include taxes and fees of up to Fares nonrefundable and may not be available on all flights Package rates per person double occupancy based on select midweek travel and do not include air taxes and fees hotel taxes or transfers but do include car rental taxes and fees if applicable Packages must be booked by to receive the reduced airfare promotion Package rates are limited and rates including car are based on a compact size car Top Cruise Disclaimer All rates are per person double occupancy cruise only and include port charges unless otherwise indicated above Government fees and taxes are additional All rates are subject to availability and may go up sell out or be withdrawn by the cruise line at any time Disclaimer for Resort Condominium Rates shown are per unit for the specific time period listed and include applicable taxes Guests may not exceed maximum occupancy for specific unit purchased Rates may sell out at any time Additional dates and unit sizes are listed on the ResortEscapescom website FL Seller of Travel Reg No ST CST IA SOT Copyright MyTravel USA
<5230050.1075861111223.JavaMail.evans@thyme>,flycheap@promos.flycheap.com,2002-01-08 15:24:34,Warm Up on a Florida Beach from January Dear Flycheapcom Member You are receiving this email because you are a registered user of Flycheapcom and have indicated that you would like to receive travel specials from us Heres what youll find in todays Flycheap newsletter Warm Up on a Florida Beach from Florida Vacations from Top Cruise Deals Nt Royal Caribbean from St Thomas USVI Nights from per person Reserve your Hotel Room online and Save For more information please visit a hrefAOL Users Click herea WARM UP ON A FLORIDA BEACH FROM Tired of the bleak northern winter Just need a short family vacation The sunshine state offers it all From any point in Florida a beach is no more than miles away Take your pick from the miles of spectacular sandy beaches Orlando is the home of the Family Vacation with Walt Disney World Universal Studios Sea World and just a short trip to Busch Gardens Tampa FLORIDA AIRFARES FROM These fares are roundtrip to Florida and include all taxes and surcharges Raleigh Tampa New York Ft Lauderdale Boston Tampa Los Angeles Tampa Syracuse Miami Chicago Ft Lauderdale Philadelphia Ft Lauderdale Denver Miami Detroit Ft Lauderdale Memphis Miami Richmond Miami Seattle Tampa Dallas Miami Atlanta Miami Baltimore Tampa Fares available from where you live to everywhere you want to go Visit for even more great fares a hrefClick herea Remember Fly Smart Fly Cheap at FLYCHEAPCOM FLORIDA VACATION PACKAGES FROM CALL FLY CHEAP or visit Florida Vacation Packages Include Nights Accommodation at the listed resort airfare via American Airlines or US Airways Package rates are available from over cities to Resorts in Florida Best Western Oceanside in Ft Lauderdale New York Boston Chicago Dallas Denver Los Angeles Holiday Inn South Beach Resort in Miami New York Boston Chicago Dallas Denver Los Angeles Tradewinds Sandpiper in St Petersburg New York Boston Chicago Dallas Denver Los Angeles Comfort Suites Lake Buena Vista in Orlando New York Boston Chicago Dallas Denver Los Angeles CALL FLY CHEAP or visit WE ALSO HAVE THE FOLLOWING PROMOTIONS TO GREAT DESTINATIONS Reduced Rates at the Monte Carlo Casino in Las Vegas through th Night Free at the Hyatt Cancun Caribe in Cancun through Reduced Rates at the Copacabana in Acapulco through th Night Free at the Condado Beach Resort in San Juan through th Night Free and room upgrade at the Wyndham El San Juan or El Conquistador in San Juan through th night free at La Cabana All Suite Resort in Aruba through Reduced Rates at the Ritz Carlton in Cancun through Visit for even more great fares a hrefClick herea Remember Fly Smart Fly Cheap at FLYCHEAPCOM TOP CRUISE DEALS Bahamas Nights on Royal Caribbean from only Last Minute Deal ssaspidtype a hrefssaspidtypeClick herea Caribbean Nights on the Carnival Victory from only pp ssaspidtype a hrefssaspidtypeClick herea Hawaii Night Hawaiian Cruisetour Includes nights hotel and sightseeing in Honolulu from pp ssaspidtype a hrefssaspidtypeClick herea For other hot cruise deals visit cruisesindexasptype a hrefcruisesindexasptypeClick herea RESORT CONDOMINIUM SPECIAL St Thomas USVI Nights from per person Boasting one of the most famous whitesand beaches in the world Sapphire Beach Resort is noted for providing the ideal Caribbean experience This breathtaking resort is made for romance yet ideal for families total price including tax Per person price based upon double occupancy Click here for more details mrasppropertydatesubregion a hrefmrasppropertydatesubregionClick herea This special resort offer is available through ResortEscapescom Click the link or call for details RESERVE YOUR HOTEL ROOM ONLINE lodging Now that youve booked your flights search for hotels on Flycheapcoms sister site MyTravelcom On the MyTravelcom Hotel Search Engine you can reserve online at one of our hotels resorts and inns It is safe and secure and youll find some of the best Hotel Rates in the industry lodging a hreflodgingClick herea This email is free service of Flycheapcom and Travel Services International For more information please visit You received this mailing at this address To automatically unsubscribe from Flycheapcom mailings please click here airdelphpemailaddress a hrefairdelphpemailaddressAOL Users Click here to unsubscribea Flycheapcom is part of the MyTravel Group MyTravelcocom is now MyTravel click here for details aboutusmytravelasp a hrefaboutusmytravelaspClick herea Disclaimer Roundtrip fares require day advance purchase Saturday night stay and Tuesday Wednesday or Thursday travel only Air fares valid for and must be ticketed by Airfares include all taxes and fees Fares are nonrefundable and may not be available on all flights Package rates per person double occupancy based on select midweek travel and do not include air taxes and fees hotel taxes or transfers but do include car rental taxes and fees if applicable Packages must be booked by Package rates are limited and rates including car are based on an economy size car Top Cruise Disclaimer All rates are per person double occupancy cruise only and include port charges unless otherwise indicated above Government fees and taxes are additional All rates are subject to availability and may go up sell out or be withdrawn by the cruise line at any time Disclaimer for St Thomas Resort Rates shown are per unit for the specific time period listed and include applicable taxes Guests may not exceed maximum occupancy for specific unit purchased Rates may sell out at any time Additional dates and unit sizes are listed on the ResortEscapescom website FL Seller of Travel Reg No ST CST IA SOT Copyright MyTravel USA
<22402436.1075861111248.JavaMail.evans@thyme>,flycheap@promos.flycheap.com,2002-01-03 18:31:52,Try Your Luck in Las Vegas from January Dear Flycheapcom Member You are receiving this email because you are a registered user of Flycheapcom and have indicated that you would like to Receive travel specials from us Heres what youll find in todays FlyCheap newsletter Try your luck in Vegas from Vacations from Top Cruise Deals Nt Bahamas from per person Night Orlando Florida Vacation from per person Reserve your Hotel Room online and Save For more information please visit a hrefAOL Users Click herea TRY YOUR LUCK IN VEGAS Onearmed bandits free drinks massive buffets and more glitz than any city in the world Las Vegas also has some of the most beautiful desert scenery in the west and its just a short trip to the Hoover Dam and the Grand Canyon LAS VEGAS AIRFARE ONLY PROMOTIONS FROM These fares are roundtrip to Las Vegas and include all taxes and surcharges Los Angeles Phoenix San Diego New York City Baltimore Boston Philadelphia Hartford Ft Lauderdale Chicago Dallas Seattle Minneapolis Raleigh Durham San Francisco LAS VEGAS VACATION PACKAGES FROM Las Vegas Vacation Packages include Nights Accommodation at the listed resort airfare via American Airlines or US Airways The New Frontier New York Boston Chicago Dallas Denver Los Angeles Miami Ballys New York Boston Chicago Dallas Denver Los Angeles Miami Rio Suites New York Boston Chicago Dallas Denver Los Angeles Miami Monte Carlo New York Boston Chicago Dallas Denver Los Angeles Miami WE ALSO HAVE PROMOTIONS TO THESE GREAT TROPICAL DESTINATIONS th Nt FREE at Hotel Beach Plaza in St Martin thru th Nt FREE at the Condado Beach Resort in San Juan thru th Nt FREE and room upgrade at the Wyndham El San Juan or El Conquistador in San Juan thru Reduced Rates at the Buena Vista Suites in Orlando thru th Nt FREE at La Cabana All Suite Resort in Aruba thru Reduced Rates at the Ritz Carlton in Cancun thru Stay Nts and receive FREE at Outrigger and Ohana resorts in Hawaii thru Airfares and Vacations available from where you live to everywhere you want to go For more great fares call FlyCheap and FlyCheap Vacations at FlyCheap visit a hrefAOL Users click herea Remember Fly Smart Fly Cheap at FLYCHEAPCOM TOP CRUISE DEALS Carnival Night Bahamas from Port Canaveral pp ssaspidtype a hrefssaspidtypeAOL Users Click herea Norwegian Cruise Line Nt Eastern Caribbean from pp ssaspidtype a hrefssaspidtypeAOL Users Click herea Princess Cruises Nt Western Caribbean from pp ssaspidtype a hrefssaspidtypeAOL Users Click herea For other hot cruise deals visit cruisesindexasptype a hrefcruisesindexasptypeAOL Users Click herea RESORT CONDOMINIUM SPECIAL Night Orlando Florida Vacation from per person A true luxury villa in the heart of Orlandos attractions Celebration World Resort is only miles from the main gate at Walt Disney World total price including tax Per person price based upon quad occupancy Click here for more details mrasppropertydatesubregion a hrefmrasppropertydatesubregionAOL Users Click herea This special resort offer is available through ResortEscapescom Click the link or call for details RESERVE YOUR HOTEL ROOM ONLINE lodging Now that youve booked your flights search for hotels on Flycheapcoms sister site MyTravelcom On the MyTravelcom Hotel Search Engine you can reserve online at one of our hotels resorts and inns It is safe and secure and youll find some of the best Hotel Rates in the industry lodging a hreflodgingAOL Users Click herea This email is free service of Flycheapcom and Travel Services International For more information please visit You received this mailing at this address To automatically unsubscribe from Flycheapcom mailings please click here airdelphpemailaddress a hrefairdelphpemailaddressAOL Users Click here to unsubscribea Disclaimer Disclaimer Roundtrip fares require day advance purchase Saturday night stay and Tuesday Wednesday or Thursday travel only Air fares valid for and must be ticketed by Air fares include all taxes and fees Fares nonrefundable and may not be available on all flights Package rates per person double occupancy based on select midweek travel and do not include air taxes and fees hotel taxes or transfers but do include car rental taxes and fees if applicable Packages must be booked by Package rates are limited and rates including car are based on a compact size car Top Cruise Disclaimer All rates are per person double occupancy Cruise only and include port charges unless otherwise indicated above Government fees and taxes are additional All rates are subject to availability and may go up sell out or be withdrawn by the cruise line at any time Disclaimer for Celebration World Resort Rates shown are per unit for the specific time period listed and include applicable taxes Guests may not exceed maximum occupancy for specific unit purchased Rates may Sell out at any time Additional dates and unit sizes are listed on the ResortEscapescom website FL Seller of Travel Reg No ST CST IA SOT Copyright MyTravelcom
<3474998.1075861111274.JavaMail.evans@thyme>,flycheap@promos.flycheap.com,2001-12-27 14:23:12,Caribbean All Inclusive Vacations from December Dear Flycheapcom Member You are receiving this email because you are a registered user of Flycheapcom and have indicated that you would like to receive travel specials from us Heres what youll find in todays Flycheap newsletter Visit the USAs Sun Destinations from Caribbean AllInclusive Vacations from Top Cruise Deals Steamboat Springs Colorado Nights from per person Reserve your Hotel Room online and Save For more information please visit a hrefAOL Users Click herea VISIT THE USAS SUN DESTINATIONS FROM Warm up with these cool rates to some of the Great Sun Destinations These fares are roundtrip and include all taxes and surcharges Raleigh Durham Phoenix New York Ft Lauderdale Chicago Orlando Philadelphia Nassau Detroit San Diego Washington West Palm Beach Seattle Los Angeles Minneapolis San Diego Hartford Miami New York San Juan Atlanta Montego Bay Boston Ft Lauderdale Pittsburgh Ft Myers Fares available from where you live to everywhere you want to go Visit for even more great fares a hrefAOL Users Click herea Remember Fly Smart Fly Cheap at FLYCHEAPCOM CARIBBEAN ALLINCLUSIVE VACATIONS FROM CALL FLY CHEAP or visit FLYCHEAPCOM Caribbean Vacation Packages Include Nights Accommodation at the listed resort airfare via American Airlines or US Airways Transfers included in Jamaica All Inclusive resort prices include all meals beverages taxes gratuities water sports activities and much much more Package rates are available from over cities to Resorts in the Caribbean Barcelo Club Las Perlas New York Boston Chicago Dallas Denver Los Angeles Miami Sun Village Beach Resort New York Boston Chicago Dallas Denver Los Angeles Miami Sandals Inn New York Boston Chicago Dallas Denver Los Angeles Miami Renaissance Jamaica Grande Resort New York Boston Chicago Dallas Denver Los Angeles Miami We also have the following promotions in these great destinations th Night Free at the Condado Beach Resort in San Juan through th Night Free and room upgrade at the Wyndham El San Juan or El Conquistador in San Juan through Reduced Rates at the Buena Vista Suites in Orlando through th night free at La Cabana All Suite Resort in Aruba through Reduced Rates at the Ritz Carlton in Cancun through Stay nights receive free at Outrigger and Ohana resorts in Hawaii through Visit for even more great fares a hrefAOL Users Click herea Remember Fly Smart Fly Cheap at FLYCHEAPCOM TOP CRUISE DEALS Princess Nt Alaska Voyage of the Glaciers from ssaspidtype a hrefssaspidtypeAOL Users Click herea Carnival Nt Western Caribbean Cruise from only pp ssaspidtype a hrefssaspidtypeAOL Users Click herea Celebrity Cruises Nt Transatlantic and Spain Cruisetour Includes nights hotel and sightseeing in Barcelona pp ssaspidtype a hrefssaspidtypeAOL Users Click herea For other hot cruise deals visit cruisesindexasptype a hrefcruisesindexasptypeAOL Users Click herea RESORT CONDOMINIUM SPECIAL Steamboat Springs Colorado Nights from per person Located high in the Rocky Mountains The Village at Steamboat is the perfect ski destination for the entire group total price including tax Per person price based upon quad occupancy Click here for more details mrasppropertydatesubregion a hrefmrasppropertydatesubregionAOL Users Click herea This special resort offer is available through ResortEscapescom Click the link or call for details RESERVE YOUR HOTEL ROOM ONLINE lodging Now that youve booked your flights search for hotels on Flycheapcoms sister site MyTravelcom On the MyTravelcom Hotel Search Engine you can reserve online at one of our hotels resorts and inns It is safe and secure and youll find some of the best Hotel Rates in the industry lodging a hreflodgingAOL Users Click herea This email is free service of Flycheapcom and Travel Services International For more information please visit You received this mailing at this address To automatically unsubscribe from Flycheapcom mailings please click here airdelphpemailaddress a hrefairdelphpemailaddressAOL Users Click here to unsubscribea Flycheapcom is part of the MyTravel Group MyTravelcocom is now MyTravel click here for details aboutusmytravelasp a hrefaboutusmytravelaspAOL Users Click herea Disclaimer Roundtrip fares require day advance purchase Saturday night stay and Tuesday Wednesday or Thursday travel only Air fares valid for and returning and must be ticketed by Air fares include all taxes and fees Fares nonrefundable and may not be available on all flights Package rates per person double occupancy based on select midweek travel and do not include air taxes and fees hotel taxes or transfers but do include car rental taxes and fees if applicable Packages must be booked by Package rates are limited and rates including car are based on a compact size car Top Cruise Disclaimer All rates are per person double occupancy cruise only and include port charges unless otherwise indicated above Government fees and taxes are additional All rates are subject to availability and may go up sell out or be withdrawn by the cruise line at any time Disclaimer for Colorado Resort Rates shown are per unit for the specific time period listed and include applicable taxes Guests may not exceed maximum occupancy for specific unit purchased Rates may sell out at any time Additional dates and unit sizes are listed on the ResortEscapescom website FL Seller of Travel Reg No ST CST IA SOT Copyright MyTravelcom
