Message_id,From,Time_stamp,Text
<18425366.1075851901524.JavaMail.evans@thyme>,george.robinson@enron.com,2001-04-12 06:15:00,Lockridge Remediation SiteRemediation efforts to remove PSH have gone well recently and it is now time to focus more attention toward remediation of the dissolved phase plume This is reflected in the proposed scope Two files are attached The first file includes a project scope and cost estimate for The second file contains photos of the site The cost estimate is This figure includes only contract installation dollars so the work order amount would be about more than this The bulk of this figure is for system modifications to focus more attention toward remediation of the dissolved phase plume If you get a chance to look at the photos be sure to look at the last photo This photo shows the interior of the SVE knockout box that was installed in Dec in the NE pit area This installation has worked very well over the past two winter periods and has greatly increased the effectiveness of the SVE system The SVE knockout box recently installed at the N Crawar site is nearly identical Give me a call and lets discuss George
<1282769.1075851901546.JavaMail.evans@thyme>,george.robinson@enron.com,2001-04-12 06:18:00,N Crawar Remediation SiteTwo files are attached The first file includes a project scope and cost estimate for The second file contains two photos of the SVE system that was recently startedup The cost estimate is This figure includes only contract installation dollars so the work order amount would be about more than this The bulk of this figure is for installation of additional remediation wells I think we should keepup an aggressive schedule with this site due to the close proximity of the Crane County water wells Give me a call and lets discuss George
<1610140.1075851902396.JavaMail.evans@thyme>,george.robinson@enron.com,2001-05-14 04:42:00,ETS OM Schedule for Remediation Sites Cc The attached file contains a schedule for OM spending for both TW and NNG remediation sites The requested for the Roswell Station pit removal is included in this schedule Thanks George
<10776204.1075851902443.JavaMail.evans@thyme>,george.robinson@enron.com,2001-05-16 03:54:00,ETS Remediation Sites Current Estimate Cc Attached is the current estimate for the remediation sites in your area
<4849641.1075851902821.JavaMail.evans@thyme>,george.robinson@enron.com,2001-05-25 10:20:00,Rental Rates for Baker Furnace Units Cc Jim Saddler with AcuVac regarding rental rates on his SVE equipment SAVE systems He indicated that rental on a single unit would be per month and rental on two units would be per unit per month I also contacted Baker Furnace regarding rental of comparable SVE equipment and they indicated that rental would be per month In light of this I suggest we establish a rental rate for the TW units as is at per unit per month I also discussed costs associated with refurbishing old units with John Sachs at Baker Furnace John indicated that they have already replaced the old Baker Fax telemetry systems with Sensaphone systems on several used units He also indicated the various options they have for silencing the units It can be done but apparently adding silencers to the blower is not a simple modification We are set up to move the units to Midland next week but I think we should strongly consider shipping the units back to Baker Furnace for these modifications John indicated that they could turn them around in about two weeks Allowing for shipping time this would place the units back in Midland around June th a more realistic date would be June th A rough cost estimate is per unit plus shipping I believe this would save both time and cost compared to trying to do the modifications in Midland We would also end up with good as new units As a compromise between EOTT and TW if EOTT would pick up the costs for the refurbishing then TW could lower the rental rate to something on the order of per unit per month
<5173954.1075851903198.JavaMail.evans@thyme>,george.robinson@enron.com,2001-06-15 06:51:00,Cc figures for are included in the attached memo George 
<25541109.1075851903455.JavaMail.evans@thyme>,george.robinson@enron.com,2001-06-22 09:34:00,ETS Remediation Projects Current Estimate Cc 
<15146237.1075851903804.JavaMail.evans@thyme>,george.robinson@enron.com,2001-07-06 10:42:00,TW Roswell Station Characterization Plan Cc Two files are attached The first file is the text and figures of a plan for characterizing impacted soil in the former surface impoundment areas The second file contains the attachments to the characterization plan The attachments include copies of soil boring logs and a summary of some previous soil sample results I will also send two hard copies of the plan to you via FedEx Transwestern is ready to proceed upon approval from the NMOCD and the NMED HRMB Please call me if you have any questions or comments Thanks George George C Robinson PE Contract Environmental Engineer Cypress Engineering ENRON Office ENRON email 
<20296267.1075851895221.JavaMail.evans@thyme>,george.robinson@enron.com,1999-08-25 03:25:00,Roswell Station Phase V Soil and Groundwater Assessment Plan Cc Olson OCD has issued a letter dated approving TWs modified Groundwater Monitoring Plan and proposed Phase V Soil and Groundwater Assessment Plan The modified monitoring plan will significantly reduce the routine groundwater sampling costs from about per year to per year The Phase V assessment plan is relatively limited in scope The plan includes the installation and sampling of three additional offsite wells into the uppermost aquifer These activities will be on hold pending obtaining offsite access either by means of a property exchange business lease or water development easement
<31981525.1075851904267.JavaMail.evans@thyme>,george.robinson@enron.com,2001-07-26 10:19:00,TW Roswell Station Characterization Plan Cc Two files are attached The first file is the text and figures of a plan for characterizing impacted soil in the former surface impoundment areas The second file contains the attachments to the characterization plan The attachments include copies of soil boring logs and a summary of some previous soil sample results I will also send a hard copy of the plan to you via FedEx Transwestern is ready to proceed upon approval from the NMOCD and the NMED HRMB Please call me if you have any questions or comments Thanks George George C Robinson PE Contract Environmental Engineer Cypress Engineering ENRON Office ENRON email 
<18973457.1075851904625.JavaMail.evans@thyme>,george.robinson@enron.com,2001-08-17 09:51:00,Weekly ReportI was cleaning out my sent mail folder and just realized I had sent this to the wrong Campbell George George C Robinson PE Contract Environmental Engineer Cypress Engineering ENRON Office ENRON email 
<19140145.1075851904649.JavaMail.evans@thyme>,george.robinson@enron.com,2001-08-17 09:58:00,Remediation Projects Current Estimate Cc file contains the current estimate for remediation projects George C Robinson PE Contract Environmental Engineer Cypress Engineering ENRON Office ENRON email 
<10656382.1075851904696.JavaMail.evans@thyme>,george.robinson@enron.com,2001-08-21 06:58:00,TW Roswell Station Remediation Cc received written approval from both the OCD and the NMED for the soil characterization plan that was submitted for sampling soil in the former surface impoundment area located at the northeast corner of the facility A work plan for excavation and disposal of affected soil will be prepared subsequent to completion of the soil characterization plan A tentative schedule is as follows Meet with the Team and the contractor Gandy at the site on August th Collect soil samples for characterization on September th and th Bill Olson with the OCD has indicated that he would like to be present for these activities Receive lab results by September st Submit excavation work plan by October th Whether or not we can complete the excavation work this year will be largely dependent upon obtaining a quick approval of an excavation work plan The timing will be tight but it can be done George C Robinson PE Contract Environmental Engineer Cypress Engineering ENRON Office ENRON email 
<1914317.1075851905959.JavaMail.evans@thyme>,george.robinson@enron.com,2001-09-21 02:27:00,TW Roswell Station Waste Characterization of Pit Areassampling for waste characterization was completed on September th Bill Olson with the NMOCD was onsite to observe the sampling activities Twentytwo soil samples were collected from the two former pit areas Lab results indicate that the impacted soil samples do not trigger RCRA hazardous waste criteria more specifically for all samples all TCLP VOC constituents were nondetect for all samples all TCLP SVOC constituents were nondetect for all samples all TCLP Metal constituents were nondetect with only two exceptions Arsenic was detected in the TCLP extract for two samples one at mgL and another at mgL both below the RCRA regulatory limit of mgL for all samples the samples were determined to be notignitable for all samples reactive cyanide and reactive sulfide were nondetect with only one exception Reactive sulfide was detected for one sample at mgkg this is below the guidance level of mgkg the measured pH for all samples was in the range of this is within the RCRA regulatory limits of Furthermore the measured TPH for all samples was in the range of mgkg with an average TPH concentration of mgkg Selected photos of the sampling effort are attached There was a considerable amount of waste debris found in the pits particulary at the east end of the larger pit area I will be finalizing the excavation plan for the former pit areas over the next week or so I will prepare cost estimates for two alternative excavation plans one for a dig and haul option and one for a combination of dig and haul for the most heavily affected soil and onsite blending for less affected soil We should try to have a work plan to the NMOCD by the week of October st George C Robinson PE Contract Environmental Engineer Cypress Engineering ENRON Office ENRON email 
<28523642.1075851907264.JavaMail.evans@thyme>,george.robinson@enron.com,2001-11-05 06:47:00, Cost Update for TW NNG Remediation Projectsattached table contains a cost update for spending George C Robinson PE Contract Environmental Engineer Cypress Engineering ENRON Office ENRON email 
<25054808.1075851895654.JavaMail.evans@thyme>,george.robinson@enron.com,1999-10-22 07:42:00,TW Laguna Station Remediation Cc Wednesday October th I contacted Ms Barbara Bernacik at the Office of the Pueblo of Laguna Division of Environment I contacted Ms Bernacik at the suggestion of Norm Gonzales TW Laguna Team to discuss outstanding environmental issues at the Station In a conversation with Norm the previous week Norm indicated to me that he had met with Ms Bernacik and Ray Lucero Engineer Pueblo of Laguna recently in regards to backfilling an open excavation which had been excavated in when a diesel UST was removed from the site The excavation had not been backfilled pending authorization from the Pueblo of Laguna This and other outstanding issues were discussed in a meeting with Ray Lucero the Governor of the Pueblo of Laguna Ted Ryther Larry Campbell Butch Russell and myself back in but there was no resolution of the issues primarily because at the time the Lagunas did not have an environmental staff person to address such issues Subsequently Ms Bernacik was hired as the Lagunas environmental staff person about two years ago In the course of Norms conversation with Ms Bernacik and Mr Lucero Mr Lucero indicated some concern that the Pueblo of Laguna had not been kept apprised of environmental issues at the Station In light of this I have prepared a Report of Groundwater Monitoring Activities This report covers monitoring activities between June and June As previously mentioned I also contacted Ms Bernacik for the purpose of introducing myself and to inform her that a report has been prepared and will be delivered to her office I also suggested that we meet at the site to discuss outstanding environmental issues The response from Ms Bernacik was very favorable and we agreed to meet at the site at am November th Ms Bernacik also indicated that someone from the BIA will be with her
<32070200.1075851895793.JavaMail.evans@thyme>,george.robinson@enron.com,2000-01-04 08:57:00,Laguna Station Offsite drilling Cc Antonio at the Laguna Tribal Office had contacted Norm Gonzales Laguna Team last week with some questions regarding a permit the Tribe was going to issue to TW for drilling the six additional offsite monitor wells The questions were in regard to project start and complete date and who to issue the permit to I contacted Ester this afternoon to discuss these items Ester will issue the permit to Norm Gonzales with a start date of and a complete date of Ester indicated that the permit can be reissued with different dates if necessary Ester also indicated that I should contact Thurman TJ Robinson with the BIA Laguna Office regarding NEPA documentation I contacted TJ and he said that he has submitted the paperwork for a categorical exclusion for the additional wells TJ said that this was submitted to the BIA office in Albuquerque and that we could still shoot for January th as a start date He said he would fax a copy of the document to me once he receives it He also indicated that he still needed to check into whether there is a fee associated with the submittal and he would get back to me on this issue
<3862508.1075851896607.JavaMail.evans@thyme>,george.robinson@enron.com,2000-04-24 10:17:00,Newspaper story in The Monohans News Cc attached file contains a scanned image of a story that was published in The Monahans News a weekly paper on Thursday April Ive shown the story to Bill and he suggested that you let Rich Jolly know about the story Thanks George Forwarded by George RobinsonOTSEnron on PM PM Michelle Muniz Michelle Muniz Michelle Muniz PM PM To George NRON cc Subject Newspaper I hope this works MM
<7521864.1075851909219.JavaMail.evans@thyme>,george.robinson@enron.com,1999-10-22 03:48:00,Re NNG Eunice Station Cc were apparent after my last conversation with Bill Olson about a month ago Texaco has convinced Bill that the plume of elevated TDS originates from an offsite source an old waterflood operation toward the northwest and upgradient of the Texaco and NNG facilities Although our data from years ago indicated the source as Texacos old brine ponds Bill indicated that Texaco has more recently presented data that is more regional in scope and implicates the waterflood operation I have not seen any of this recent data Bill has accepted Texacos single soil boring in the former crude oil pit area as evidence that the pit was not the source of oil found in NNGs monitor well MW I dont agree but our best chance of convincing him otherwise will not come until Texaco excavates the old pit area and completes the additional assessment activities we agreed to in our meeting with them last year In light of these two points I think it is going to be difficult to convince Bill that NNG should not adhere to the biennial sampling until things are settled between Texaco and NNG However if you are going to give it a shot I suggest that you present the position that Texaco has already demonstrated whether correctly or not that the dissolved phase plume of TDS originated from another source Texaco has already demonstrated that they were the source for the dissolved phase plume of benzene measured in NNGs fenceline monitor wells and The only unresolved issue is the presence of PSH in monitor well MW In light of this the only monitoring NNG should be responsible for is measuring PSH thickness in well MW since it makes no sense to collect groundwater samples from a well containing free product Also the last information I have on Texacos activities is an assessment report dated July If you would get a copy of any more recent reports and correspondence it would be a big help Another thought to consider prior sampling history indicated a declining trend of benzene concentrations at NNGs fenceline monitor wells If this trend has continued additional sample data would be beneficial to our future discussions with Texaco and the OCD Larry Campbell AM To George nron Bret ReichET NRON cc Subject Re NNG Eunice Station Bret what do you think about this We have pretty much proven that we are not the culprits is this activity I have a problem conducting an ongoing sampling for an issue that were not responsible for even though we initiated the sampling activity I plan on visiting the OCD about this issue and either forcing them to justify why we should continue the sampling when the data points to our neighbors Additionally because of the turnover and inability to get the guilty party to get moving on this spending additional money and not receiving any return seems like a waste of time Thoughts George Robinson AM To Larry CampbellET nron cc Bret ReichET NRON Subject NNG Eunice Station The last groundwater sampling event at the Eunice Station was completed in August Subsequently the OCD approved our revised sampling plan that calls for biennial sampling In light of this we were due to sample this past August I held off on sampling in hope that Texaco would soon assume this responsibility however since it does not appear that this is going to occur anytime soon enough I will schedule a sampling event within the next four weeks Since there are only six monitor wells to sample at this site sampling can be completed in one day by one person at a cost of about including expenses and lab costs
<10668449.1075851909267.JavaMail.evans@thyme>,george.robinson@enron.com,2000-02-18 02:25:00,Re Eunice Gas Plant Cc preliminary sample results yesterday Sample TPH mgkg and Sample TPH mgkg were collected from the east wall of the excavation about feet outside the NNG facility fence and about feet below ground surface Sample TPH mgkg was collected from the east wall of the excavation about feet outside the NNG facility fence and about feet below ground surface There was little visual evidence that this soil sample was affected but apparently it is In my discussions with Texacos consultant I inquired about their sample analysis plan He indicated that they were submitting soil samples for TPH analysis by method mod GRO DRO I was concerned about comparing results from the mod analysis to our older data generated by method In light of this I submitted our samples for analysis by method The mod method is a more compound specific analysis than the method and often the more appropriate method to use However in this case it may not be the most appropriate method The mod method is a GC method used to measure the mass of hydrocarbon compounds that will elute within specific time windows The first time window is set up to measure the mass of gasoline range organics GRO The second time window is set up to measure the mass of diesel range organics DRO Any hydrocarbon compounds that elute after the DRO time window are not measured This would not be an issue if the soil was contaminated with a light condensate but Texacos oil pit was reportedly used to accumulate liquids not suitable for feed stock to the plant I think we can assume this meant heavy hydrocarbons The method is a less sophisticated method that measures petroleum hydrocarbon compounds over a wider range of carbon number that is it will measure the presence of heavier hydrocarbons that would not be measured using method mod In light of this the method is likely the more appropriate method for assessing soil affected by the Texaco oil pit particularly when results are compared to older data generated using method I have requested our lab to confirm the results for Sample using method In addition I have asked that they run the sample using method mod GRO DRO so that we can compare the two results We should have these results later next week I would like to get this additional information and discuss it among ourselves before we respond to Texaco Right now I am inclined to say that the Texaco oil pit is neither implicated or cleared as the culprit of contamination found in NNGs monitor well MW From George Robinson AM To Bret ReichET NRON cc Larry CampbellET nron Louis SoldanoET NRON Subject Re Eunice Gas Plant Bret I collected three soil samples from the east wall of the excavation area We should have results back from the lab later this week Although the samples did not appear to be affected with petroleum hydrocarbons I suggest we take a look at the results before initiating any further discussion with Texaco George Bret Reich PM To George NRON Larry CampbellET nron cc Louis Soldano Subject Eunice Gas Plant fyi Forwarded by Bret ReichETSEnron on PM Pope D Bruce on PM To Reich Bret W cc Subject Eunice Gas Plant Bretthe work on the old Texaco pit is finished and I am told that neither Texaco nor the NMOCD found evidence of migration to the Northern compressor site Once you have had a chance to talk to your clients and the Enron consultants who witnessed the work give me a call and lets discuss the next step I am not sure the settlement agreements we drafted are still relevant As you can see I am now in our Houston office You can now contact me at the numbers shown below The email address is unchanged I will be in the office through Thursday and out of town the following week Let me know when you are ready to discuss this D Bruce Pope Senior Counsel Texaco Inc Texnet FAX Email PRIVILEGED CONFIDENTIAL COMMUNICATION Do not read copy or disseminate this communication unless you are the intended addressee This communication may contain information that is privileged confidential and exempt from disclosure under applicable law If you are not the intended recipient you are on notice that any unauthorized disclosure copying distribution or taking of any action in reliance on the contents of the electronically transmitted materials is prohibited If you have received this communication in error please call us collect immediately at and ask to speak to the sender of the communication Also please notify immediately via email the sender that you have received the communication in error
<315825.1075851909313.JavaMail.evans@thyme>,george.robinson@enron.com,2000-03-27 07:30:00,Re NNG Eunice Station Recent Development Cc I discussed this with Bill Kendrick this afternoon our suggestion is that you forward my original message on the subject to Texacos attorney asking several questions is Texaco aware of the pipeline removal activities has the release been stopped and how has the extent of impacted soil been determined and does it extend onto NNGs property or down to groundwater and has the NMOCD been notified We should also indicate our concern that other Texaco pipelines crossing near or through NNGs facility may also be in poor condition and should be checked particularly the two lines which cross the southwestern corner of the NNG facility near the location of monitor well MW NNGs well which contains PSH This will allow Texaco the opportunity to notify the OCD In a related matter I think a copy of the letter that I prepared for Larry regarding excavation activities should be transmitted to Texacos attorney and the OCD I suggest sending a copy of this letter to the OCD because Bill Olson with the OCD had asked for a copy of any correspondence that was generated regarding the excavation activities and because Texaco has already indicated that their lab results did not identify the presence of impacted soil remaining in the excavation area Bret Reich AM To George NRON cc Larry CampbellET nron Subject Re NNG Eunice Station Recent Development Im assuming Dynegy took samples and must prepare a report for the New Mexico OCD Maybe we should give the OCD guy a heads up and let him know we are concerned about impact to our property Id like to send those photos to Texacos attorney and ask for an explanation what do you think
<10670108.1075851909363.JavaMail.evans@thyme>,george.robinson@enron.com,2001-02-05 05:16:00,Work Offers for Cypress Engineering Cc The attached document is provided to facilitate the preparation of work offers for Cypress Engineering Larry Campbell is the project manager for each of these ongoing remediation projects I can be reached at if you have any questions regarding this request Thanks George
<17633499.1075851909385.JavaMail.evans@thyme>,george.robinson@enron.com,2001-04-09 10:53:00,Weekly Reportweekly report and project cost summary are attached
<13480447.1075851909408.JavaMail.evans@thyme>,george.robinson@enron.com,2001-05-14 04:42:00,ETS OM Schedule for Remediation Sites Cc The attached file contains a schedule for OM spending for both TW and NNG remediation sites The requested for the Roswell Station pit removal is included in this schedule Thanks George
<6348233.1075851909451.JavaMail.evans@thyme>,george.robinson@enron.com,2001-05-16 03:54:00,ETS Remediation Sites Current Estimate Cc Attached is the current estimate for the remediation sites in your area
<25214590.1075851909474.JavaMail.evans@thyme>,george.robinson@enron.com,2001-06-15 06:51:00,Cc figures for are included in the attached memo George 
<22708355.1075851909497.JavaMail.evans@thyme>,george.robinson@enron.com,2001-08-17 09:51:00,Weekly ReportI was cleaning out my sent mail folder and just realized I had sent this to the wrong Campbell George George C Robinson PE Contract Environmental Engineer Cypress Engineering ENRON Office ENRON email 
<11228063.1075851909520.JavaMail.evans@thyme>,george.robinson@enron.com,2001-11-05 06:47:00, Cost Update for TW NNG Remediation Projectsattached table contains a cost update for spending George C Robinson PE Contract Environmental Engineer Cypress Engineering ENRON Office ENRON email 
