Message_id,From,Time_stamp,Text
<23389999.1075841230011.JavaMail.evans@thyme>,insidenytimes@nytimes.com,2002-01-16 11:45:22,Portraits of Grief Read Profiles of WTC VictimsPST TIMES Inside NYTimescom Tuesday January Dear NYTimescom Member One of the most meaningful features to appear in The New York Times and on NYTimescom is Portraits of Grief This feature first began running on September and presented brief profiles of World Trade Center victims On December the final daily edition of Portraits of Grief appeared in The New York Times newspaper A book will be published this year and the feature will continue to appear from time to time as more names become known and more families agree to interviews In the meantime we invite you to visit the Web site to see a complete collection of Portraits of Grief alphabetized and listed by day This archive represents all the Portraits published to date They will remain at NYTimescom indefinitely pagesnationalportraitsrdhcmcppFwFOExPUmODjVODkq Another recent special feature has been the multimedia photo essay We have already talked here about the essays done by Vincent Laforet and James Hill I would now like to direct your attention to the newest this one by Times staff photographer Ruth Fremson about the women in Afghanistan The essay features a very strong audio commentary which makes the point that not all the women feel the same about the headtotoe veil they were required to wear under the Talibans rule in fact many are very comfortable dressed as they are pagesnationaldayofterrorindexhtmlrdhcmcppDkFOExPUmODjVODkq We have enjoyed participating in almost daily conversations with correspondents of The New York Times In these unstructured talks each correspondent provides information not only about the news he or she is covering but on what life is like in the particular place he or she is located There are over discussions now available for listening in audio format nationalbegweraudiohtmlrdhcmcppAcFOExPUmODjVODkq The Winter Olympics games at Salt Lake City begin soon and NYTimescom already has started covering this event Our Olympics section covers security concerns athlete profiles and an interactive map of the torch relay Special email updates are now available and include periodic countdown reports and details of the torch run athlete profiles and event previews When the games begin on Feb well send daily dispatches with event results and exclusive postcards from Salt Lake City by Times sports reporter George Vecsey pagesolympicsindexhtmlrdhcmcppIZFOExPUmODjVODkq I would also like to invite you to explore these new features on NYTimescom Introducing The New York Times Job Market Know the deal with DealBook New Topics of The Times collections now available The Outlook for business and the markets in Join in for NFL playoffs Best of in the arts For students TEST doesnt have to be a fourletter word Introducing The New York Times Job Market If youre serious about finding a new job NYTimescom is a better resource than ever Thats because weve just launched Job Market which features a more easyto navigate design articles about careers and the workplace and of course the best job listings in the tristate area and nationwide You can also post your resume on Job Market and sign up for daily email alerts pagesjobsrdhcmcppEXFOExPUmODjVODkq Know the deal with DealBook NYTimescoms daily look at the world of mergers and acquisitions private capital IPOs and more has been expanded in a new easiertouse HTML format Delivered daily via email this popular newsletter edited by Andrew Ross Sorkin now has even more features to help you know the deal on Wall Street and around the world Sign up for free now emaildealbookrdhcmcppDMFOExPUmODjVODkq New Topics of The Times collections now available Our Topics of the Times series has expanded The new collections include Thomas Friedman on Sept Authors in Depth VS Naipaul Winter Desserts Destination Hawaii Each collection contains up to nine archived articles and can be purchased for at timestopicsrdhcmcppCjFOExPUmODjVODkq The Outlook for business and the markets in After two years of poor returns investors may have a better time in as an economic recovery looks more and more possible Every January we publish the annual economic Outlook section which includes useful articles by the New York Times staff outlookrdhcmcppCKFOExPUmODjVODkq Join in for NFL playoffs From the first round of the playoffs on Jan until Super Bowl Sunday on Jan NYTimescom will have complete coverage of the NFL playoffs including features opinion game coverage statistics audio and extended use of Times photography pagessportsfootballindexhtmlrdhcmcppBFOExPUmODjVODkq Best of in the arts The critics of The New York Times review the year in the arts including top lists for the years best movies albums and television shows indexesartsindexhtmlrdhcmcppLQFOExPUmODjVODkq For students TEST doesnt have to be a fourletter word The Learning Networks Word of the Day and Test Prep Question of the Day help students build their vocabulary for upcoming standardized tests in ways that are fun and interactive Every weekday theres a focus on a different word its definition and an example of its use in the context of a recent Times article and students can then test their understanding online with the days analogy or sentence completion question learningstudentswordofdayrdhcmcppHFOExPUmODjVODkq Thanks for your time Yours truly Bernard Gwertzman Editor The New York Times on the Web PS If you have a friend or colleague who might be interested feel free to forward this email ABOUT THIS EMAIL Your registration to NYTimescom included permission to send you information about new features and services As a member of the BBBOnline Privacy Program and the TRUSTe privacy program we are committed to protecting your privacy To unsubscribe from future mailings visit unsubscriberdhcmcppCqFOExPUmODjVODkq To change your email address please go to our help center helprdhcmcppCcFOExPUmODjVODkq Suggestions and feedback are welcome at Copyright The New York Times Company Powered By Annuncio 
<10675154.1075860724524.JavaMail.evans@thyme>,insidenytimes@nytimes.com,2002-02-07 09:45:22,Thomas Friedmans Insights into IMES Inside NYTimescom Thursday February Dear NYTimescom Member After the events of Sept its more important than ever to stay informed about terrorist activities occurring around the globe To help weve created two special online Topics of the Times offerings that wed like to share with you Each contains a series of up to nine archived OpEd columns by Thomas Friedman National Book Award winner and foreign affairs columnist for The New York Times Priced at only each these riveting collections put at your fingertips the insightful Pulitzer Prizewinning perspectives of Americas foremost commentator on the Middle East terrorism and globalization Thomas Friedman on Terrorism contains six preSept columns about the threat of terrorism and the conflict in the Middle East Digital Defense A Memo From Osama Angry Wired and Deadly Motives for the Bombing The Terrorist Question Beirut Oklahoma To view this collection visit timestopicsfriedmanhtmlrdhcmcppCUCKrtgmUxrvUxgm Thomas Friedman on Sept has these nine OpEd columns published in the first days after the attacks World War III The Big Terrible Hama Rules Terrorism Game Theory Talk Later Sept Eastern Middle School Yes but What Its Freedom Stupid Bush to bin Laden To view this collection visit timestopicsseptemberhtmlrdhcmcppCVCKrtgmUxrvUxgm You might also want to order these other Topics of The Times offerings located at timestopicsrdhcmcppCWCKrtgmUxrvUxgm Authors in Depth V S Naipaul Winter Desserts Destination Hawaii William Safire On Language Each collection is just and contains up to nine archived articles Thank you for being a valued subscriber and for your continued interest in NYTimescom Sincerely The New York Times on the Web PS If you have a friend or colleague who might be interested feel free to forward this email ABOUT THIS EMAIL Your registration to NYTimescom included permission to send you information about new features and services As a member of the BBBOnline Privacy Program and the TRUSTe privacy program we are committed to protecting your privacy To unsubscribe from future mailings visit unsubscriberdhcmcppCXCKrtgmUxrvUxgm To change your email address please go to our help center helprdhcmcppCKCKrtgmUxrvUxgm Suggestions and feedback are welcome at Copyright The New York Times Company Powered By Annuncio 
<20122849.1075860722687.JavaMail.evans@thyme>,insidenytimes@nytimes.com,2002-01-16 14:12:41,Portraits of Grief Read Profiles of WTC IMES Inside NYTimescom Tuesday January Dear NYTimescom Member One of the most meaningful features to appear in The New York Times and on NYTimescom is Portraits of Grief This feature first began running on September and presented brief profiles of World Trade Center victims On December the final daily edition of Portraits of Grief appeared in The New York Times newspaper A book will be published this year and the feature will continue to appear from time to time as more names become known and more families agree to interviews In the meantime we invite you to visit the Web site to see a complete collection of Portraits of Grief alphabetized and listed by day This archive represents all the Portraits published to date They will remain at NYTimescom indefinitely pagesnationalportraitsrdhcmcppFzGMKrtgmUxrvUxgm Another recent special feature has been the multimedia photo essay We have already talked here about the essays done by Vincent Laforet and James Hill I would now like to direct your attention to the newest this one by Times staff photographer Ruth Fremson about the women in Afghanistan The essay features a very strong audio commentary which makes the point that not all the women feel the same about the headtotoe veil they were required to wear under the Talibans rule in fact many are very comfortable dressed as they are pagesnationaldayofterrorindexhtmlrdhcmcppJaGMKrtgmUxrvUxgm We have enjoyed participating in almost daily conversations with correspondents of The New York Times In these unstructured talks each correspondent provides information not only about the news he or she is covering but on what life is like in the particular place he or she is located There are over discussions now available for listening in audio format nationalbegweraudiohtmlrdhcmcppFWGMKrtgmUxrvUxgm The Winter Olympics games at Salt Lake City begin soon and NYTimescom already has started covering this event Our Olympics section covers security concerns athlete profiles and an interactive map of the torch relay Special email updates are now available and include periodic countdown reports and details of the torch run athlete profiles and event previews When the games begin on Feb well send daily dispatches with event results and exclusive postcards from Salt Lake City by Times sports reporter George Vecsey pagesolympicsindexhtmlrdhcmcppEvGMKrtgmUxrvUxgm I would also like to invite you to explore these new features on NYTimescom Introducing The New York Times Job Market Know the deal with DealBook New Topics of The Times collections now available The Outlook for business and the markets in Join in for NFL playoffs Best of in the arts For students TEST doesnt have to be a fourletter word Introducing The New York Times Job Market If youre serious about finding a new job NYTimescom is a better resource than ever Thats because weve just launched Job Market which features a more easyto navigate design articles about careers and the workplace and of course the best job listings in the tristate area and nationwide You can also post your resume on Job Market and sign up for daily email alerts pagesjobsrdhcmcppEtGMKrtgmUxrvUxgm Know the deal with DealBook NYTimescoms daily look at the world of mergers and acquisitions private capital IPOs and more has been expanded in a new easiertouse HTML format Delivered daily via email this popular newsletter edited by Andrew Ross Sorkin now has even more features to help you know the deal on Wall Street and around the world Sign up for free now emaildealbookrdhcmcppELGMKrtgmUxrvUxgm New Topics of The Times collections now available Our Topics of the Times series has expanded The new collections include Thomas Friedman on Sept Authors in Depth VS Naipaul Winter Desserts Destination Hawaii Each collection contains up to nine archived articles and can be purchased for at timestopicsrdhcmcppClGMKrtgmUxrvUxgm The Outlook for business and the markets in After two years of poor returns investors may have a better time in as an economic recovery looks more and more possible Every January we publish the annual economic Outlook section which includes useful articles by the New York Times staff outlookrdhcmcppBzGMKrtgmUxrvUxgm Join in for NFL playoffs From the first round of the playoffs on Jan until Super Bowl Sunday on Jan NYTimescom will have complete coverage of the NFL playoffs including features opinion game coverage statistics audio and extended use of Times photography pagessportsfootballindexhtmlrdhcmcppBdGMKrtgmUxrvUxgm Best of in the arts The critics of The New York Times review the year in the arts including top lists for the years best movies albums and television shows indexesartsindexhtmlrdhcmcppAWGMKrtgmUxrvUxgm For students TEST doesnt have to be a fourletter word The Learning Networks Word of the Day and Test Prep Question of the Day help students build their vocabulary for upcoming standardized tests in ways that are fun and interactive Every weekday theres a focus on a different word its definition and an example of its use in the context of a recent Times article and students can then test their understanding online with the days analogy or sentence completion question learningstudentswordofdayrdhcmcppLGMKrtgmUxrvUxgm Thanks for your time Yours truly Bernard Gwertzman Editor The New York Times on the Web PS If you have a friend or colleague who might be interested feel free to forward this email ABOUT THIS EMAIL Your registration to NYTimescom included permission to send you information about new features and services As a member of the BBBOnline Privacy Program and the TRUSTe privacy program we are committed to protecting your privacy To unsubscribe from future mailings visit unsubscriberdhcmcppKFGMKrtgmUxrvUxgm To change your email address please go to our help center helprdhcmcppKGMKrtgmUxrvUxgm Suggestions and feedback are welcome at Copyright The New York Times Company Powered By Annuncio 
<12725275.1075852103176.JavaMail.evans@thyme>,insidenytimes@nytimes.com,2001-10-22 09:31:28,A Nation Challenged Complete Coverage From NYTimescomDear Member It has been more than a month since the tragic events of September And I want to express my personal appreciation to the many thousands of readers from around the world who have sent in words of sympathy to the people of this country and in particular of New York City The New York Times on the Web has kept open the area reserved for these messages and you are free to read them on our site nationalATTFORUMhtmlrdhcmcppEDjEKrtgmUxrvUxgm The unfolding developments on the military and public health areas are covered in great depth by the Times staff of reporters and editors To make it easier to catch up on the past six weeks of coverage we have created a special section on the Web called A Nation Challenged This includes a daybyday rundown of events as well as an archive of past coverage pagesnationaldayofterrorindexhtmlrdhcmcppECDEKrtgmUxrvUxgm With so many correspondents involved in coverage of this crisis we felt it might illuminate some of the background to these stories to have conversations with many of them You can listen to conversations with such veteran correspondents as RW Apple John F Burns David Sanger Judith Miller and many others libraryworldbegweraudiohtmlrdhcmcppEBGEKrtgmUxrvUxgm In a further effort to provide some unusual background to the situation Vincent Laforet a New York Times staff photographer gives a first person account of being among the refugees in Pakistan in Photographers Journal a personal multimedia essay His photos explore refugees piecing together a Koran spending time in an opium den and living in a Pakistani school Vincent accompanies the essay with an audio description photojournalrdhcmcppEbEKrtgmUxrvUxgm I have to confess to being a fervent New York Yankees fan going back to my childhood as a boy in the Bronx Many New Yorkers got a tremendous lift by the Yankees comeback against a very strong Oakland Athletics team By the time you read this you may know whether the Yankees won or lost against the Seattle Mariners in the championship series leading up to the World Series pagessportsbaseballindexhtmlrdhcmcppEtEKrtgmUxrvUxgm More New Features Whats New with U Search Our Commercial Real Estate Listings Sign Up for Our Holiday Specials Email Looking for a Job Learn About the World of Journalism with Ask a Reporter advertisement The most comprehensive Real Estate listings site in town NYTimescomrealestate combines The New York Times Classified ads with listings from nearly every broker in the city more searchable New York listings than youll find anyplace else Most listings feature neighborhood maps photos floor plans and virtual tours cityfeetrdhcmcppEMEKrtgmUxrvUxgm Whats New with U The New York Times on the Webs College section provides the latest collegerelated news from The Times and provides numerous resources for college and university teachers and students The site features an innovative News by Subject search which allows you to search and browse recent Times articles by interest or field of study You can even sign up for alerts so you can have articles on topics important to you delivered directly to your email collegerdhcmcppEEEKrtgmUxrvUxgm Search Our Commercial Real Estate Listings If you are looking to purchase or lease property in the New York City area search our extensive commercial real estate listings cityfeetrdhcmcppEDYEKrtgmUxrvUxgm Sign Up for Our Holiday Specials Email Sign up for NYTimescoms Holiday Email for exclusive deals from our top advertisers This email offers special deals throughout the year beginning with the December holidays servicesemailemailhtmlrdhcmcppECeEKrtgmUxrvUxgm Looking for a Job Search NYTimescomjobs when you are looking for a new job Sign up for job email alerts to learn when a position is posted with your criteria or post your resume and let top employers find you pagesjobsrdhcmcppEBcEKrtgmUxrvUxgm Learn About the World of Journalism with Ask a Reporter Every two weeks a different New York Times writer editor or photographer joins The Learning Network to answer students questions submitted to the site QAs address the reporters beat the topics that he or she covers and journalism in general A full archive of over past QAs is available learningstudentsaskreportersrdhcmcppENEKrtgmUxrvUxgm Thanks for your time We hope youll make a point of visiting us today and every day Yours truly Bernard Gwertzman Editor The New York Times on the Web PS If you have a friend or colleague who might be interested feel free to forward this email ABOUT THIS EMAIL Your registration to NYTimescom included permission to send you information about new features and services As a member of the BBBOnline Privacy Program and the TRUSTe privacy program we are committed to protecting your privacy To unsubscribe from future mailings visit unsubscriberdhcmcppEJEKrtgmUxrvUxgm To change your email address please go to our help center helprdhcmcppECZEKrtgmUxrvUxgm Suggestions and feedback are welcome at 
<29354488.1075841954146.JavaMail.evans@thyme>,insidenytimes@nytimes.com,2002-01-16 11:25:00,Portraits of Grief Read Profiles of WTC Victimsthomas PST TIMES Inside NYTimescom Tuesday January Dear NYTimescom Member One of the most meaningful features to appear in The New York Times and on NYTimescom is Portraits of Grief This feature first began running on September and presented brief profiles of World Trade Center victims On December the final daily edition of Portraits of Grief appeared in The New York Times newspaper A book will be published this year and the feature will continue to appear from time to time as more names become known and more families agree to interviews In the meantime we invite you to visit the Web site to see a complete collection of Portraits of Grief alphabetized and listed by day This archive represents all the Portraits published to date They will remain at NYTimescom indefinitely pagesnationalportraitsrdhcmcppFwFOIbmxZkHxZo Another recent special feature has been the multimedia photo essay We have already talked here about the essays done by Vincent Laforet and James Hill I would now like to direct your attention to the newest this one by Times staff photographer Ruth Fremson about the women in Afghanistan The essay features a very strong audio commentary which makes the point that not all the women feel the same about the headtotoe veil they were required to wear under the Talibans rule in fact many are very comfortable dressed as they are pagesnationaldayofterrorindexhtmlrdhcmcppDkFOIbmxZkHxZo We have enjoyed participating in almost daily conversations with correspondents of The New York Times In these unstructured talks each correspondent provides information not only about the news he or she is covering but on what life is like in the particular place he or she is located There are over discussions now available for listening in audio format nationalbegweraudiohtmlrdhcmcppAcFOIbmxZkHxZo The Winter Olympics games at Salt Lake City begin soon and NYTimescom already has started covering this event Our Olympics section covers security concerns athlete profiles and an interactive map of the torch relay Special email updates are now available and include periodic countdown reports and details of the torch run athlete profiles and event previews When the games begin on Feb well send daily dispatches with event results and exclusive postcards from Salt Lake City by Times sports reporter George Vecsey pagesolympicsindexhtmlrdhcmcppIZFOIbmxZkHxZo I would also like to invite you to explore these new features on NYTimescom Introducing The New York Times Job Market Know the deal with DealBook New Topics of The Times collections now available The Outlook for business and the markets in Join in for NFL playoffs Best of in the arts For students TEST doesnt have to be a fourletter word Introducing The New York Times Job Market If youre serious about finding a new job NYTimescom is a better resource than ever Thats because weve just launched Job Market which features a more easyto navigate design articles about careers and the workplace and of course the best job listings in the tristate area and nationwide You can also post your resume on Job Market and sign up for daily email alerts pagesjobsrdhcmcppEXFOIbmxZkHxZo Know the deal with DealBook NYTimescoms daily look at the world of mergers and acquisitions private capital IPOs and more has been expanded in a new easiertouse HTML format Delivered daily via email this popular newsletter edited by Andrew Ross Sorkin now has even more features to help you know the deal on Wall Street and around the world Sign up for free now emaildealbookrdhcmcppDMFOIbmxZkHxZo New Topics of The Times collections now available Our Topics of the Times series has expanded The new collections include Thomas Friedman on Sept Authors in Depth VS Naipaul Winter Desserts Destination Hawaii Each collection contains up to nine archived articles and can be purchased for at timestopicsrdhcmcppCjFOIbmxZkHxZo The Outlook for business and the markets in After two years of poor returns investors may have a better time in as an economic recovery looks more and more possible Every January we publish the annual economic Outlook section which includes useful articles by the New York Times staff outlookrdhcmcppCKFOIbmxZkHxZo Join in for NFL playoffs From the first round of the playoffs on Jan until Super Bowl Sunday on Jan NYTimescom will have complete coverage of the NFL playoffs including features opinion game coverage statistics audio and extended use of Times photography pagessportsfootballindexhtmlrdhcmcppBFOIbmxZkHxZo Best of in the arts The critics of The New York Times review the year in the arts including top lists for the years best movies albums and television shows indexesartsindexhtmlrdhcmcppLQFOIbmxZkHxZo For students TEST doesnt have to be a fourletter word The Learning Networks Word of the Day and Test Prep Question of the Day help students build their vocabulary for upcoming standardized tests in ways that are fun and interactive Every weekday theres a focus on a different word its definition and an example of its use in the context of a recent Times article and students can then test their understanding online with the days analogy or sentence completion question learningstudentswordofdayrdhcmcppHFOIbmxZkHxZo Thanks for your time Yours truly Bernard Gwertzman Editor The New York Times on the Web PS If you have a friend or colleague who might be interested feel free to forward this email ABOUT THIS EMAIL Your registration to NYTimescom included permission to send you information about new features and services As a member of the BBBOnline Privacy Program and the TRUSTe privacy program we are committed to protecting your privacy To unsubscribe from future mailings visit unsubscriberdhcmcppCqFOIbmxZkHxZo To change your email address please go to our help center helprdhcmcppCcFOIbmxZkHxZo Suggestions and feedback are welcome at Copyright The New York Times Company Powered By Annuncio 
