Message_id,From,Time_stamp,Text
<3635259.1075840678904.JavaMail.evans@thyme>,jdquillen@yahoo.com,2001-04-17 05:40:00,Fwd Top Signs a Rapper Has Gone Nuts Cc Note forwarded message attached Do You Yahoo Yahoo Auctions buy the things you want at great prices Contenttransferencoding BIT Received by mailaracnetcom mbox dquillen with Cubic Circles cucipop v Tue Apr XFrom Tue Apr ReturnPath Received from outmtatopicacom outmtatopicacom by mailaracnetcom with SMTP id fHjFC for Tue Apr To From The Top List Subject Top Signs a Rapper Has Gone Nuts MessageID ReplyTo XTopicaLoop ListHelp listsTop ListUnsubscribe mailto ListSubscribe mailto ListArchive listsTopread Received qmail invoked by alias Apr Received qmail invoked by uid Apr Received from lsmlswemediaonenet by inmtatopicacom with SMTP Apr Received from custerdome wewemediaonenet by lsmlswemediaonenet with ESMTP id fHhC for Toptopicacom Tue Apr PDT Date Tue Apr MIMEVersion Contenttype textplain charsetusascii Xmailer Pegasus Mail for Win vc ContentLength T H E T O P F I V E L I S T Rest In Peace Joey R Todays Classic Top Songs if the Artists ReMade Them Today Read it on our website To subscribe April NOTE FROM CHRIS Rapper Sean Combs recently announced that he no longer wants to be known as Puffy or Puff Daddy preferring instead to be called P Diddy The Top Signs a Rapper Has Gone Nuts Stopped wearing a sideways baseball cap and started wearing a tinfoil Napoleon hat Asks the press and to call him G Dubya Shows up at his next concert wearing a Catholic schoolgirl dress and raps about the cruelty of living under Da Momma Supe All work n no play makez Ice Tray a dull boweee All work n no play makez Ice Tray a dull boweee All work n no play makez Ice Tray a dull boweee His new video features him prancing around in a Dorothy outfit singing Ding dong the wiotch is dead Now wants to be known as The Rapper Formerly Known As Simpering Girly PeeBoy Overheard telling Jennifer Lopez Quit shaking that thing in my face and go put some clothes on already Wears his white dorag after Labor Day Produces double album of nothin but songs about Madeleine Albrights ass On election day announced hes switching party affiliation to West Coast Help the police cuz its nice when theyre around We need em cuz they protect our town and Topfivecoms Number Sign a Rapper Has Gone Nuts The wheels on the bus go round and round Woah Yeah The Top List wwwtopfivecom Copyright by Chris White NEED SOME POSTTAXDAY PURCHASING POWER NextCard Internet Visa Instant Approvals GET APPROVED TODAY As low as Intro APR indexhtmlrefaff Rumination of the Day As far as ineffectual suicide methods go Im sticking with Visine Christy Simuangco To subscribe to Ruminations Selected from submissions from contributors Todays Top List authors are Doug Finney Houston TX th rd in a row Dan Johnson Champlin MN Wade Kwon Birmingham AL Rob Knapp Charlotte NC David Hyatt New York NY Martin Bredeck Hybla Valley VA Mark Niebuhr Minneapolis MN Banner Tag Steven Wilber Pomeroy WA Curtis Matthews Kennesaw GA Beth Gaynor Columbus OH Dave Wesley Pleasant Hill CA Hall of Famer Jason Anderson Birmingham AL Jody LaFerriere Leominster MA Topic Doug Finney Houston TX Runner Up list name Larry Hollister Concord CA HM list name Hall of Famer Slick Sharkey Miami FL List moderator Chris White Los Angeles CA List ownereditor Russell ODB Jones Brooklyn NY Ambience Ambience explanation arcsamhtm MC Lamer and Hip Hopeless The Runners Up and Honorable Mention submissions The Runners Up and Honorable Mention submissions for todays list can be found on our website T H E T O P F I V E L I S T TOP The Home of Original Humor The Top List original lists Top Classic greatest hits Ruminations odd thoughts The Daily Probe news satire The Whack Report real stories The Kid Report kid stories Gadget Geek cool stuff Copyright by Chris White All rights reserved Do not forward publish broadcast or use in any manner without crediting The Top List at wwwtopfivecom To unsubscribe Send mail to To bitch at the owner Save on all your monthly bills LowerMyBillscom has compared s of providers so you dont have to Our free service guarantees you savings on everything from Insurance to Long distance caaabPfclvXASclwLhfLowerMyBills EASY UNSUBSCRIBE click here uclvXASclwLhOr send an email To This email was sent to T O P I C A Learn More Surf LessNewsletters Tips and Discussions on Topics You Choosepartnertag
<31956087.1075840657059.JavaMail.evans@thyme>,jdquillen@yahoo.com,2001-02-16 01:12:00,Fwd Top New US Army Weapons for Cc Note forwarded message attached Do You Yahoo Get personalized email addresses from Yahoo Mail only a year Contenttransferencoding BIT Received by mailaracnetcom mbox dquillen with Cubic Circles cucipop v Fri Feb XFrom Fri Feb ReturnPath Received from outmtatopicacom outmtatopicacom by mailaracnetcom with SMTP id fGShb for Fri Feb To From The Top List Subject Top New US Army Weapons for Date Fri Feb MessageID ReplyTo XTopicaLoop Received qmail invoked by alias Feb Received qmail invoked by uid Feb Received from falconproditdearthlinknet by inmtatopicacom with SMTP Feb Received from custerdome poolcvxbradleydialupearthlinknet by falconproditdearthlinknet EL with ESMTP id BAA for Toptopicacom Fri Feb PST MIMEVersion Contenttype textplain charsetUSASCII Xmailer Pegasus Mail for Win vc ContentLength To unsubscribe T H E T O P F I V E L I S T Well hello Clarice Todays Classic Top GOP Euphemisms for Impeaching the President Read it on our website To subscribe February NOTE FROM CHRIS Todays list was compiled from submissions sent in by our ClubTop subscribers For info on joining ClubTop go to htmlClubTophtm The Top New US Army Weapons for The Britney Spear A deadly assault weapon with razor sharp retractable twelve inch nipples which reduce men to drooling idiots R MultiEnvironment Inhalation Assistance Device for ShortTerm Repeatable Infantry Stimulus Okay its actually just a crack pipe RoboReagan Oh come on Did you really think he was hospitalized for a broken hip The Heche Bomb Rather than killing countless civilians like its thermonuclear predecessor detonation of this warhead simply bewilders the enemy by wandering amongst them knocking on their doors and making strange remarks Compassionate Carbine Kills just as effectively but a small sound chip in the stock says Im sorry with each bullet fired Ultra Anthrax Plus Similar to regular Anthrax but with a hint of lemon for a clean refreshing scent Sharkbomb Fills the target area with thousands attorneys leaving it bogged down by legal haggling Army of One Pvt First Class Frank Richards will be dispatched to finally eliminate those pesky Iraqis We expect him to be far more effective than a full dose of the Army without all of the unpleasant side effects The Atomic Balm Deadly Chapstick that comes in three luminescent colors Irradiated Iraq Indigo Glowing Gorky Green and Malignant Mao Mauve Land Mimes Will repulse frustrate and anger the enemy now with potent trapped in a box mechanism Star Wars Defense System Network of ground and orbital based weapons designed to prevent George Lucas from entering US airspace with another lame prequel SHDI Strategic Hairpiece Defense Initiative Uses satellite laser technology to track Sam Donaldson Dont Ask Dont Telegraph Global communication without leaving the closet The Subliminable Obsiconfusionary Mispronunciator Confuses foreign leaders by introducing gibberish into speeches Best of all its stealthiable and Topfivecoms Number New US Army Weapon for The Lewinsky Land Mine Get anywhere near it and itll blow your nuts off The Top List wwwtopfivecom Copyright by Chris White You will ALWAYS find a runnerup entry that you think is funny enough to make the list Bob Williams ClubTop ranks up there with This Is True for great premium subscriptions Scott Ventura ClubTop is a ray of fun every day Ive been a subscriber from the beginning and its never failed to make me laugh at least once Lonnie Falk ClubTop A buck a month a laugh a minute Learn more at htmlClubTophtm Rumination of the Day Human cloning may raise some ethical issues but man I could really use another me in my car to get into that carpool lane J Hutter To subscribe to Ruminations Selected from submissions from contributors Todays Top List authors are Mike Cunningham Woodridge IL Woohoo Liz Scott Madison AL Laura Song Tucson AZ Michal Bryc St Louis MO John D Hopkins Watkinsville GA Paul Atkinson Portland OR Frank Weisbly CA Evan Simper Holbrook AZ Jack Scheer Falls Church VA Chris Warner Alameda CA Adam Chunn Houston TX Jeff Abramsohn Waltham MA Warren Marcus Rockville MD Jon Killian Spanaway WA Bob Roth Fairfield IA Dave Juurlink Toronto Canada BT Cesul Ann Arbor MI Eric Akawie Burke VA Jason Davis Milwaukee WI Arthur Levesque Laurel MD Tom Stoudt Fort Washington PA Marshal Perlman Minneapolis MN Topic Jim Griffith Sunnyvale CA Banner Tag Dale Weese Florissant MO Runner Up list name Tristan Fabriani Passaic NJ Honorable Mention list name Chris White Irvine CA List ownereditor The Tubes San Francisco CA Ambience Ambience explanation arcsamhtm Dont Laugh Dont Tell and Boot Camp The Runners Up and Honorable Mention submissions The Runners Up and Honorable Mention submissions for todays list can be found on our website T H E T O P F I V E L I S T TOP The Home of Original Humor The Top List original lists Top Classic greatest hits Ruminations odd thoughts The Daily Probe news satire The Whack Report real stories The Kid Report kid stories Gadget Geek cool stuff Copyright by Chris White All rights reserved Do not forward publish broadcast or use in any manner without crediting The Top List at wwwtopfivecom To unsubscribe Send mail to To bitch at the owner GET A NEXTCARD VISA in seconds Get rates as low as Intro or Fixed APR and no hidden fees Apply NOW aaabhclvXASclwLhcNextCard T O P I C A Learn More Surf Less Newsletters Tips and Discussions on Topics You Choose partnertag
<10189457.1075840657135.JavaMail.evans@thyme>,jdquillen@yahoo.com,2001-02-17 01:48:00,Fwd Fw Dad buys the clothes Cc Note forwarded message attached Do You Yahoo Get personalized email addresses from Yahoo Mail only a year Received by mailaracnetcom mbox dquillen with Cubic Circles cucipop v Sat Feb XFrom Sat Feb ReturnPath Received from relayolypencom relayolypencom by mailaracnetcom with ESMTP id fHCQnb for Sat Feb Received from mailolypencom mailolypencom by relayolypencom with ESMTP id fHCRKP Sat Feb Received from default pppolypencom by mailolypencom with SMTP id fHCQTl Sat Feb MessageID dcdceceeeddefault From courtney chris To jeff rood Cc Darrin Quillen Sara Mosher Lindsey Marie dg brown Dave Lisa Cindy Chuck Mary Kay Baldwin Alex Subject Fw Dad buys the clothes Date Sat Feb MIMEVersion ContentType multipartmixed boundaryNextPartCCFC XPriority XMSMailPriority Normal XMailer Microsoft Outlook Express XMimeOLE Produced By Microsoft MimeOLE V ContentLength A good Saturday morning chuckle Original Message Sent Monday February PM Subject Fw Dad buys the clothes Sent Sunday February AM Subject Dad buys the clothes This is another download I HAD to send Never let a Dad buy your childrens clothes IMAGE KidShirtjpg
<32904744.1075840660354.JavaMail.evans@thyme>,jdquillen@yahoo.com,2001-02-28 11:37:00,Fwd YOUR JOB IS NOT THAT BAD Cc Note forwarded message attached Do You Yahoo Get email at your own domain with Yahoo Mail Received by mailaracnetcom mbox dquillen with Cubic Circles cucipop v Wed Feb XFrom Wed Feb ReturnPath Received from hotmailcom fpavhotmailcom by mailaracnetcom with ESMTP id fSMIGF for Wed Feb Received from mail pickup service by hotmailcom with Microsoft SMTPSVC Wed Feb Received from by pvfdpavhotmailmsncom with HTTP Wed Feb GMT XOriginatingIP From Bill Barnes Subject Fwd YOUR JOB IS NOT THAT BAD Date Wed Feb MimeVersion ContentType multipartmixed boundaryNextPartafbe MessageID XOriginalArrivalTime Feb UTC FILETIMEBDCAD ContentLength From Scott Shelli Peters To Subject Fwd YOUR JOB IS NOT THAT BAD Date Wed Feb Subject Fw Job A reminder that your job may not be all that bad Get your FREE download of MSN Explorer at Eledropjpg
<4401116.1075840719892.JavaMail.evans@thyme>,jdquillen@yahoo.com,2001-02-17 01:48:00,Fwd Fw Dad buys the clothes Cc Note forwarded message attached Do You Yahoo Get personalized email addresses from Yahoo Mail only a year Received by mailaracnetcom mbox dquillen with Cubic Circles cucipop v Sat Feb XFrom Sat Feb ReturnPath Received from relayolypencom relayolypencom by mailaracnetcom with ESMTP id fHCQnb for Sat Feb Received from mailolypencom mailolypencom by relayolypencom with ESMTP id fHCRKP Sat Feb Received from default pppolypencom by mailolypencom with SMTP id fHCQTl Sat Feb MessageID dcdceceeeddefault From courtney chris To jeff rood Cc Darrin Quillen Sara Mosher Lindsey Marie dg brown Dave Lisa Cindy Chuck Mary Kay Baldwin Alex Subject Fw Dad buys the clothes Date Sat Feb MIMEVersion ContentType multipartmixed boundaryNextPartCCFC XPriority XMSMailPriority Normal XMailer Microsoft Outlook Express XMimeOLE Produced By Microsoft MimeOLE V ContentLength A good Saturday morning chuckle Original Message Sent Monday February PM Subject Fw Dad buys the clothes Sent Sunday February AM Subject Dad buys the clothes This is another download I HAD to send Never let a Dad buy your childrens clothes IMAGE KidShirtjpg
<17059704.1075840719972.JavaMail.evans@thyme>,jdquillen@yahoo.com,2001-02-16 01:12:00,Fwd Top New US Army Weapons for Cc Note forwarded message attached Do You Yahoo Get personalized email addresses from Yahoo Mail only a year Contenttransferencoding BIT Received by mailaracnetcom mbox dquillen with Cubic Circles cucipop v Fri Feb XFrom Fri Feb ReturnPath Received from outmtatopicacom outmtatopicacom by mailaracnetcom with SMTP id fGShb for Fri Feb To From The Top List Subject Top New US Army Weapons for Date Fri Feb MessageID ReplyTo XTopicaLoop Received qmail invoked by alias Feb Received qmail invoked by uid Feb Received from falconproditdearthlinknet by inmtatopicacom with SMTP Feb Received from custerdome poolcvxbradleydialupearthlinknet by falconproditdearthlinknet EL with ESMTP id BAA for Toptopicacom Fri Feb PST MIMEVersion Contenttype textplain charsetUSASCII Xmailer Pegasus Mail for Win vc ContentLength To unsubscribe T H E T O P F I V E L I S T Well hello Clarice Todays Classic Top GOP Euphemisms for Impeaching the President Read it on our website To subscribe February NOTE FROM CHRIS Todays list was compiled from submissions sent in by our ClubTop subscribers For info on joining ClubTop go to htmlClubTophtm The Top New US Army Weapons for The Britney Spear A deadly assault weapon with razor sharp retractable twelve inch nipples which reduce men to drooling idiots R MultiEnvironment Inhalation Assistance Device for ShortTerm Repeatable Infantry Stimulus Okay its actually just a crack pipe RoboReagan Oh come on Did you really think he was hospitalized for a broken hip The Heche Bomb Rather than killing countless civilians like its thermonuclear predecessor detonation of this warhead simply bewilders the enemy by wandering amongst them knocking on their doors and making strange remarks Compassionate Carbine Kills just as effectively but a small sound chip in the stock says Im sorry with each bullet fired Ultra Anthrax Plus Similar to regular Anthrax but with a hint of lemon for a clean refreshing scent Sharkbomb Fills the target area with thousands attorneys leaving it bogged down by legal haggling Army of One Pvt First Class Frank Richards will be dispatched to finally eliminate those pesky Iraqis We expect him to be far more effective than a full dose of the Army without all of the unpleasant side effects The Atomic Balm Deadly Chapstick that comes in three luminescent colors Irradiated Iraq Indigo Glowing Gorky Green and Malignant Mao Mauve Land Mimes Will repulse frustrate and anger the enemy now with potent trapped in a box mechanism Star Wars Defense System Network of ground and orbital based weapons designed to prevent George Lucas from entering US airspace with another lame prequel SHDI Strategic Hairpiece Defense Initiative Uses satellite laser technology to track Sam Donaldson Dont Ask Dont Telegraph Global communication without leaving the closet The Subliminable Obsiconfusionary Mispronunciator Confuses foreign leaders by introducing gibberish into speeches Best of all its stealthiable and Topfivecoms Number New US Army Weapon for The Lewinsky Land Mine Get anywhere near it and itll blow your nuts off The Top List wwwtopfivecom Copyright by Chris White You will ALWAYS find a runnerup entry that you think is funny enough to make the list Bob Williams ClubTop ranks up there with This Is True for great premium subscriptions Scott Ventura ClubTop is a ray of fun every day Ive been a subscriber from the beginning and its never failed to make me laugh at least once Lonnie Falk ClubTop A buck a month a laugh a minute Learn more at htmlClubTophtm Rumination of the Day Human cloning may raise some ethical issues but man I could really use another me in my car to get into that carpool lane J Hutter To subscribe to Ruminations Selected from submissions from contributors Todays Top List authors are Mike Cunningham Woodridge IL Woohoo Liz Scott Madison AL Laura Song Tucson AZ Michal Bryc St Louis MO John D Hopkins Watkinsville GA Paul Atkinson Portland OR Frank Weisbly CA Evan Simper Holbrook AZ Jack Scheer Falls Church VA Chris Warner Alameda CA Adam Chunn Houston TX Jeff Abramsohn Waltham MA Warren Marcus Rockville MD Jon Killian Spanaway WA Bob Roth Fairfield IA Dave Juurlink Toronto Canada BT Cesul Ann Arbor MI Eric Akawie Burke VA Jason Davis Milwaukee WI Arthur Levesque Laurel MD Tom Stoudt Fort Washington PA Marshal Perlman Minneapolis MN Topic Jim Griffith Sunnyvale CA Banner Tag Dale Weese Florissant MO Runner Up list name Tristan Fabriani Passaic NJ Honorable Mention list name Chris White Irvine CA List ownereditor The Tubes San Francisco CA Ambience Ambience explanation arcsamhtm Dont Laugh Dont Tell and Boot Camp The Runners Up and Honorable Mention submissions The Runners Up and Honorable Mention submissions for todays list can be found on our website T H E T O P F I V E L I S T TOP The Home of Original Humor The Top List original lists Top Classic greatest hits Ruminations odd thoughts The Daily Probe news satire The Whack Report real stories The Kid Report kid stories Gadget Geek cool stuff Copyright by Chris White All rights reserved Do not forward publish broadcast or use in any manner without crediting The Top List at wwwtopfivecom To unsubscribe Send mail to To bitch at the owner GET A NEXTCARD VISA in seconds Get rates as low as Intro or Fixed APR and no hidden fees Apply NOW aaabhclvXASclwLhcNextCard T O P I C A Learn More Surf Less Newsletters Tips and Discussions on Topics You Choose partnertag
<485056.1075840699415.JavaMail.evans@thyme>,jdquillen@yahoo.com,2001-04-17 05:40:00,Fwd Top Signs a Rapper Has Gone Nuts Cc Note forwarded message attached Do You Yahoo Yahoo Auctions buy the things you want at great prices Contenttransferencoding BIT Received by mailaracnetcom mbox dquillen with Cubic Circles cucipop v Tue Apr XFrom Tue Apr ReturnPath Received from outmtatopicacom outmtatopicacom by mailaracnetcom with SMTP id fHjFC for Tue Apr To From The Top List Subject Top Signs a Rapper Has Gone Nuts MessageID ReplyTo XTopicaLoop ListHelp listsTop ListUnsubscribe mailto ListSubscribe mailto ListArchive listsTopread Received qmail invoked by alias Apr Received qmail invoked by uid Apr Received from lsmlswemediaonenet by inmtatopicacom with SMTP Apr Received from custerdome wewemediaonenet by lsmlswemediaonenet with ESMTP id fHhC for Toptopicacom Tue Apr PDT Date Tue Apr MIMEVersion Contenttype textplain charsetusascii Xmailer Pegasus Mail for Win vc ContentLength T H E T O P F I V E L I S T Rest In Peace Joey R Todays Classic Top Songs if the Artists ReMade Them Today Read it on our website To subscribe April NOTE FROM CHRIS Rapper Sean Combs recently announced that he no longer wants to be known as Puffy or Puff Daddy preferring instead to be called P Diddy The Top Signs a Rapper Has Gone Nuts Stopped wearing a sideways baseball cap and started wearing a tinfoil Napoleon hat Asks the press and to call him G Dubya Shows up at his next concert wearing a Catholic schoolgirl dress and raps about the cruelty of living under Da Momma Supe All work n no play makez Ice Tray a dull boweee All work n no play makez Ice Tray a dull boweee All work n no play makez Ice Tray a dull boweee His new video features him prancing around in a Dorothy outfit singing Ding dong the wiotch is dead Now wants to be known as The Rapper Formerly Known As Simpering Girly PeeBoy Overheard telling Jennifer Lopez Quit shaking that thing in my face and go put some clothes on already Wears his white dorag after Labor Day Produces double album of nothin but songs about Madeleine Albrights ass On election day announced hes switching party affiliation to West Coast Help the police cuz its nice when theyre around We need em cuz they protect our town and Topfivecoms Number Sign a Rapper Has Gone Nuts The wheels on the bus go round and round Woah Yeah The Top List wwwtopfivecom Copyright by Chris White NEED SOME POSTTAXDAY PURCHASING POWER NextCard Internet Visa Instant Approvals GET APPROVED TODAY As low as Intro APR indexhtmlrefaff Rumination of the Day As far as ineffectual suicide methods go Im sticking with Visine Christy Simuangco To subscribe to Ruminations Selected from submissions from contributors Todays Top List authors are Doug Finney Houston TX th rd in a row Dan Johnson Champlin MN Wade Kwon Birmingham AL Rob Knapp Charlotte NC David Hyatt New York NY Martin Bredeck Hybla Valley VA Mark Niebuhr Minneapolis MN Banner Tag Steven Wilber Pomeroy WA Curtis Matthews Kennesaw GA Beth Gaynor Columbus OH Dave Wesley Pleasant Hill CA Hall of Famer Jason Anderson Birmingham AL Jody LaFerriere Leominster MA Topic Doug Finney Houston TX Runner Up list name Larry Hollister Concord CA HM list name Hall of Famer Slick Sharkey Miami FL List moderator Chris White Los Angeles CA List ownereditor Russell ODB Jones Brooklyn NY Ambience Ambience explanation arcsamhtm MC Lamer and Hip Hopeless The Runners Up and Honorable Mention submissions The Runners Up and Honorable Mention submissions for todays list can be found on our website T H E T O P F I V E L I S T TOP The Home of Original Humor The Top List original lists Top Classic greatest hits Ruminations odd thoughts The Daily Probe news satire The Whack Report real stories The Kid Report kid stories Gadget Geek cool stuff Copyright by Chris White All rights reserved Do not forward publish broadcast or use in any manner without crediting The Top List at wwwtopfivecom To unsubscribe Send mail to To bitch at the owner Save on all your monthly bills LowerMyBillscom has compared s of providers so you dont have to Our free service guarantees you savings on everything from Insurance to Long distance caaabPfclvXASclwLhfLowerMyBills EASY UNSUBSCRIBE click here uclvXASclwLhOr send an email To This email was sent to T O P I C A Learn More Surf LessNewsletters Tips and Discussions on Topics You Choosepartnertag
