Message_id,From,Time_stamp,Text
<14501722.1075841386540.JavaMail.evans@thyme>,jminniece@sbcglobal.net,2002-04-16 21:54:16,Joe call me tomorrowpst at work Joe Minniece Director of IS HanoverDirect mailto
<5421869.1075841386899.JavaMail.evans@thyme>,jminniece@sbcglobal.net,2002-04-10 22:28:45,Joe you arepst going fishing with us on Memorial weekend Also whats Drews email account Thanks Joe
<31553273.1075841389532.JavaMail.evans@thyme>,jminniece@sbcglobal.net,2002-03-20 10:08:59,Re You still therepst I am going fishing in May in Dickerson want to go Original Message From Parks Joe mailtoJoe NRONcom To Joe Minniece mailto Sent Wednesday March AM Subject RE You still there Yep still here Things are pretty slow just waiting to get the hell out Original Message From Joe Minniece mailto Sent Tuesday March PM To Parks Joe Subject You still there what is happening hope all is well just got back from a week of skiing with Maco in Tahoe Was great but did my gambling suck Joe This email is the property of Enron Corp andor its relevant affiliate and may contain confidential and privileged material for the sole use of the intended recipient s Any review use distribution or disclosure by others is strictly prohibited If you are not the intended recipient or authorized to receive for the recipient please contact the sender or reply to Enron Corp at and delete all copies of the message This email and any attachments hereto are not intended to be an offer or an acceptance and do not create or evidence a binding and enforceable contract between Enron Corp or any of its affiliates and the intended recipient or any other party and may not be relied on by anyone as the basis of a contract by estoppel or otherwise Thank you 
<20975533.1075841389703.JavaMail.evans@thyme>,jminniece@sbcglobal.net,2002-03-19 21:12:08,You still therepst what is happening hope all is well just got back from a week of skiing with Maco in Tahoe Was great but did my gambling suck Joe
<20928554.1075841383770.JavaMail.evans@thyme>,jminniece@sbcglobal.net,2002-05-21 15:18:52,RE Fishingpst Got your number in the cell heres my number its my cell I get in at on Thursday want to meet Maco and me out Thursday night for a beer Original Message From Parks Joe To Joe Minniece Subject RE Fishing hey dumby call me when you get to town friday night also i am having some people over sunday if you want to come over joe cell home work Original MeParks Joe hey ssage From Joe Minniece mailto Sent Friday May PM To Parks Joe Subject Re Fishing oh well ill see you next week Joe Original Message From Parks Joe mailto To Joe mailto Minniece Sent Friday May PM Subject Fishing Bad news I am not going to be able to take off work that day to go fishing But will be arround for the weekend This email is the property of Bridgeline Holdings LP andor its relevan t affiliates and may contain confidential and privileged material for the sole use of the intended recipients Any review use distribution or di sclosure by others is strictly prohibited If you are not the intended reci pient or authorized to receive for the recipient please contact the send er and delete all copies of the message This email and any attachments h ereto are not intended to be an offer or an acceptance and do not create or evidence a binding and enforceable contract between Bridgeline Holdings LP or any of its affiliates and the intended recipient or any other p arty and may not be relied on by anyone as the basis of a contract by esto ppel or otherwise Thank you This email is the property of Bridgeline Holdings LP andor its relevan t affiliates and may contain confidential and privileged material for the sole use of the intended recipients Any review use distribution or di sclosure by others is strictly prohibited If you are not the intended reci pient or authorized to receive for the recipient please contact the send er and delete all copies of the message This email and any attachments h ereto are not intended to be an offer or an acceptance and do not create or evidence a binding and enforceable contract between Bridgeline Holdings LP or any of its affiliates and the intended recipient or any other p arty and may not be relied on by anyone as the basis of a contract by esto ppel or otherwise Thank you 
<14346932.1075841383845.JavaMail.evans@thyme>,jminniece@sbcglobal.net,2002-05-17 13:49:44,Re Fishingpst oh well ill see you next week Joe Original Message From Parks Joe mailto To Joe Minniece mailto Sent Friday May PM Subject Fishing Bad news I am not going to be able to take off work that day to go fishing But will be arround for the weekend This email is the property of Bridgeline Holdings LP andor its relevant affiliates and may contain confidential and privileged material for the sole use of the intended recipients Any review use distribution or disclosure by others is strictly prohibited If you are not the intended recipient or authorized to receive for the recipient please contact the sender and delete all copies of the message This email and any attachments hereto are not intended to be an offer or an acceptance and do not create or evidence a binding and enforceable contract between Bridgeline Holdings LP or any of its affiliates and the intended recipient or any other party and may not be relied on by anyone as the basis of a contract by estoppel or otherwise Thank you 
