Message_id,From,Time_stamp,Text
<31998734.1075861772078.JavaMail.evans@thyme>,john.laborde@enron.com,2001-10-23 06:45:14,Kevin Let me know if you need us to provide any additional input on the Arizona taxes for your project Best regards John x
<33142745.1075861033281.JavaMail.evans@thyme>,john.laborde@enron.com,2001-12-17 12:44:16,RMT ContractsSara I wanted to follow up with you to find out if you are still planning to send an example contract to me for transactions involving RMT If you plan to send it interoffice mail I am in EB Thanks John x
<12467834.1075855400336.JavaMail.evans@thyme>,john.laborde@enron.com,2001-12-17 12:44:16,RMT ContractsSara I wanted to follow up with you to find out if you are still planning to send an example contract to me for transactions involving RMT If you plan to send it interoffice mail I am in EB Thanks John x
<27582606.1075861054906.JavaMail.evans@thyme>,john.laborde@enron.com,2002-01-09 15:07:43,RE RMT Trial Balance InformationSusan Did Greg say that the cash is still in ERMT or was it swept back up into ENA or Enron Corp Original Message From Musch Susan Sent Wednesday January PM To Zisman Stuart Laborde John Shackleton Sara Subject RE RMT Trial Balance Information Importance High I just confirmed with Greg Whiting in Accounting that RMT made MM contribution to ERMT RMT obtained such funds through a capital contribution from ENA which in turn received a MM contribution from Enron Corp Best regards Susan Original Message From Musch Susan Sent Wednesday January PM To Zisman Stuart Cc Laborde John Shackleton Sara Subject RMT Trial Balance Information Importance High Stuart Would you please send me your fax number so I can fax you the November th Trial Balance for RMT Thanks Susan Original Message From Shackleton Sara Sent Wednesday January PM To Laborde John Musch Susan Zisman Stuart Subject RMT memo File RMT risk memodot Sara Shackleton Enron Wholesale Services Smith Street EBa Houston TX Ph Fax 
<1043885.1075861055092.JavaMail.evans@thyme>,john.laborde@enron.com,2002-01-10 09:09:56,RE Wire InfoIm not so sure of that because we couldnt see all of the wire transfers There was a credit to the new entitys account in the amount of million on November th and then there was a debit of on the th It looks like that money went into a Goldman Sachs account Original Message From Zisman Stuart Sent Thursday January AM To Musch Susan Laborde John Shackleton Sara Subject RE Wire Info I assume this means that the payment was made and not swept back by Enron Corp Original Message From Musch Susan Sent Thursday January AM To Laborde John Zisman Stuart Shackleton Sara Subject FW Wire Info FYI Best regards Susan Original Message From Moehlman Cathy Sent Thursday January AM To Musch Susan Subject Wire Info OLE Object Picture Device Independent Bitmap 
