Message_id,From,Time_stamp,Text
<33395262.1075845115853.JavaMail.evans@thyme>,lhandli1@txu.com,2001-05-10 07:33:19,IntraInter GISBJpst Keith would you please forward an IntraInter GISB to Enron If they are interested please have them forward their pertinent information Thanks Lynn
<29880656.1075840494353.JavaMail.evans@thyme>,lhandli1@txu.com,2002-04-09 07:32:05,Lone Star Pipelinepst Price for tomm is For the th Thanks Lynn Forwarded by Lynn HandlinENERGYTXU on AM Germany Chris Chris NRONcom on PM To Mazowita Mike Mike NRONcom Kelly Katherine L KatherineL NRONcom Dinari Sabra L SabraL NRONcom cc Germany Chris Chris NRONcom Subject Lone Star Pipeline Lynn Im selling you dth for Friday April th at the same point we sold it to you today Kathy Kelly will call you tomorrow about the weekend I love email Just as an introduction Im taking Joe Parks place buyingselling the gas everyday Kathy Kelly is my backup and she will be handling things for the rest of the week Sabra Dinari schedules the gas on Lone Star for us Mike this is what we have sold to TXU for April Date Volume Price Thanks Chris L Germany Manager Gas Trading Phone Fax This email is the property of Enron Corp andor its relevant affiliate and may contain confidential and privileged material for the sole use of the intended recipient s Any review use distribution or disclosure by others is strictly prohibited If you are not the intended recipient or authorized to receive for the recipient please contact the sender or reply to Enron Corp at and delete all copies of the message This email and any attachments hereto are not intended to be an offer or an acceptance and do not create or evidence a binding and enforceable contract between Enron Corp or any of its affiliates and the intended recipient or any other party and may not be relied on by anyone as the basis of a contract by estoppel or otherwise Thank you 
<16873618.1075840494409.JavaMail.evans@thyme>,lhandli1@txu.com,2002-04-05 08:50:31,Lone Star activity for Sat th Mon thpst Price for April th is Thanks so much Lynn Forwarded by Lynn HandlinENERGYTXU on AM Germany Chris Chris NRONcom on PM To Mazowita Mike Mike NRONcom Kelly Katherine L KatherineL NRONcom Dinari Sabra L SabraL NRONcom Denetsosie Troy Troy NRONcom cc Hill Garrick Garrick NRONcom Germany Chris Chris NRONcom Subject Lone Star activity for Sat th Mon th Lynn we would like to roll the deal weve been doing all week For the weekend we are selling you dth per day at the same point I will be out tomorrow If you have any questions please call Kathy Kelly at or Troy Denetsosie at Thanks This email is the property of Enron Corp andor its relevant affiliate and may contain confidential and privileged material for the sole use of the intended recipient s Any review use distribution or disclosure by others is strictly prohibited If you are not the intended recipient or authorized to receive for the recipient please contact the sender or reply to Enron Corp at and delete all copies of the message This email and any attachments hereto are not intended to be an offer or an acceptance and do not create or evidence a binding and enforceable contract between Enron Corp or any of its affiliates and the intended recipient or any other party and may not be relied on by anyone as the basis of a contract by estoppel or otherwise Thank you 
<13183200.1075840494479.JavaMail.evans@thyme>,lhandli1@txu.com,2002-04-04 08:54:41,Lone Star Pipelinepst Price for the th is Thanks for the business Forwarded by Lynn HandlinENERGYTXU on AM Germany Chris Chris NRONcom on PM To Mazowita Mike Mike NRONcom Kelly Katherine L KatherineL NRONcom Dinari Sabra L SabraL NRONcom cc Germany Chris Chris NRONcom Subject Lone Star Pipeline Lynn Im selling you dth for Friday April th at the same point we sold it to you today Kathy Kelly will call you tomorrow about the weekend I love email Just as an introduction Im taking Joe Parks place buyingselling the gas everyday Kathy Kelly is my backup and she will be handling things for the rest of the week Sabra Dinari schedules the gas on Lone Star for us Mike this is what we have sold to TXU for April Date Volume Price Thanks Chris L Germany Manager Gas Trading Phone Fax This email is the property of Enron Corp andor its relevant affiliate and may contain confidential and privileged material for the sole use of the intended recipient s Any review use distribution or disclosure by others is strictly prohibited If you are not the intended recipient or authorized to receive for the recipient please contact the sender or reply to Enron Corp at and delete all copies of the message This email and any attachments hereto are not intended to be an offer or an acceptance and do not create or evidence a binding and enforceable contract between Enron Corp or any of its affiliates and the intended recipient or any other party and may not be relied on by anyone as the basis of a contract by estoppel or otherwise Thank you 
<32253010.1075840488568.JavaMail.evans@thyme>,lhandli1@txu.com,2002-04-22 10:26:11,Ponderosa Pine prepaymentspst Chris do you mind cking to see if this is accurate Thanks Lynn Forwarded by Lynn HandlinENERGYTXU on PM Nneka P Settle AM To Lynn XUE cc Subject Ponderosa Pine prepayments We are trying to match up the March Ponderosa prepays with what is currently in GasMaster and the two numbers do not equal Did they prepay more than the nominated March deals Also could you confirm whether the following are all the prepays that we received from Ponderosa 
<19952438.1075841388533.JavaMail.evans@thyme>,lhandli1@txu.com,2002-03-27 10:59:08,Ponderosapst Joe can you send me an updated spreadsheet with all business through March Thanks Lynn Forwarded by Lynn HandlinENERGYTXU on PM Ken XUB AM To Lynn XUE cc Subject Ponderosa Lynn Mike at Ponderosa says they wont be using the credit of approximately that they have on their account due to the prepays for the rest of the month He wants to know if we will send it back What do you think thanks Ken
<17129137.1075841390192.JavaMail.evans@thyme>,lhandli1@txu.com,2002-03-14 04:30:47,Prepay Ponderosa for pst Hi Joe can you send me an updated spreadsheet Thanks so much Lynn Forwarded by Lynn HandlinENERGYTXU on AM Ken XUB PM To Lynn XUE cc Subject Prepay Ponderosa for Lynn we received a wire transfer yesterday for from Ponderosa actually Tenaska IV Let me know if you need anything else Ken
<3905310.1075841391328.JavaMail.evans@thyme>,lhandli1@txu.com,2002-03-01 09:04:16,Ponderosa Prepay for pst We are selling to Ponderosa on a prepay basis only approved by Credit Here is the latest on the prepay MMBtu MMBtu MMBtu MMBtu Total due Amt already PP Amount due Ponderosa stated that they will wire ASAP Let me know if I can do anything to help Thanks Lynn
