Message_id,From,Time_stamp,Text
<20898509.1075845199106.JavaMail.evans@thyme>,mailer@denverpost.publishmail.com,2001-06-05 05:01:57,DPO Broncos newsIMAGE Go to DPO front page Careers Homes Autos Yellow Pages IMAGE documentwrite documentwrite IMAGE documentwrite documentwrite documentwrite IMAGE Tuesday June IMAGE ABOUT USHELP IMAGE ARCHIVES IMAGE BOOKS IMAGE BUS INESS IMAGE CLASSIFIEDS IMAGE COLUMNISTS IMAGE COMMUNITY IMAG E DISCUSSION IMAGE EMAIL US IMAGE ENTERTAINMENT IMAGE FOODD INING IMAGE LIFESTYLES IMAGE NEWS IMAGE NEWSLETTERS IMAGE O BITUARIES IMAGE OPINION IMAGE SHOPPING IMAGE SPECIAL SECTIONS IMAGE SPORTS IMAGE Avalanche IMAGE Broncos IMAGE Colle ges IMAGE Columns IMAGE Discussions IMAGE Golf IMAGE Motor Sports IMAGE Nuggets IMAGE Olympics IMAGE Other S ports IMAGE Preps IMAGE Rapids IMAGE Recreation IMAGE Rockies IMAGE Scores IMAGE Womens Sports IMAGE TRAVEL IMAGE WEATHER IMAGE DPO HOME IMAGE SEARCH DPO Enter search t erm hit return key Click here foradvanced search Broncos Topper B ears courting Sundquist Ted Sundquist the Denver Broncos director of col legiate scouting had a second interview with Chicago Bears officials Sunda y and is considered one of three finalists for the job as VP and GM story I know I can still play In a perfect world Steve Beuerlein stil l would be the Carolina Panthers starting quarterback In the real world o f the NFL the yearold will have to settle for playing backup quarterba ck for Denver story Griese leads quarterback shuffle mailbag T he Denver Posts Broncos writer takes your questions each week and responds to the pick of the litter in Adam Schefters Broncos Mailbag Check out the first of two summer installments as Adam tackles questions ranging from the silly to the scintillating including several about the QB situtaion mailbag Denver signs QB Beuerlein story Broncos fancying Coleman notes AM AROUND THE NFL Niners relea se Jerry Rice The San Francisco ers released legendary wide receiver Jer ry Rice on Monday He is reportedly on the verge of signing a deal with the Oakland Raiders story From the wire AP Sports Network Bron cos Mailbag Griese leads QB shuffle Get thee to Greeley AFC West toughens up Thats news to me CA Dont count on View Previous Articles Select an EditionMonday June Sunday June Saturday June Friday June Thursday May Wedne sday May Tuesday May Last Seven Days All contents Copy right The Denver Post or other copyright holders All rights reserved This material may not be published broadcast rewritten or redistributed for any commercial purpose Terms of use Privacy policy Go to Secti on DPO A to ZAbout UsHelpAccess Magazine BusinessAdam Schefter Columns Al Knight ColumnistsAl Lewis ColumnistsAngela Cortez ColumnistsAP Mon eyWire BusinessArchivesAstronomy WeatherAvalanche SportsAvsEmailBeltw ay Notebook ColumnsBest Bets EntertainmentBill Husted ColumnistsBilli e Stanton ColumnistsBob Ewegen ColumnistsBooksBreaking News NewsBret Saunders ColumnistsBroncos SportsBroncos Mailbag BroncosBusinessCalen dars EntertainmentCaroline Schomp ColumnistsCate Terwilliger Columnis tsCensus NewsChapter One BooksCharity solicitations NewsCharlie Meyer s ColumnsChuck Green ColumnsClassifieds Colleges SportsColo Journal LifestylesColo KidsColorado Voices ColumnistsColumbine NewsColumnist sColumnists FoodDiningColumnists BusinessColumnists LifestylesColumn ists OpinionColumnists EntertainmentColumns NewsColumns SportsComic s EntertainmentCommunityCompass ColumnistsComputing BusinessConfluenc e Park LifestylesContestsCritics Choice ColumnistsCSAP Tests NewsDav e Barry ColumnistsDavid Thomas ColumnistsDeals of the Week Columnists Denver The WestDiane Carman ColumnsDick Kreck ColumnistsDiscussionDis cussions SportsDPO HomeDr Wine ColumnistsEMail UsEd Quillen Column ists EntertainmentEreos Story BusinessField of Genes NewsFoodDiningFr ed Brown ColumnistsFuneral notices ObituariesGail Schoettler Columnis tsGardening LifestylesGlenn Giffin ColumnistsGlenn Guzzo ColumnistsGo lf SportsGrowth NewsGuest Commentary ColumnistsHealth LifestylesHig h school of the week PrepsHoroscopes LifestylesI Project NewsInns for the Night TravelInternatl Business BusinessInternships About Us HelpIrv Moss ColumnsJim Armstrong ColumnsJoanne Davidson ColumnistsJo anne Ditmer ColumnistsJoanne Ostrow ColumnistsJohn Henderson ColumnsJ ohn Meyer ColumnsJonBenet NewsKat Valentine ColumnistsKelly Pate Co lumnists Kristen BrowningBlas ColumnistsLegislature NewsLife Voices ColumnistsLifestylesLotteryLottery NewsMarc J Spears ColumnsMark Kiszl a ColumnsMcVeigh Execution NewsMichael Booth ColumnistsMike Keefe C olumnistsMike Klis ColumnsMotor Sports SportsMovie Mania ColumnistsMo vie Reviews EntertainmentMovie Times EntertainmentMr Beer Columnists Neil Devlin ColumnsNewsNewslettersNIENuggets SportsObituariesOlympics SportsOpinionOther Sports SportsPM UpdatePenelope Purdy ColumnistsPe rspective OpinionPeter G Chronis ColumnistsPhotosPolitics NewsPrep S tats Preps Preps SportsPrivacy PolicyRanger NewsRapids SportsRecipe s FoodDiningRecreation SportsReggie Rivers ColumnistsRestaurants F oodDiningReviews BooksRock Talk ColumnistsRockies SportsSandra Dilla rd ColumnistsScores SportsScott Willoughby ColumnsS eller Beware N ewsShoppingSilver Plume NewsSmog Report NewsSnow Sports SportsSound C heck ColumnistsSpecial SectionsSportsStadium NewsStanley Cup Finals A valancheStock Quotes BusinessStreet Smarts ColumnistsSue OBrien Colu mnistsSummer calendar EntertainmentSunday Lifestyles LifestylesSuzanne Brown Fashion ColumnistsTech Town Columnists Terms of UseTerry Frei ColumnsTestSectionThe Dish ColumnistsTina Griego ColumnsTom Kensler ColumnsTravelTravel Notes TravelTV Listings EntertainmentUSAWeekend L ifestylesValkyries SportsWall St Journal BusinessWar Stories NewsWea therWomen s Sports SportsWoody Paige ColumnsWorldNation NewsWrite for us OpinionWriters on Range Columnists IMAGEIMAGE QB Q UANDARY Who will enter the regular season as the Broncos No QB S Beuerlein G Frerotte B Griese J Jackson Other View Resul ts IMAGE FEATURES Results THE WIRE News from AP Br eaking news YOUR VOICE Live chat Join the forum MAILBAG Rea d the latest Pose question WORDS WITH wrapup COLUMNS Adam Schefter NEW STADIUM Webcam DPO coverage IMAGE requ ires Flash COMMUNITY Fan sites denver broncoscom Logo Roste r Depth Chart Transactions NFLcom Main page Rosters TV Radio Ticket Exchange IMAGE IMAGE IMAGE IMAGE EMail services provided by IMAGE You are subscribed to The Denver Post Online as Change your preferences add or d elete newsletters or unsubscribe 
<13468776.1075845199511.JavaMail.evans@thyme>,mailer@denverpost.publishmail.com,2001-06-06 05:02:07,DPO Broncos newsIMAGE Go to DPO front page Careers Homes Autos Yellow Pages IMAGE documentwrite documentwrite IMAGE documentwrite documentwrite documentwrite IMAGE Wednesday June IMAGE ABOUT USHELP IMAGE ARCHIVES IMAGE BOOKS IMAGE BUS INESS IMAGE CLASSIFIEDS IMAGE COLUMNISTS IMAGE COMMUNITY IMAG E DISCUSSION IMAGE EMAIL US IMAGE ENTERTAINMENT IMAGE FOODD INING IMAGE LIFESTYLES IMAGE NEWS IMAGE NEWSLETTERS IMAGE O BITUARIES IMAGE OPINION IMAGE SHOPPING IMAGE SPECIAL SECTIONS IMAGE SPORTS IMAGE Avalanche IMAGE Broncos IMAGE Colle ges IMAGE Columns IMAGE Discussions IMAGE Golf IMAGE Motor Sports IMAGE Nuggets IMAGE Olympics IMAGE Other S ports IMAGE Preps IMAGE Rapids IMAGE Recreation IMAGE Rockies IMAGE Scores IMAGE Womens Sports IMAGE TRAVEL IMAGE WEATHER IMAGE DPO HOME IMAGE SEARCH DPO Enter search t erm hit return key Click here foradvanced search Broncos Topper T estimony tabs Davis A former manager of Atlantas hottest strip club dropp ed more names of famous athletes Tuesday testifying his boss arranged for dancers to have sex with Denver Broncos running back Terrell Davis and form er NBA star Dennis Rodman story Bears courting Sundquist Ted Sun dquist the Denver Broncos director of collegiate scouting had a second i nterview with Chicago Bears officials Sunday and is considered one of three finalists for the job as VP and GM story I know I can still pla y In a perfect world Steve Beuerlein still would be the Carolina Panther s starting quarterback In the real world of the NFL the yearold will have to settle for playing backup quarterback for Denver story Gr iese leads quarterback shuffle mailbag Denver signs QB Beuerlein story Broncos fancying Coleman notes AM AROUND THE NFL Niners release Jerry Rice The San Francisco ers rele ased legendary wide receiver Jerry Rice on Monday He is reportedly on the verge of signing a deal with the Oakland Raiders story From the wire AP Sports Network Broncos Mailbag Griese leads QB shuffle Get thee to Greeley AFC West toughens up Thats news to me CA Dont count on View Previous Articles Select an EditionTuesda y June Monday June Sunday June Saturday June Friday June Thursday May Wednesday May Las t Seven Days All contents Copyright The Denver Post or other copyri ght holders All rights reserved This material may not be published broa dcast rewritten or redistributed for any commercial purpose Terms of use Privacy policy Go to Section DPO A to ZAbout UsHelpAccess Magazine BusinessAdam Schefter ColumnsAl Knight ColumnistsAl Lewis Columnist sAndrew Cohen ColumnistsAngela Cortez ColumnistsAP MoneyWire Business ArchivesAstronomy WeatherAvalanche SportsAvsEmailBeltway Notebook Col umnsBest Bets EntertainmentBill Husted ColumnistsBillie Stanton Colum nistsBob Ewegen ColumnistsBooksBreaking News NewsBret Saunders Column istsBroncos SportsBroncos Mailbag BroncosBusinessCalendars Entertainm entCaroline Schomp ColumnistsCate Terwilliger ColumnistsCensus NewsCh apter One BooksCharity solicitations NewsCharlie Meyers ColumnsChuck Green Columns ClassifiedsColleges SportsColo Journal LifestylesColo KidsColorado Voices ColumnistsColumbine NewsColumnistsColumnists Foo dDiningColumnists BusinessColumnists LifestylesColumnists OpinionCol umnists EntertainmentColumns NewsColumns SportsComics Entertainment CommunityCompass ColumnistsComputing BusinessConfluence Park Lifestyl esContestsCritics Choice ColumnistsCSAP Tests NewsDave Barry Columni stsDavid Thomas ColumnistsDeals of the Week ColumnistsDenver The West Diane Carman ColumnsDick Kreck ColumnistsDiscussionDiscussions Sports DPO HomeDr Wine Columnists EMail UsEd Quillen ColumnistsEntertainment Ereos Story BusinessField of Genes NewsFoodDiningFred Brown Columni stsFuneral notices ObituariesGail Schoettler ColumnistsGardening Life stylesGlenn Giffin ColumnistsGlenn Guzzo ColumnistsGolf SportsGrowth NewsGuest Commentary ColumnistsHealth LifestylesHigh school of the w eek PrepsHoroscopes LifestylesI Project NewsInns for the Night T ravelInternatl Business BusinessInternships About UsHelpIrv Moss Co lumnsJim Armstrong ColumnsJoanne Davidson ColumnistsJoanne Ditmer Col umnistsJoanne Ostrow ColumnistsJohn Henderson ColumnsJohn Meyer Colum nsJonBenet News Kat Valentine ColumnistsKelly Pate ColumnistsKristen BrowningBlas ColumnistsLegislature NewsLife Voices ColumnistsLifesty lesLotteryLottery NewsMarc J Spears ColumnsMark Kiszla ColumnsMcVeig h Execution NewsMichael Booth ColumnistsMike Keefe ColumnistsMike Kli s ColumnsMotor Sports SportsMovie Mania ColumnistsMovie Reviews Ent ertainmentMovie Times EntertainmentMr Beer ColumnistsNeil Devlin Col umnsNewsNewslettersNIENuggets SportsObituariesOlympics SportsOpinionOth er Sports SportsPM UpdatePenelope Purdy ColumnistsPerspectiv e Opi nionPeter G Chronis Columnists PhotosPolitics NewsPrep Stats PrepsPr eps SportsPrivacy PolicyRanger NewsRapids SportsRecipes FoodDining Recreation SportsReggie Rivers ColumnistsRestaurants FoodDiningRevie ws BooksRock Talk ColumnistsRockies SportsSandra Dillard Columnists Scores SportsScott Willoughby ColumnsSean Kelly ColumnistsSeller Bewa re NewsShoppingSilver Plume NewsSmog Report NewsSnow Sports SportsS ound Check ColumnistsSpecial SectionsSportsStadium NewsStanley Cup Fina ls AvalancheStock Quotes BusinessStreet Smarts Co lumnistsSue OBrie n Columnists Summer calendar EntertainmentSunday Lifestyles Lifestyle sSuzanne Brown Fashion ColumnistsTech Town ColumnistsTerms of UseTerr y Frei ColumnsTestSectionThe Dish ColumnistsTina Griego ColumnsTom Ke nsler ColumnsTravelTravel Notes TravelTV Listings EntertainmentUSAWee kend LifestylesValkyries SportsWall St Journal BusinessWar Stories NewsWeatherWomens Sports SportsWoody Paige ColumnsWorldNation News Write for us OpinionWriters on Range Columnists IMAGEIMAGE QB QUANDARY Who will enter the regular season as the Broncos No QB S Beuerlein G Frerotte B Griese J Jackson Other Vi ew Results IMAGE FEATURES Results THE WIRE News from A P Breaking news YOUR VOICE Live chat Join the forum MAILBA G Read the latest Pose question WORDS WITH wrapup COL UMNS Adam Schefter NEW STADIUM Webcam DPO coverage IMAGE requires Flash COMMUNITY Fan sites denver broncoscom Logo Roster Depth Chart Transactions NFLcom Main page Ros ters TV Radio Ticket Exchange IMAGE IMAGE I MAGE IMAGE EMail services provided by IMAGE You are subscribed to The Denver Post Online as Change your preferences add or d elete newsletters or unsubscribe 
<12509210.1075845201182.JavaMail.evans@thyme>,mailer@denverpost.publishmail.com,2001-06-07 05:01:52,DPO Broncos news Careers Homes Autos Yellow Pages documentwrite documentwrite documentwrite d ocumentwrite documentwrite Thursday June ABOUT USHELP ARCHIVES BOOKS BUSINESS CLASSIFIEDS COLU MNISTS COMMUNITY DISCUSSION EMAIL US ENTERTAINMENT FOODDIN ING LIFESTYLES NEWS NEWSLETTERS OBITUARIES OPINION SHOPPI NG SPECIAL SECTIONS SPORTS Avalanche Broncos Colleges Columns Discussions Golf Motor Sports Nuggets Olympics Other Sports Preps Rapids Recreation Roc kies Scores Womens Sports TRAVEL WEATHER DPO HOME SEARCH DPO Enter search term hit return key Click here foradvanced sear ch Testimony tabs Davis A former manager of Atlantas hottest stri p club dropped more names of famous athletes Tuesday testifying his boss a rranged for dancers to have sex with Terrell Davis and Dennis Rodman stor y Bears courting Sundquist Ted Sundquist the Denver Broncos dire ctor of collegiate scouting had a second interview with Chicago Bears offi cials Sunday and is considered one of three finalists for the job as VP and GM story Griese leads quarterback shuffle The Denver Posts Broncos writer takes your questions each week and responds to the pick of t he litter in Adam Schefters Broncos Mailbag Check out the first of two summer installments as Adam tackles questions ranging from the silly to the scintillating including several about the QB situtaion mailbag I know I can still play story Denver signs QB Beuerlein story Broncos fancying Coleman notes Team hires Steve Watson s tory Some kind of nerdy guy Kennison favored to earn No roste r spot Chiefs sign CB Crockett NFL schedulemakers dodge potholes McGlockton adds depth at Dtackle Invesco scores as media drop Mile High Road to future includes Reamon QB Weinkes step slow and old Broncos have running back for trade Receiver crop one of best AM Broncos Mailbag Griese leads QB shuffle Get t hee to Greeley AFC West toughens up Thats news to me CA Don t count on View Previous Articles Select an EditionWednesday June Tuesday June Monday June Sunday June Saturday June Friday June Thursday May Last Se ven Days All contents Copyright The Denver Post or other copyright holders All rights reserved This material may not be published broadcas t rewritten or redistributed for any commercial purpose Terms of use Pr ivacy policy Go to Section DPO A to ZAbout UsHelpAccess Magazine Bu sinessAdam Schefter ColumnsAl Knight ColumnistsAl Lewis ColumnistsAnd rew Cohen ColumnistsAngela Cortez ColumnistsAP MoneyWire BusinessArch ivesAstronomy WeatherAvalanche SportsAvsEmailBeltway Notebook Columns Best Bets EntertainmentBill Husted ColumnistsBillie Stanton Columnist sBob Ewegen ColumnistsBooksBreaking News NewsBret Saunders Columnists Broncos SportsBroncos Mailbag BroncosBusinessCalendars EntertainmentC aroline Schomp ColumnistsCate Terwilliger ColumnistsCensus NewsChapte r One BooksCharity solicitations NewsCharlie Meyers ColumnsChuck Gree n Columns ClassifiedsColleges SportsColo Journal LifestylesColo Kid sColorado Voices ColumnistsColumbine NewsColumnistsColumnists FoodDi ningColumnists BusinessColumnists LifestylesColumnists OpinionColumni sts EntertainmentColumns NewsColumns SportsComics EntertainmentComm unityCompass ColumnistsComputing BusinessConfluence Park LifestylesCo ntestsCritics Choice ColumnistsCSAP Tests NewsDave Barry ColumnistsD avid Thomas ColumnistsDeals of the Week ColumnistsDenver The WestDian e Carman ColumnsDick Kreck ColumnistsDiscussionDiscussions SportsDPO HomeDr Wine Columnists EMail UsEd Quillen ColumnistsEntertainmentEreo s Story BusinessField of Genes NewsFoodDiningFred Brown ColumnistsF uneral notices ObituariesGail Schoettler ColumnistsGardening Lifestyl esGlenn Giffin ColumnistsGlenn Guzzo ColumnistsGolf SportsGrowth N ewsGuest Commentary ColumnistsHealth LifestylesHigh school of the week PrepsHoroscopes LifestylesI Project NewsInns for the Night Trave lInternatl Business BusinessInternships About UsHelpIrv Moss Column sJim Armstrong ColumnsJoanne Davidson ColumnistsJoanne Ditmer Columni stsJoanne Ostrow ColumnistsJohn Henderson ColumnsJohn Meyer ColumnsJo nBenet News Kat Valentine ColumnistsKelly Pate ColumnistsKristen Brow ningBlas ColumnistsLegislature NewsLife Voices ColumnistsLifestylesL otteryLottery NewsMarc J Spears ColumnsMark Kiszla ColumnsMcVeigh Ex ecution NewsMichael Booth ColumnistsMike Keefe ColumnistsMike Klis ColumnsMotor Sports SportsMovie Mania ColumnistsMovie Reviews Enterta inmentMovie Times EntertainmentMr Beer ColumnistsNeil Devlin Columns NewsNewslettersNIENuggets SportsObituariesOlympics SportsOpinionOther S ports SportsPM UpdatePenelope Purdy ColumnistsPerspectiv e Opinion Peter G Chronis Columnists PhotosPolitics NewsPrep Stats PrepsPreps SportsPrivacy PolicyRanger NewsRapids SportsRecipes FoodDiningRecr eation SportsReggie Rivers ColumnistsRestaurants FoodDiningReviews BooksRock Talk ColumnistsRockies SportsSandra Dillard ColumnistsScor es SportsScott Willoughby ColumnsSean Kelly ColumnistsSeller Beware NewsShoppingSilver Plume NewsSmog Report NewsSnow Sports SportsSound Check ColumnistsSpecial SectionsSportsStadium NewsStanley Cup Finals AvalancheStock Quotes BusinessStreet Smarts Co lumnistsSue OBrien Columnists Summer calendar EntertainmentSunday Lifestyles LifestylesSuz anne Brown Fashion ColumnistsTech Town ColumnistsTerms of UseTerry Fr ei ColumnsTestSectionThe Dish ColumnistsTina Griego ColumnsTom Kensle r ColumnsTravelTravel Notes TravelTV Listings EntertainmentUSAWeekend LifestylesValkyries SportsWall St Journal BusinessWar Stories New sWeatherWomens Sports SportsWoody Paige ColumnsWorldNation NewsWrit e for us OpinionWriters on Range Columnists FEATURES Results THE WIRE News from AP Breaking news YOUR VOICE Li ve chat Join the forum MAILBAG Read the latest Pose question WORDS WITH wrapup COLUMNS Adam Schefter NEW STADIUM Webcam DPO coverage requires Flash COMMUNITY Fan sites denver broncoscom Roster Depth Chart Transactions NFL com Main page Rosters TV Radio Ticket Exchange EMail services provided by You are subscribed to The Denver Post On line as Change your preferences add or delete n ewsletters or unsubscribe 
<23776801.1075845201581.JavaMail.evans@thyme>,mailer@denverpost.publishmail.com,2001-06-08 05:02:08,DPO Broncos news Careers Homes Autos Yellow Pages documentwrite documentwrite documentwrite d ocumentwrite documentwrite Friday June ABOUT USHELP ARCHIVES BOOKS BUSINESS CLASSIFIEDS COLU MNISTS COMMUNITY DISCUSSION EMAIL US ENTERTAINMENT FOODDIN ING LIFESTYLES NEWS NEWSLETTERS OBITUARIES OPINION SHOPPI NG SPECIAL SECTIONS SPORTS Avalanche Broncos Colleges Columns Discussions Golf Motor Sports Nuggets Olympics Other Sports Preps Rapids Recreation Roc kies Scores Womens Sports TRAVEL WEATHER DPO HOME SEARCH DPO Enter search term hit return key Click here foradvanced sear ch Testimony tabs Davis A former manager of Atlantas hottest stri p club dropped more names of famous athletes Tuesday testifying his boss a rranged for dancers to have sex with Terrell Davis and Dennis Rodman stor y Bears courting Sundquist Ted Sundquist the Denver Broncos dire ctor of collegiate scouting had a second interview with Chicago Bears offi cials Sunday and is considered one of three finalists for the job as VP and GM story Griese leads quarterback shuffle The Denver Posts Broncos writer takes your questions each week and responds to the pick of t he litter in Adam Schefters Broncos Mailbag Check out the first of two summer installments as Adam tackles questions ranging from the silly to the scintillating including several about the QB situtaion mailbag Denver signs QB Beuerlein story Broncos fancying Coleman notes AM AROUND THE NFL Chiefs ink Cadrez to oneyear deal Glenn Cadrez was released by the Denver Broncos last month two days before he was due a roster bonus He led Denver with tackles i n He was second on the team with tackles in story From the wire AP Sports Network Broncos Mailbag Griese leads QB sh uffle Get thee to Greeley AFC West toughens up Thats news to m e CA Dont count on View Previous Articles Select an Edi tionThursday June Wednesday June Tuesday June Mo nday June Sunday June Saturday June Friday June Last Seven Days All contents Copyright The Denver Post or other copyright holders All rights reserved This material may not be pub lished broadcast rewritten or redistributed for any commercial purpose T erms of use Privacy policy Go to Section DPO A to ZAbout UsHelpAcce ss Magazine BusinessAdam Schefter ColumnsAl Knight ColumnistsAl Lewis ColumnistsAndrew Cohen ColumnistsAngela Cortez ColumnistsAP MoneyWir e BusinessArchivesAstronomy WeatherAvalanche SportsAvsEmailBeltway No tebook ColumnsBest Bets EntertainmentBill Husted ColumnistsBillie Sta nton ColumnistsBob Ewegen ColumnistsBooksBreaking News NewsBret Saund ers ColumnistsBroncos SportsBroncos Mailbag BroncosBusinessCalendars EntertainmentCaroline Schomp ColumnistsCate Terwilliger ColumnistsCen sus NewsChapter One BooksCharity solicitations NewsCharlie Meyers C olumnsChuck Green Columns ClassifiedsColleges SportsColo Journal Lif estylesColo KidsColorado Voices ColumnistsColumbine NewsColumnistsColu mnists FoodDiningColumnists BusinessColumnists LifestylesColumnists OpinionColumnists EntertainmentColumns NewsColumns SportsComics E ntertainmentCommunityCompass ColumnistsComputing BusinessConfluence Par k LifestylesContestsCritics Choice ColumnistsCSAP Tests NewsDave Bar ry ColumnistsDavid Thomas ColumnistsDeals of the Week ColumnistsDenve r The WestDiane Carman ColumnsDick Kreck ColumnistsDiscussionDiscussi ons SportsDPO HomeDr Wine Columnists EMail UsEd Quillen ColumnistsE ntertainmentEreos Story BusinessField of Genes NewsFoodDiningFred Bro wn ColumnistsFuneral notices ObituariesGail Schoettler ColumnistsGard ening LifestylesGlenn Giffin ColumnistsGlenn Guzzo ColumnistsGolf S portsGrowth NewsGuest Commentary ColumnistsHealth LifestylesHigh sch ool of the week PrepsHoroscopes LifestylesI Project NewsInns for t he Night TravelInternatl Business BusinessInternships About UsHelpI rv Moss ColumnsJim Armstrong ColumnsJoanne Davidson ColumnistsJoanne Ditmer ColumnistsJoanne Ostrow ColumnistsJohn Henderson ColumnsJohn M eyer ColumnsJonBenet News Kat Valentine ColumnistsKelly Pate Column istsKristen BrowningBlas ColumnistsLegislature NewsLife Voices Colum nistsLifestylesLotteryLottery NewsMarc J Spears ColumnsMark Kiszla C olumnsMcVeigh Execution NewsMichael Booth ColumnistsMike Keefe Column istsMike Klis ColumnsMotor Sports SportsMovie Mania ColumnistsMovie R eviews EntertainmentMovie Times EntertainmentMr Beer ColumnistsNeil Devlin ColumnsNewsNewslettersNIENuggets SportsObituariesOlympics Spor tsOpinionOther Sports SportsPM UpdatePenelope Purdy ColumnistsPerspec tiv e OpinionPeter G Chronis Columnists PhotosPolitics NewsPrep Sta ts PrepsPreps SportsPrivacy PolicyRanger NewsRapids SportsRecipes FoodDiningRecreation SportsReggie Rivers ColumnistsRestaurants Food DiningReviews BooksRock Talk ColumnistsRockies SportsSandra Dillard ColumnistsScores SportsScott Willoughby ColumnsSean Kelly Columnist sSeller Beware NewsShoppingSilver Plume NewsSmog Report NewsSnow Spor ts SportsSound Check ColumnistsSpecial SectionsSportsStadium NewsStan ley Cup Finals AvalancheStock Quotes BusinessStreet Smarts Co lumnis tsSue OBrien Columnists Summer calendar EntertainmentSunday Lifestyles LifestylesSuzanne Brown Fashion ColumnistsTech Town ColumnistsTerm s of UseTerry Frei ColumnsTestSectionThe Dish ColumnistsTina Griego C olumnsTom Kensler ColumnsTravelTravel Notes TravelTV Listings Enterta inmentUSAWeekend LifestylesValkyries SportsWall St Journal BusinessW ar Stories NewsWeatherWomens Sports SportsWoody Paige ColumnsWorldN ation NewsWrite for us OpinionWriters on Range Columnists FEATURES Results THE WIRE News from AP Breaking news YOUR VOICE Live chat Join the forum MAILBAG Read the latest Pose question WORDS WITH wrapup COLUMNS Adam Schefter NEW STADIUM Webcam DPO coverage requires Flash COMMUNI TY Fan sites denver broncoscom Roster Depth Chart Trans actions NFLcom Main page Rosters TV Radio Ticket Excha nge EMail services provided by You are subscribed to The Denver Post On line as Change your preferences add or delete n ewsletters or unsubscribe 
