Message_id,From,Time_stamp,Text
<26999824.1075862268426.JavaMail.evans@thyme>,mitch.taylor@enron.com,2001-11-19 08:36:35,Re Todays schedule change Cc Im stuck in traffic trying to get back from ground zero Ill meet you at Bill Sperrys office at Mitch Sent from my BlackBerry Wireless Handheld
<8184581.1075862291960.JavaMail.evans@thyme>,mitch.taylor@enron.com,2001-11-27 12:18:31,ReWe are sitting in Weils offices waiting to negotiate Unfortunately we do not know what the deal is We are waiting on the higher ups to fill us in on what we are negotiating Unclear whether dyn is in and the total deal is for mm or dyn is out and it is a mm transaction Well let you know Mitch Sent from my BlackBerry Wireless Handheld
<29487219.1075862292652.JavaMail.evans@thyme>,mitch.taylor@enron.com,2001-11-28 10:33:26,ReWe are on a plane coming back I dont think they formally backed out but effectively that is what has happened Sent from my BlackBerry Wireless Handheld
<10211886.1075862293760.JavaMail.evans@thyme>,mitch.taylor@enron.com,2001-09-06 14:46:44,FW Revised NRG CompcoRod Here is the information we discussed It appears gas pipelines trade at x EBITDA Mitch Original Message From Wadlington Mark Sent Thursday August PM To Taylor Mitch Subject FW Revised NRG Compco you asked jayshree about domestic pipes I get this from CSFB investment banking biweekly It is their comp set One tab is labelled mlp and one tab is labelled pipelines mark Original Message From Saul Grant mailto Sent Wednesday August PM To Detmering Timothy J Wadlington Mark Subject FW Revised NRG Compco Please find the attached weekly summary SUMMARY xls Grant Saul Investment Banking Analyst Global Energy Group CREDIT FIRST SUISSE BOSTON Telephone Internal Fax Email This message is for the named persons use only It may contain confidential proprietary or legally privileged information No confidentiality or privilege is waived or lost by any mistransmission If you receive this message in error please immediately delete it and all copies of it from your system destroy any hard copies of it and notify the sender You must not directly or indirectly use disclose distribute print or copy any part of this message if you are not the intended recipient CREDIT SUISSE GROUP and each of its subsidiaries each reserve the right to monitor all email communications through its networks Any views expressed in this message are those of the individual sender except where the message states otherwise and the sender is authorised to state them to be the views of any such entity Unless otherwise stated any pricing information given in this message is indicative only is subject to change and does not constitute an offer to deal at any price quoted Any reference to the terms of executed transactions should be treated as preliminary only and subject to our formal written confirmation
<20503871.1075840831228.JavaMail.evans@thyme>,mitch.taylor@enron.com,2002-01-02 12:29:41,FW NetCo conference calls Cc John Below is the request from Top Gun Muller andor myself will join you on the th floor for the conference call Original Message From Brennan James mailto Sent Wednesday January PM To Taylor Mitch Cc Schleimer Andrew Subject FW NetCo conference calls Mitch I neglected to spell out that at we hope John or Louise will walk through the details of physical delivery so that everyone on our due diligence team will have the opportunity to ask questions that may arise Rgds James Original Message From Schleimer Andrew Sent Wednesday January PM To Pittarelli Ernest UBS ODonnell Pat UBS Meinel Matt UBS Dyrvik Per UBS Eber Louis UBS Stockman Michael UBS Cc Brennan James Meisner Joseph Hunt Jim Ming Tom Sherrill Russell Schleimer Andrew Subject NetCo conference calls Team We have set up two conference calls for this afternoon the first at pm NY time and the second at pm We are currently confirming participation from Enron either Louise Kitchen or John Lavoratto from the Wholesale trading business You are each invited to join either at or the same call in number will work for both depending on your needs At Ernie Pittarelli Operations plans to review with Louise or John the scope of the business going forward This may be of in interest to Pat ODonnell IT and Per Dyrvik Finance as well At the topic will turn to physical delivery I would anticipate that Lou Eber legal will want to participate as well as outside counsel from Covington Burling and Sullivan Cromwell Bill Glass credit and Mike Stockman risk may also want to participate on this call The dialin number for both and is domestic and international Conference Moderator James Brennan Conference PasscodeReservation Rgds James Visit our website at This message contains confidential information and is intended only for the individual named If you are not the named addressee you should not disseminate distribute or copy this email Please notify the sender immediately by email if you have received this email by mistake and delete this email from your system Email transmission cannot be guaranteed to be secure or errorfree as information could be intercepted corrupted lost destroyed arrive late or incomplete or contain viruses The sender therefore does not accept liability for any errors or omissions in the contents of this message which arise as a result of email transmission If verification is required please request a hardcopy version This message is provided for informational purposes and should not be construed as a solicitation or offer to buy or sell any securities or related financial instruments
<14470914.1075840804493.JavaMail.evans@thyme>,mitch.taylor@enron.com,2002-02-03 12:58:37,RE Transition Services Agreement Cc legal email pst Can we have a meeting at AM Monday morning to discuss the Transition Services I will try to get conference room c Jim please invite anyone else from your team that you feel would be helpful Mary we will plan on patching you in by phone Mitch Original Message From Kitchen Louise Sent Saturday February PM To Golden Jeff Whalley Greg Cc Muller Mark S Taylor Mitch Schuler Lance Legal Subject RE Transition Services Agreement Just give us a time Thanks Louise Original Message From Golden Jeff Sent Friday February PM To Whalley Greg Cc Muller Mark S Taylor Mitch Schuler Lance Legal Kitchen Louise Subject FW Transition Services Agreement Greg Im sure mitch and I would be happy to help broker thisIm sure its getting the right people at the table for an hour Id suggest fallon louise lance and mary korby from weil Any ohers Jeff Jeff Golden Original Message From Schuler Lance Legal LanceSchuler NRONcom To Taylor Mitch Mitchell NRONcom Golden Jeff Jeff NRONcom Sent Fri Feb Subject FW Transition Services Agreement I am going to need you guys to help weigh in Thanks Lance W Lance Schuler Enron North America Corp Smith Street Houston Texas Phone Fax Email Original Message From Racicot Paul Sent Friday February PM To Fallon Jim Cc Schuler Lance Legal Sager Elizabeth Miller Don Asset Mktg Dimichele Rich Subject Transition Services Agreement Jim There is a lot of confusion over the scope and scale of services that the estate will require from UBS over the next several months During the negotiations over the Transistion Services Agreement it was clearly contemplated that the estate will need UBS to schedule and purchase power as an agent of the estate However most of the UBS team does not understand or expect to provide these types of services I know that you have coordinated with Greg Whalley but I feel it is necessary that we have a broader coordination meeting between the two organizations I think this meeting needs to happen at your level Thanks Paul
<7535549.1075862255818.JavaMail.evans@thyme>,mitch.taylor@enron.com,2001-11-27 05:21:59,ReIts death or dynegy with no clear leader Mitch Sent from my BlackBerry Wireless Handheld
<18680267.1075862262651.JavaMail.evans@thyme>,mitch.taylor@enron.com,2001-11-27 21:10:49,ReI fear death is making a strong push down the backstretch Right now its a pissing match between Watson and the banks We are somewhat emasculated bystanders Mitch Sent from my BlackBerry Wireless Handheld
