Message_id,From,Time_stamp,Text
<12824460.1075840969663.JavaMail.evans@thyme>,newsletters@123jump.com,2002-02-05 21:22:33,FLASH ALERT Dont fall for Technologys biggest LIEPST This message was not sent to you unsolicited You are currently subscribed to this mailing list To change or cancel your subscription please follow the instructions at the end of this message Thank you Dear Investor Heres the biggest lie in technology today one that has individual investors completely in the dark about an opportunity of immense proportions A LOWRISK tech stock that can easily DOUBLE your money by this time next yearthen make your fortune several times over in the years to come IN JUST A MOMENT Ill tell you how to get the name of this stock complete details and my full buy instructions absolutely FREE without obligation of any kind But first back to technologys biggest lie Im talking about the socalled glut of fiber optic cable WHEN the World Trade Center got hit the Internet slowed downvery noticeably slowed down In fact it nearly came to a grinding halt That means there isnt enough capacity or redundancy built into the system to accommodate a blip in demand Sources tell me that the government is very worried about this problem After all this is the second time its happened Back in July a tunnel fire in Baltimore slowed the Internet to a crawl for two full days That means our communications systemsand therefore our economyare very very vulnerable And we are closer to the BREAKING POINT than of Americans even begin to understand Heres one example Qwestone of Americas biggest carriersrecently said theyre loaded on their network That doesnt sound too baduntil you understand how these networks operate You cant load a network much past In fact is virtually catastrophicbecause the network spends so much time searching for open channels it doesnt spend any time actually sending packets of information The system locks Communications stops The nation comes to a standstill And business the economy and our national security all go in the CRAPPER BUT WHY do we have this capacity problem amidst a fiber glut Because of all the fiber that has ever been laid is darkthat is its not activated And the company Im recommending is the supplier of the components needed to do the job Im looking at a DOUBLE possibly a TRIPLE by this time next year And I fully expect to multiply our money fivetimes over by In fact this stock truly has tenbagger potential So get in on the action Click on the link below to get the name of this stock in your special FREE report Meet the Powerbrokers of the Real Economy I think youll find this FREE offer well worth your while In the last time tech stocks started from such depressed levelsmy clients earned as verified by The Hulbert Financial Digest And that earned us Hulberts RANKING for all investment advisories At the height of the boom this companys stock was nearly times higher So what changed Spending on communications networks dried up Now the government is ready to pump billion in emergency spending into the economy interest rates are practically zero and the need isnt just vital for the economy anymoreits a question of NATIONAL SECURITY Please dont miss out Youve got nothing to lose by taking a look at this FREE no strings attachedspecial report Click here to sign up now indexhtmpromocodeDJ Sincerely Michael Murphy TECHNOLOGY INVESTING PS The longer you wait the more profits you MISS OUT on This tenbagger has a long ways to runbut its already UP since October st in recognition of this companys vital new role in national security Dark fiber does no good Actual carrying capacity is strained to the limits And get thisdata traffic is DOUBLING every year now That means a network running at of capacity needs to double its load by this time next year just to keep up Thats why the fiber must be lit Thats why the fiber will be lit Click here to get your special FREE report now indexhtmpromocodeDJ You are currently subscribed to Jumpcom mailing list as To Cancel your subscription please go to lettersremovehtmidemailletoutlookweekly To Change your subscription please go to lettershtmemail
<32592895.1075851527739.JavaMail.evans@thyme>,newsletters@123jump.com,2001-10-24 11:59:11,Free Email Seminar This message was not sent to you unsolicited You are currently subscribed to the Jumpcom mailing list To no longer receive messages please follow the easy unsubscribe instructions at the end of this message My readers are up in yearsand now I want to show YOU the core principles of our winning investment strategy Join Me for My FirstEver FREE Email Seminar Success Secrets of a Tech Stock Pro Dear Investor How many technology investors do you know who have outperformed the NASDAQ by more than since My Technology Investing readers have done exactly thatand I believe I can help YOU do the same Thats why Ive developed a brand new email seminar Success Secrets of a Tech Stock Pro that Id like to offer youabsolutely FREE In this fourweek email series Ill show you How to Identify the Companies That Will Survive the Market Meltdown September th changed everything Good ideas and innovation are no longer enough Bet on that and youll loseplain and simple Heres what you SHOULD look for instead How to Spot Tomorrows Top Technology Performers Today Hint It has NOTHING to do with priceearnings OR pricebook ratios and Wall Street doesnt have a clue Learn the factors you MUST evaluate before buying a single tech companythe right criteria can mean the difference between millions of dollars in profitsand more gutwrenching losses How YOU Can Avoid the Costliest Mistakes Most Investors Made Last Year My readers and I were able to lock in profits even as the NASDAQ crashed by knowing these three simple rulesand were turning them to our advantage this year too Thats how weve racked up gains of up to in several of our stocks in alone Heres your chance to put them to work for you too PLUS Ill reveal my top picks to help you DOUBLE YOUR MONEY OR BETTER in just the next months including Unparalleled cash resources This industry frontrunner has a whopping of the fiber optic components market LOCKED UP With companies looking to increase their data storage and disaster recovery efforts after the recent terrorist attacks this area is going to gain a HUGE boost Every investor must own this stock Military Electronics Biometric Identification Technologies Cell phone boom MP craze PDAs EZ Pass Internet Gaming Find out how you can make profits with one innovative powerhouse More profitable than the rise of computers AND the Internet This companys making genebased drugs fast and giving cancer a run for its money Heres how YOU can profit After the terrorist attacksthe market crashand the recent inventory glut its a WHOLE NEW BALLGAME for technology stocks Sadly most investors dont know the new rulesand theyre missing out on a slew of unbelievable profits that a small handful of investors is quietly taking to the bank So far my Technology Investing readers are sitting on gains of in Applied Materials in Oracle in Immunex and more Which crowd do YOU want to run with You CAN make money in this market and you CAN set yourself up for even more phenomenal profits when technology stocks finally turn around With the new rulesa savvy seasoned guideand my FREE email seminar on your side you can hardly lose So go ahead visit ppamolcmolcjsppcML now and sign up right awaythis offer is only available through Monday October Youve got NOTHING to loseenroll FREE today and begin profiting tomorrow Sincerely Michael Murphy Editor Technology Investing PS This comprehensive week email seminar is ABSOLUTELY FREE My hope is that the materials I send you will help you gain a solid investing edge and that youll ultimately decide to profit alongside me on an ongoing basis by joining my proven Technology Investing advisory service The choice is yoursand with this FREE course youve got nothing to lose Visit ppamolcmolcjsppcML and sign up sign up before Monday October space is limited so dont delay You are currently subscribed to Internet Stock News as To Cancel your subscription please go to confirmhtmlistidmid To Change your subscription please go to lettershtmSLemail
