Message_id,From,Time_stamp,Text
<14635934.1075858647784.JavaMail.evans@thyme>,rebecca.fite@enron.com,2001-10-23 10:29:53,Re REMINDER EES NEW MARKET ENTRY STATUS MEETING TODAYEditors note todays meeting is today October not the th as indicated belowsorry for the confusion Rebecca Fite PM To New Market Entry cc Subject REMINDER EES NEW MARKET ENTRY STATUS MEETING TODAY Meeting is at pm CST Tuesday October EB C Dial in Passcode FYI FOR NEW ATTENDEES THIS IS A RECURRING WEEKLY MEETING AT PM TUESDAYS INVITATIONS ARE NOT SENT PLEASE MARK YOUR CALENDAR ACCORDINGLY 
<32165483.1075858647808.JavaMail.evans@thyme>,rebecca.fite@enron.com,2001-10-23 10:26:47,REMINDER EES NEW MARKET ENTRY STATUS MEETING TODAYMeeting is at pm CST Tuesday October EB C Dial in Passcode FYI FOR NEW ATTENDEES THIS IS A RECURRING WEEKLY MEETING AT PM TUESDAYS INVITATIONS ARE NOT SENT PLEASE MARK YOUR CALENDAR ACCORDINGLY 
<15641750.1075858666063.JavaMail.evans@thyme>,rebecca.fite@enron.com,2001-08-27 11:25:01,Data requirements for enrollmentRichard The attached is the latest and greatest dealsheet and is what is completed and submitted to CSC to enroll customers for physical serve Let me know if you have any questions Rebecca
<6123924.1075861633735.JavaMail.evans@thyme>,rebecca.fite@enron.com,2001-11-15 07:15:09,State LicensingUtility AgreementsGloria Jim and Harry Thanks for pulling us all together on Monday We look forward to working with your group on merging the State Licensing and Utility Agreements into a common area in order to keep the organization informed and up to date I wanted to recap just a bit The Services Group has state licensing responsibility for Gas and Power for EESI and EEMC We handle new licensing and renewals We are on an autoreminder distribution from EES legal Heather Mathis for renewalsreporting We physically house all documentation relating to licensing on our floor We currently publish and distribute as needed State License status report which identifies where we are licensed and what our license is The Services Group works directly with Gloria for utility agreements as we are one of many groups who she obtains signoff from andor information in order to execute agreements and State Licensing information is critical to her processes Gloria and I met yesterday to discuss next steps We are working together to provide the following Matrix of Executed Agreements which includes State License UDC Agreement Type Signatory Date Issued ExpirationRenewal Security Requirements Weeks Backfill each groups need for documentation provide copies of State Licenses andor UDC agreements Weeks Identify the EESENE contacts sent to the StateUDC update as needed internally and externally Weeks Provide Summary information regarding StateUDC that can be placed on EES Market Central Weeks Ensure information is updated published organized and accessible to all interested parties Gloria has initiated creating binders that will be housed on the th floor we will encompass State information with the executed UDC agreements Gloria please feel free to add anything I have overlooked Ive attached the contact list currently used when obtaining State Licenses This should help identify other stakeholders who you may want to speak with Regards Rebecca
<4928110.1075861633975.JavaMail.evans@thyme>,rebecca.fite@enron.com,2001-11-15 10:32:18,Texas Pilot Report Due Cc Jim We have to file a report under project pilot reporting in Texas today The data will be available at PM Who on your team can I coordinate with to submit the actual filing The procedure to submit the filing can be located on the Texas PUC website lefthand side filings Thanks in advance Rebecca
<27378202.1075861634089.JavaMail.evans@thyme>,rebecca.fite@enron.com,2001-11-15 13:10:25,RE Texas Pilot Report Due Cc Thanks Jim I did check the deadline and its pm The files will follow shortly Regards Rebecca Original Message From Steffes James D Sent Thursday November PM To Fite Rebecca Ogenyi Gloria Kingerski Harry Hunter Bevin Cc Hetrick Nancy Subject RE Texas Pilot Report Due Rebecca Pls work through Gloria and Bevin Hunter in Austin My understanding is that PUCT filing deadlines are always pm but Bevin can take it over to the PUCT this evening I assume that you will create the report and Gloria will draft a simple cover sheet filing Gloria we may need Marianne Carroll to sign Jim Original Message From Fite Rebecca Sent Thursday November PM To Steffes James D Ogenyi Gloria Kingerski Harry Cc Hetrick Nancy Subject Texas Pilot Report Due Jim We have to file a report under project pilot reporting in Texas today The data will be available at PM Who on your team can I coordinate with to submit the actual filing The procedure to submit the filing can be located on the Texas PUC website lefthand side filings Thanks in advance Rebecca
<31477468.1075861638900.JavaMail.evans@thyme>,rebecca.fite@enron.com,2001-11-26 09:32:06,Texas Pilot Reprot REFILEGloriaBevin Attached are the three reports that should be refiled with the PUC today for Project Please call if you have any questions or need additional information Thanks Rebecca
<967667.1075855210212.JavaMail.evans@thyme>,rebecca.fite@enron.com,2001-11-21 11:45:10,State Licensing Matrix Cc Team Attached is our latest draft have a great thanksgiving Rebecca Original Message From Shields Craig Sent Wednesday November AM To Fite Rebecca Subject Here you go
<7180025.1075861642880.JavaMail.evans@thyme>,rebecca.fite@enron.com,2001-11-21 07:27:15,RE Performance Surety Bonds Cc One more Washington Gas EES has parental guaranty Due to current financial status Washington Gas has requested Bond instead RAC contact indicated no bond available EES has days to respond A note on the ConEd ServicesOperations has a work around for the few Midmarket deals origination is closing which will prevent us from increasing our security Straight Dual Billing Mass Market volume increase will drive any security increase in this market Thanks Rebecca Original Message From Kingerski Harry Sent Wednesday November AM To Steffes James D Leff Dan Hughes Evan Cc Fite Rebecca Ogenyi Gloria Sharp Vicki Herndon Rogers Black Don Richter Jeff Mihalik Teresa Subject RE Performance Surety Bonds and just to be clear here are the recent or current issues I am aware of and their status Con Ed request for million security in lieu of parental guaranty complete million sent prior to deadline Request for additional security likely to come when Con Ed sees our increasing load SoCal Gas request for margin sharing agreement in lieu of parental guaranty complete New contract signed and delivered Retail and wholesale gas desks to work together to avoid occurence of margin call for credit over million daily Peoples Gas of IL request for letter of credit for k in lieu of parental guaranty deferred Peoples agreed to suspend demand for lc if further downgrade does not occur Virginia license for EES gas complete for now Services served copy of application to other parties Their comments due back to VA SCC by Dec Maryland license for EEMC gas scheduled to be approved on provisional basis today MD PSC will be reviewing generic requirement that parental guarantees be unconditional unlimited and unrestricted Pennsylvania request for update to EES and EPMI bonds and request for increase in EES bond from k to m Under review New bond language has been sent to Mary Grisaffi Trying to whittle down or eliminate increase CGE request for deposit associated with Transmission Service Agreement being processed Service request reduced from MW to MW to reduce cash outlay First Energy requested new security in lieu of parental guaranty deferred First Energy agreed to continue accepting parental guaranty in absence of further downgrade If there are others we should know about please let me know Original Message From Steffes James D Sent Wednesday November AM To Leff Dan Hughes Evan Kingerski Harry Cc Fite Rebecca Ogenyi Gloria Sharp Vicki Herndon Rogers Black Don Richter Jeff Subject RE Performance Surety Bonds After talking with Dan I intend to set up a meeting to provide complete matrices on licensing and utility contracts sometime early during the week beginning Dec Also just to make sure everyone is clear Harry Gloria and Rebecca are on point during the next few weeks to ensure that that EES andor EPMI responds timely to any request for info additional security or other utility matters This of course will continue to require help from legal credit and operations If anyone has any other questions please give me a call Thanks Original Message From Leff Dan Sent Tuesday November PM To Steffes James D Hughes Evan Kingerski Harry Subject RE Performance Surety Bonds when can we discuss this thanks Original Message From Steffes James D Sent Tuesday November AM To Leff Dan Hughes Evan Kingerski Harry Subject RE Performance Surety Bonds Dan I will get with Evan and his team and pull this together Of course much of the activity with Utilities is driven by their requirements and judgements which change over time Jim Original Message From Leff Dan Sent Tuesday November AM To Hughes Evan Steffes James D Subject Performance Surety Bonds Jim Evan As you are probably aware the performance and surety bond market is difficult for us to navigate in and around in our current situation As an example EFS has been shut out of getting access to new bid and performance payments bonds for its business that requires these We are addressing this with the bonding companies now All of their existing bonds are in place and in force In light of this I wanted to make sure that we are absolutely current in all aspects of all bonding requirements with UDCs and LDCs Please send me the most current copy of your matrix that illustrates where we have existing bonds in place what drives the capacity requirements status renewal expiration date current payment status etc I would like to make sure that we are all clear on how these work what triggers increases decreases in capacity and other issues impacting our ability to continue to flow electricity and natural gas to our clients Thanks Dan
