Message_id,From,Time_stamp,Text
<22266469.1075845628916.JavaMail.evans@thyme>,scott.laidlaw@enron.com,2000-11-30 09:33:00,Re FURTHER UPDATE TO Westinghouse DA Generator Damaged MVIndustrialBridge Cc below for responses in red regards scott James P CT PM To Scott LaidlawENRON NRONDEVELOPMENT Matthew TezykENRON NRONDEVELOPMENT cc James P CT Subject Re FURTHER UPDATE TO Westinghouse DA Generator Damaged MVIndustrialBridge Project Doc Nbr More questions can either of you answer Forwarded by James P StuddertHOUECT on PM Ted Rosen on PM To cc Subject Re FURTHER UPDATE TO Westinghouse DA Generator Damaged MVIndustrialBridge Jim Sharron seems content with what you have provided regarding Enrons responsibility to insure etc Thank you She is now asking the following What is Enron claiming for response siemens westinghouse iswill be claiming for full and total loss of the generator a replacement generator is currently being manufactured in austria and will arrive in port of houston tx in the mid april timeframe we have a meeting sched with them next week well attempt to determine what the value of just the generator is from siemenswestinghouse ie we have a price for the gas turbine generator unit but not separate prices for just the gas turbine and the generator What is the financial extent of Enrons claim response plz refer to above comment It seems to me that the short answers to these questions would be The cost to repair the generator that Enron was supposed to receive from SWPC response again we are talking about a total loss and not just a repair plz see above Unknown until SWPC actually tears down the generator and determines the extent of damage and the cost to repair response again the generator will not be repaired therefore this question is na Those answers however will certainly provoke further questions such as When and where is SWPC going to tear down the unit inspect it and determine the repair costs response plz see prior email also the generator will not be repaired therefore this question is na Isnt the water damage just getting worse as the generator just sits there unopened with no measures taken to prevent further deterioration response plz understand that siemens westinghouse still has care custody and control of the damaged generator at this time siemens westinghouse considers the generator a total loss normally this would have been a great question however given the circumstances this question is na Jim if anyone can provide a response to Sharrons questions please let me know what you find out Thanks Thanks Ted Rosen PM Will this do Forwarded by James P StuddertHOUECT on PM Scott NRONDEVELOPMENT PM To James P CT cc Matthew TezykENRON NRONDEVELOPMENT Ben CT Chris nron Kay nron Dan ShultzENRON NRONDEVELOPMENT Subject Re FURTHER UPDATE TO Westinghouse DA Generator Damaged MV IndustrialBridge Document link James P Studdert thanx for note ref section cargo insurance of the purchase contract between enron equipment procurement company and siemens westinghouse power corporation a siemens company for one wda gas turbine generator package yk contract r ct provides that Purchaser shall provide or cause to be provided and maintained for the period of transportation in sufficient time so as not to delay Sellers transportation of the Equipment Cargo Insurance for Equipment Such insurance will be provided as Marine Cargo Insurance on a warehouse to warehouse basis insuring Equipment against loss or damage arising from customary allrisk marine perils including war strikes riots and civil commotion while in transit The deductible the responsibility of Seller shall be Twenty Five Thousand US Dollars for each and every physical damage loss Purchaser shall provide or cause to be provided Seller the opportunity to review and comment on the draft Cargo insurance policy prior to its placement Such review shall occur as soon as available Sellers review shall be limited to days from Purchasers submission of draft Cargo Policy Purchaser shall incorporate or cause to be incorporated Sellers suggested changes to the Cargo Policy provided such provisions are common customary and are reasonable commercially available Such policy shall specify Seller as an additional insured and waive any rights of subrogation against Seller under such policy where Purchaser is enron where Seller is siemenswestinghouse where Equipment shall mean the CTUnit and all other material and supplies to be furnished by Seller pursuant to the Scope of Work where CTUnit shall mean a nominal da gas turbine generator econopac with generator package with all its ancillary and auxiliary equipment hope this helps we can fax a cc of this section as needed plz advise including names and fax numbers also plz advise if addl info needed regards scott James P CT PM To Scott LaidlawENRON NRONDEVELOPMENT Matthew TezykENRON NRONDEVELOPMENT cc James P CT Subject Re FURTHER UPDATE TO Westinghouse DA Generator Damaged MV IndustrialBridge Project Doc Nbr Please see the comments from Ted Rosen below and advise if this can be answered Thanks Forwarded by James P StuddertHOUECT on PM James P Studdert AM To David CT cc James P CT Subject Re FURTHER UPDATE TO Westinghouse DA Generator Damaged MV IndustrialBridge David can you come up with the requested documentation and if there is none can you write an explanatory memo as to how this came down Forwarded by James P StuddertHOUECT on AM Ted Rosen on AM To cc Subject Re FURTHER UPDATE TO Westinghouse DA Generator Damaged MV IndustrialBridge Jim Thanks for the reply Sharron has focused on the comment that the unit has not actually been delivered to Enron and that title ownership and custody are still with SWPC She is therefore questioning Enrons insurable interest I have commented to her that Enron can insure goods titled to another party as long as Enron has instructions to insure the goods Sharron does not dispute this but has asked if there is any documentary evidence that would show that Enron had instructions to insure this cargo I think we can interpret instructions liberally If there is a purchase order or similar agreement that states that Enron is to insure the turbine that should be sufficient Would you please ask for this Thanks and regards Ted Rosen AM Heres the response finally Forwarded by James P StuddertHOUECT on AM Scott NRONDEVELOPMENT AM To James P CT Matthew TezykENRON NRONDEVELOPMENT Dan ShultzENRON NRONDEVELOPMENT Ben CT cc Subject FURTHER UPDATE TO Westinghouse DA Generator Damaged MV Industrial Bridge plz see addl comments below in blue ie reflects conversation with mr matt tezyk regards scott Forwarded by Scott LaidlawENRONDEVELOPMENT on AM Scott Laidlaw AM To James P CT Matthew TezykENRON NRONDEVELOPMENT Dan ShultzENRON NRONDEVELOPMENT Ben CT cc Subject Re Westinghouse DA Generator Damaged MV Industrial Bridge Document link Scott Laidlaw regrets i thought that this had been previously responded to see below for comments in red regards scott James P CT PM To Scott LaidlawENRON NRONDEVELOPMENT Matthew TezykENRON NRONDEVELOPMENT cc James P CT Subject Westinghouse DA Generator Damaged MV Industrial Bridge Project Doc Nbr No one has bothered to respond The questions below need to be answered BY SOMEONE Underwriters are growing impatient and if no response is forthcoming they will assume we have withdrawn the claim and close their file Can SOMEONE please respond Forwarded by James P StuddertHOUECT on PM James P Studdert PM To Scott LaidlawENRON NRONDEVELOPMENT Matthew TezykENRON NRONDEVELOPMENT cc James P CT Subject Westinghouse DA Generator Damaged MV Industrial Bridge Gentlemen if Ive left out who this should be directed to please forward to whomever can provide the answers Is Enron Equipment Procurement Co still pursuing a claim against Enron cargo insurers comment we probably need to discuss this with enas ben jacoby so that you can receive specific guidance as i understand it since enrons insurance eg marine cargo is primary enron will pursue a claim against the enron cargo insurer further comment the answer remains yes again must discuss with enas ben jacoby because of his commercial involvementexpectations If so I must provide proof of ownership of the damaged generator other than an email message Please provide ASAP comment what do you need while enron has made approx of the payments for the gas turbine generator unit it is likely that ownership still resides with westinghouse ie it was never delivered per the equipment purchase contract with enron again what type of documentation do you need does it matter if westinghouse is still in the loop further comment at this time title ownership care custody and control remain with westinghouse further westinghouse must continue to be in the loop because the monies for the damaged might ultimately be paid to them ie westinghouse provides enron with a new replacement generator then westinghouse receives the insurance money to cover their lossdamaged generator Is the generator to be repaired comment no the generator is not to be repaired instead a replacement generator is being manufactured in austria for westinghouse and is to be delivered to the port of houston in the midapril timeframe If so when and where comment na Underwriters surveyor needs to examine it when it is taken apart comment na The surveyor was told when he made an inspection at the Port that a detailed repair estimate would be provided to him on the other unit that was damaged and this would provide a guide as to the type of damage on our unit comment only the generator was damaged the gas turbine is complete and resides in houston i do not understand your comment about damage to another unit further comment the other unit does not belong to enron ie it belongs to another westinghouse client plz understand that the other unit was immersed deeper in salt water than our unit as a result its damage was greater in that we are getting a replacement generator we have to assume that the other unit that was also damaged is also being replaced therefore it can be inferred that the damage estimate for both generators are approximately the same To date nothing has been sent to our surveyor comment none further comment we are not sure about your statement our understanding is that you previously both communicated with and sent the accident survey of westinghouses underwriter to our surveyor As it has been over three months since the unit arrived in Houston in its damaged condition if Enron expects to collect from Enron cargo insurers we must move forward in providing the information previously requested or prejudice Enrons claim to recovery due to lack of cooperation with the adjustersurveyor comment noted
<30272905.1075845631896.JavaMail.evans@thyme>,scott.laidlaw@enron.com,2000-12-06 07:41:00,Westinghouse DA damaged generator Cc thanx for your time on phone this afternoon a just received cc of letter from westinghouse in it they assert that title to the existing generator passed to enron upon delivery into the united states delivery occurred at houston on or about jul as required by the contract and incoterms risk of loss to the generator passed to enron when the generator arrived ddp at houston while the generator remained on board the common carrier the generator was delivered in an undamaged condition title and risk of loss passed to enron before the water damage to the generator occurred xxxxxxxxxxxxxxxxxxxxxxxxxxxxxxxxxxxxxxxxxxxxxxxxxxxxxxxxxxxxx b per the contract between enron and westinghouse section title to Equipment Title to the Equipment will pass to Purchaser immediately upon entry into the united states section risk of loss Seller shall bear the risk of loss and damage with respect to the Equipment until delivery of the Equipment to the Delivery Point in accordance with Section Seller shall be required to inspect the Equipment for damage at the Delivery Point section Seller shall cause the Equipment to be delivered to the Delivery Point on a DDP basis in accordance with Sections by the date set forth therein section Seller shall be responsible for delivering the CTUnit DDP to the iii us port of export by any means of transport section Seller shall perform customs clearance for the Equipment through us customs and pay any import duties section Guaranteed Unit Delivery Date Seller will cause the CTUnit authors note includes the generator to be delivered in an undamaged condition in accordance with the SpecificationCT to the Delivery Point DDP in accordance with Schedule I below the Guaranteed Unit Delivery Date authors note the date specified in the contract was later slipped per agreement with enron section Completion of Delivery delivery of the CTUnit to the Delivery Point shall be considered complete for the purposes of Delivery Liquidated Damages as it pertains to the delivery of Major Components authors note includes the GT and generator when the last Major Component of such CTUnit is delivered DDP to the Delivery Point in complete and undamaged condition Purchaser shall have the right to inspect the Equipment for condition of the Equipment upon actual delivery Purchaser reserves the right to reject damaged Equipment at any location however in the event a portion of the Equipment is damaged or defective upon delivery to the Delivery Point Purchaser after making an initial assessment of the damage or defect and consulting with Seller as to how such damage will affect the installation operation performance reliability efficiency and warranty of the damaged Equipment may either i reasonable determine that such damage or defect is such that the preceding criteria is so adversely affected that Purchaser cannot accept delivery of the damaged Equipment and declare that delivery has not occurred or ii after taking into account such criteria and Sellers proposed plan for correcting such damage or defect in accordance with Section declare that delivery has occurred in the event Purchaser discovers such a damage or defect it shall notify Seller of such as soon as practical c facts of the case as we know them common carrier ship carrying the generator supposedly arrived in port of houston approx jul ie that was the ships estimated time of arrival eta westinghouse is claiming that delivery occurred on or about jul enron representative frank cervenka went to CTSS ie the westinghouse facility here in houston on friday jul to inspect the combustion turbine during that inspection westinghouse employees informed him that the generator had salt water damage at the port as a result the following monday jul he visited the port of houston with the siemenswestinghouse insurance adjustor and saw the damaged generator note this was just a cursory visit to verify that in fact the unit had been damaged the full extent of the damage and impact on the project was not known at that time eg repair or replace were still viable options enron received formal notification faxed letter of the damaged generator on approx aug enron has already made progress payments to siemenswestinghouse in the amount of of the contract value of the gas turbine and generator DDP per incoterms means delivered duty paid Westinghouse despite prior requests from enron has not provided copies of the customs clearance documentation ie we dont know the exact date that the generator cleared customs or if it cleared customs title means ownership but does not imply either risk of loss or care custody and control with title comes both ownership and the responsibility for payment of taxes d info not known by enron when did ship come into port when did damage to generator occur when or if us customs duties were paid f info known by enron generator is a total loss as determined by westinghouse per section of contract enron was not given the formal opportunity to inspect the damaged generator until a month after it arrived in port as recalled by matt tezyk westinghouse was then advised by enron in writing that the generator was rejected and that delivery had not occurred authors note matt to find cc of that letter g enrons assertions are that DDP was not satisfied ie delivery of the generator did not occur in accordance with the terms of the contract title ie ownership remains with siemenswestinghouse risk of loss remains with siemenswestinghouse xxxxxxxxxxxxxxxxxxxxxxxxxxxxxxxxxxxxxxxxxxxxxxxxxxxxxxxxxxxxx john plz assess the copy of the contract provided to you this afternoon under separate cover we request a legal opinion as to whether delivery in accordance with the contract of the CTUnit occurred or not plz call with any questions regards scott
<23380218.1075845639141.JavaMail.evans@thyme>,scott.laidlaw@enron.com,2000-12-14 03:46:00,westinghouse DA update Cc s calls westinghouse is asking enron whether wed consider the following settlement of the north america peakerpanamaelectrocities gtg issue particularly as it relates to the damaged generator again plz understand that this is not a formal offer at this time will come within days depending on our response westinghouse does not want to go to their senior management with a settlement offer without knowing that enron will respond favorably when formally presented ie just a waste of time for all concerned westinghouse will reimburse enron asap with moneys paid to date by enron to westinghouse note westinghouse is willing to consider taking back the gtg for what enron paid westinghouse BUT NO addl monies will be offerred or considered this is a ceiling money to be wired within days of settlement agreement westinghouse takes back the unit asis no further claimsrights of action between the parties on this gtgcontract this potential of an offer from westinghouse has a life span of just a few days ie this week westinghouse is long on DA machines and for them to take this one back into the fold will present them with marketing challenges in pros brings cash back to enron on the balance sheet before end of year we dont currently have a use for this gtg in an enron project ie unless an idc treatment can be agreed projects now cant typically afford this unit we dont currently have an anticipated use for this gtg in the next to months in an enron project we dont have to pay for storage ie such costs are already accruing dispute resolution per contract consists of senior management meeting seeking to settle if unable the remedy is the ny courts therefore we can avoid lawsuit therefore well save on outside legal costs as part of settlement we can possibly secure an option forward or first right of refussal on a f or g machine for projects in by settling now this avoids further month by month increases in idc cons idc costs to be written off by ena or elsewhere for ben plz advise dan shultz kay mann hopefully and scott laidlaw are available to meet today on this issue regards scott
<33477409.1075845639981.JavaMail.evans@thyme>,scott.laidlaw@enron.com,2000-12-15 01:27:00,westinghouse DA gtg including damaged generator Cc thanx for your time on the phone yesterday my understanding is that you do not want to proceed at this time with the tentative westinghouse offer outlined in my email sent yesterday this issue is to be reassessed next month in the interim both chris booth and scott laidlaw are to work directly with outside counsel and with kay mann in firming up our claim position re the equipment supply contract for the gtg between enron and siemenswestinghouse also reaffirming my comment to you yesterday my understanding is that this north american peakerpanamaelectrocities gtg was initially contracted by eecc for ena dave delaney then the gtg including idc shifted to calme david haug for the panama project upon calmes demise the gtg migrated back to ena at no time has eecc owned the gtg ownership was always with a business unit with eecc administering the contract on the business units behalf hope this helps regards scott
<11618997.1075845654929.JavaMail.evans@thyme>,scott.laidlaw@enron.com,2001-01-17 14:59:00,damaged westinghouse generator Cc voice mail the marked up letter along with cc of the contract is on front left corner of my desk as viewed from chair attached is draft of response letter needs to be revised to pick up above comments also per our conversation our understanding is that this letter was to go out under bens signature regards scott
<1875821.1075845677025.JavaMail.evans@thyme>,scott.laidlaw@enron.com,2001-03-14 17:18:00,coop city SHORT FUSE for rehash of capex and om numbers Cc attached file plan forward revdoc plz consider this file and its contents to be a work in progress this will be our working tool for meeting this thurs at am it includes action item list referred to as plan forward per my notes what enron is prepared to do in this deal note mark bernstein to provide more detailed listing per my notes what enron is not prepared to do same note as above listing of scope taken from my notes and file reading plz consider as draft we have to agree on baseline before we can price looking forward to seeing you there for ray danner lets discuss your note re benchmark vs detailed estimate and info requirements during planned meeting i agree with your concerns regards scott
<2858029.1075845677452.JavaMail.evans@thyme>,scott.laidlaw@enron.com,2001-03-15 15:47:00,coop city REVISED project schedule AND capexom number updates Cc revised project sched plz see attached file updated scheds for both gtgs and hrsgs based on conversations today with ss and nooterdeltak respectively for the gtgs time period from order to exworks is months for hrsgs time period from order to exworks is also months with delay in ordering major equipment until funds released in midnov the projects cod is delayed until april represents a worsening of the schedule by months re revised capexom numbers by cob friday mar complete revised sched status attached complete scope reconciliation status completed with pb powers john mesko on thursday mar complete revised putstakes to existing benchmark analysis with x lm and x lm including detailed listing of assumptions develop preliminary assessment of cap status to complete fri am mar complete cash flow analysis status by mark brand by noon monday mar complete var assessment of model by mid morning at latest status by mark brand finalize cap level status pending provide filled in template to jeff ader for approval to send to pb powercoop city status pending send info to pb powercoop city by noon status pending plz note that client has adjusted sched to allow days review of data by coop board before their formal meeting on tues mar plz call with any questions regards scott
<14139420.1075845679078.JavaMail.evans@thyme>,scott.laidlaw@enron.com,2001-03-19 02:39:00,coop city redline of development agreement termsheet Cc enclosed are comments from randy pais rob long robert sevitz scott laidlaw regards scott
<26193109.1075845691311.JavaMail.evans@thyme>,scott.laidlaw@enron.com,2001-04-11 05:37:00,coal initiative request for short fuse support Cc roe greetings our understanding is that our current PSA with you has lapsed however ms renee alfaro has sent an extension letter to extend that PSA at this time enrons position is that we are unable to use the lapsedextended PSA for work on the coal initiative ie accounting rule requirements however well be sending you soon a cc of a PSA that is compliant with our offbalance sheet accounting requirements plz stay tuned but in the interim lets get started on the short fuse request for info from enron using just a tasking letter with a nottoexceed without prior approval price of and a commitment from enron to pay said related invoices attached is a copy of the tasking letter that we discussed on the phone plz sign date and return fax this tasking letter back to me upon receipt ill sign date and fax you back a record copy plz call with any questions regards scott
<19047260.1075845749607.JavaMail.evans@thyme>,scott.laidlaw@enron.com,2001-03-14 17:18:00,coop city SHORT FUSE for rehash of capex and om numbers Cc attached file plan forward revdoc plz consider this file and its contents to be a work in progress this will be our working tool for meeting this thurs at am it includes action item list referred to as plan forward per my notes what enron is prepared to do in this deal note mark bernstein to provide more detailed listing per my notes what enron is not prepared to do same note as above listing of scope taken from my notes and file reading plz consider as draft we have to agree on baseline before we can price looking forward to seeing you there for ray danner lets discuss your note re benchmark vs detailed estimate and info requirements during planned meeting i agree with your concerns regards scott
