Message_id,From,Time_stamp,Text
<17300417.1075845887327.JavaMail.evans@thyme>,scott.laidlaw@enron.com,2000-11-29 02:53:00,Warm Fuzzies from BWare neat regards scott FIVE GREAT LESSONS Most Important Lesson During my second month of nursing school our professor gave us a pop quiz I was a conscientious student and had breezed through the questionsuntil I read the last one What is the first name of the woman who cleans the school Surely this was some kind of joke I had seen the cleaning woman several times She was tall darkhaired and in her s but how would I know her name I handed in my paper leaving the last question blank Just before class ended one student asked if the last question would count toward our quiz grade Absolutely said the professor In your careers you will meet many people All are significant They deserve your attention and care even if all you do is smile and say hello Ive never forgotten that lesson I also learned her name was Dorothy Second Important Lesson Pickup in the Rain One night at PM an older African American woman was standing on the side of an Alabama highway trying to endure a lashing rain storm Her car had broken down and she desperately needed a ride Soaking wet she decided to flag down the next car A young white man stopped to help her generally unheard of in those conflictfilled s The man took her to safety helped her get assistance and put her into a taxi cab She seemed to be in a big hurry but wrote down his address and thanked him Seven days went by and a knock came on the mans door To his surprise a giant console color TV was delivered to his home A special note was attached It read Thank you so much for assisting me on the highway the other night The rain drenched not only my clothes but also my spirits Then you came along Because of you I was able to make it to my dying husbands bedside just before he passed away God bless you for helping me and unselfishly serving others Sincerely Mrs Nat King Cole Third Important Lesson Always remember those who serve In the days when an ice cream sundae cost much less a year old boy entered a hotel coffee shop and sat at a table A waitress put a glass of water in front of him How much is an ice cream sundae he asked Fifty cents replied the waitress The little boy pulled his hand out of his pocket and studied the coins in it Well how much is a plain dish of ice cream he inquired By now more people were waiting for a table and the waitress was growing impatient Thirtyfive cents she brusquely replied The little boy again counted his coins Ill have the plain ice cream he said The waitress brought the ice cream put the bill on the table and walked away The boy finished the ice cream paid the cashier and left When the waitress came back she began to cry as she wiped down the table There placed neatly beside the empty dish were two nickels and five pennies You see he couldnt have the sundae because he had to have enough left to leave her a tip Fourth Important Lesson The Obstacle in Our Path In ancient times a King had a boulder placed on a roadway then he hid himself and watched to see if anyone would remove the huge rock Some of the kings wealthiest merchants and courtiers came by and simply walked around it Many loudly blamed the king for not keeping the roads clear but none did anything about getting the stone out of the way Then a peasant came along carrying a load of vegetables Upon approaching the boulder the peasant laid down his burden and tried to move the stone to the side of the road After much pushing and straining he finally succeeded After the peasant picked up his load of vegetables he noticed a purse lying in the road where the boulder had been The purse contained many gold coins and a note from the king indicating that the gold was for the person who removed the boulder from the roadway The peasant learned what many of us never understand Every obstacle presents an opportunity to improve our condition Fifth Important Lesson Giving When it Counts Many years ago when I worked as a volunteer at a hospital I got to know a little girl named Liz who was suffering from a rare and serious disease Her only chance of recovery appeared to be a blood transfusion from her year old brother who had miraculously survived the same disease and had developed the antibodies needed to combat the illness The doctor explained the situation to her little brother and asked the little boy if he would be willing to give his blood to his sister I saw him hesitate for only a moment before taking a deep breath and saying Yes Ill do it if it will save her As the transfusion progressed he lay in bed next to his sister and smiled as we all did seeing the color returning to her cheeks Then his face grew pale and his smile faded He looked up at the doctor and asked with a trembling voice Will I start to die right away Being young the little boy had misunderstood the doctor he thought he was going to have to give his sister all of his blood in order to save her You see after all understanding and attitude are everything
<29274282.1075846133378.JavaMail.evans@thyme>,scott.laidlaw@enron.com,2000-09-19 08:42:00,LM Configuration Cc request copies of the lm and da contracts including amendments are being made at this time hope to get those to you this wednesday the attached email concerns a pending amendment to the lm contract plz call with any questions regards scott Forwarded by Scott LaidlawENRONDEVELOPMENT on PM Matthew Tezyk PM To Scott LaidlawENRON NRONDEVELOPMENT cc Subject LM Configuration Project Doc Nbr As you requested this is the meat for Change Order I do not have it and am unsure if it is signed Matt Forwarded by Matthew TezykENRONDEVELOPMENT on PM From Chris Booth PM To cc John A nron Ben F CT Bill CT John nron Kathleen ClarkENRON NRONDEVELOPMENT Matthew TezykENRON NRONDEVELOPMENT Steven RoseENRON NRONDEVELOPMENT Bruce GoldenENRON NRONDEVELOPMENT Mike ColemanENRON NRONDEVELOPMENT Terri AustinENRON NRONDEVELOPMENT Subject LM Configuration Please note the following changes to theattached LM Configuration Matrix Enron South America ESA to receive units Change units and to GE generators change from Brush generator Change units and to Fin Fan coolers swap with units and Las Vegas Cogen to receive units Change units and to Shell and Tube coolers swap with units and Change orders to be executed to include the following scope Add Quantity standard base stacks currently assigned to PSCo These stacks were committed by M Miller of ENA in March but not yet accounted for by change order Add Quantity heavy base stacks with extensions to total stack height assigned to ESA units Four of these stack bases are committed by M Miller of ENA in March but not yet accounted for by change order Add Quantity ton chiller units wo cooling towers assigned to ESA units These two chillers were committed by M Miller of ENA in March but not yet accounted for by change order Add Quantity cooling towers for item above Add Quantity ton chiller units w cooling towers assigned to ESA units Additional items GE Package Power to investigate removal and credit of duel fuel package from units and prior to shipment Chris
<4485936.1075846133450.JavaMail.evans@thyme>,scott.laidlaw@enron.com,2000-10-13 12:21:00,siemens westinghouse damaged generator greetings the attached letters are drafts for your review and comment well clean up the transmittal with letterhead at time of sending our intent is to send these two letters to siemens westinghouse asap plz respond with comments asap regards scott
<30306553.1075846133698.JavaMail.evans@thyme>,scott.laidlaw@enron.com,2000-11-30 03:51:00,DA with damaged Generator meeting during week of dec Cc phone callsmessages a tentative timedate of am to noon houston time on wednesday dec has been set for a meeting between siemenswestinghouse and enron re the subject unit the exact timingdate to be confirmed by siemenswestinghouse after mark tartaglio is able to discussconfirm with lynn dekrey attendees from enron to include ben jacoby chris booth kay mann and scott laidlaw to be confirmed attendees from siemenswestinghouse to include mark tartaglio and lynn dekrey to be confirmed agenda as follows to be confirmed discuss facts of issue siemenswestinghouse to present their response to enrons recent correspondence discuss plan forward re resolution of issue mindful of current relationship between the parties plz call with any questions regards scott Scott Laidlaw Project Manager Enron Engineering Construction Company Clay Street Suite Houston TX Work Fax 
<23054511.1075846133752.JavaMail.evans@thyme>,scott.laidlaw@enron.com,2000-11-30 05:09:00,Re FURTHER UPDATE TO Westinghouse DA Generator Damaged MV IndustrialBridge Cc note ref section cargo insurance of the purchase contract between enron equipment procurement company and siemens westinghouse power corporation a siemens company for one wda gas turbine generator package yk contract r ct provides that Purchaser shall provide or cause to be provided and maintained for the period of transportation in sufficient time so as not to delay Sellers transportation of the Equipment Cargo Insurance for Equipment Such insurance will be provided as Marine Cargo Insurance on a warehouse to warehouse basis insuring Equipment against loss or damage arising from customary allrisk marine perils including war strikes riots and civil commotion while in transit The deductible the responsibility of Seller shall be Twenty Five Thousand US Dollars for each and every physical damage loss Purchaser shall provide or cause to be provided Seller the opportunity to review and comment on the draft Cargo insurance policy prior to its placement Such review shall occur as soon as available Sellers review shall be limited to days from Purchasers submission of draft Cargo Policy Purchaser shall incorporate or cause to be incorporated Sellers suggested changes to the Cargo Policy provided such provisions are common customary and are reasonable commercially available Such policy shall specify Seller as an additional insured and waive any rights of subrogation against Seller under such policy where Purchaser is enron where Seller is siemenswestinghouse where Equipment shall mean the CTUnit and all other material and supplies to be furnished by Seller pursuant to the Scope of Work where CTUnit shall mean a nominal da gas turbine generator econopac with generator package with all its ancillary and auxiliary equipment hope this helps we can fax a cc of this section as needed plz advise including names and fax numbers also plz advise if addl info needed regards scott James P CT PM To Scott LaidlawENRON NRONDEVELOPMENT Matthew TezykENRON NRONDEVELOPMENT cc James P CT Subject Re FURTHER UPDATE TO Westinghouse DA Generator Damaged MV IndustrialBridge Project Doc Nbr Please see the comments from Ted Rosen below and advise if this can be answered Thanks Forwarded by James P StuddertHOUECT on PM James P Studdert AM To David CT cc James P CT Subject Re FURTHER UPDATE TO Westinghouse DA Generator Damaged MV IndustrialBridge David can you come up with the requested documentation and if there is none can you write an explanatory memo as to how this came down Forwarded by James P StuddertHOUECT on AM Ted Rosen on AM To cc Subject Re FURTHER UPDATE TO Westinghouse DA Generator Damaged MV IndustrialBridge Jim Thanks for the reply Sharron has focused on the comment that the unit has not actually been delivered to Enron and that title ownership and custody are still with SWPC She is therefore questioning Enrons insurable interest I have commented to her that Enron can insure goods titled to another party as long as Enron has instructions to insure the goods Sharron does not dispute this but has asked if there is any documentary evidence that would show that Enron had instructions to insure this cargo I think we can interpret instructions liberally If there is a purchase order or similar agreement that states that Enron is to insure the turbine that should be sufficient Would you please ask for this Thanks and regards Ted Rosen AM Heres the response finally Forwarded by James P StuddertHOUECT on AM Scott NRONDEVELOPMENT AM To James P CT Matthew TezykENRON NRONDEVELOPMENT Dan ShultzENRON NRONDEVELOPMENT Ben CT cc Subject FURTHER UPDATE TO Westinghouse DA Generator Damaged MV Industrial Bridge plz see addl comments below in blue ie reflects conversation with mr matt tezyk regards scott Forwarded by Scott LaidlawENRONDEVELOPMENT on AM Scott Laidlaw AM To James P CT Matthew TezykENRON NRONDEVELOPMENT Dan ShultzENRON NRONDEVELOPMENT Ben CT cc Subject Re Westinghouse DA Generator Damaged MV Industrial Bridge Document link Scott Laidlaw regrets i thought that this had been previously responded to see below for comments in red regards scott James P CT PM To Scott LaidlawENRON NRONDEVELOPMENT Matthew TezykENRON NRONDEVELOPMENT cc James P CT Subject Westinghouse DA Generator Damaged MV Industrial Bridge Project Doc Nbr No one has bothered to respond The questions below need to be answered BY SOMEONE Underwriters are growing impatient and if no response is forthcoming they will assume we have withdrawn the claim and close their file Can SOMEONE please respond Forwarded by James P StuddertHOUECT on PM James P Studdert PM To Scott LaidlawENRON NRONDEVELOPMENT Matthew TezykENRON NRONDEVELOPMENT cc James P CT Subject Westinghouse DA Generator Damaged MV Industrial Bridge Gentlemen if Ive left out who this should be directed to please forward to whomever can provide the answers Is Enron Equipment Procurement Co still pursuing a claim against Enron cargo insurers comment we probably need to discuss this with enas ben jacoby so that you can receive specific guidance as i understand it since enrons insurance eg marine cargo is primary enron will pursue a claim against the enron cargo insurer further comment the answer remains yes again must discuss with enas ben jacoby because of his commercial involvementexpectations If so I must provide proof of ownership of the damaged generator other than an email message Please provide ASAP comment what do you need while enron has made approx of the payments for the gas turbine generator unit it is likely that ownership still resides with westinghouse ie it was never delivered per the equipment purchase contract with enron again what type of documentation do you need does it matter if westinghouse is still in the loop further comment at this time title ownership care custody and control remain with westinghouse further westinghouse must continue to be in the loop because the monies for the damaged might ultimately be paid to them ie westinghouse provides enron with a new replacement generator then westinghouse receives the insurance money to cover their lossdamaged generator Is the generator to be repaired comment no the generator is not to be repaired instead a replacement generator is being manufactured in austria for westinghouse and is to be delivered to the port of houston in the midapril timeframe If so when and where comment na Underwriters surveyor needs to examine it when it is taken apart comment na The surveyor was told when he made an inspection at the Port that a detailed repair estimate would be provided to him on the other unit that was damaged and this would provide a guide as to the type of damage on our unit comment only the generator was damaged the gas turbine is complete and resides in houston i do not understand your comment about damage to another unit further comment the other unit does not belong to enron ie it belongs to another westinghouse client plz understand that the other unit was immersed deeper in salt water than our unit as a result its damage was greater in that we are getting a replacement generator we have to assume that the other unit that was also damaged is also being replaced therefore it can be inferred that the damage estimate for both generators are approximately the same To date nothing has been sent to our surveyor comment none further comment we are not sure about your statement our understanding is that you previously both communicated with and sent the accident survey of westinghouses underwriter to our surveyor As it has been over three months since the unit arrived in Houston in its damaged condition if Enron expects to collect from Enron cargo insurers we must move forward in providing the information previously requested or prejudice Enrons claim to recovery due to lack of cooperation with the adjustersurveyor comment noted
