Message_id,From,Time_stamp,Text
<1165404.1075862187011.JavaMail.evans@thyme>,tajmajulie@aol.com,2001-11-06 16:18:49,Silly StuffThought this might relieve some work stress Careful its hightly addictive Love ya Jules amsterdamjamflamjamhtml
<24726412.1075862187034.JavaMail.evans@thyme>,tajmajulie@aol.com,2001-11-09 12:52:14,RE Uy veSounds good I thought you were taking the day off Went out with Rebecca last night but am planning on being good for the rest of the weekend Loads of work to do Big tough week next week Gotta go write a paper Miss you loads Cheers big ears Jules
<11509873.1075840381919.JavaMail.evans@thyme>,tajmajulie@aol.com,2002-01-16 11:03:38,Famous Dadpst You are in the New York Times today page C Cant tell if its good or bad cuz I dont understand business jargon Im about to go for a little run Its beautiful out Met a new professor today Russian but nice Ready for summer vacation already At least we have a three day weekend Hope youre having a good day Cheers Jules
<13277814.1075840382274.JavaMail.evans@thyme>,tajmajulie@aol.com,2002-01-14 10:08:10,Third times a charmpst Im attaching the final copy of my resume already critiqued by my advisor and ready to be sent to companies See what you think when you get a second I added a few projects and computer skills and changed a few classes Hope youre having a good day at work Cheers loser Jules
<5334830.1075840380019.JavaMail.evans@thyme>,tajmajulie@aol.com,2002-01-25 08:20:22,For the Accountantspst Dad this was sent to me by my friend who is working for PriceWaterhouseCoopers Good for a laugh Ive got my reception for making deans list later this afternoon Gotta get my suit out Will probably run later too as I was too tired yesterday when I got out of class Love ya Cheers big ears Jules Inline attachment follows From To TraceyBranniganNIUKABAS Date Friday January GMT Subject Forwarded by Joseph NevilleIEABASPwC on Caroline M Lyons To Tom MEAIE Deirdre MEAIE Eoin MEAIE Olive MEAIE Marie MEAIE John S MEAIE Killian MEAIE Joseph MEAIE Kathryn MEAIE Niamh MEAIE Brian MEAIE Ronan MEAIE cc Subject For the Accountants file attached Forwarded by Caroline M LyonsIEABASPwC on Julie Ann Cummins To Andrew MEAIE Caroline M MEAIE Simon MEAIE cc Subject For the Accountants file attached Forwarded by Julie Ann CumminsIEABASPwC on Brian Bergin Sent by Brian Bergin To Julie Ann MEAIE internet internet internet cc Subject For the Accountants file attached See attached file ArthurAndersengif Kind regards Brian Julie Ann Cummins Audit and Business Advisory Services PricewaterhouseCoopers Georges Quay Dublin Ireland TEL Ext FAX EMail Caroline Lyons CIP Audit and Business Advisory Services PricewaterhouseCoopers Georges Quay Dublin Phone xt The information transmitted is intended only for the person or entity to which it is addressed and may contain confidential andor privileged material Any review retransmission dissemination or other use of or taking of any action in reliance upon this information by persons or entities other than the intended recipient is prohibited If you received this in error please contact the sender and delete the material from any computer
<28265147.1075840390131.JavaMail.evans@thyme>,tajmajulie@aol.com,2001-12-04 13:35:06,Fwd Corporate Policypst Thought this was appropriate Just click the screen for each new slide Love Jules Inline attachment follows From To Date Tuesday December GMT Subject Get your FREE download of MSN Explorer at bqlhmtagitlENasp
<13652676.1075862190667.JavaMail.evans@thyme>,tajmajulie@aol.com,2001-11-07 18:52:49,Uy veHey Dad I know youre tied up in meetings and I know you are probably very bored and anxious But I just wanted to let you know that at times like this I realize how AWESOME you are Im sure you have tons of stuff on your mind as today has definitely not been one of the better ones for our family But that which does not kill us makes us stronger and God knows we will be stronger after this This will all be over soon and we will be able to look back and laugh as I will also by then have figured out how to get my computer to stop running in safe mode and actually be able to read the emails I am typing A pretty smart guy once told me that when things like this happen they always seem huge at the time But in the timeline of your life timeline this whole experience will encompass like oneone thousandth of the period at the end of this sentence I miss you and wish I could be there for this whole ordeal But please try to keep your chin up and your good spirit because Im pretty sure thats all that matters in the end I love you loads and wish you the best of everything Cheers big ears Jules PS Im gonna send you a joke after I send this one Dont read it if its not an opportune time for you to laugh out loud
<15329339.1075862190692.JavaMail.evans@thyme>,tajmajulie@aol.com,2001-11-07 18:53:51,Fwd FW One of lifes many truths Inline attachment follows From To TraceyBranniganNIUKABAS Date Wednesday November GMT Subject Forwarded by Joseph NevilleIEABASPwC on Barry ORegan To Caitriona AllisIEABASPwC INTL Robert X KellyIEABASPwC Geraldine LeaIEABASPwC Joseph NevilleIEABASPwC Sibhie Tooler INTL Vanessa TraceyIEABASPwC Siobhan WeldonIEABASPwC Gillian Carter INTL Grainne Clancy INTL cc Subject FW One of lifes many truths Forwarded by Barry OReganIEABASPwC on Keith McGuinness on To Barnwell Amanda Barry O MEAIE Boner Brendan Breen Berlitz EUR Cabbage claire maguire Claire O Connor LMI Derek Hannon Gill Graham MEAIE john baxter John Sweeney Kevin Jones Warecom Marlene Kane PEDO SandraHT Stephen ODriscoll Toni Healy Tony Tony Handy Tony erlitzie Vanessa MEAIE Vernon Southward cc Subject FW One of lifes many truths Very Good A woman and a man are involved in a car accident its a bad one Both of their cars are totally demolished but amazingly neither of them are hurt After they crawl out of their cars the woman says So youre a man thats interesting Im a woman Wow just look at our cars Theres nothing left but fortunately we are unhurt This must be a sign from God that we should meet and be friends and live together in peace for the rest of our days Flattered the man replied Oh yes I agree with you completely This must be a sign from God The woman continued And look at this heres another miracle My car is completely demolished but this bottle of wine didnt break Surely God wants us to drink this wine and celebrate our good fortune Then she hands the bottle to the man The man nods his head in agreement opens it and drinks half the bottle and then hands the it back to the woman The woman takes the bottle immediately puts the cap back on and hands it back to the man The man asks Arent you having any The woman replies No I think Ill just wait for the police Moral of the story Women are clever btches Dont mess with them OR Women are vindictive Dont mess with them This Email and any files transmitted with it are private and intended solely for the use of the individual or entity to whom they are addressed If you are not the intended recipient the Email and any files have been transmitted to you in error and any copying distribution or other use of the information contained in them is strictly prohibited Nothing in this Email message amounts to a contractual or other legal commitment on the part of the Government unless confirmed by a communication signed on behalf of the Secretary of State Pennocks mailing list mailmanlistinfopennocks This message has been checked for all known viruses by the MessageLabs Virus Scanning Service For further information visit statsasp This email has been scanned for viruses by the MessageLabs SkyScan service For further details please see maingncnoticesgncinformationnoticepdf or contact your departmental help desk The Message Labs trial has been extended until further notice In case of problems please call your organisations IT helpdesk This Email and any files transmitted with it are private and intended solely for the use of the individual or entity to whom they are addressed If you are not the intended recipient the Email and any files have been transmitted to you in error and any copying distribution or other use of the information contained in them is strictly prohibited Nothing in this Email message amounts to a contractual or other legal commitment on the part of the Government unless confirmed by a communication signed on behalf of the Secretary of State The information transmitted is intended only for the person or entity to which it is addressed and may contain confidential andor privileged material Any review retransmission dissemination or other use of or taking of any action in reliance upon this information by persons or entities other than the intended recipient is prohibited If you received this in error please contact the sender and delete the material from any computer
