Message_id,From,Time_stamp,Text
<20255399.1075862296506.JavaMail.evans@thyme>,taria.reed@enron.com,2001-03-08 06:09:18,SecretariatHardie is not in today The Secretariat ID is secretariat and the password is crpsec Please let me know if for some reason that does not work for you Taria Reed ext The information contained in this email may be confidential andor privileged This email is intended to be reviewed by the individual or organization named above If you are not the intended recipient you are hereby notified that any review dissemination or copying of this email or its attachments if any or the information contained herein is prohibited If you have received this email in error please immediately notify the sender by return email and delete this email from your system Thank you
<20825886.1075858963866.JavaMail.evans@thyme>,taria.reed@enron.com,2001-10-29 09:16:07,DatasheetAttached are datasheets for Enron North America Corp Enron Canada Corp Enron Power Marketing Inc ECT Investments Inc Enron Credit Inc all on one document Taria Reed Corporate Secretary Department ext 
<14388073.1075858963889.JavaMail.evans@thyme>,taria.reed@enron.com,2001-10-29 09:22:44,RE Datasheetjust give me a call if you need another one Taria Original Message From Jones Tana Sent Monday October AM To Reed Taria Subject RE Datasheet Thanks for your help Original Message From Reed Taria Sent Monday October AM To Jones Tana Subject Datasheet Attached are datasheets for Enron North America Corp Enron Canada Corp Enron Power Marketing Inc ECT Investments Inc Enron Credit Inc all on one document Taria Reed Corporate Secretary Department ext File datasheetsdoc 
<10687330.1075858963999.JavaMail.evans@thyme>,taria.reed@enron.com,2001-10-29 11:06:21,RE Datasheethere are the last two on the list Taria Original Message From Jones Tana Sent Monday October AM To Reed Taria Subject RE Datasheet I just got handed another list Can I get the datasheets for the following companies Enron Global Markets LLC Enron Liquids Fuels Inc Enron Fuels Caribbean LP Enron Petrochemicals Company Enron Gas Liquids Inc Enron Clean Fuels Company Enron Reserve Acquisition Corp Enron Capital Trade Resources Singapore Pte Ltd Enron Capital Trade Global Resources Corp Enron Capital Trade International Corp Enron Capital Trade International Corp Singapore Branch Thanks Original Message From Reed Taria Sent Monday October AM To Jones Tana Subject Datasheet Attached are datasheets for Enron North America Corp Enron Canada Corp Enron Power Marketing Inc ECT Investments Inc Enron Credit Inc all on one document Taria Reed Corporate Secretary Department ext File datasheetsdoc 
<5081948.1075858964021.JavaMail.evans@thyme>,taria.reed@enron.com,2001-10-29 11:07:22,RE Datasheetno problem Taria Original Message From Jones Tana Sent Monday October PM To Reed Taria Subject RE Datasheet Taria Thanks for your help I really appreciate it Original Message From Reed Taria Sent Monday October PM To Jones Tana Subject RE Datasheet here are the last two on the list File datasheetsdoc Taria Original Message From Jones Tana Sent Monday October AM To Reed Taria Subject RE Datasheet I just got handed another list Can I get the datasheets for the following companies Enron Global Markets LLC Enron Liquids Fuels Inc Enron Fuels Caribbean LP Enron Petrochemicals Company Enron Gas Liquids Inc Enron Clean Fuels Company Enron Reserve Acquisition Corp Enron Capital Trade Resources Singapore Pte Ltd Enron Capital Trade Global Resources Corp Enron Capital Trade International Corp Enron Capital Trade International Corp Singapore Branch Thanks Original Message From Reed Taria Sent Monday October AM To Jones Tana Subject Datasheet Attached are datasheets for Enron North America Corp Enron Canada Corp Enron Power Marketing Inc ECT Investments Inc Enron Credit Inc all on one document Taria Reed Corporate Secretary Department ext File datasheetsdoc 
<20128711.1075860846196.JavaMail.evans@thyme>,taria.reed@enron.com,2002-01-16 06:41:47,Positions held by Jeff Skilling Cc Good morning Attached is a report of all positions ever held by Jeff Skilling while here at Enron per a request by Hardie Davis Tori suggested that I email it to you directly Please reply or call me at ext if you have any questions or other requests Taria Reed Corporate Secretary Dept Enron Corp 
<16494850.1075861083937.JavaMail.evans@thyme>,taria.reed@enron.com,2002-03-25 13:05:22,Current DO ReportAttached is a report comprised of those entities on which you serve as a director an officer andor an attorney in fact with the effective date of each such election or appointment based on our current records This report is being provided as a courtesy for your information Please review it at your convenience and call Lori Pinder at x should you have any questions on the domestic entities or Larry Pardue at x with questions on the international entities Thanks Taria Reed Corporate Secretary Department Enron Corp EBB
